Sheet: Feuille1
C1: 432Hz | F1: cohérent
D2: of:=EXP(LN(2)/12) -> 1.0594630943593 | E2: of:=[.D2]^12 -> 2 | F2: cohérent | G2: cohérent/432Hz | H2: cents depuis 432
C3: 256.87 | D3: of:=[.D4]/[.$D$2] -> 256.868736840588 | E3: C | F3: 256 | G3: of:=1200*(LN([.F3]/[.D3])/LN(2)) -> -5.86500259616189 | H3: of:=1200*(LN([.F3]/[.F4])/LN(2)) -> -90.8958456730863
D4: of:=[.D5]/[.$D$2] -> 272.142946777293 | E4: C# | F4: 269.8 | G4: of:=1200*(LN([.F4]/[.D4])/LN(2)) -> -14.9691569230754 | H4: of:=1200*(LN([.F4]/[.F5])/LN(2)) -> -113.014156057689
C5: 288.33 | D5: of:=[.D6]/[.$D$2] -> 288.325408500727 | E5: D | F5: 288 | G5: of:=1200*(LN([.F5]/[.D5])/LN(2)) -> -1.95500086538701 | H5: of:=1200*(LN([.F5]/[.F6])/LN(2)) -> -88.4700485455853
D6: of:=[.D7]/[.$D$2] -> 305.470129472588 | E6: Eb | F6: 303.1 | G6: of:=1200*(LN([.F6]/[.D6])/LN(2)) -> -13.4849523198016 | H6: of:=1200*(LN([.F6]/[.F7])/LN(2)) -> -115.43995318519
C7: 323.63 | D7: of:=[.D8]/[.$D$2] -> 323.634328605363 | E7: E | F7: 324 | G7: of:=1200*(LN([.F7]/[.D7])/LN(2)) -> 1.955000865388 | H7: of:=1200*(LN([.F7]/[.F8])/LN(2)) -> -89.5486002555637
C8: 342.88 | D8: of:=[.D9]/[.$D$2] -> 342.878627225131 | E8: F | F8: 341.2 | G8: of:=1200*(LN([.F8]/[.D8])/LN(2)) -> -8.49639887904868 | H8: of:=1200*(LN([.F8]/[.F9])/LN(2)) -> -115.311063621387
D9: of:=[.D10]/[.$D$2] -> 363.267251389605 | E9: F# | F9: 364.7 | G9: of:=1200*(LN([.F9]/[.D9])/LN(2)) -> 6.81466474233809 | H9: of:=1200*(LN([.F9]/[.F10])/LN(2)) -> -89.2753335268875
C10: 384.87 | D10: of:=[.D11]/[.$D$2] -> 384.868246236627 | E10: G | F10: 384 | G10: of:=1200*(LN([.F10]/[.D10])/LN(2)) -> -3.91000173077467 | H10: of:=1200*(LN([.F10]/[.F11])/LN(2)) -> -90.0400700505856
D11: of:=[.D12]/[.$D$2] -> 407.753703078492 | E11: G# | F11: 404.5 | G11: of:=1200*(LN([.F11]/[.D11])/LN(2)) -> -13.8699316801891 | H11: of:=1200*(LN([.F11]/[.F12])/LN(2)) -> -113.869931680189
C12: 432 | D12: 432 | E12: A | F12: 432 | G12: of:=1200*(LN([.F12]/[.D12])/LN(2)) -> 0
D13: of:=[.D12]*[.$D$2] -> 457.688056763216 | E13: Bb | F13: 455.1 | G13: of:=1200*(LN([.F13]/[.D13])/LN(2)) -> -9.81727129916954 | H13: of:=1200*(LN([.F13]/[.F12])/LN(2)) -> 90.1827287008308
C14: 484.9 | D14: of:=[.D13]*[.$D$2] -> 484.903604869649 | E14: B | F14: 486 | G14: of:=1200*(LN([.F14]/[.D14])/LN(2)) -> 3.91000173077475 | H14: of:=1200*(LN([.F14]/[.F13])/LN(2)) -> 113.727273029944