Sheet: jsFleur_de_vie
A1: R | B1: N | C1: ln(N)/ln(R) | D1: ln(N)/ln(R+1) | E1: Nombre d’or Phi | F1: 3+Phi/ln(R+1) | G1: différence à 3+Phi/ln(R+1)
A2: 1 | B2: 13 | C2: 0 | D2: of:=LN([.B2])/LN([.A2]+1) -> 3.70043971814109 | E2: of:=(1+SQRT(5))/2 -> 1.6180339887499 | F2: of:=3+[.E2]/LN([.A2]+1) -> 5.33432961155926 | G2: of:=[.D2]-[.F2] -> -1.63388989341817
A3: 2 | B3: 55 | C3: 3.65 | D3: of:=LN([.B3])/LN([.A3]+1) -> 3.64763185936207 | E3: of:=(1+SQRT(5))/2 -> 1.6180339887499 | F3: of:=3+[.E3]/LN([.A3]+1) -> 4.47279800657564 | G3: of:=[.D3]-[.F3] -> -0.825166147213576
A4: 3 | B4: 175 | C4: 3.73 | D4: of:=LN([.B4])/LN([.A4]+1) -> 3.72560555591616 | E4: of:=(1+SQRT(5))/2 -> 1.6180339887499 | F4: of:=3+[.E4]/LN([.A4]+1) -> 4.16716480577963 | G4: of:=[.D4]-[.F4] -> -0.441559249863466
A5: 4 | B5: 381 | C5: 3.69 | D5: of:=LN([.B5])/LN([.A5]+1) -> 3.69246886084525 | E5: of:=(1+SQRT(5))/2 -> 1.6180339887499 | F5: of:=3+[.E5]/LN([.A5]+1) -> 4.00534104251514 | G5: of:=[.D5]-[.F5] -> -0.312872181669893
A6: 5 | B6: 721 | C6: 3.67 | D6: of:=LN([.B6])/LN([.A6]+1) -> 3.67272463201776 | E6: of:=(1+SQRT(5))/2 -> 1.6180339887499 | F6: of:=3+[.E6]/LN([.A6]+1) -> 3.90304196324242 | G6: of:=[.D6]-[.F6] -> -0.230317331224655
A7: 6 | B7: 1215 | C7: 3.65 | D7: of:=LN([.B7])/LN([.A7]+1) -> 3.64996264561481 | E7: of:=(1+SQRT(5))/2 -> 1.6180339887499 | F7: of:=3+[.E7]/LN([.A7]+1) -> 3.83150498471649 | G7: of:=[.D7]-[.F7] -> -0.181542339101672
A8: 7 | B8: 1927 | C8: 3.64 | D8: of:=LN([.B8])/LN([.A8]+1) -> 3.63738028543191 | E8: of:=(1+SQRT(5))/2 -> 1.6180339887499 | F8: of:=3+[.E8]/LN([.A8]+1) -> 3.77810987051975 | G8: of:=[.D8]-[.F8] -> -0.140729585087847
A9: 8 | B9: 2833 | C9: 3.62 | D9: of:=LN([.B9])/LN([.A9]+1) -> 3.61778744959585 | E9: of:=(1+SQRT(5))/2 -> 1.6180339887499 | F9: of:=3+[.E9]/LN([.A9]+1) -> 3.73639900328782 | G9: of:=[.D9]-[.F9] -> -0.118611553691973
A10: 9 | B10: 3977 | C10: 3.6 | D10: of:=LN([.B10])/LN([.A10]+1) -> 3.59955559098598 | E10: of:=(1+SQRT(5))/2 -> 1.6180339887499 | F10: of:=3+[.E10]/LN([.A10]+1) -> 3.70270323284599 | G10: of:=[.D10]-[.F10] -> -0.103147641860008
A11: 10 | B11: 5447 | C11: 3.59 | D11: of:=LN([.B11])/LN([.A11]+1) -> 3.58765471327031 | E11: of:=(1+SQRT(5))/2 -> 1.6180339887499 | F11: of:=3+[.E11]/LN([.A11]+1) -> 3.67477258373408 | G11: of:=[.D11]-[.F11] -> -0.0871178704637687
A12: 11 | B12: 7207 | C12: 3.57 | D12: of:=LN([.B12])/LN([.A12]+1) -> 3.57470493134311 | E12: of:=(1+SQRT(5))/2 -> 1.6180339887499 | F12: of:=3+[.E12]/LN([.A12]+1) -> 3.651144777969 | G12: of:=[.D12]-[.F12] -> -0.0764398466258922
A13: 12 | B13: 9211 | C13: 3.56 | D13: of:=LN([.B13])/LN([.A13]+1) -> 3.55880465024936 | E13: of:=(1+SQRT(5))/2 -> 1.6180339887499 | F13: of:=3+[.E13]/LN([.A13]+1) -> 3.63082492605282 | G13: of:=[.D13]-[.F13] -> -0.0720202758034532
A14: 13 | B14: 11775 | C14: 3.55 | D14: of:=LN([.B14])/LN([.A14]+1) -> 3.55192508085877 | E14: of:=(1+SQRT(5))/2 -> 1.6180339887499 | F14: of:=3+[.E14]/LN([.A14]+1) -> 3.61311058709959 | G14: of:=[.D14]-[.F14] -> -0.0611855062408182
A15: 14 | B15: 14665 | C15: 3.54 | D15: of:=LN([.B15])/LN([.A15]+1) -> 3.54248195897808 | E15: of:=(1+SQRT(5))/2 -> 1.6180339887499 | F15: of:=3+[.E15]/LN([.A15]+1) -> 3.59749039662977 | G15: of:=[.D15]-[.F15] -> -0.0550084376516886
A16: 15 | B16: 17981 | C16: 3.53 | D16: of:=LN([.B16])/LN([.A16]+1) -> 3.53354640926234 | E16: of:=(1+SQRT(5))/2 -> 1.6180339887499 | F16: of:=3+[.E16]/LN([.A16]+1) -> 3.58358240288982 | G16: of:=[.D16]-[.F16] -> -0.0500359936274752
A17: 16 | B17: 21727 | C17: 3.52 | D17: of:=LN([.B17])/LN([.A17]+1) -> 3.52472962429231 | E17: of:=(1+SQRT(5))/2 -> 1.6180339887499 | F17: of:=3+[.E17]/LN([.A17]+1) -> 3.5710950049506 | G17: of:=[.D17]-[.F17] -> -0.0463653806582864
A18: 17 | B18: 25963 | C18: 3.52 | D18: of:=LN([.B18])/LN([.A18]+1) -> 3.51665065186748 | E18: of:=(1+SQRT(5))/2 -> 1.6180339887499 | F18: of:=3+[.E18]/LN([.A18]+1) -> 3.55980134193105 | G18: of:=[.D18]-[.F18] -> -0.0431506900635736
A19: 18 | B19: 30715 | C19: 3.51 | D19: of:=LN([.B19])/LN([.A19]+1) -> 3.50915963506336 | E19: of:=(1+SQRT(5))/2 -> 1.6180339887499 | F19: of:=3+[.E19]/LN([.A19]+1) -> 3.54952199729673 | G19: of:=[.D19]-[.F19] -> -0.0403623622333762
A20: 19 | B20: 36093 | C20: 3.5 | D20: of:=LN([.B20])/LN([.A20]+1) -> 3.50293459543774 | E20: of:=(1+SQRT(5))/2 -> 1.6180339887499 | F20: of:=3+[.E20]/LN([.A20]+1) -> 3.5401130144485 | G20: of:=[.D20]-[.F20] -> -0.0371784190107558
A21: 20 | B21: 42073 | C21: 3.5 | D21: of:=LN([.B21])/LN([.A21]+1) -> 3.4971532322572 | E21: of:=(1+SQRT(5))/2 -> 1.6180339887499 | F21: of:=3+[.E21]/LN([.A21]+1) -> 3.53145740320436 | G21: of:=[.D21]-[.F21] -> -0.0343041709471583
A22: 21 | B22: 48651 | C22: 3.49 | D22: of:=LN([.B22])/LN([.A22]+1) -> 3.49151711930125 | E22: of:=(1+SQRT(5))/2 -> 1.6180339887499 | F22: of:=3+[.E22]/LN([.A22]+1) -> 3.52345899908038 | G22: of:=[.D22]-[.F22] -> -0.0319418797791307
A23: 22 | B23: 55863 | C23: 3.49 | D23: of:=LN([.B23])/LN([.A23]+1) -> 3.48610355848185 | E23: of:=(1+SQRT(5))/2 -> 1.6180339887499 | F23: of:=3+[.E23]/LN([.A23]+1) -> 3.51603794404399 | G23: of:=[.D23]-[.F23] -> -0.0299343855621368
A24: 23 | B24: 63727 | C24: 3.48 | D24: of:=LN([.B24])/LN([.A24]+1) -> 3.48086099359666 | E24: of:=(1+SQRT(5))/2 -> 1.6180339887499 | F24: of:=3+[.E24]/LN([.A24]+1) -> 3.50912730718999 | G24: of:=[.D24]-[.F24] -> -0.0282663135933316
A25: 24 | B25: 72131 | C25: 3.48 | D25: of:=LN([.B25])/LN([.A25]+1) -> 3.47520059731306 | E25: of:=(1+SQRT(5))/2 -> 1.6180339887499 | F25: of:=3+[.E25]/LN([.A25]+1) -> 3.50267052125757 | G25: of:=[.D25]-[.F25] -> -0.0274699239445111
A26: 25 | B26: 81671 | C26: 3.47 | D26: of:=LN([.B26])/LN([.A26]+1) -> 3.47149144559846 | E26: of:=(1+SQRT(5))/2 -> 1.6180339887499 | F26: of:=3+[.E26]/LN([.A26]+1) -> 3.49661941255199 | G26: of:=[.D26]-[.F26] -> -0.0251279669535238
A27: 26 | B27: 91759 | C27: 3.47 | D27: of:=LN([.B27])/LN([.A27]+1) -> 3.46707720021422 | E27: of:=(1+SQRT(5))/2 -> 1.6180339887499 | F27: of:=3+[.E27]/LN([.A27]+1) -> 3.49093266885855 | G27: of:=[.D27]-[.F27] -> -0.0238554686443271
A28: 27 | B28: 102659 | C28: 3.46 | D28: of:=LN([.B28])/LN([.A28]+1) -> 3.4629231369019 | E28: of:=(1+SQRT(5))/2 -> 1.6180339887499 | F28: of:=3+[.E28]/LN([.A28]+1) -> 3.48557463499286 | G28: of:=[.D28]-[.F28] -> -0.0226514980909598
A29: 28 | B29: 114397 | C29: 3.46 | D29: of:=LN([.B29])/LN([.A29]+1) -> 3.45898629698198 | E29: of:=(1+SQRT(5))/2 -> 1.6180339887499 | F29: of:=3+[.E29]/LN([.A29]+1) -> 3.48051435645807 | G29: of:=[.D29]-[.F29] -> -0.0215280594760952
A30: 29 | B30: 126951 | C30: 3.46 | D30: of:=LN([.B30])/LN([.A30]+1) -> 3.45512334202604 | E30: of:=(1+SQRT(5))/2 -> 1.6180339887499 | F30: of:=3+[.E30]/LN([.A30]+1) -> 3.47572481311248 | G30: of:=[.D30]-[.F30] -> -0.0206014710864388
A31: 30 | B31: 140393 | C31: 3.45 | D31: of:=LN([.B31])/LN([.A31]+1) -> 3.45144003341097 | E31: of:=(1+SQRT(5))/2 -> 1.6180339887499 | F31: of:=3+[.E31]/LN([.A31]+1) -> 3.47118229987479 | G31: of:=[.D31]-[.F31] -> -0.0197422664638141
A32: 31 | B32: 154765 | C32: 3.45 | D32: of:=LN([.B32])/LN([.A32]+1) -> 3.44794394365976 | E32: of:=(1+SQRT(5))/2 -> 1.6180339887499 | F32: of:=3+[.E32]/LN([.A32]+1) -> 3.46686592231185 | G32: of:=[.D32]-[.F32] -> -0.0189219786520951
A33: 32 | B33: 170073 | C33: 3.44 | D33: of:=LN([.B33])/LN([.A33]+1) -> 3.44457514359696 | E33: of:=(1+SQRT(5))/2 -> 1.6180339887499 | F33: of:=3+[.E33]/LN([.A33]+1) -> 3.4627571827905 | G33: of:=[.D33]-[.F33] -> -0.0181820391935359
A34: 33 | B34: 186565 | C34: 3.44 | D34: of:=LN([.B34])/LN([.A34]+1) -> 3.44166028915473 | E34: of:=(1+SQRT(5))/2 -> 1.6180339887499 | F34: of:=3+[.E34]/LN([.A34]+1) -> 3.4588396386175 | G34: of:=[.D34]-[.F34] -> -0.0171793494627699
A35: 34 | B35: 203847 | C35: 3.44 | D35: of:=LN([.B35])/LN([.A35]+1) -> 3.43851706780975 | E35: of:=(1+SQRT(5))/2 -> 1.6180339887499 | F35: of:=3+[.E35]/LN([.A35]+1) -> 3.4550986178473 | G35: of:=[.D35]-[.F35] -> -0.0165815500375484
A36: 35 | B36: 222381 | C36: 3.44 | D36: of:=LN([.B36])/LN([.A36]+1) -> 3.43577015149217 | E36: of:=(1+SQRT(5))/2 -> 1.6180339887499 | F36: of:=3+[.E36]/LN([.A36]+1) -> 3.45152098162121 | G36: of:=[.D36]-[.F36] -> -0.0157508301290421
A37: 36 | B37: 241533 | C37: 3.43 | D37: of:=LN([.B37])/LN([.A37]+1) -> 3.43257910829266 | E37: of:=(1+SQRT(5))/2 -> 1.6180339887499 | F37: of:=3+[.E37]/LN([.A37]+1) -> 3.44809492430833 | G37: of:=[.D37]-[.F37] -> -0.0155158160156712
A38: 37 | B38: 262269 | C38: 3.43 | D38: of:=LN([.B38])/LN([.A38]+1) -> 3.43005647858662 | E38: of:=(1+SQRT(5))/2 -> 1.6180339887499 | F38: of:=3+[.E38]/LN([.A38]+1) -> 3.44480980455226 | G38: of:=[.D38]-[.F38] -> -0.0147533259656401
A39: 38 | B39: 283981 | C39: 3.43 | D39: of:=LN([.B39])/LN([.A39]+1) -> 3.42744679259385 | E39: of:=(1+SQRT(5))/2 -> 1.6180339887499 | F39: of:=3+[.E39]/LN([.A39]+1) -> 3.44165600173789 | G39: of:=[.D39]-[.F39] -> -0.0142092091440404
A40: 39 | B40: 306883 | C40: 3.42 | D40: of:=LN([.B40])/LN([.A40]+1) -> 3.42494841688241 | E40: of:=(1+SQRT(5))/2 -> 1.6180339887499 | F40: of:=3+[.E40]/LN([.A40]+1) -> 3.43862479348449 | G40: of:=[.D40]-[.F40] -> -0.0136763766020818
A41: 40 | B41: 330863 | C41: 3.42 | D41: of:=LN([.B41])/LN([.A41]+1) -> 3.42243517645758 | E41: of:=(1+SQRT(5))/2 -> 1.6180339887499 | F41: of:=3+[.E41]/LN([.A41]+1) -> 3.435708250624 | G41: of:=[.D41]-[.F41] -> -0.0132730741664191
A42: 41 | B42: 356163 | C42: 3.42 | D42: of:=LN([.B42])/LN([.A42]+1) -> 3.42008392279611 | E42: of:=(1+SQRT(5))/2 -> 1.6180339887499 | F42: of:=3+[.E42]/LN([.A42]+1) -> 3.43289914679324 | G42: of:=[.D42]-[.F42] -> -0.0128152239971286
A43: 42 | B43: 382827 | C43: 3.42 | D43: of:=LN([.B43])/LN([.A43]+1) -> 3.41788207847549 | E43: of:=(1+SQRT(5))/2 -> 1.6180339887499 | F43: of:=3+[.E43]/LN([.A43]+1) -> 3.43019088029873 | G43: of:=[.D43]-[.F43] -> -0.0123088018232385
A44: 43 | B44: 410493 | C44: 3.42 | D44: of:=LN([.B44])/LN([.A44]+1) -> 3.41555667282219 | E44: of:=(1+SQRT(5))/2 -> 1.6180339887499 | F44: of:=3+[.E44]/LN([.A44]+1) -> 3.42757740633482 | G44: of:=[.D44]-[.F44] -> -0.0120207335126339
A45: 44 | B45: 439695 | C45: 3.41 | D45: of:=LN([.B45])/LN([.A45]+1) -> 3.4134459302954 | E45: of:=(1+SQRT(5))/2 -> 1.6180339887499 | F45: of:=3+[.E45]/LN([.A45]+1) -> 3.42505317797363 | G45: of:=[.D45]-[.F45] -> -0.0116072476782296
A46: 45 | B46: 470419 | C46: 3.41 | D46: of:=LN([.B46])/LN([.A46]+1) -> 3.41149188792785 | E46: of:=(1+SQRT(5))/2 -> 1.6180339887499 | F46: of:=3+[.E46]/LN([.A46]+1) -> 3.42261309461723 | G46: of:=[.D46]-[.F46] -> -0.0111212066893782
A47: 46 | B47: 502237 | C47: 3.41 | D47: of:=LN([.B47])/LN([.A47]+1) -> 3.40943484685827 | E47: of:=(1+SQRT(5))/2 -> 1.6180339887499 | F47: of:=3+[.E47]/LN([.A47]+1) -> 3.42025245682302 | G47: of:=[.D47]-[.F47] -> -0.0108176099647497
A48: 47 | B48: 535591 | C48: 3.41 | D48: of:=LN([.B48])/LN([.A48]+1) -> 3.40750223300328 | E48: of:=(1+SQRT(5))/2 -> 1.6180339887499 | F48: of:=3+[.E48]/LN([.A48]+1) -> 3.41796692659223 | G48: of:=[.D48]-[.F48] -> -0.0104646935889434
A49: 48 | B49: 570109 | C49: 3.41 | D49: of:=LN([.B49])/LN([.A49]+1) -> 3.40549712843458 | E49: of:=(1+SQRT(5))/2 -> 1.6180339887499 | F49: of:=3+[.E49]/LN([.A49]+1) -> 3.41575249235824 | G49: of:=[.D49]-[.F49] -> -0.0102553639236627
A50: 49 | B50: 606321 | C50: 3.4 | D50: of:=LN([.B50])/LN([.A50]+1) -> 3.40365197477191 | E50: of:=(1+SQRT(5))/2 -> 1.6180339887499 | F50: of:=3+[.E50]/LN([.A50]+1) -> 3.41360543803162 | G50: of:=[.D50]-[.F50] -> -0.00995346325971269
A51: 50 | B51: 644167 | C51: 3.4 | D51: of:=LN([.B51])/LN([.A51]+1) -> 3.40190907168281 | E51: of:=(1+SQRT(5))/2 -> 1.6180339887499 | F51: of:=3+[.E51]/LN([.A51]+1) -> 3.41152231555822 | G51: of:=[.D51]-[.F51] -> -0.00961324387541218
A52: 51 | B52: 683329 | C52: 3.4 | D52: of:=LN([.B52])/LN([.A52]+1) -> 3.40012732137573 | E52: of:=(1+SQRT(5))/2 -> 1.6180339887499 | F52: of:=3+[.E52]/LN([.A52]+1) -> 3.40949992052902 | G52: of:=[.D52]-[.F52] -> -0.00937259915328959
A53: 52 | B53: 724139 | C53: 3.4 | D53: of:=LN([.B53])/LN([.A53]+1) -> 3.39842483517011 | E53: of:=(1+SQRT(5))/2 -> 1.6180339887499 | F53: of:=3+[.E53]/LN([.A53]+1) -> 3.40753527044874 | G53: of:=[.D53]-[.F53] -> -0.00911043527862176
A54: 53 | B54: 766537 | C54: 3.4 | D54: of:=LN([.B54])/LN([.A54]+1) -> 3.39676421096812 | E54: of:=(1+SQRT(5))/2 -> 1.6180339887499 | F54: of:=3+[.E54]/LN([.A54]+1) -> 3.40562558532755 | G54: of:=[.D54]-[.F54] -> -0.00886137435942924
A55: 54 | B55: 810435 | C55: 3.4 | D55: of:=LN([.B55])/LN([.A55]+1) -> 3.39510736708149 | E55: of:=(1+SQRT(5))/2 -> 1.6180339887499 | F55: of:=3+[.E55]/LN([.A55]+1) -> 3.40376827030818 | G55: of:=[.D55]-[.F55] -> -0.00866090322669688
A56: 55 | B56: 856161 | C56: 3.39 | D56: of:=LN([.B56])/LN([.A56]+1) -> 3.39354540200577 | E56: of:=(1+SQRT(5))/2 -> 1.6180339887499 | F56: of:=3+[.E56]/LN([.A56]+1) -> 3.40196090008086 | G56: of:=[.D56]-[.F56] -> -0.00841549807508324
A57: 56 | B57: 903551 | C57: 3.39 | D57: of:=LN([.B57])/LN([.A57]+1) -> 3.39201432929554 | E57: of:=(1+SQRT(5))/2 -> 1.6180339887499 | F57: of:=3+[.E57]/LN([.A57]+1) -> 3.4002012048728 | G57: of:=[.D57]-[.F57] -> -0.00818687557725717
A58: 57 | B58: 952793 | C58: 3.39 | D58: of:=LN([.B58])/LN([.A58]+1) -> 3.39055440858808 | E58: of:=(1+SQRT(5))/2 -> 1.6180339887499 | F58: of:=3+[.E58]/LN([.A58]+1) -> 3.39848705782775 | G58: of:=[.D58]-[.F58] -> -0.00793264923966985
A59: 58 | B59: 1003233 | C59: 3.39 | D59: of:=LN([.B59])/LN([.A59]+1) -> 3.38899115781514 | E59: of:=(1+SQRT(5))/2 -> 1.6180339887499 | F59: of:=3+[.E59]/LN([.A59]+1) -> 3.39681646361536 | G59: of:=[.D59]-[.F59] -> -0.00782530580022733
A60: 59 | B60: 1056205 | C60: 3.39 | D60: of:=LN([.B60])/LN([.A60]+1) -> 3.38764670203232 | E60: of:=(1+SQRT(5))/2 -> 1.6180339887499 | F60: of:=3+[.E60]/LN([.A60]+1) -> 3.39518754813145 | G60: of:=[.D60]-[.F60] -> -0.00754084609913042
A61: 60 | B61: 1110347 | C61: 3.39 | D61: of:=LN([.B61])/LN([.A61]+1) -> 3.38618590523144 | E61: of:=(1+SQRT(5))/2 -> 1.6180339887499 | F61: of:=3+[.E61]/LN([.A61]+1) -> 3.39359854916767 | G61: of:=[.D61]-[.F61] -> -0.00741264393622254
A62: 61 | B62: 1166457 | C62: 3.38 | D62: of:=LN([.B62])/LN([.A62]+1) -> 3.3847895910476 | E62: of:=(1+SQRT(5))/2 -> 1.6180339887499 | F62: of:=3+[.E62]/LN([.A62]+1) -> 3.39204780794464 | G62: of:=[.D62]-[.F62] -> -0.00725821689704276
A63: 62 | B63: 1225011 | C63: 3.38 | D63: of:=LN([.B63])/LN([.A63]+1) -> 3.38353959194609 | E63: of:=(1+SQRT(5))/2 -> 1.6180339887499 | F63: of:=3+[.E63]/LN([.A63]+1) -> 3.39053376141575 | G63: of:=[.D63]-[.F63] -> -0.00699416946965803
A64: 63 | B64: 1284833 | C64: 3.38 | D64: of:=LN([.B64])/LN([.A64]+1) -> 3.38219157038991 | E64: of:=(1+SQRT(5))/2 -> 1.6180339887499 | F64: of:=3+[.E64]/LN([.A64]+1) -> 3.38905493525988 | G64: of:=[.D64]-[.F64] -> -0.00686336486996408
A65: 64 | B65: 1346831 | C65: 3.38 | D65: of:=LN([.B65])/LN([.A65]+1) -> 3.38091893996218 | E65: of:=(1+SQRT(5))/2 -> 1.6180339887499 | F65: of:=3+[.E65]/LN([.A65]+1) -> 3.38760993749158 | G65: of:=[.D65]-[.F65] -> -0.00669099752939983
A66: 65 | B66: 1410641 | C66: 3.38 | D66: of:=LN([.B66])/LN([.A66]+1) -> 3.37964716446564 | E66: of:=(1+SQRT(5))/2 -> 1.6180339887499 | F66: of:=3+[.E66]/LN([.A66]+1) -> 3.38619745262525 | G66: of:=[.D66]-[.F66] -> -0.0065502881596049
A67: 66 | B67: 1476393 | C67: 3.38 | D67: of:=LN([.B67])/LN([.A67]+1) -> 3.37839499690272 | E67: of:=(1+SQRT(5))/2 -> 1.6180339887499 | F67: of:=3+[.E67]/LN([.A67]+1) -> 3.38481623633745 | G67: of:=[.D67]-[.F67] -> -0.00642123943473694
A68: 67 | B68: 1544365 | C68: 3.38 | D68: of:=LN([.B68])/LN([.A68]+1) -> 3.37720046419444 | E68: of:=(1+SQRT(5))/2 -> 1.6180339887499 | F68: of:=3+[.E68]/LN([.A68]+1) -> 3.38346511057796 | G68: of:=[.D68]-[.F68] -> -0.00626464638351809
A69: 68 | B69: 1614283 | C69: 3.38 | D69: of:=LN([.B69])/LN([.A69]+1) -> 3.37601367317745 | E69: of:=(1+SQRT(5))/2 -> 1.6180339887499 | F69: of:=3+[.E69]/LN([.A69]+1) -> 3.38214295908548 | G69: of:=[.D69]-[.F69] -> -0.00612928590803863
A70: 69 | B70: 1686585 | C70: 3.37 | D70: of:=LN([.B70])/LN([.A70]+1) -> 3.37489287749199 | E70: of:=(1+SQRT(5))/2 -> 1.6180339887499 | F70: of:=3+[.E70]/LN([.A70]+1) -> 3.38084872326923 | G70: of:=[.D70]-[.F70] -> -0.0059558457772444
A71: 70 | B71: 1760371 | C71: 3.37 | D71: of:=LN([.B71])/LN([.A71]+1) -> 3.37370751618261 | E71: of:=(1+SQRT(5))/2 -> 1.6180339887499 | F71: of:=3+[.E71]/LN([.A71]+1) -> 3.37958139842135 | G71: of:=[.D71]-[.F71] -> -0.00587388223874319
A72: 71 | B72: 1836757 | C72: 3.37 | D72: of:=LN([.B72])/LN([.A72]+1) -> 3.3726065288148 | E72: of:=(1+SQRT(5))/2 -> 1.6180339887499 | F72: of:=3+[.E72]/LN([.A72]+1) -> 3.37834003022947 | G72: of:=[.D72]-[.F72] -> -0.00573350141466911
A73: 72 | B73: 1914771 | C73: 3.37 | D73: of:=LN([.B73])/LN([.A73]+1) -> 3.37145911518725 | E73: of:=(1+SQRT(5))/2 -> 1.6180339887499 | F73: of:=3+[.E73]/LN([.A73]+1) -> 3.37712371156148 | G73: of:=[.D73]-[.F73] -> -0.00566459637423788
A74: 73 | B74: 1996031 | C74: 3.37 | D74: of:=LN([.B74])/LN([.A74]+1) -> 3.3704581489021 | E74: of:=(1+SQRT(5))/2 -> 1.6180339887499 | F74: of:=3+[.E74]/LN([.A74]+1) -> 3.37593157949787 | G74: of:=[.D74]-[.F74] -> -0.00547343059577266
A75: 74 | B75: 2078721 | C75: 3.37 | D75: of:=LN([.B75])/LN([.A75]+1) -> 3.369381218003 | E75: of:=(1+SQRT(5))/2 -> 1.6180339887499 | F75: of:=3+[.E75]/LN([.A75]+1) -> 3.37476281258934 | G75: of:=[.D75]-[.F75] -> -0.0053815945863378
A76: 75 | B76: 2163817 | C76: 3.37 | D76: of:=LN([.B76])/LN([.A76]+1) -> 3.3683404642016 | E76: of:=(1+SQRT(5))/2 -> 1.6180339887499 | F76: of:=3+[.E76]/LN([.A76]+1) -> 3.37361662831979 | G76: of:=[.D76]-[.F76] -> -0.00527616411819176
A77: 76 | B77: 2251299 | C77: 3.37 | D77: of:=LN([.B77])/LN([.A77]+1) -> 3.36732807306069 | E77: of:=(1+SQRT(5))/2 -> 1.6180339887499 | F77: of:=3+[.E77]/LN([.A77]+1) -> 3.37249228075677 | G77: of:=[.D77]-[.F77] -> -0.00516420769607384
A78: 77 | B78: 2341205 | C78: 3.37 | D78: of:=LN([.B78])/LN([.A78]+1) -> 3.36634301154292 | E78: of:=(1+SQRT(5))/2 -> 1.6180339887499 | F78: of:=3+[.E78]/LN([.A78]+1) -> 3.37138905837307 | G78: of:=[.D78]-[.F78] -> -0.00504604683015319
A79: 78 | B79: 2433297 | C79: 3.37 | D79: of:=LN([.B79])/LN([.A79]+1) -> 3.36535832039505 | E79: of:=(1+SQRT(5))/2 -> 1.6180339887499 | F79: of:=3+[.E79]/LN([.A79]+1) -> 3.37030628202516 | G79: of:=[.D79]-[.F79] -> -0.00494796163011024
A80: 79 | B80: 2527643 | C80: 3.36 | D80: of:=LN([.B80])/LN([.A80]+1) -> 3.36437886736382 | E80: of:=(1+SQRT(5))/2 -> 1.6180339887499 | F80: of:=3+[.E80]/LN([.A80]+1) -> 3.36924330307506 | G80: of:=[.D80]-[.F80] -> -0.00486443571124484
A81: 80 | B81: 2624185 | C81: 3.36 | D81: of:=LN([.B81])/LN([.A81]+1) -> 3.36339787067383 | E81: of:=(1+SQRT(5))/2 -> 1.6180339887499 | F81: of:=3+[.E81]/LN([.A81]+1) -> 3.36819950164391 | G81: of:=[.D81]-[.F81] -> -0.00480163097008468
A82: 81 | B82: 2723893 | C82: 3.36 | D82: of:=LN([.B82])/LN([.A82]+1) -> 3.36249527904667 | E82: of:=(1+SQRT(5))/2 -> 1.6180339887499 | F82: of:=3+[.E82]/LN([.A82]+1) -> 3.36717428498636 | G82: of:=[.D82]-[.F82] -> -0.0046790059396935
A83: 82 | B83: 2825743 | C83: 3.36 | D83: of:=LN([.B83])/LN([.A83]+1) -> 3.36157902383322 | E83: of:=(1+SQRT(5))/2 -> 1.6180339887499 | F83: of:=3+[.E83]/LN([.A83]+1) -> 3.36616708597614 | G83: of:=[.D83]-[.F83] -> -0.00458806214291752
A84: 83 | B84: 2930405 | C84: 3.36 | D84: of:=LN([.B84])/LN([.A84]+1) -> 3.3607011692707 | E84: of:=(1+SQRT(5))/2 -> 1.6180339887499 | F84: of:=3+[.E84]/LN([.A84]+1) -> 3.36517736169374 | G84: of:=[.D84]-[.F84] -> -0.0044761924230361
A85: 84 | B85: 3036805 | C85: 3.36 | D85: of:=LN([.B85])/LN([.A85]+1) -> 3.35977678015134 | E85: of:=(1+SQRT(5))/2 -> 1.6180339887499 | F85: of:=3+[.E85]/LN([.A85]+1) -> 3.36420459210839 | G85: of:=[.D85]-[.F85] -> -0.00442781195704889
A86: 85 | B86: 3146611 | C86: 3.36 | D86: of:=LN([.B86])/LN([.A86]+1) -> 3.35892905593673 | E86: of:=(1+SQRT(5))/2 -> 1.6180339887499 | F86: of:=3+[.E86]/LN([.A86]+1) -> 3.36324827884678 | G86: of:=[.D86]-[.F86] -> -0.00431922291004838
A87: 86 | B87: 3258363 | C87: 3.36 | D87: of:=LN([.B87])/LN([.A87]+1) -> 3.35804837035103 | E87: of:=(1+SQRT(5))/2 -> 1.6180339887499 | F87: of:=3+[.E87]/LN([.A87]+1) -> 3.36230794404193 | G87: of:=[.D87]-[.F87] -> -0.0042595736908928
A88: 87 | B88: 3373043 | C88: 3.36 | D88: of:=LN([.B88])/LN([.A88]+1) -> 3.35720239175475 | E88: of:=(1+SQRT(5))/2 -> 1.6180339887499 | F88: of:=3+[.E88]/LN([.A88]+1) -> 3.36138312925615 | G88: of:=[.D88]-[.F88] -> -0.00418073750140335
A89: 88 | B89: 3490593 | C89: 3.36 | D89: of:=LN([.B89])/LN([.A89]+1) -> 3.35638286393068 | E89: of:=(1+SQRT(5))/2 -> 1.6180339887499 | F89: of:=3+[.E89]/LN([.A89]+1) -> 3.36047339447246 | G89: of:=[.D89]-[.F89] -> -0.00409053054178266
A90: 89 | B90: 3610169 | C90: 3.36 | D90: of:=LN([.B90])/LN([.A90]+1) -> 3.35553417807325 | E90: of:=(1+SQRT(5))/2 -> 1.6180339887499 | F90: of:=3+[.E90]/LN([.A90]+1) -> 3.35957831714939 | G90: of:=[.D90]-[.F90] -> -0.00404413907613543
A91: 90 | B91: 3733435 | C91: 3.35 | D91: of:=LN([.B91])/LN([.A91]+1) -> 3.35475739324331 | E91: of:=(1+SQRT(5))/2 -> 1.6180339887499 | F91: of:=3+[.E91]/LN([.A91]+1) -> 3.35869749133448 | G91: of:=[.D91]-[.F91] -> -0.00394009809116991
A92: 91 | B92: 3859287 | C92: 3.35 | D92: of:=LN([.B92])/LN([.A92]+1) -> 3.35398100794236 | E92: of:=(1+SQRT(5))/2 -> 1.6180339887499 | F92: of:=3+[.E92]/LN([.A92]+1) -> 3.35783052683234 | G92: of:=[.D92]-[.F92] -> -0.00384951888997653
A93: 92 | B93: 3987129 | C93: 3.35 | D93: of:=LN([.B93])/LN([.A93]+1) -> 3.35317117780925 | E93: of:=(1+SQRT(5))/2 -> 1.6180339887499 | F93: of:=3+[.E93]/LN([.A93]+1) -> 3.3569770484231 | G93: of:=[.D93]-[.F93] -> -0.00380587061384885
A94: 93 | B94: 4118217 | C94: 3.35 | D94: of:=LN([.B94])/LN([.A94]+1) -> 3.35239767406305 | E94: of:=(1+SQRT(5))/2 -> 1.6180339887499 | F94: of:=3+[.E94]/LN([.A94]+1) -> 3.35613669512799 | G94: of:=[.D94]-[.F94] -> -0.00373902106494173
A95: 94 | B95: 4252149 | C95: 3.35 | D95: of:=LN([.B95])/LN([.A95]+1) -> 3.35163541384154 | E95: of:=(1+SQRT(5))/2 -> 1.6180339887499 | F95: of:=3+[.E95]/LN([.A95]+1) -> 3.35530911951843 | G95: of:=[.D95]-[.F95] -> -0.00367370567688097
A96: 95 | B96: 4388875 | C96: 3.35 | D96: of:=LN([.B96])/LN([.A96]+1) -> 3.35088009204982 | E96: of:=(1+SQRT(5))/2 -> 1.6180339887499 | F96: of:=3+[.E96]/LN([.A96]+1) -> 3.35449398706578 | G96: of:=[.D96]-[.F96] -> -0.00361389501595788
A97: 96 | B97: 4528463 | C97: 3.35 | D97: of:=LN([.B97])/LN([.A97]+1) -> 3.35013364085828 | E97: of:=(1+SQRT(5))/2 -> 1.6180339887499 | F97: of:=3+[.E97]/LN([.A97]+1) -> 3.35369097552896 | G97: of:=[.D97]-[.F97] -> -0.00355733467067676
A98: 97 | B98: 4671523 | C98: 3.35 | D98: of:=LN([.B98])/LN([.A98]+1) -> 3.34942303781137 | E98: of:=(1+SQRT(5))/2 -> 1.6180339887499 | F98: of:=3+[.E98]/LN([.A98]+1) -> 3.35289977437725 | G98: of:=[.D98]-[.F98] -> -0.00347673656588032
A99: 98 | B99: 4816921 | C99: 3.35 | D99: of:=LN([.B99])/LN([.A99]+1) -> 3.34869295841719 | E99: of:=(1+SQRT(5))/2 -> 1.6180339887499 | F99: of:=3+[.E99]/LN([.A99]+1) -> 3.35212008424601 | G99: of:=[.D99]-[.F99] -> -0.00342712582881788
A100: 99 | B100: 4965201 | C100: 3.35 | D100: of:=LN([.B100])/LN([.A100]+1) -> 3.34796841709283 | E100: of:=(1+SQRT(5))/2 -> 1.6180339887499 | F100: of:=3+[.E100]/LN([.A100]+1) -> 3.35135161642299 | G100: of:=[.D100]-[.F100] -> -0.0033831993301594
A101: 100 | B101: 5117417 | C101: 3.35 | D101: of:=LN([.B101])/LN([.A101]+1) -> 3.34729295175642 | E101: of:=(1+SQRT(5))/2 -> 1.6180339887499 | F101: of:=3+[.E101]/LN([.A101]+1) -> 3.35059409236345 | G101: of:=[.D101]-[.F101] -> -0.00330114060703002
A102: 101 | B102: 5272175 | C102: 3.35 | D102: of:=LN([.B102])/LN([.A102]+1) -> 3.34660422314052 | E102: of:=(1+SQRT(5))/2 -> 1.6180339887499 | F102: of:=3+[.E102]/LN([.A102]+1) -> 3.34984724323188 | G102: of:=[.D102]-[.F102] -> -0.00324302009135558
A103: 102 | B103: 5429251 | C103: 3.35 | D103: of:=LN([.B103])/LN([.A103]+1) -> 3.34589396368016 | E103: of:=(1+SQRT(5))/2 -> 1.6180339887499 | F103: of:=3+[.E103]/LN([.A103]+1) -> 3.34911080946892 | G103: of:=[.D103]-[.F103] -> -0.0032168457887578
A104: 103 | B104: 5590795 | C104: 3.35 | D104: of:=LN([.B104])/LN([.A104]+1) -> 3.34524642534684 | E104: of:=(1+SQRT(5))/2 -> 1.6180339887499 | F104: of:=3+[.E104]/LN([.A104]+1) -> 3.34838454038161 | G104: of:=[.D104]-[.F104] -> -0.00313811503476424
A105: 104 | B105: 5754227 | C105: 3.34 | D105: of:=LN([.B105])/LN([.A105]+1) -> 3.34455906411094 | E105: of:=(1+SQRT(5))/2 -> 1.6180339887499 | F105: of:=3+[.E105]/LN([.A105]+1) -> 3.3476681937557 | G105: of:=[.D105]-[.F105] -> -0.00310912964475163
A106: 105 | B106: 5922349 | C106: 3.34 | D106: of:=LN([.B106])/LN([.A106]+1) -> 3.34393639629368 | E106: of:=(1+SQRT(5))/2 -> 1.6180339887499 | F106: of:=3+[.E106]/LN([.A106]+1) -> 3.34696153548843 | G106: of:=[.D106]-[.F106] -> -0.00302513919474734
A107: 106 | B107: 6092241 | C107: 3.34 | D107: of:=LN([.B107])/LN([.A107]+1) -> 3.34326959230307 | E107: of:=(1+SQRT(5))/2 -> 1.6180339887499 | F107: of:=3+[.E107]/LN([.A107]+1) -> 3.34626433924071 | G107: of:=[.D107]-[.F107] -> -0.00299474693763768
A108: 107 | B108: 6265951 | C108: 3.34 | D108: of:=LN([.B108])/LN([.A108]+1) -> 3.34263184248587 | E108: of:=(1+SQRT(5))/2 -> 1.6180339887499 | F108: of:=3+[.E108]/LN([.A108]+1) -> 3.34557638610734 | G108: of:=[.D108]-[.F108] -> -0.00294454362146812
A109: 108 | B109: 6442613 | C109: 3.34 | D109: of:=LN([.B109])/LN([.A109]+1) -> 3.3419915032351 | E109: of:=(1+SQRT(5))/2 -> 1.6180339887499 | F109: of:=3+[.E109]/LN([.A109]+1) -> 3.34489746430424 | G109: of:=[.D109]-[.F109] -> -0.00290596106914132
A110: 109 | B110: 6623189 | C110: 3.34 | D110: of:=LN([.B110])/LN([.A110]+1) -> 3.3413792446145 | E110: of:=(1+SQRT(5))/2 -> 1.6180339887499 | F110: of:=3+[.E110]/LN([.A110]+1) -> 3.34422736887172 | G110: of:=[.D110]-[.F110] -> -0.00284812425721848
A111: 110 | B111: 6806189 | C111: 3.34 | D111: of:=LN([.B111])/LN([.A111]+1) -> 3.34074572849927 | E111: of:=(1+SQRT(5))/2 -> 1.6180339887499 | F111: of:=3+[.E111]/LN([.A111]+1) -> 3.34356590139267 | G111: of:=[.D111]-[.F111] -> -0.00282017289340875
A112: 111 | B112: 6993015 | C112: 3.34 | D112: of:=LN([.B112])/LN([.A112]+1) -> 3.34013481439279 | E112: of:=(1+SQRT(5))/2 -> 1.6180339887499 | F112: of:=3+[.E112]/LN([.A112]+1) -> 3.34291286972498 | G112: of:=[.D112]-[.F112] -> -0.00277805533218878
A113: 112 | B113: 7183881 | C113: 3.34 | D113: of:=LN([.B113])/LN([.A113]+1) -> 3.33955049377337 | E113: of:=(1+SQRT(5))/2 -> 1.6180339887499 | F113: of:=3+[.E113]/LN([.A113]+1) -> 3.34226808774716 | G113: of:=[.D113]-[.F113] -> -0.00271759397379245
A114: 113 | B114: 7377393 | C114: 3.34 | D114: of:=LN([.B114])/LN([.A114]+1) -> 3.33895022652538 | E114: of:=(1+SQRT(5))/2 -> 1.6180339887499 | F114: of:=3+[.E114]/LN([.A114]+1) -> 3.34163137511655 | G114: of:=[.D114]-[.F114] -> -0.00268114859117574
A115: 114 | B115: 7574769 | C115: 3.34 | D115: of:=LN([.B115])/LN([.A115]+1) -> 3.33836880809279 | E115: of:=(1+SQRT(5))/2 -> 1.6180339887499 | F115: of:=3+[.E115]/LN([.A115]+1) -> 3.34100255703932 | G115: of:=[.D115]-[.F115] -> -0.00263374894652868
A116: 115 | B116: 7776133 | C116: 3.34 | D116: of:=LN([.B116])/LN([.A116]+1) -> 3.33780765505845 | E116: of:=(1+SQRT(5))/2 -> 1.6180339887499 | F116: of:=3+[.E116]/LN([.A116]+1) -> 3.34038146405155 | G116: of:=[.D116]-[.F116] -> -0.0025738089931
A117: 116 | B117: 7979637 | C117: 3.34 | D117: of:=LN([.B117])/LN([.A117]+1) -> 3.3372160902276 | E117: of:=(1+SQRT(5))/2 -> 1.6180339887499 | F117: of:=3+[.E117]/LN([.A117]+1) -> 3.33976793181088 | G117: of:=[.D117]-[.F117] -> -0.00255184158327815
A118: 117 | B118: 8187693 | C118: 3.34 | D118: of:=LN([.B118])/LN([.A118]+1) -> 3.33665793993871 | E118: of:=(1+SQRT(5))/2 -> 1.6180339887499 | F118: of:=3+[.E118]/LN([.A118]+1) -> 3.33916180089794 | G118: of:=[.D118]-[.F118] -> -0.00250386095922828
A119: 118 | B119: 8398471 | C119: 3.34 | D119: of:=LN([.B119])/LN([.A119]+1) -> 3.33608458672729 | E119: of:=(1+SQRT(5))/2 -> 1.6180339887499 | F119: of:=3+[.E119]/LN([.A119]+1) -> 3.3385629166273 | G119: of:=[.D119]-[.F119] -> -0.00247832990000818
A120: 119 | B120: 8613743 | C120: 3.34 | D120: of:=LN([.B120])/LN([.A120]+1) -> 3.33553985405297 | E120: of:=(1+SQRT(5))/2 -> 1.6180339887499 | F120: of:=3+[.E120]/LN([.A120]+1) -> 3.33797112886708 | G120: of:=[.D120]-[.F120] -> -0.00243127481411154
A121: 120 | B121: 8831855 | C121: 3.33 | D121: of:=LN([.B121])/LN([.A121]+1) -> 3.33498210101702 | E121: of:=(1+SQRT(5))/2 -> 1.6180339887499 | F121: of:=3+[.E121]/LN([.A121]+1) -> 3.33738629186704 | G121: of:=[.D121]-[.F121] -> -0.00240419085002053
A122: 121 | B122: 9054015 | C122: 3.33 | D122: of:=LN([.B122])/LN([.A122]+1) -> 3.33443977754107 | E122: of:=(1+SQRT(5))/2 -> 1.6180339887499 | F122: of:=3+[.E122]/LN([.A122]+1) -> 3.33680826409447 | G122: of:=[.D122]-[.F122] -> -0.00236848655339683
A123: 122 | B123: 9280223 | C123: 3.33 | D123: of:=LN([.B123])/LN([.A123]+1) -> 3.33391136952908 | E123: of:=(1+SQRT(5))/2 -> 1.6180339887499 | F123: of:=3+[.E123]/LN([.A123]+1) -> 3.33623690807762 | G123: of:=[.D123]-[.F123] -> -0.00232553854853323
A124: 123 | B124: 9509441 | C124: 3.33 | D124: of:=LN([.B124])/LN([.A124]+1) -> 3.33337284012906 | E124: of:=(1+SQRT(5))/2 -> 1.6180339887499 | F124: of:=3+[.E124]/LN([.A124]+1) -> 3.33567209025616 | G124: of:=[.D124]-[.F124] -> -0.00229925012710419
A125: 124 | B125: 9743315 | C125: 3.33 | D125: of:=LN([.B125])/LN([.A125]+1) -> 3.33285963637072 | E125: of:=(1+SQRT(5))/2 -> 1.6180339887499 | F125: of:=3+[.E125]/LN([.A125]+1) -> 3.33511368083838 | G125: of:=[.D125]-[.F125] -> -0.00225404446766442
A126: 125 | B126: 9980783 | C126: 3.33 | D126: of:=LN([.B126])/LN([.A126]+1) -> 3.3323475372598 | E126: of:=(1+SQRT(5))/2 -> 1.6180339887499 | F126: of:=3+[.E126]/LN([.A126]+1) -> 3.33456155366464 | G126: of:=[.D126]-[.F126] -> -0.00221401640484364
A127: 126 | B127: 10221483 | C127: 3.33 | D127: of:=LN([.B127])/LN([.A127]+1) -> 3.33182883975776 | E127: of:=(1+SQRT(5))/2 -> 1.6180339887499 | F127: of:=3+[.E127]/LN([.A127]+1) -> 3.33401558607696 | G127: of:=[.D127]-[.F127] -> -0.00218674631920157
A128: 127 | B128: 10466277 | C128: 3.33 | D128: of:=LN([.B128])/LN([.A128]+1) -> 3.33132071586884 | E128: of:=(1+SQRT(5))/2 -> 1.6180339887499 | F128: of:=3+[.E128]/LN([.A128]+1) -> 3.33347565879418 | G128: of:=[.D128]-[.F128] -> -0.00215494292533913
A129: 128 | B129: 10714743 | C129: 3.33 | D129: of:=LN([.B129])/LN([.A129]+1) -> 3.3308140015871 | E129: of:=(1+SQRT(5))/2 -> 1.6180339887499 | F129: of:=3+[.E129]/LN([.A129]+1) -> 3.33294165579266 | G129: of:=[.D129]-[.F129] -> -0.00212765420556682
A130: 129 | B130: 10967095 | C130: 3.33 | D130: of:=LN([.B130])/LN([.A130]+1) -> 3.33031232732997 | E130: of:=(1+SQRT(5))/2 -> 1.6180339887499 | F130: of:=3+[.E130]/LN([.A130]+1) -> 3.33241346419201 | G130: of:=[.D130]-[.F130] -> -0.00210113686204449
A131: 130 | B131: 11224265 | C131: 3.33 | D131: of:=LN([.B131])/LN([.A131]+1) -> 3.32983209384181 | E131: of:=(1+SQRT(5))/2 -> 1.6180339887499 | F131: of:=3+[.E131]/LN([.A131]+1) -> 3.33189097414573 | G131: of:=[.D131]-[.F131] -> -0.00205888030391943
A132: 131 | B132: 11484851 | C132: 3.33 | D132: of:=LN([.B132])/LN([.A132]+1) -> 3.32934648554546 | E132: of:=(1+SQRT(5))/2 -> 1.6180339887499 | F132: of:=3+[.E132]/LN([.A132]+1) -> 3.33137407873651 | G132: of:=[.D132]-[.F132] -> -0.0020275931910434
A133: 132 | B133: 11748867 | C133: 3.33 | D133: of:=LN([.B133])/LN([.A133]+1) -> 3.32885586315855 | E133: of:=(1+SQRT(5))/2 -> 1.6180339887499 | F133: of:=3+[.E133]/LN([.A133]+1) -> 3.33086267387585 | G133: of:=[.D133]-[.F133] -> -0.00200681071730324
A134: 133 | B134: 12018201 | C134: 3.33 | D134: of:=LN([.B134])/LN([.A134]+1) -> 3.32839240859045 | E134: of:=(1+SQRT(5))/2 -> 1.6180339887499 | F134: of:=3+[.E134]/LN([.A134]+1) -> 3.33035665820799 | G134: of:=[.D134]-[.F134] -> -0.00196424961754405
A135: 134 | B135: 12291289 | C135: 3.33 | D135: of:=LN([.B135])/LN([.A135]+1) -> 3.32792801533071 | E135: of:=(1+SQRT(5))/2 -> 1.6180339887499 | F135: of:=3+[.E135]/LN([.A135]+1) -> 3.32985593301768 | G135: of:=[.D135]-[.F135] -> -0.00192791768696976
A136: 135 | B136: 12567131 | C136: 3.33 | D136: of:=LN([.B136])/LN([.A136]+1) -> 3.32744629795432 | E136: of:=(1+SQRT(5))/2 -> 1.6180339887499 | F136: of:=3+[.E136]/LN([.A136]+1) -> 3.3293604021418 | G136: of:=[.D136]-[.F136] -> -0.00191410418747795
A137: 136 | B137: 12848277 | C137: 3.33 | D137: of:=LN([.B137])/LN([.A137]+1) -> 3.32698856387476 | E137: of:=(1+SQRT(5))/2 -> 1.6180339887499 | F137: of:=3+[.E137]/LN([.A137]+1) -> 3.32886997188461 | G137: of:=[.D137]-[.F137] -> -0.00188140800984948
A138: 137 | B138: 13133307 | C138: 3.33 | D138: of:=LN([.B138])/LN([.A138]+1) -> 3.32653099025466 | E138: of:=(1+SQRT(5))/2 -> 1.6180339887499 | F138: of:=3+[.E138]/LN([.A138]+1) -> 3.32838455093636 | G138: of:=[.D138]-[.F138] -> -0.00185356068170872
A139: 138 | B139: 13421717 | C139: 3.33 | D139: of:=LN([.B139])/LN([.A139]+1) -> 3.32606572597273 | E139: of:=(1+SQRT(5))/2 -> 1.6180339887499 | F139: of:=3+[.E139]/LN([.A139]+1) -> 3.32790405029525 | G139: of:=[.D139]-[.F139] -> -0.00183832432251796
A140: 139 | B140: 13716009 | C140: 3.33 | D140: of:=LN([.B140])/LN([.A140]+1) -> 3.32562999166887 | E140: of:=(1+SQRT(5))/2 -> 1.6180339887499 | F140: of:=3+[.E140]/LN([.A140]+1) -> 3.32742838319239 | G140: of:=[.D140]-[.F140] -> -0.00179839152352113
A141: 140 | B141: 14013047 | C141: 3.33 | D141: of:=LN([.B141])/LN([.A141]+1) -> 3.32517635664026 | E141: of:=(1+SQRT(5))/2 -> 1.6180339887499 | F141: of:=3+[.E141]/LN([.A141]+1) -> 3.32695746501984 | G141: of:=[.D141]-[.F141] -> -0.00178110837957668
A142: 141 | B142: 14315039 | C142: 3.32 | D142: of:=LN([.B142])/LN([.A142]+1) -> 3.32473692673625 | E142: of:=(1+SQRT(5))/2 -> 1.6180339887499 | F142: of:=3+[.E142]/LN([.A142]+1) -> 3.3264912132614 | G142: of:=[.D142]-[.F142] -> -0.00175428652514276
A143: 142 | B143: 14620709 | C143: 3.32 | D143: of:=LN([.B143])/LN([.A143]+1) -> 3.32429296813551 | E143: of:=(1+SQRT(5))/2 -> 1.6180339887499 | F143: of:=3+[.E143]/LN([.A143]+1) -> 3.32602954742614 | G143: of:=[.D143]-[.F143] -> -0.00173657929063076
A144: 143 | B144: 14932239 | C144: 3.32 | D144: of:=LN([.B144])/LN([.A144]+1) -> 3.32387398258828 | E144: of:=(1+SQRT(5))/2 -> 1.6180339887499 | F144: of:=3+[.E144]/LN([.A144]+1) -> 3.3255723889845 | G144: of:=[.D144]-[.F144] -> -0.0016984063962151
A145: 144 | B145: 15246391 | C145: 3.32 | D145: of:=LN([.B145])/LN([.A145]+1) -> 3.32343545653057 | E145: of:=(1+SQRT(5))/2 -> 1.6180339887499 | F145: of:=3+[.E145]/LN([.A145]+1) -> 3.3251196613068 | G145: of:=[.D145]-[.F145] -> -0.0016842047762311
A146: 145 | B146: 15566337 | C146: 3.32 | D146: of:=LN([.B146])/LN([.A146]+1) -> 3.32301935387102 | E146: of:=(1+SQRT(5))/2 -> 1.6180339887499 | F146: of:=3+[.E146]/LN([.A146]+1) -> 3.32467128960416 | G146: of:=[.D146]-[.F146] -> -0.00165193573314415
A147: 146 | B147: 15890333 | C147: 3.32 | D147: of:=LN([.B147])/LN([.A147]+1) -> 3.32260204031185 | E147: of:=(1+SQRT(5))/2 -> 1.6180339887499 | F147: of:=3+[.E147]/LN([.A147]+1) -> 3.32422720087164 | G147: of:=[.D147]-[.F147] -> -0.00162516055979056
A148: 147 | B148: 16218717 | C148: 3.32 | D148: of:=LN([.B148])/LN([.A148]+1) -> 3.32218757061949 | E148: of:=(1+SQRT(5))/2 -> 1.6180339887499 | F148: of:=3+[.E148]/LN([.A148]+1) -> 3.32378732383348 | G148: of:=[.D148]-[.F148] -> -0.00159975321399175
A149: 148 | B149: 16550889 | C149: 3.32 | D149: of:=LN([.B149])/LN([.A149]+1) -> 3.32176833204772 | E149: of:=(1+SQRT(5))/2 -> 1.6180339887499 | F149: of:=3+[.E149]/LN([.A149]+1) -> 3.32335158889044 | G149: of:=[.D149]-[.F149] -> -0.00158325684272054
A150: 149 | B150: 16888341 | C150: 3.32 | D150: of:=LN([.B150])/LN([.A150]+1) -> 3.32136207952854 | E150: of:=(1+SQRT(5))/2 -> 1.6180339887499 | F150: of:=3+[.E150]/LN([.A150]+1) -> 3.32291992806907 | G150: of:=[.D150]-[.F150] -> -0.00155784854052632
A151: 150 | B151: 17229927 | C151: 3.32 | D151: of:=LN([.B151])/LN([.A151]+1) -> 3.32095456375348 | E151: of:=(1+SQRT(5))/2 -> 1.6180339887499 | F151: of:=3+[.E151]/LN([.A151]+1) -> 3.32249227497286 | G151: of:=[.D151]-[.F151] -> -0.00153771121937574
A152: 151 | B152: 17576721 | C152: 3.32 | D152: of:=LN([.B152])/LN([.A152]+1) -> 3.32055785260655 | E152: of:=(1+SQRT(5))/2 -> 1.6180339887499 | F152: of:=3+[.E152]/LN([.A152]+1) -> 3.32206856473516 | G152: of:=[.D152]-[.F152] -> -0.00151071212861176
A153: 152 | B153: 17927579 | C153: 3.32 | D153: of:=LN([.B153])/LN([.A153]+1) -> 3.32015841808538 | E153: of:=(1+SQRT(5))/2 -> 1.6180339887499 | F153: of:=3+[.E153]/LN([.A153]+1) -> 3.32164873397384 | G153: of:=[.D153]-[.F153] -> -0.00149031588846649
A154: 153 | B154: 18282961 | C154: 3.32 | D154: of:=LN([.B154])/LN([.A154]+1) -> 3.31976125468533 | E154: of:=(1+SQRT(5))/2 -> 1.6180339887499 | F154: of:=3+[.E154]/LN([.A154]+1) -> 3.32123272074757 | G154: of:=[.D154]-[.F154] -> -0.00147146606223769
A155: 154 | B155: 18642967 | C155: 3.32 | D155: of:=LN([.B155])/LN([.A155]+1) -> 3.31936712457839 | E155: of:=(1+SQRT(5))/2 -> 1.6180339887499 | F155: of:=3+[.E155]/LN([.A155]+1) -> 3.32082046451366 | G155: of:=[.D155]-[.F155] -> -0.00145333993527386
A156: 155 | B156: 19008981 | C156: 3.32 | D156: of:=LN([.B156])/LN([.A156]+1) -> 3.31899010300494 | E156: of:=(1+SQRT(5))/2 -> 1.6180339887499 | F156: of:=3+[.E156]/LN([.A156]+1) -> 3.32041190608743 | G156: of:=[.D156]-[.F156] -> -0.00142180308249307
A157: 156 | B157: 19377829 | C157: 3.32 | D157: of:=LN([.B157])/LN([.A157]+1) -> 3.31859659941753 | E157: of:=(1+SQRT(5))/2 -> 1.6180339887499 | F157: of:=3+[.E157]/LN([.A157]+1) -> 3.32000698760302 | G157: of:=[.D157]-[.F157] -> -0.00141038818548145
A158: 157 | B158: 19752305 | C158: 3.32 | D158: of:=LN([.B158])/LN([.A158]+1) -> 3.31821538988831 | E158: of:=(1+SQRT(5))/2 -> 1.6180339887499 | F158: of:=3+[.E158]/LN([.A158]+1) -> 3.31960565247552 | G158: of:=[.D158]-[.F158] -> -0.00139026258720332
A159: 158 | B159: 20131797 | C159: 3.32 | D159: of:=LN([.B159])/LN([.A159]+1) -> 3.31783959460349 | E159: of:=(1+SQRT(5))/2 -> 1.6180339887499 | F159: of:=3+[.E159]/LN([.A159]+1) -> 3.31920784536452 | G159: of:=[.D159]-[.F159] -> -0.00136825076102998
A160: 159 | B160: 20515355 | C160: 3.32 | D160: of:=LN([.B160])/LN([.A160]+1) -> 3.31745961834499 | E160: of:=(1+SQRT(5))/2 -> 1.6180339887499 | F160: of:=3+[.E160]/LN([.A160]+1) -> 3.31881351213886 | G160: of:=[.D160]-[.F160] -> -0.00135389379387174
A161: 160 | B161: 20904295 | C161: 3.32 | D161: of:=LN([.B161])/LN([.A161]+1) -> 3.31708795197727 | E161: of:=(1+SQRT(5))/2 -> 1.6180339887499 | F161: of:=3+[.E161]/LN([.A161]+1) -> 3.3184225998426 | G161: of:=[.D161]-[.F161] -> -0.00133464786533422
A162: 161 | B162: 21298371 | C162: 3.32 | D162: of:=LN([.B162])/LN([.A162]+1) -> 3.31672169665383 | E162: of:=(1+SQRT(5))/2 -> 1.6180339887499 | F162: of:=3+[.E162]/LN([.A162]+1) -> 3.31803505666217 | G162: of:=[.D162]-[.F162] -> -0.0013133600083437
A163: 162 | B163: 21697075 | C163: 3.32 | D163: of:=LN([.B163])/LN([.A163]+1) -> 3.31635579894026 | E163: of:=(1+SQRT(5))/2 -> 1.6180339887499 | F163: of:=3+[.E163]/LN([.A163]+1) -> 3.31765083189467 | G163: of:=[.D163]-[.F163] -> -0.00129503295440703
A164: 163 | B164: 22101261 | C164: 3.32 | D164: of:=LN([.B164])/LN([.A164]+1) -> 3.31599767621731 | E164: of:=(1+SQRT(5))/2 -> 1.6180339887499 | F164: of:=3+[.E164]/LN([.A164]+1) -> 3.31726987591716 | G164: of:=[.D164]-[.F164] -> -0.0012721996998537
A165: 164 | B165: 22509829 | C165: 3.32 | D165: of:=LN([.B165])/LN([.A165]+1) -> 3.31563717293233 | E165: of:=(1+SQRT(5))/2 -> 1.6180339887499 | F165: of:=3+[.E165]/LN([.A165]+1) -> 3.31689214015712 | G165: of:=[.D165]-[.F165] -> -0.00125496722478724
A166: 165 | B166: 22923619 | C166: 3.32 | D166: of:=LN([.B166])/LN([.A166]+1) -> 3.31528145919693 | E166: of:=(1+SQRT(5))/2 -> 1.6180339887499 | F166: of:=3+[.E166]/LN([.A166]+1) -> 3.31651757706371 | G166: of:=[.D166]-[.F166] -> -0.00123611786678612
A167: 166 | B167: 23342197 | C167: 3.31 | D167: of:=LN([.B167])/LN([.A167]+1) -> 3.31492649902792 | E167: of:=(1+SQRT(5))/2 -> 1.6180339887499 | F167: of:=3+[.E167]/LN([.A167]+1) -> 3.3161461400802 | G167: of:=[.D167]-[.F167] -> -0.00121964105228223
A168: 167 | B168: 23765943 | C168: 3.31 | D168: of:=LN([.B168])/LN([.A168]+1) -> 3.31457524208102 | E168: of:=(1+SQRT(5))/2 -> 1.6180339887499 | F168: of:=3+[.E168]/LN([.A168]+1) -> 3.31577778361712 | G168: of:=[.D168]-[.F168] -> -0.00120254153609478
A169: 168 | B169: 24194685 | C169: 3.31 | D169: of:=LN([.B169])/LN([.A169]+1) -> 3.31422596891582 | E169: of:=(1+SQRT(5))/2 -> 1.6180339887499 | F169: of:=3+[.E169]/LN([.A169]+1) -> 3.31541246302641 | G169: of:=[.D169]-[.F169] -> -0.00118649411058547
A170: 169 | B170: 24628027 | C170: 3.31 | D170: of:=LN([.B170])/LN([.A170]+1) -> 3.31387531460461 | E170: of:=(1+SQRT(5))/2 -> 1.6180339887499 | F170: of:=3+[.E170]/LN([.A170]+1) -> 3.31505013457639 | G170: of:=[.D170]-[.F170] -> -0.00117481997178404
A171: 170 | B171: 25068527 | C171: 3.31 | D171: of:=LN([.B171])/LN([.A171]+1) -> 3.31354308303133 | E171: of:=(1+SQRT(5))/2 -> 1.6180339887499 | F171: of:=3+[.E171]/LN([.A171]+1) -> 3.31469075542751 | G171: of:=[.D171]-[.F171] -> -0.0011476723961743
A172: 171 | B172: 25511967 | C172: 3.31 | D172: of:=LN([.B172])/LN([.A172]+1) -> 3.3131960162335 | E172: of:=(1+SQRT(5))/2 -> 1.6180339887499 | F172: of:=3+[.E172]/LN([.A172]+1) -> 3.31433428360889 | G172: of:=[.D172]-[.F172] -> -0.00113826737539746
A173: 172 | B173: 25961803 | C173: 3.31 | D173: of:=LN([.B173])/LN([.A173]+1) -> 3.312860642045 | E173: of:=(1+SQRT(5))/2 -> 1.6180339887499 | F173: of:=3+[.E173]/LN([.A173]+1) -> 3.31398067799569 | G173: of:=[.D173]-[.F173] -> -0.001120035950684
A174: 173 | B174: 26417177 | C174: 3.31 | D174: of:=LN([.B174])/LN([.A174]+1) -> 3.31252991280804 | E174: of:=(1+SQRT(5))/2 -> 1.6180339887499 | F174: of:=3+[.E174]/LN([.A174]+1) -> 3.31362989828705 | G174: of:=[.D174]-[.F174] -> -0.00109998547900947
A175: 174 | B175: 26876405 | C175: 3.31 | D175: of:=LN([.B175])/LN([.A175]+1) -> 3.31219132960895 | E175: of:=(1+SQRT(5))/2 -> 1.6180339887499 | F175: of:=3+[.E175]/LN([.A175]+1) -> 3.31328190498487 | G175: of:=[.D175]-[.F175] -> -0.00109057537592294
A176: 175 | B176: 27342849 | C176: 3.31 | D176: of:=LN([.B176])/LN([.A176]+1) -> 3.31186898684052 | E176: of:=(1+SQRT(5))/2 -> 1.6180339887499 | F176: of:=3+[.E176]/LN([.A176]+1) -> 3.31293665937321 | G176: of:=[.D176]-[.F176] -> -0.0010676725326908
A177: 176 | B177: 27813117 | C177: 3.31 | D177: of:=LN([.B177])/LN([.A177]+1) -> 3.31153834172239 | E177: of:=(1+SQRT(5))/2 -> 1.6180339887499 | F177: of:=3+[.E177]/LN([.A177]+1) -> 3.3125941234983 | G177: of:=[.D177]-[.F177] -> -0.00105578177591381
A178: 177 | B178: 28289499 | C178: 3.31 | D178: of:=LN([.B178])/LN([.A178]+1) -> 3.31121535030459 | E178: of:=(1+SQRT(5))/2 -> 1.6180339887499 | F178: of:=3+[.E178]/LN([.A178]+1) -> 3.31225426014923 | G178: of:=[.D178]-[.F178] -> -0.00103890984463728
A179: 178 | B179: 28770017 | C179: 3.31 | D179: of:=LN([.B179])/LN([.A179]+1) -> 3.31088624776718 | E179: of:=(1+SQRT(5))/2 -> 1.6180339887499 | F179: of:=3+[.E179]/LN([.A179]+1) -> 3.31191703283917 | G179: of:=[.D179]-[.F179] -> -0.00103078507199017
A180: 179 | B180: 29257549 | C180: 3.31 | D180: of:=LN([.B180])/LN([.A180]+1) -> 3.31057019679776 | E180: of:=(1+SQRT(5))/2 -> 1.6180339887499 | F180: of:=3+[.E180]/LN([.A180]+1) -> 3.31158240578728 | G180: of:=[.D180]-[.F180] -> -0.00101220898951349
A181: 180 | B181: 29749515 | C181: 3.31 | D181: of:=LN([.B181])/LN([.A181]+1) -> 3.31024972868203 | E181: of:=(1+SQRT(5))/2 -> 1.6180339887499 | F181: of:=3+[.E181]/LN([.A181]+1) -> 3.31125034390101 | G181: of:=[.D181]-[.F181] -> -0.00100061521898942
A182: 181 | B182: 30247157 | C182: 3.31 | D182: of:=LN([.B182])/LN([.A182]+1) -> 3.30993286333168 | E182: of:=(1+SQRT(5))/2 -> 1.6180339887499 | F182: of:=3+[.E182]/LN([.A182]+1) -> 3.31092081275914 | G182: of:=[.D182]-[.F182] -> -0.000987949427452062
A183: 182 | B183: 30751319 | C183: 3.31 | D183: of:=LN([.B183])/LN([.A183]+1) -> 3.30962458479744 | E183: of:=(1+SQRT(5))/2 -> 1.6180339887499 | F183: of:=3+[.E183]/LN([.A183]+1) -> 3.31059377859511 | G183: of:=[.D183]-[.F183] -> -0.000969193797663692
A184: 183 | B184: 31260647 | C184: 3.31 | D184: of:=LN([.B184])/LN([.A184]+1) -> 3.30931604573263 | E184: of:=(1+SQRT(5))/2 -> 1.6180339887499 | F184: of:=3+[.E184]/LN([.A184]+1) -> 3.31026920828105 | G184: of:=[.D184]-[.F184] -> -0.000953162548425368
A185: 184 | B185: 31774555 | C185: 3.31 | D185: of:=LN([.B185])/LN([.A185]+1) -> 3.30900362907003 | E185: of:=(1+SQRT(5))/2 -> 1.6180339887499 | F185: of:=3+[.E185]/LN([.A185]+1) -> 3.3099470693122 | G185: of:=[.D185]-[.F185] -> -0.000943440242171967
A186: 185 | B186: 32295659 | C186: 3.31 | D186: of:=LN([.B186])/LN([.A186]+1) -> 3.30870293997435 | E186: of:=(1+SQRT(5))/2 -> 1.6180339887499 | F186: of:=3+[.E186]/LN([.A186]+1) -> 3.30962732979174 | G186: of:=[.D186]-[.F186] -> -0.00092438981738896
A187: 186 | B187: 32821165 | C187: 3.31 | D187: of:=LN([.B187])/LN([.A187]+1) -> 3.30839701624297 | E187: of:=(1+SQRT(5))/2 -> 1.6180339887499 | F187: of:=3+[.E187]/LN([.A187]+1) -> 3.3093099584162 | G187: of:=[.D187]-[.F187] -> -0.000912942173223907
A188: 187 | B188: 33353467 | C188: 3.31 | D188: of:=LN([.B188])/LN([.A188]+1) -> 3.30809973755192 | E188: of:=(1+SQRT(5))/2 -> 1.6180339887499 | F188: of:=3+[.E188]/LN([.A188]+1) -> 3.30899492446116 | G188: of:=[.D188]-[.F188] -> -0.000895186909237289
A189: 188 | B189: 33890683 | C189: 3.31 | D189: of:=LN([.B189])/LN([.A189]+1) -> 3.30779998481488 | E189: of:=(1+SQRT(5))/2 -> 1.6180339887499 | F189: of:=3+[.E189]/LN([.A189]+1) -> 3.30868219776751 | G189: of:=[.D189]-[.F189] -> -0.000882212952626471
A190: 189 | B190: 34434371 | C190: 3.31 | D190: of:=LN([.B190])/LN([.A190]+1) -> 3.30750641541262 | E190: of:=(1+SQRT(5))/2 -> 1.6180339887499 | F190: of:=3+[.E190]/LN([.A190]+1) -> 3.30837174872797 | G190: of:=[.D190]-[.F190] -> -0.000865333315347883
A191: 190 | B191: 34982161 | C191: 3.31 | D191: of:=LN([.B191])/LN([.A191]+1) -> 3.3072057351488 | E191: of:=(1+SQRT(5))/2 -> 1.6180339887499 | F191: of:=3+[.E191]/LN([.A191]+1) -> 3.30806354827412 | G191: of:=[.D191]-[.F191] -> -0.000857813125310525
A192: 191 | B192: 35535587 | C192: 3.31 | D192: of:=LN([.B192])/LN([.A192]+1) -> 3.30690642078987 | E192: of:=(1+SQRT(5))/2 -> 1.6180339887499 | F192: of:=3+[.E192]/LN([.A192]+1) -> 3.30775756786369 | G192: of:=[.D192]-[.F192] -> -0.000851147073822833
A193: 192 | B193: 36095843 | C193: 3.31 | D193: of:=LN([.B193])/LN([.A193]+1) -> 3.30661460957844 | E193: of:=(1+SQRT(5))/2 -> 1.6180339887499 | F193: of:=3+[.E193]/LN([.A193]+1) -> 3.30745377946837 | G193: of:=[.D193]-[.F193] -> -0.000839169889928826
A194: 193 | B194: 36662571 | C194: 3.31 | D194: of:=LN([.B194])/LN([.A194]+1) -> 3.30632799952735 | E194: of:=(1+SQRT(5))/2 -> 1.6180339887499 | F194: of:=3+[.E194]/LN([.A194]+1) -> 3.30715215556176 | G194: of:=[.D194]-[.F194] -> -0.000824156034410439
A195: 194 | B195: 37235319 | C195: 3.31 | D195: of:=LN([.B195])/LN([.A195]+1) -> 3.30604395291222 | E195: of:=(1+SQRT(5))/2 -> 1.6180339887499 | F195: of:=3+[.E195]/LN([.A195]+1) -> 3.30685266910787 | G195: of:=[.D195]-[.F195] -> -0.000808716195652703
A196: 195 | B196: 37814279 | C196: 3.31 | D196: of:=LN([.B196])/LN([.A196]+1) -> 3.30576322552383 | E196: of:=(1+SQRT(5))/2 -> 1.6180339887499 | F196: of:=3+[.E196]/LN([.A196]+1) -> 3.3065552935498 | G196: of:=[.D196]-[.F196] -> -0.000792068025963655
A197: 196 | B197: 38397207 | C197: 3.31 | D197: of:=LN([.B197])/LN([.A197]+1) -> 3.30547451455354 | E197: of:=(1+SQRT(5))/2 -> 1.6180339887499 | F197: of:=3+[.E197]/LN([.A197]+1) -> 3.30626000279879 | G197: of:=[.D197]-[.F197] -> -0.000785488245249155
A198: 197 | B198: 38987011 | C198: 3.31 | D198: of:=LN([.B198])/LN([.A198]+1) -> 3.30519222949345 | E198: of:=(1+SQRT(5))/2 -> 1.6180339887499 | F198: of:=3+[.E198]/LN([.A198]+1) -> 3.30596677122361 | G198: of:=[.D198]-[.F198] -> -0.000774541730164557
A199: 198 | B199: 39583085 | C199: 3.3 | D199: of:=LN([.B199])/LN([.A199]+1) -> 3.30491309640713 | E199: of:=(1+SQRT(5))/2 -> 1.6180339887499 | F199: of:=3+[.E199]/LN([.A199]+1) -> 3.30567557364016 | G199: of:=[.D199]-[.F199] -> -0.000762477233031689
A200: 199 | B200: 40184979 | C200: 3.3 | D200: of:=LN([.B200])/LN([.A200]+1) -> 3.3046347766165 | E200: of:=(1+SQRT(5))/2 -> 1.6180339887499 | F200: of:=3+[.E200]/LN([.A200]+1) -> 3.30538638530143 | G200: of:=[.D200]-[.F200] -> -0.000751608684934624
A201: 200 | B201: 40792881 | C201: 3.3 | D201: of:=LN([.B201])/LN([.A201]+1) -> 3.30435802629901 | E201: of:=(1+SQRT(5))/2 -> 1.6180339887499 | F201: of:=3+[.E201]/LN([.A201]+1) -> 3.30509918188771 | G201: of:=[.D201]-[.F201] -> -0.000741155588698028
A202: 201 | B202: 41407949 | C202: 3.3 | D202: of:=LN([.B202])/LN([.A202]+1) -> 3.30408796711261 | E202: of:=(1+SQRT(5))/2 -> 1.6180339887499 | F202: of:=3+[.E202]/LN([.A202]+1) -> 3.30481393949707 | G202: of:=[.D202]-[.F202] -> -0.000725972384457485
A203: 202 | B203: 42028029 | C203: 3.3 | D203: of:=LN([.B203])/LN([.A203]+1) -> 3.30381456695803 | E203: of:=(1+SQRT(5))/2 -> 1.6180339887499 | F203: of:=3+[.E203]/LN([.A203]+1) -> 3.3045306346361 | G203: of:=[.D203]-[.F203] -> -0.0007160676780682
A204: 203 | B204: 42654261 | C204: 3.3 | D204: of:=LN([.B204])/LN([.A204]+1) -> 3.303542934996 | E204: of:=(1+SQRT(5))/2 -> 1.6180339887499 | F204: of:=3+[.E204]/LN([.A204]+1) -> 3.30424924421088 | G204: of:=[.D204]-[.F204] -> -0.000706309214884016
A205: 204 | B205: 43286875 | C205: 3.3 | D205: of:=LN([.B205])/LN([.A205]+1) -> 3.30327391798097 | E205: of:=(1+SQRT(5))/2 -> 1.6180339887499 | F205: of:=3+[.E205]/LN([.A205]+1) -> 3.30396974551827 | G205: of:=[.D205]-[.F205] -> -0.000695827537297244
A206: 205 | B206: 43926601 | C206: 3.3 | D206: of:=LN([.B206])/LN([.A206]+1) -> 3.3030104458796 | E206: of:=(1+SQRT(5))/2 -> 1.6180339887499 | F206: of:=3+[.E206]/LN([.A206]+1) -> 3.30369211623728 | G206: of:=[.D206]-[.F206] -> -0.00068167035768596
A207: 206 | B207: 44571637 | C207: 3.3 | D207: of:=LN([.B207])/LN([.A207]+1) -> 3.30274461410422 | E207: of:=(1+SQRT(5))/2 -> 1.6180339887499 | F207: of:=3+[.E207]/LN([.A207]+1) -> 3.30341633442088 | G207: of:=[.D207]-[.F207] -> -0.000671720316653968
A208: 207 | B208: 45223415 | C208: 3.3 | D208: of:=LN([.B208])/LN([.A208]+1) -> 3.30248239514772 | E208: of:=(1+SQRT(5))/2 -> 1.6180339887499 | F208: of:=3+[.E208]/LN([.A208]+1) -> 3.30314237848781 | G208: of:=[.D208]-[.F208] -> -0.000659983340083326
A209: 208 | B209: 45880631 | C209: 3.3 | D209: of:=LN([.B209])/LN([.A209]+1) -> 3.30221823857465 | E209: of:=(1+SQRT(5))/2 -> 1.6180339887499 | F209: of:=3+[.E209]/LN([.A209]+1) -> 3.30287022721478 | G209: of:=[.D209]-[.F209] -> -0.000651988640130163
A210: 209 | B210: 46544599 | C210: 3.3 | D210: of:=LN([.B210])/LN([.A210]+1) -> 3.30195744666613 | E210: of:=(1+SQRT(5))/2 -> 1.6180339887499 | F210: of:=3+[.E210]/LN([.A210]+1) -> 3.3025998597288 | G210: of:=[.D210]-[.F210] -> -0.000642413062662328
A211: 210 | B211: 47216091 | C211: 3.3 | D211: of:=LN([.B211])/LN([.A211]+1) -> 3.30170285960081 | E211: of:=(1+SQRT(5))/2 -> 1.6180339887499 | F211: of:=3+[.E211]/LN([.A211]+1) -> 3.30233125549966 | G211: of:=[.D211]-[.F211] -> -0.000628395898852663
A212: 211 | B212: 47892651 | C212: 3.3 | D212: of:=LN([.B212])/LN([.A212]+1) -> 3.30144456189007 | E212: of:=(1+SQRT(5))/2 -> 1.6180339887499 | F212: of:=3+[.E212]/LN([.A212]+1) -> 3.30206439433274 | G212: of:=[.D212]-[.F212] -> -0.00061983244267072
A213: 212 | B213: 48575483 | C213: 3.3 | D213: of:=LN([.B213])/LN([.A213]+1) -> 3.30118727902286 | E213: of:=(1+SQRT(5))/2 -> 1.6180339887499 | F213: of:=3+[.E213]/LN([.A213]+1) -> 3.30179925636188 | G213: of:=[.D213]-[.F213] -> -0.000611977339026293
A214: 213 | B214: 49265655 | C214: 3.3 | D214: of:=LN([.B214])/LN([.A214]+1) -> 3.3009349452005 | E214: of:=(1+SQRT(5))/2 -> 1.6180339887499 | F214: of:=3+[.E214]/LN([.A214]+1) -> 3.30153582204249 | G214: of:=[.D214]-[.F214] -> -0.000600876841991393
A215: 214 | B215: 49962137 | C215: 3.3 | D215: of:=LN([.B215])/LN([.A215]+1) -> 3.30068344276522 | E215: of:=(1+SQRT(5))/2 -> 1.6180339887499 | F215: of:=3+[.E215]/LN([.A215]+1) -> 3.30127407214483 | G215: of:=[.D215]-[.F215] -> -0.000590629379606966
A216: 215 | B216: 50664753 | C216: 3.3 | D216: of:=LN([.B216])/LN([.A216]+1) -> 3.30043202866129 | E216: of:=(1+SQRT(5))/2 -> 1.6180339887499 | F216: of:=3+[.E216]/LN([.A216]+1) -> 3.30101398774747 | G216: of:=[.D216]-[.F216] -> -0.00058195908617753
A217: 216 | B217: 51373809 | C217: 3.3 | D217: of:=LN([.B217])/LN([.A217]+1) -> 3.30018174721234 | E217: of:=(1+SQRT(5))/2 -> 1.6180339887499 | F217: of:=3+[.E217]/LN([.A217]+1) -> 3.30075555023091 | G217: of:=[.D217]-[.F217] -> -0.000573803018572683
A218: 217 | B218: 52090987 | C218: 3.3 | D218: of:=LN([.B218])/LN([.A218]+1) -> 3.29993848825496 | E218: of:=(1+SQRT(5))/2 -> 1.6180339887499 | F218: of:=3+[.E218]/LN([.A218]+1) -> 3.30049874127135 | G218: of:=[.D218]-[.F218] -> -0.000560253016385293
A219: 218 | B219: 52813449 | C219: 3.3 | D219: of:=LN([.B219])/LN([.A219]+1) -> 3.2996919179542 | E219: of:=(1+SQRT(5))/2 -> 1.6180339887499 | F219: of:=3+[.E219]/LN([.A219]+1) -> 3.3002435428346 | G219: of:=[.D219]-[.F219] -> -0.000551624880396506
A220: 219 | B220: 53542849 | C220: 3.3 | D220: of:=LN([.B220])/LN([.A220]+1) -> 3.29944784919887 | E220: of:=(1+SQRT(5))/2 -> 1.6180339887499 | F220: of:=3+[.E220]/LN([.A220]+1) -> 3.29998993717024 | G220: of:=[.D220]-[.F220] -> -0.000542087971360239
A221: 220 | B221: 54278297 | C221: 3.3 | D221: of:=LN([.B221])/LN([.A221]+1) -> 3.2992030812773 | E221: of:=(1+SQRT(5))/2 -> 1.6180339887499 | F221: of:=3+[.E221]/LN([.A221]+1) -> 3.29973790680577 | G221: of:=[.D221]-[.F221] -> -0.000534825528466953
A222: 221 | B222: 55021723 | C222: 3.3 | D222: of:=LN([.B222])/LN([.A222]+1) -> 3.29896408189358 | E222: of:=(1+SQRT(5))/2 -> 1.6180339887499 | F222: of:=3+[.E222]/LN([.A222]+1) -> 3.29948743454105 | G222: of:=[.D222]-[.F222] -> -0.000523352647470166
A223: 222 | B223: 55769673 | C223: 3.3 | D223: of:=LN([.B223])/LN([.A223]+1) -> 3.29871909731557 | E223: of:=(1+SQRT(5))/2 -> 1.6180339887499 | F223: of:=3+[.E223]/LN([.A223]+1) -> 3.2992385034428 | G223: of:=[.D223]-[.F223] -> -0.000519406127234667
A224: 223 | B224: 56527093 | C224: 3.3 | D224: of:=LN([.B224])/LN([.A224]+1) -> 3.29848449663254 | E224: of:=(1+SQRT(5))/2 -> 1.6180339887499 | F224: of:=3+[.E224]/LN([.A224]+1) -> 3.29899109683924 | G224: of:=[.D224]-[.F224] -> -0.00050660020669735
A225: 224 | B225: 57290225 | C225: 3.3 | D225: of:=LN([.B225])/LN([.A225]+1) -> 3.2982476777006 | E225: of:=(1+SQRT(5))/2 -> 1.6180339887499 | F225: of:=3+[.E225]/LN([.A225]+1) -> 3.29874519831489 | G225: of:=[.D225]-[.F225] -> -0.000497520614283875
A226: 225 | B226: 58061381 | C226: 3.3 | D226: of:=LN([.B226])/LN([.A226]+1) -> 3.29801602690819 | E226: of:=(1+SQRT(5))/2 -> 1.6180339887499 | F226: of:=3+[.E226]/LN([.A226]+1) -> 3.29850079170545 | G226: of:=[.D226]-[.F226] -> -0.000484764797263448
A227: 226 | B227: 58836647 | C227: 3.3 | D227: of:=LN([.B227])/LN([.A227]+1) -> 3.29777701349871 | E227: of:=(1+SQRT(5))/2 -> 1.6180339887499 | F227: of:=3+[.E227]/LN([.A227]+1) -> 3.2982578610929 | G227: of:=[.D227]-[.F227] -> -0.000480847594186873
A228: 227 | B228: 59620803 | C228: 3.3 | D228: of:=LN([.B228])/LN([.A228]+1) -> 3.29754565988203 | E228: of:=(1+SQRT(5))/2 -> 1.6180339887499 | F228: of:=3+[.E228]/LN([.A228]+1) -> 3.29801639080058 | G228: of:=[.D228]-[.F228] -> -0.000470730918547879
A229: 228 | B229: 60410281 | C229: 3.3 | D229: of:=LN([.B229])/LN([.A229]+1) -> 3.29731072953906 | E229: of:=(1+SQRT(5))/2 -> 1.6180339887499 | F229: of:=3+[.E229]/LN([.A229]+1) -> 3.2977763653885 | G229: of:=[.D229]-[.F229] -> -0.000465635849441259
A230: 229 | B230: 61208221 | C230: 3.3 | D230: of:=LN([.B230])/LN([.A230]+1) -> 3.29708175441758 | E230: of:=(1+SQRT(5))/2 -> 1.6180339887499 | F230: of:=3+[.E230]/LN([.A230]+1) -> 3.29753776964873 | G230: of:=[.D230]-[.F230] -> -0.00045601523114458
A231: 230 | B231: 62014319 | C231: 3.3 | D231: of:=LN([.B231])/LN([.A231]+1) -> 3.29685754058682 | E231: of:=(1+SQRT(5))/2 -> 1.6180339887499 | F231: of:=3+[.E231]/LN([.A231]+1) -> 3.29730058860086 | G231: of:=[.D231]-[.F231] -> -0.000443048014040492
A232: 231 | B232: 62825415 | C232: 3.3 | D232: of:=LN([.B232])/LN([.A232]+1) -> 3.29662860934481 | E232: of:=(1+SQRT(5))/2 -> 1.6180339887499 | F232: of:=3+[.E232]/LN([.A232]+1) -> 3.29706480748766 | G232: of:=[.D232]-[.F232] -> -0.000436198142846678
A233: 232 | B233: 63642457 | C233: 3.3 | D233: of:=LN([.B233])/LN([.A233]+1) -> 3.29639783713661 | E233: of:=(1+SQRT(5))/2 -> 1.6180339887499 | F233: of:=3+[.E233]/LN([.A233]+1) -> 3.29683041177071 | G233: of:=[.D233]-[.F233] -> -0.000432574634107397
A234: 233 | B234: 64469661 | C234: 3.3 | D234: of:=LN([.B234])/LN([.A234]+1) -> 3.29617724030793 | E234: of:=(1+SQRT(5))/2 -> 1.6180339887499 | F234: of:=3+[.E234]/LN([.A234]+1) -> 3.29659738712628 | G234: of:=[.D234]-[.F234] -> -0.000420146818346456
A235: 234 | B235: 65300889 | C235: 3.3 | D235: of:=LN([.B235])/LN([.A235]+1) -> 3.29594914515477 | E235: of:=(1+SQRT(5))/2 -> 1.6180339887499 | F235: of:=3+[.E235]/LN([.A235]+1) -> 3.29636571944116 | G235: of:=[.D235]-[.F235] -> -0.000416574286393967
A236: 235 | B236: 66142307 | C236: 3.3 | D236: of:=LN([.B236])/LN([.A236]+1) -> 3.29573086947935 | E236: of:=(1+SQRT(5))/2 -> 1.6180339887499 | F236: of:=3+[.E236]/LN([.A236]+1) -> 3.29613539480876 | G236: of:=[.D236]-[.F236] -> -0.000404525329401828
A237: 236 | B237: 66988543 | C237: 3.3 | D237: of:=LN([.B237])/LN([.A237]+1) -> 3.29550730928725 | E237: of:=(1+SQRT(5))/2 -> 1.6180339887499 | F237: of:=3+[.E237]/LN([.A237]+1) -> 3.29590639952508 | G237: of:=[.D237]-[.F237] -> -0.00039909023783391
A238: 237 | B238: 67842929 | C238: 3.3 | D238: of:=LN([.B238])/LN([.A238]+1) -> 3.29528760527031 | E238: of:=(1+SQRT(5))/2 -> 1.6180339887499 | F238: of:=3+[.E238]/LN([.A238]+1) -> 3.29567872008501 | G238: of:=[.D238]-[.F238] -> -0.000391114814694671
A239: 238 | B239: 68706205 | C239: 3.3 | D239: of:=LN([.B239])/LN([.A239]+1) -> 3.29507352732812 | E239: of:=(1+SQRT(5))/2 -> 1.6180339887499 | F239: of:=3+[.E239]/LN([.A239]+1) -> 3.29545234317851 | G239: of:=[.D239]-[.F239] -> -0.000378815850394343
A240: 239 | B240: 69572273 | C240: 3.29 | D240: of:=LN([.B240])/LN([.A240]+1) -> 3.29484881636456 | E240: of:=(1+SQRT(5))/2 -> 1.6180339887499 | F240: of:=3+[.E240]/LN([.A240]+1) -> 3.29522725568705 | G240: of:=[.D240]-[.F240] -> -0.000378439322492596
A241: 240 | B241: 70448407 | C241: 3.29 | D241: of:=LN([.B241])/LN([.A241]+1) -> 3.29463267344184 | E241: of:=(1+SQRT(5))/2 -> 1.6180339887499 | F241: of:=3+[.E241]/LN([.A241]+1) -> 3.29500344467997 | G241: of:=[.D241]-[.F241] -> -0.000370771238135337
A242: 241 | B242: 71332885 | C242: 3.29 | D242: of:=LN([.B242])/LN([.A242]+1) -> 3.29442032345902 | E242: of:=(1+SQRT(5))/2 -> 1.6180339887499 | F242: of:=3+[.E242]/LN([.A242]+1) -> 3.29478089741106 | G242: of:=[.D242]-[.F242] -> -0.000360573952039367
A243: 242 | B243: 72223397 | C243: 3.29 | D243: of:=LN([.B243])/LN([.A243]+1) -> 3.29420575323746 | E243: of:=(1+SQRT(5))/2 -> 1.6180339887499 | F243: of:=3+[.E243]/LN([.A243]+1) -> 3.29455960131513 | G243: of:=[.D243]-[.F243] -> -0.000353848077669916
A244: 243 | B244: 73122011 | C244: 3.29 | D244: of:=LN([.B244])/LN([.A244]+1) -> 3.29399415214392 | E244: of:=(1+SQRT(5))/2 -> 1.6180339887499 | F244: of:=3+[.E244]/LN([.A244]+1) -> 3.29433954400469 | G244: of:=[.D244]-[.F244] -> -0.000345391860769428
A245: 244 | B245: 74028549 | C245: 3.29 | D245: of:=LN([.B245])/LN([.A245]+1) -> 3.29378492711595 | E245: of:=(1+SQRT(5))/2 -> 1.6180339887499 | F245: of:=3+[.E245]/LN([.A245]+1) -> 3.29412071326673 | G245: of:=[.D245]-[.F245] -> -0.000335786150782447
A246: 245 | B246: 74941927 | C246: 3.29 | D246: of:=LN([.B246])/LN([.A246]+1) -> 3.2935753181362 | E246: of:=(1+SQRT(5))/2 -> 1.6180339887499 | F246: of:=3+[.E246]/LN([.A246]+1) -> 3.29390309705951 | G246: of:=[.D246]-[.F246] -> -0.000327778923309374
A247: 246 | B247: 75860769 | C247: 3.29 | D247: of:=LN([.B247])/LN([.A247]+1) -> 3.29336200729201 | E247: of:=(1+SQRT(5))/2 -> 1.6180339887499 | F247: of:=3+[.E247]/LN([.A247]+1) -> 3.29368668350945 | G247: of:=[.D247]-[.F247] -> -0.000324676217437592
A248: 247 | B248: 76789305 | C248: 3.29 | D248: of:=LN([.B248])/LN([.A248]+1) -> 3.29315508851682 | E248: of:=(1+SQRT(5))/2 -> 1.6180339887499 | F248: of:=3+[.E248]/LN([.A248]+1) -> 3.29347146090813 | G248: of:=[.D248]-[.F248] -> -0.000316372391304665
A249: 248 | B249: 77724443 | C249: 3.29 | D249: of:=LN([.B249])/LN([.A249]+1) -> 3.2929470696947 | E249: of:=(1+SQRT(5))/2 -> 1.6180339887499 | F249: of:=3+[.E249]/LN([.A249]+1) -> 3.29325741770929 | G249: of:=[.D249]-[.F249] -> -0.000310348014590733
A250: 249 | B250: 78668149 | C250: 3.29 | D250: of:=LN([.B250])/LN([.A250]+1) -> 3.29274248026438 | E250: of:=(1+SQRT(5))/2 -> 1.6180339887499 | F250: of:=3+[.E250]/LN([.A250]+1) -> 3.29304454252596 | G250: of:=[.D250]-[.F250] -> -0.000302062261575919
A251: 250 | B251: 79619165 | C251: 3.29 | D251: of:=LN([.B251])/LN([.A251]+1) -> 3.29253829298297 | E251: of:=(1+SQRT(5))/2 -> 1.6180339887499 | F251: of:=3+[.E251]/LN([.A251]+1) -> 3.29283282412756 | G251: of:=[.D251]-[.F251] -> -0.000294531144589438
A252: 251 | B252: 80576439 | C252: 3.29 | D252: of:=LN([.B252])/LN([.A252]+1) -> 3.29233209369848 | E252: of:=(1+SQRT(5))/2 -> 1.6180339887499 | F252: of:=3+[.E252]/LN([.A252]+1) -> 3.29262225143719 | G252: of:=[.D252]-[.F252] -> -0.000290157738714214
A253: 252 | B253: 81541599 | C253: 3.29 | D253: of:=LN([.B253])/LN([.A253]+1) -> 3.29212752911771 | E253: of:=(1+SQRT(5))/2 -> 1.6180339887499 | F253: of:=3+[.E253]/LN([.A253]+1) -> 3.29241281352887 | G253: of:=[.D253]-[.F253] -> -0.000285284411156717
A254: 253 | B254: 82517427 | C254: 3.29 | D254: of:=LN([.B254])/LN([.A254]+1) -> 3.29193059085018 | E254: of:=(1+SQRT(5))/2 -> 1.6180339887499 | F254: of:=3+[.E254]/LN([.A254]+1) -> 3.29220449962489 | G254: of:=[.D254]-[.F254] -> -0.000273908774706122
A255: 254 | B255: 83498111 | C255: 3.29 | D255: of:=LN([.B255])/LN([.A255]+1) -> 3.2917283969913 | E255: of:=(1+SQRT(5))/2 -> 1.6180339887499 | F255: of:=3+[.E255]/LN([.A255]+1) -> 3.2919972990932 | G255: of:=[.D255]-[.F255] -> -0.000268902101900448
A256: 255 | B256: 84487019 | C256: 3.29 | D256: of:=LN([.B256])/LN([.A256]+1) -> 3.29152829498637 | E256: of:=(1+SQRT(5))/2 -> 1.6180339887499 | F256: of:=3+[.E256]/LN([.A256]+1) -> 3.29179120144491 | G256: of:=[.D256]-[.F256] -> -0.000262906458542211
A257: 256 | B257: 85483265 | C257: 3.29 | D257: of:=LN([.B257])/LN([.A257]+1) -> 3.29132830480912 | E257: of:=(1+SQRT(5))/2 -> 1.6180339887499 | F257: of:=3+[.E257]/LN([.A257]+1) -> 3.29158619633172 | G257: of:=[.D257]-[.F257] -> -0.000257891522594811
A258: 257 | B258: 86489275 | C258: 3.29 | D258: of:=LN([.B258])/LN([.A258]+1) -> 3.29113343907645 | E258: of:=(1+SQRT(5))/2 -> 1.6180339887499 | F258: of:=3+[.E258]/LN([.A258]+1) -> 3.29138227354355 | G258: of:=[.D258]-[.F258] -> -0.000248834467100778
A259: 258 | B259: 87500603 | C259: 3.29 | D259: of:=LN([.B259])/LN([.A259]+1) -> 3.29093433154374 | E259: of:=(1+SQRT(5))/2 -> 1.6180339887499 | F259: of:=3+[.E259]/LN([.A259]+1) -> 3.29117942300612 | G259: of:=[.D259]-[.F259] -> -0.000245091462380831
A260: 259 | B260: 88522863 | C260: 3.29 | D260: of:=LN([.B260])/LN([.A260]+1) -> 3.29074250781295 | E260: of:=(1+SQRT(5))/2 -> 1.6180339887499 | F260: of:=3+[.E260]/LN([.A260]+1) -> 3.29097763477863 | G260: of:=[.D260]-[.F260] -> -0.000235126965684618
A261: 260 | B261: 89550027 | C261: 3.29 | D261: of:=LN([.B261])/LN([.A261]+1) -> 3.29054557224425 | E261: of:=(1+SQRT(5))/2 -> 1.6180339887499 | F261: of:=3+[.E261]/LN([.A261]+1) -> 3.29077689905147 | G261: of:=[.D261]-[.F261] -> -0.000231326807211385
A262: 261 | B262: 90585789 | C262: 3.29 | D262: of:=LN([.B262])/LN([.A262]+1) -> 3.29035099966073 | E262: of:=(1+SQRT(5))/2 -> 1.6180339887499 | F262: of:=3+[.E262]/LN([.A262]+1) -> 3.29057720614395 | G262: of:=[.D262]-[.F262] -> -0.000226206483216806
A263: 262 | B263: 91631361 | C263: 3.29 | D263: of:=LN([.B263])/LN([.A263]+1) -> 3.29016104619059 | E263: of:=(1+SQRT(5))/2 -> 1.6180339887499 | F263: of:=3+[.E263]/LN([.A263]+1) -> 3.29037854650215 | G263: of:=[.D263]-[.F263] -> -0.0002175003115652
A264: 263 | B264: 92682453 | C264: 3.29 | D264: of:=LN([.B264])/LN([.A264]+1) -> 3.28996721190329 | E264: of:=(1+SQRT(5))/2 -> 1.6180339887499 | F264: of:=3+[.E264]/LN([.A264]+1) -> 3.29018091069678 | G264: of:=[.D264]-[.F264] -> -0.000213698793487538
A265: 264 | B265: 93741441 | C265: 3.29 | D265: of:=LN([.B265])/LN([.A265]+1) -> 3.28977414590188 | E265: of:=(1+SQRT(5))/2 -> 1.6180339887499 | F265: of:=3+[.E265]/LN([.A265]+1) -> 3.28998428942102 | G265: of:=[.D265]-[.F265] -> -0.000210143519142836
A266: 265 | B266: 94810893 | C266: 3.29 | D266: of:=LN([.B266])/LN([.A266]+1) -> 3.28958664068593 | E266: of:=(1+SQRT(5))/2 -> 1.6180339887499 | F266: of:=3+[.E266]/LN([.A266]+1) -> 3.28978867348852 | G266: of:=[.D266]-[.F266] -> -0.000202032802593344
A267: 266 | B267: 95888163 | C267: 3.29 | D267: of:=LN([.B267])/LN([.A267]+1) -> 3.28939952832541 | E267: of:=(1+SQRT(5))/2 -> 1.6180339887499 | F267: of:=3+[.E267]/LN([.A267]+1) -> 3.28959405383135 | G267: of:=[.D267]-[.F267] -> -0.000194525505942789
A268: 267 | B268: 96971831 | C268: 3.29 | D268: of:=LN([.B268])/LN([.A268]+1) -> 3.28921014417219 | E268: of:=(1+SQRT(5))/2 -> 1.6180339887499 | F268: of:=3+[.E268]/LN([.A268]+1) -> 3.28940042149804 | G268: of:=[.D268]-[.F268] -> -0.000190277325848864
A269: 268 | B269: 98065125 | C269: 3.29 | D269: of:=LN([.B269])/LN([.A269]+1) -> 3.28902442114025 | E269: of:=(1+SQRT(5))/2 -> 1.6180339887499 | F269: of:=3+[.E269]/LN([.A269]+1) -> 3.28920776765164 | G269: of:=[.D269]-[.F269] -> -0.000183346511395843
A270: 269 | B270: 99166231 | C270: 3.29 | D270: of:=LN([.B270])/LN([.A270]+1) -> 3.28883893279975 | E270: of:=(1+SQRT(5))/2 -> 1.6180339887499 | F270: of:=3+[.E270]/LN([.A270]+1) -> 3.28901608356784 | G270: of:=[.D270]-[.F270] -> -0.000177150768090328
A271: 270 | B271: 100275313 | C271: 3.29 | D271: of:=LN([.B271])/LN([.A271]+1) -> 3.28865393257378 | E271: of:=(1+SQRT(5))/2 -> 1.6180339887499 | F271: of:=3+[.E271]/LN([.A271]+1) -> 3.28882536063307 | G271: of:=[.D271]-[.F271] -> -0.000171428059289269
A272: 271 | B272: 101391649 | C272: 3.29 | D272: of:=LN([.B272])/LN([.A272]+1) -> 3.28846810335356 | E272: of:=(1+SQRT(5))/2 -> 1.6180339887499 | F272: of:=3+[.E272]/LN([.A272]+1) -> 3.28863559034274 | G272: of:=[.D272]-[.F272] -> -0.000167486989180787
A273: 272 | B273: 102517579 | C273: 3.29 | D273: of:=LN([.B273])/LN([.A273]+1) -> 3.28828551381792 | E273: of:=(1+SQRT(5))/2 -> 1.6180339887499 | F273: of:=3+[.E273]/LN([.A273]+1) -> 3.28844676429941 | G273: of:=[.D273]-[.F273] -> -0.000161250481489184
A274: 273 | B274: 103653053 | C274: 3.29 | D274: of:=LN([.B274])/LN([.A274]+1) -> 3.28810593692025 | E274: of:=(1+SQRT(5))/2 -> 1.6180339887499 | F274: of:=3+[.E274]/LN([.A274]+1) -> 3.28825887421106 | G274: of:=[.D274]-[.F274] -> -0.00015293729080712
A275: 274 | B275: 104796295 | C275: 3.29 | D275: of:=LN([.B275])/LN([.A275]+1) -> 3.28792622221066 | E275: of:=(1+SQRT(5))/2 -> 1.6180339887499 | F275: of:=3+[.E275]/LN([.A275]+1) -> 3.28807191188939 | G275: of:=[.D275]-[.F275] -> -0.000145689678737959
A276: 275 | B276: 105945555 | C276: 3.29 | D276: of:=LN([.B276])/LN([.A276]+1) -> 3.2877434064819 | E276: of:=(1+SQRT(5))/2 -> 1.6180339887499 | F276: of:=3+[.E276]/LN([.A276]+1) -> 3.28788586924812 | G276: of:=[.D276]-[.F276] -> -0.000142462766223428
A277: 276 | B277: 107103285 | C277: 3.29 | D277: of:=LN([.B277])/LN([.A277]+1) -> 3.28756163843289 | E277: of:=(1+SQRT(5))/2 -> 1.6180339887499 | F277: of:=3+[.E277]/LN([.A277]+1) -> 3.28770073830136 | G277: of:=[.D277]-[.F277] -> -0.000139099868474712
A278: 277 | B278: 108272589 | C278: 3.29 | D278: of:=LN([.B278])/LN([.A278]+1) -> 3.28738594935538 | E278: of:=(1+SQRT(5))/2 -> 1.6180339887499 | F278: of:=3+[.E278]/LN([.A278]+1) -> 3.28751651116199 | G278: of:=[.D278]-[.F278] -> -0.000130561806606977
A279: 278 | B279: 109446243 | C279: 3.29 | D279: of:=LN([.B279])/LN([.A279]+1) -> 3.28720438377483 | E279: of:=(1+SQRT(5))/2 -> 1.6180339887499 | F279: of:=3+[.E279]/LN([.A279]+1) -> 3.28733318004008 | G279: of:=[.D279]-[.F279] -> -0.000128796265251641
A280: 279 | B280: 110631389 | C280: 3.29 | D280: of:=LN([.B280])/LN([.A280]+1) -> 3.28702857030892 | E280: of:=(1+SQRT(5))/2 -> 1.6180339887499 | F280: of:=3+[.E280]/LN([.A280]+1) -> 3.28715073724134 | G280: of:=[.D280]-[.F280] -> -0.000122166932417844
A281: 280 | B281: 111822665 | C281: 3.29 | D281: of:=LN([.B281])/LN([.A281]+1) -> 3.28684978385981 | E281: of:=(1+SQRT(5))/2 -> 1.6180339887499 | F281: of:=3+[.E281]/LN([.A281]+1) -> 3.28696917516561 | G281: of:=[.D281]-[.F281] -> -0.000119391305803518
A282: 281 | B282: 113025503 | C282: 3.29 | D282: of:=LN([.B282])/LN([.A282]+1) -> 3.28667661631559 | E282: of:=(1+SQRT(5))/2 -> 1.6180339887499 | F282: of:=3+[.E282]/LN([.A282]+1) -> 3.28678848630537 | G282: of:=[.D282]-[.F282] -> -0.000111869989777524
A283: 282 | B283: 114235423 | C283: 3.29 | D283: of:=LN([.B283])/LN([.A283]+1) -> 3.2865019062924 | E283: of:=(1+SQRT(5))/2 -> 1.6180339887499 | F283: of:=3+[.E283]/LN([.A283]+1) -> 3.28660866324424 | G283: of:=[.D283]-[.F283] -> -0.00010675695184359
A284: 283 | B284: 115454483 | C284: 3.29 | D284: of:=LN([.B284])/LN([.A284]+1) -> 3.28632883440382 | E284: of:=(1+SQRT(5))/2 -> 1.6180339887499 | F284: of:=3+[.E284]/LN([.A284]+1) -> 3.28642969865562 | G284: of:=[.D284]-[.F284] -> -0.000100864251805444
A285: 284 | B285: 116680537 | C285: 3.29 | D285: of:=LN([.B285])/LN([.A285]+1) -> 3.28615406644645 | E285: of:=(1+SQRT(5))/2 -> 1.6180339887499 | F285: of:=3+[.E285]/LN([.A285]+1) -> 3.28625158530122 | G285: of:=[.D285]-[.F285] -> -0.0000975188547736039
A286: 285 | B286: 117917335 | C286: 3.29 | D286: of:=LN([.B286])/LN([.A286]+1) -> 3.28598325593899 | E286: of:=(1+SQRT(5))/2 -> 1.6180339887499 | F286: of:=3+[.E286]/LN([.A286]+1) -> 3.2860743160297 | G286: of:=[.D286]-[.F286] -> -0.0000910600907157999
A287: 286 | B287: 119162513 | C287: 3.29 | D287: of:=LN([.B287])/LN([.A287]+1) -> 3.28581274150761 | E287: of:=(1+SQRT(5))/2 -> 1.6180339887499 | F287: of:=3+[.E287]/LN([.A287]+1) -> 3.28589788377535 | G287: of:=[.D287]-[.F287] -> -0.0000851422677379254
A288: 287 | B288: 120415669 | C288: 3.29 | D288: of:=LN([.B288])/LN([.A288]+1) -> 3.2856418985853 | E288: of:=(1+SQRT(5))/2 -> 1.6180339887499 | F288: of:=3+[.E288]/LN([.A288]+1) -> 3.2857222815567 | G288: of:=[.D288]-[.F288] -> -0.0000803829714071114
A289: 288 | B289: 121676189 | C289: 3.29 | D289: of:=LN([.B289])/LN([.A289]+1) -> 3.28546982256485 | E289: of:=(1+SQRT(5))/2 -> 1.6180339887499 | F289: of:=3+[.E289]/LN([.A289]+1) -> 3.2855475024753 | G289: of:=[.D289]-[.F289] -> -0.0000776799104520442
A290: 289 | B290: 122946595 | C290: 3.29 | D290: of:=LN([.B290])/LN([.A290]+1) -> 3.28530014740882 | E290: of:=(1+SQRT(5))/2 -> 1.6180339887499 | F290: of:=3+[.E290]/LN([.A290]+1) -> 3.28537353971436 | G290: of:=[.D290]-[.F290] -> -0.00007339230554404
A291: 290 | B291: 124227073 | C291: 3.29 | D291: of:=LN([.B291])/LN([.A291]+1) -> 3.28513303492182 | E291: of:=(1+SQRT(5))/2 -> 1.6180339887499 | F291: of:=3+[.E291]/LN([.A291]+1) -> 3.28520038653757 | G291: of:=[.D291]-[.F291] -> -0.0000673516157441156
A292: 291 | B292: 125516343 | C292: 3.28 | D292: of:=LN([.B292])/LN([.A292]+1) -> 3.28496658137863 | E292: of:=(1+SQRT(5))/2 -> 1.6180339887499 | F292: of:=3+[.E292]/LN([.A292]+1) -> 3.28502803628781 | G292: of:=[.D292]-[.F292] -> -0.0000614549091793037
A293: 292 | B293: 126812687 | C293: 3.28 | D293: of:=LN([.B293])/LN([.A293]+1) -> 3.28479835639995 | E293: of:=(1+SQRT(5))/2 -> 1.6180339887499 | F293: of:=3+[.E293]/LN([.A293]+1) -> 3.284856482386 | G293: of:=[.D293]-[.F293] -> -0.0000581259860510386
A294: 293 | B294: 128120435 | C294: 3.28 | D294: of:=LN([.B294])/LN([.A294]+1) -> 3.28463434000424 | E294: of:=(1+SQRT(5))/2 -> 1.6180339887499 | F294: of:=3+[.E294]/LN([.A294]+1) -> 3.28468571832986 | G294: of:=[.D294]-[.F294] -> -0.000051378325628626
A295: 294 | B295: 129434967 | C295: 3.28 | D295: of:=LN([.B295])/LN([.A295]+1) -> 3.28446809723124 | E295: of:=(1+SQRT(5))/2 -> 1.6180339887499 | F295: of:=3+[.E295]/LN([.A295]+1) -> 3.28451573769282 | G295: of:=[.D295]-[.F295] -> -0.0000476404615774584
A296: 295 | B296: 130758805 | C296: 3.28 | D296: of:=LN([.B296])/LN([.A296]+1) -> 3.28430306572226 | E296: of:=(1+SQRT(5))/2 -> 1.6180339887499 | F296: of:=3+[.E296]/LN([.A296]+1) -> 3.28434653412279 | G296: of:=[.D296]-[.F296] -> -0.0000434684005341524
A297: 296 | B297: 132092505 | C297: 3.28 | D297: of:=LN([.B297])/LN([.A297]+1) -> 3.28413992346588 | E297: of:=(1+SQRT(5))/2 -> 1.6180339887499 | F297: of:=3+[.E297]/LN([.A297]+1) -> 3.28417810134112 | G297: of:=[.D297]-[.F297] -> -0.0000381778752456263
A298: 297 | B298: 133434513 | C298: 3.28 | D298: of:=LN([.B298])/LN([.A298]+1) -> 3.28397654355522 | E298: of:=(1+SQRT(5))/2 -> 1.6180339887499 | F298: of:=3+[.E298]/LN([.A298]+1) -> 3.28401043314148 | G298: of:=[.D298]-[.F298] -> -0.000033889586261715
A299: 298 | B299: 134785733 | C299: 3.28 | D299: of:=LN([.B299])/LN([.A299]+1) -> 3.28381408772158 | E299: of:=(1+SQRT(5))/2 -> 1.6180339887499 | F299: of:=3+[.E299]/LN([.A299]+1) -> 3.28384352338874 | G299: of:=[.D299]-[.F299] -> -0.0000294356671570739
A300: 299 | B300: 136147071 | C300: 3.28 | D300: of:=LN([.B300])/LN([.A300]+1) -> 3.28365367140767 | E300: of:=(1+SQRT(5))/2 -> 1.6180339887499 | F300: of:=3+[.E300]/LN([.A300]+1) -> 3.28367736601796 | G300: of:=[.D300]-[.F300] -> -0.0000236946102969426
A301: 300 | B301: 137515913 | C301: 3.28 | D301: of:=LN([.B301])/LN([.A301]+1) -> 3.28349187767239 | E301: of:=(1+SQRT(5))/2 -> 1.6180339887499 | F301: of:=3+[.E301]/LN([.A301]+1) -> 3.28351195503336 | G301: of:=[.D301]-[.F301] -> -0.0000200773609622118
A302: 301 | B302: 138894429 | C302: 3.28 | D302: of:=LN([.B302])/LN([.A302]+1) -> 3.28333146398359 | E302: of:=(1+SQRT(5))/2 -> 1.6180339887499 | F302: of:=3+[.E302]/LN([.A302]+1) -> 3.28334728450723 | G302: of:=[.D302]-[.F302] -> -0.0000158205236431286
A303: 302 | B303: 140280877 | C303: 3.28 | D303: of:=LN([.B303])/LN([.A303]+1) -> 3.28317019250719 | E303: of:=(1+SQRT(5))/2 -> 1.6180339887499 | F303: of:=3+[.E303]/LN([.A303]+1) -> 3.28318334857901 | G303: of:=[.D303]-[.F303] -> -0.0000131560718186208
A304: 303 | B304: 141678555 | C304: 3.28 | D304: of:=LN([.B304])/LN([.A304]+1) -> 3.28301214068459 | E304: of:=(1+SQRT(5))/2 -> 1.6180339887499 | F304: of:=3+[.E304]/LN([.A304]+1) -> 3.28302014145426 | G304: of:=[.D304]-[.F304] -> -0.00000800076966456231
A305: 304 | B305: 143084829 | C305: 3.28 | D305: of:=LN([.B305])/LN([.A305]+1) -> 3.2828539694164 | E305: of:=(1+SQRT(5))/2 -> 1.6180339887499 | F305: of:=3+[.E305]/LN([.A305]+1) -> 3.28285765740369 | G305: of:=[.D305]-[.F305] -> -0.00000368798728800357
A306: 305 | B306: 144501655 | C306: 3.28 | D306: of:=LN([.B306])/LN([.A306]+1) -> 3.28269802650952 | E306: of:=(1+SQRT(5))/2 -> 1.6180339887499 | F306: of:=3+[.E306]/LN([.A306]+1) -> 3.28269589076224 | G306: of:=[.D306]-[.F306] -> 0.00000213574728347155
A307: 306 | B307: 145925237 | C307: 3.28 | D307: of:=LN([.B307])/LN([.A307]+1) -> 3.28253968007005 | E307: of:=(1+SQRT(5))/2 -> 1.6180339887499 | F307: of:=3+[.E307]/LN([.A307]+1) -> 3.28253483592812 | G307: of:=[.D307]-[.F307] -> 0.00000484414193024918
A308: 307 | B308: 147359081 | C308: 3.28 | D308: of:=LN([.B308])/LN([.A308]+1) -> 3.28238313578959 | E308: of:=(1+SQRT(5))/2 -> 1.6180339887499 | F308: of:=3+[.E308]/LN([.A308]+1) -> 3.28237448736193 | G308: of:=[.D308]-[.F308] -> 0.00000864842765180285
A309: 308 | B309: 148803073 | C309: 3.28 | D309: of:=LN([.B309])/LN([.A309]+1) -> 3.28222818478618 | E309: of:=(1+SQRT(5))/2 -> 1.6180339887499 | F309: of:=3+[.E309]/LN([.A309]+1) -> 3.28221483958572 | G309: of:=[.D309]-[.F309] -> 0.000013345200453152
A310: 309 | B310: 150256107 | C310: 3.28 | D310: of:=LN([.B310])/LN([.A310]+1) -> 3.28207347520361 | E310: of:=(1+SQRT(5))/2 -> 1.6180339887499 | F310: of:=3+[.E310]/LN([.A310]+1) -> 3.28205588718212 | G310: of:=[.D310]-[.F310] -> 0.0000175880214809965
A311: 310 | B311: 151718709 | C311: 3.28 | D311: of:=LN([.B311])/LN([.A311]+1) -> 3.28191958383756 | E311: of:=(1+SQRT(5))/2 -> 1.6180339887499 | F311: of:=3+[.E311]/LN([.A311]+1) -> 3.2818976247935 | G311: of:=[.D311]-[.F311] -> 0.0000219590440631023
A312: 311 | B312: 153191057 | C312: 3.28 | D312: of:=LN([.B312])/LN([.A312]+1) -> 3.28176666850886 | E312: of:=(1+SQRT(5))/2 -> 1.6180339887499 | F312: of:=3+[.E312]/LN([.A312]+1) -> 3.28174004712107 | G312: of:=[.D312]-[.F312] -> 0.0000266213877870847
A313: 312 | B313: 154671951 | C313: 3.28 | D313: of:=LN([.B313])/LN([.A313]+1) -> 3.28161332998642 | E313: of:=(1+SQRT(5))/2 -> 1.6180339887499 | F313: of:=3+[.E313]/LN([.A313]+1) -> 3.28158314892408 | G313: of:=[.D313]-[.F313] -> 0.0000301810623382082
A314: 313 | B314: 156162625 | C314: 3.28 | D314: of:=LN([.B314])/LN([.A314]+1) -> 3.28146093620869 | E314: of:=(1+SQRT(5))/2 -> 1.6180339887499 | F314: of:=3+[.E314]/LN([.A314]+1) -> 3.28142692501899 | G314: of:=[.D314]-[.F314] -> 0.0000340111896992568
A315: 314 | B315: 157663219 | C315: 3.28 | D315: of:=LN([.B315])/LN([.A315]+1) -> 3.28130959413576 | E315: of:=(1+SQRT(5))/2 -> 1.6180339887499 | F315: of:=3+[.E315]/LN([.A315]+1) -> 3.28127137027864 | G315: of:=[.D315]-[.F315] -> 0.0000382238571181581
A316: 315 | B316: 159176095 | C316: 3.28 | D316: of:=LN([.B316])/LN([.A316]+1) -> 3.28116183148089 | E316: of:=(1+SQRT(5))/2 -> 1.6180339887499 | F316: of:=3+[.E316]/LN([.A316]+1) -> 3.28111647963149 | G316: of:=[.D316]-[.F316] -> 0.0000453518493994665
A317: 316 | B317: 160692523 | C317: 3.28 | D317: of:=LN([.B317])/LN([.A317]+1) -> 3.28100808866767 | E317: of:=(1+SQRT(5))/2 -> 1.6180339887499 | F317: of:=3+[.E317]/LN([.A317]+1) -> 3.2809622480608 | G317: of:=[.D317]-[.F317] -> 0.000045840606868186
A318: 317 | B318: 162224025 | C318: 3.28 | D318: of:=LN([.B318])/LN([.A318]+1) -> 3.28086085187963 | E318: of:=(1+SQRT(5))/2 -> 1.6180339887499 | F318: of:=3+[.E318]/LN([.A318]+1) -> 3.28080867060391 | G318: of:=[.D318]-[.F318] -> 0.0000521812757274809
A319: 318 | B319: 163761165 | C319: 3.28 | D319: of:=LN([.B319])/LN([.A319]+1) -> 3.28070991510153 | E319: of:=(1+SQRT(5))/2 -> 1.6180339887499 | F319: of:=3+[.E319]/LN([.A319]+1) -> 3.28065574235142 | G319: of:=[.D319]-[.F319] -> 0.000054172750109327
A320: 319 | B320: 165308631 | C320: 3.28 | D320: of:=LN([.B320])/LN([.A320]+1) -> 3.28056028597975 | E320: of:=(1+SQRT(5))/2 -> 1.6180339887499 | F320: of:=3+[.E320]/LN([.A320]+1) -> 3.28050345844653 | G320: of:=[.D320]-[.F320] -> 0.0000568275332195611
A321: 320 | B321: 166868513 | C321: 3.28 | D321: of:=LN([.B321])/LN([.A321]+1) -> 3.28041407839698 | E321: of:=(1+SQRT(5))/2 -> 1.6180339887499 | F321: of:=3+[.E321]/LN([.A321]+1) -> 3.28035181408424 | G321: of:=[.D321]-[.F321] -> 0.0000622643127337064
A322: 321 | B322: 168434617 | C322: 3.28 | D322: of:=LN([.B322])/LN([.A322]+1) -> 3.2802648055667 | E322: of:=(1+SQRT(5))/2 -> 1.6180339887499 | F322: of:=3+[.E322]/LN([.A322]+1) -> 3.28020080451067 | G322: of:=[.D322]-[.F322] -> 0.0000640010560251092
A323: 322 | B323: 170013633 | C323: 3.28 | D323: of:=LN([.B323])/LN([.A323]+1) -> 3.28011935050915 | E323: of:=(1+SQRT(5))/2 -> 1.6180339887499 | F323: of:=3+[.E323]/LN([.A323]+1) -> 3.28005042502235 | G323: of:=[.D323]-[.F323] -> 0.0000689254868002642
A324: 323 | B324: 171603455 | C324: 3.28 | D324: of:=LN([.B324])/LN([.A324]+1) -> 3.27997546112358 | E324: of:=(1+SQRT(5))/2 -> 1.6180339887499 | F324: of:=3+[.E324]/LN([.A324]+1) -> 3.27990067096553 | G324: of:=[.D324]-[.F324] -> 0.000074790158051119
A325: 324 | B325: 173197747 | C325: 3.28 | D325: of:=LN([.B325])/LN([.A325]+1) -> 3.27982674923859 | E325: of:=(1+SQRT(5))/2 -> 1.6180339887499 | F325: of:=3+[.E325]/LN([.A325]+1) -> 3.27975153773547 | G325: of:=[.D325]-[.F325] -> 0.0000752115031215084
A326: 325 | B326: 174807811 | C326: 3.28 | D326: of:=LN([.B326])/LN([.A326]+1) -> 3.27968451050357 | E326: of:=(1+SQRT(5))/2 -> 1.6180339887499 | F326: of:=3+[.E326]/LN([.A326]+1) -> 3.27960302077583 | G326: of:=[.D326]-[.F326] -> 0.0000814897277319204
A327: 326 | B327: 176423063 | C327: 3.28 | D327: of:=LN([.B327])/LN([.A327]+1) -> 3.27953817904739 | E327: of:=(1+SQRT(5))/2 -> 1.6180339887499 | F327: of:=3+[.E327]/LN([.A327]+1) -> 3.27945511557796 | G327: of:=[.D327]-[.F327] -> 0.000083063469423994
A328: 327 | B328: 178053093 | C328: 3.28 | D328: of:=LN([.B328])/LN([.A328]+1) -> 3.27939715376589 | E328: of:=(1+SQRT(5))/2 -> 1.6180339887499 | F328: of:=3+[.E328]/LN([.A328]+1) -> 3.27930781768027 | G328: of:=[.D328]-[.F328] -> 0.0000893360856180081
A329: 328 | B329: 179690115 | C329: 3.28 | D329: of:=LN([.B329])/LN([.A329]+1) -> 3.2792537892473 | E329: of:=(1+SQRT(5))/2 -> 1.6180339887499 | F329: of:=3+[.E329]/LN([.A329]+1) -> 3.2791611226676 | G329: of:=[.D329]-[.F329] -> 0.0000926665797016391
A330: 329 | B330: 181336517 | C330: 3.28 | D330: of:=LN([.B330])/LN([.A330]+1) -> 3.27911040675591 | E330: of:=(1+SQRT(5))/2 -> 1.6180339887499 | F330: of:=3+[.E330]/LN([.A330]+1) -> 3.27901502617058 | G330: of:=[.D330]-[.F330] -> 0.0000953805853369794
A331: 330 | B331: 182995413 | C331: 3.28 | D331: of:=LN([.B331])/LN([.A331]+1) -> 3.2789699234086 | E331: of:=(1+SQRT(5))/2 -> 1.6180339887499 | F331: of:=3+[.E331]/LN([.A331]+1) -> 3.27886952386502 | G331: of:=[.D331]-[.F331] -> 0.000100399543581098
A332: 331 | B332: 184661195 | C332: 3.28 | D332: of:=LN([.B332])/LN([.A332]+1) -> 3.27882700877034 | E332: of:=(1+SQRT(5))/2 -> 1.6180339887499 | F332: of:=3+[.E332]/LN([.A332]+1) -> 3.27872461147133 | G332: of:=[.D332]-[.F332] -> 0.000102397299011514
A333: 332 | B333: 186339263 | C333: 3.28 | D333: of:=LN([.B333])/LN([.A333]+1) -> 3.27868670537852 | E333: of:=(1+SQRT(5))/2 -> 1.6180339887499 | F333: of:=3+[.E333]/LN([.A333]+1) -> 3.27858028475389 | G333: of:=[.D333]-[.F333] -> 0.000106420624631731
A334: 333 | B334: 188025447 | C334: 3.28 | D334: of:=LN([.B334])/LN([.A334]+1) -> 3.27854510689786 | E334: of:=(1+SQRT(5))/2 -> 1.6180339887499 | F334: of:=3+[.E334]/LN([.A334]+1) -> 3.27843653952045 | G334: of:=[.D334]-[.F334] -> 0.000108567377408164
A335: 334 | B335: 189725233 | C335: 3.28 | D335: of:=LN([.B335])/LN([.A335]+1) -> 3.27840720758009 | E335: of:=(1+SQRT(5))/2 -> 1.6180339887499 | F335: of:=3+[.E335]/LN([.A335]+1) -> 3.27829337162164 | G335: of:=[.D335]-[.F335] -> 0.000113835958458708
A336: 335 | B336: 191433243 | C336: 3.28 | D336: of:=LN([.B336])/LN([.A336]+1) -> 3.27826805795613 | E336: of:=(1+SQRT(5))/2 -> 1.6180339887499 | F336: of:=3+[.E336]/LN([.A336]+1) -> 3.27815077695028 | G336: of:=[.D336]-[.F336] -> 0.000117281005850955
A337: 336 | B337: 193149717 | C337: 3.28 | D337: of:=LN([.B337])/LN([.A337]+1) -> 3.27812789099517 | E337: of:=(1+SQRT(5))/2 -> 1.6180339887499 | F337: of:=3+[.E337]/LN([.A337]+1) -> 3.27800875144092 | G337: of:=[.D337]-[.F337] -> 0.00011913955424836
A338: 337 | B338: 194878853 | C338: 3.28 | D338: of:=LN([.B338])/LN([.A338]+1) -> 3.27799041934426 | E338: of:=(1+SQRT(5))/2 -> 1.6180339887499 | F338: of:=3+[.E338]/LN([.A338]+1) -> 3.27786729106927 | G338: of:=[.D338]-[.F338] -> 0.000123128274990059
A339: 338 | B339: 196616617 | C339: 3.28 | D339: of:=LN([.B339])/LN([.A339]+1) -> 3.27785203089601 | E339: of:=(1+SQRT(5))/2 -> 1.6180339887499 | F339: of:=3+[.E339]/LN([.A339]+1) -> 3.27772639185161 | G339: of:=[.D339]-[.F339] -> 0.00012563904439622
A340: 339 | B340: 198365813 | C340: 3.28 | D340: of:=LN([.B340])/LN([.A340]+1) -> 3.27771516116707 | E340: of:=(1+SQRT(5))/2 -> 1.6180339887499 | F340: of:=3+[.E340]/LN([.A340]+1) -> 3.27758604984434 | G340: of:=[.D340]-[.F340] -> 0.000129111322725528
A341: 340 | B341: 200126243 | C341: 3.28 | D341: of:=LN([.B341])/LN([.A341]+1) -> 3.2775795834081 | E341: of:=(1+SQRT(5))/2 -> 1.6180339887499 | F341: of:=3+[.E341]/LN([.A341]+1) -> 3.27744626114338 | G341: of:=[.D341]-[.F341] -> 0.000133322264722846
A342: 341 | B342: 201895555 | C342: 3.28 | D342: of:=LN([.B342])/LN([.A342]+1) -> 3.27744325033899 | E342: of:=(1+SQRT(5))/2 -> 1.6180339887499 | F342: of:=3+[.E342]/LN([.A342]+1) -> 3.2773070218837 | G342: of:=[.D342]-[.F342] -> 0.000136228455282161
A343: 342 | B343: 203676335 | C343: 3.28 | D343: of:=LN([.B343])/LN([.A343]+1) -> 3.27730834300298 | E343: of:=(1+SQRT(5))/2 -> 1.6180339887499 | F343: of:=3+[.E343]/LN([.A343]+1) -> 3.27716832823883 | G343: of:=[.D343]-[.F343] -> 0.000140014764152152
A344: 343 | B344: 205466719 | C344: 3.28 | D344: of:=LN([.B344])/LN([.A344]+1) -> 3.27717325429183 | E344: of:=(1+SQRT(5))/2 -> 1.6180339887499 | F344: of:=3+[.E344]/LN([.A344]+1) -> 3.2770301764203 | G344: of:=[.D344]-[.F344] -> 0.00014307787153589
A345: 344 | B345: 207267393 | C345: 3.28 | D345: of:=LN([.B345])/LN([.A345]+1) -> 3.27703854110264 | E345: of:=(1+SQRT(5))/2 -> 1.6180339887499 | F345: of:=3+[.E345]/LN([.A345]+1) -> 3.27689256267721 | G345: of:=[.D345]-[.F345] -> 0.000145978425431181
A346: 345 | B346: 209080907 | C346: 3.28 | D346: of:=LN([.B346])/LN([.A346]+1) -> 3.27690626498741 | E346: of:=(1+SQRT(5))/2 -> 1.6180339887499 | F346: of:=3+[.E346]/LN([.A346]+1) -> 3.27675548329571 | G346: of:=[.D346]-[.F346] -> 0.000150781691702129
A347: 346 | B347: 210901845 | C347: 3.28 | D347: of:=LN([.B347])/LN([.A347]+1) -> 3.27677195483181 | E347: of:=(1+SQRT(5))/2 -> 1.6180339887499 | F347: of:=3+[.E347]/LN([.A347]+1) -> 3.27661893459857 | G347: of:=[.D347]-[.F347] -> 0.000153020233248036
A348: 347 | B348: 212734343 | C348: 3.28 | D348: of:=LN([.B348])/LN([.A348]+1) -> 3.27663897405496 | E348: of:=(1+SQRT(5))/2 -> 1.6180339887499 | F348: of:=3+[.E348]/LN([.A348]+1) -> 3.27648291294464 | G348: of:=[.D348]-[.F348] -> 0.000156061110319072
A349: 348 | B349: 214577865 | C349: 3.28 | D349: of:=LN([.B349])/LN([.A349]+1) -> 3.27650684609148 | E349: of:=(1+SQRT(5))/2 -> 1.6180339887499 | F349: of:=3+[.E349]/LN([.A349]+1) -> 3.27634741472847 | G349: of:=[.D349]-[.F349] -> 0.000159431363010221
A350: 349 | B350: 216432533 | C350: 3.28 | D350: of:=LN([.B350])/LN([.A350]+1) -> 3.27637563024867 | E350: of:=(1+SQRT(5))/2 -> 1.6180339887499 | F350: of:=3+[.E350]/LN([.A350]+1) -> 3.2762124363798 | G350: of:=[.D350]-[.F350] -> 0.00016319386887087
A351: 350 | B351: 218295235 | C351: 3.28 | D351: of:=LN([.B351])/LN([.A351]+1) -> 3.27624285571825 | E351: of:=(1+SQRT(5))/2 -> 1.6180339887499 | F351: of:=3+[.E351]/LN([.A351]+1) -> 3.27607797436315 | G351: of:=[.D351]-[.F351] -> 0.000164881355102064
A352: 351 | B352: 220171075 | C352: 3.28 | D352: of:=LN([.B352])/LN([.A352]+1) -> 3.27611250443438 | E352: of:=(1+SQRT(5))/2 -> 1.6180339887499 | F352: of:=3+[.E352]/LN([.A352]+1) -> 3.27594402517734 | G352: of:=[.D352]-[.F352] -> 0.000168479257032672
A353: 352 | B353: 222057297 | C353: 3.28 | D353: of:=LN([.B353])/LN([.A353]+1) -> 3.27598238234965 | E353: of:=(1+SQRT(5))/2 -> 1.6180339887499 | F353: of:=3+[.E353]/LN([.A353]+1) -> 3.27581058535512 | G353: of:=[.D353]-[.F353] -> 0.000171796994528961
A354: 353 | B354: 223952867 | C354: 3.28 | D354: of:=LN([.B354])/LN([.A354]+1) -> 3.27585168326994 | E354: of:=(1+SQRT(5))/2 -> 1.6180339887499 | F354: of:=3+[.E354]/LN([.A354]+1) -> 3.27567765146268 | G354: of:=[.D354]-[.F354] -> 0.000174031807261166
A355: 354 | B355: 225860625 | C355: 3.28 | D355: of:=LN([.B355])/LN([.A355]+1) -> 3.27572255071799 | E355: of:=(1+SQRT(5))/2 -> 1.6180339887499 | F355: of:=3+[.E355]/LN([.A355]+1) -> 3.27554522009928 | G355: of:=[.D355]-[.F355] -> 0.000177330618710059
A356: 355 | B356: 227779071 | C356: 3.28 | D356: of:=LN([.B356])/LN([.A356]+1) -> 3.27559380900385 | E356: of:=(1+SQRT(5))/2 -> 1.6180339887499 | F356: of:=3+[.E356]/LN([.A356]+1) -> 3.2754132878968 | G356: of:=[.D356]-[.F356] -> 0.000180521107050691
A357: 356 | B357: 229708015 | C357: 3.28 | D357: of:=LN([.B357])/LN([.A357]+1) -> 3.27546529397763 | E357: of:=(1+SQRT(5))/2 -> 1.6180339887499 | F357: of:=3+[.E357]/LN([.A357]+1) -> 3.27528185151936 | G357: of:=[.D357]-[.F357] -> 0.000183442458274286
A358: 357 | B358: 231648391 | C358: 3.28 | D358: of:=LN([.B358])/LN([.A358]+1) -> 3.27533767237114 | E358: of:=(1+SQRT(5))/2 -> 1.6180339887499 | F358: of:=3+[.E358]/LN([.A358]+1) -> 3.27515090766292 | G358: of:=[.D358]-[.F358] -> 0.000186764708218767
A359: 358 | B359: 233599521 | C359: 3.28 | D359: of:=LN([.B359])/LN([.A359]+1) -> 3.27521041446001 | E359: of:=(1+SQRT(5))/2 -> 1.6180339887499 | F359: of:=3+[.E359]/LN([.A359]+1) -> 3.27502045305487 | G359: of:=[.D359]-[.F359] -> 0.000189961405141048
A360: 359 | B360: 235562271 | C360: 3.28 | D360: of:=LN([.B360])/LN([.A360]+1) -> 3.27508412251093 | E360: of:=(1+SQRT(5))/2 -> 1.6180339887499 | F360: of:=3+[.E360]/LN([.A360]+1) -> 3.27489048445365 | G360: of:=[.D360]-[.F360] -> 0.000193638057286893
A361: 360 | B361: 237530819 | C361: 3.27 | D361: of:=LN([.B361])/LN([.A361]+1) -> 3.2749545963915 | E361: of:=(1+SQRT(5))/2 -> 1.6180339887499 | F361: of:=3+[.E361]/LN([.A361]+1) -> 3.27476099864837 | G361: of:=[.D361]-[.F361] -> 0.000193597743132212
A362: 361 | B362: 239517129 | C362: 3.27 | D362: of:=LN([.B362])/LN([.A362]+1) -> 3.27483038662848 | E362: of:=(1+SQRT(5))/2 -> 1.6180339887499 | F362: of:=3+[.E362]/LN([.A362]+1) -> 3.27463199245843 | G362: of:=[.D362]-[.F362] -> 0.000198394170043859
A363: 362 | B363: 241509291 | C363: 3.27 | D363: of:=LN([.B363])/LN([.A363]+1) -> 3.27470297587388 | E363: of:=(1+SQRT(5))/2 -> 1.6180339887499 | F363: of:=3+[.E363]/LN([.A363]+1) -> 3.27450346273317 | G363: of:=[.D363]-[.F363] -> 0.000199513140716423
A364: 363 | B364: 243518427 | C364: 3.27 | D364: of:=LN([.B364])/LN([.A364]+1) -> 3.27458017996858 | E364: of:=(1+SQRT(5))/2 -> 1.6180339887499 | F364: of:=3+[.E364]/LN([.A364]+1) -> 3.27437540635146 | G364: of:=[.D364]-[.F364] -> 0.000204773617127785
A365: 364 | B365: 245533263 | C365: 3.27 | D365: of:=LN([.B365])/LN([.A365]+1) -> 3.27445408437913 | E365: of:=(1+SQRT(5))/2 -> 1.6180339887499 | F365: of:=3+[.E365]/LN([.A365]+1) -> 3.27424782022138 | G365: of:=[.D365]-[.F365] -> 0.000206264157751601
A366: 365 | B366: 247560629 | C366: 3.27 | D366: of:=LN([.B366])/LN([.A366]+1) -> 3.27432943636585 | E366: of:=(1+SQRT(5))/2 -> 1.6180339887499 | F366: of:=3+[.E366]/LN([.A366]+1) -> 3.27412070127987 | G366: of:=[.D366]-[.F366] -> 0.000208735085988287
A367: 366 | B367: 249599639 | C367: 3.27 | D367: of:=LN([.B367])/LN([.A367]+1) -> 3.27420558564318 | E367: of:=(1+SQRT(5))/2 -> 1.6180339887499 | F367: of:=3+[.E367]/LN([.A367]+1) -> 3.27399404649233 | G367: of:=[.D367]-[.F367] -> 0.00021153915084815
A368: 367 | B368: 251651897 | C368: 3.27 | D368: of:=LN([.B368])/LN([.A368]+1) -> 3.27408357869141 | E368: of:=(1+SQRT(5))/2 -> 1.6180339887499 | F368: of:=3+[.E368]/LN([.A368]+1) -> 3.27386785285234 | G368: of:=[.D368]-[.F368] -> 0.000215725839066039
A369: 368 | B369: 253713265 | C369: 3.27 | D369: of:=LN([.B369])/LN([.A369]+1) -> 3.27396059698289 | E369: of:=(1+SQRT(5))/2 -> 1.6180339887499 | F369: of:=3+[.E369]/LN([.A369]+1) -> 3.27374211738129 | G369: of:=[.D369]-[.F369] -> 0.000218479601599153
A370: 369 | B370: 255784045 | C370: 3.27 | D370: of:=LN([.B370])/LN([.A370]+1) -> 3.2738368533435 | E370: of:=(1+SQRT(5))/2 -> 1.6180339887499 | F370: of:=3+[.E370]/LN([.A370]+1) -> 3.27361683712804 | G370: of:=[.D370]-[.F370] -> 0.000220016215461971
A371: 370 | B371: 257871061 | C371: 3.27 | D371: of:=LN([.B371])/LN([.A371]+1) -> 3.27371682870828 | E371: of:=(1+SQRT(5))/2 -> 1.6180339887499 | F371: of:=3+[.E371]/LN([.A371]+1) -> 3.2734920091686 | G371: of:=[.D371]-[.F371] -> 0.000224819539679899
A372: 371 | B372: 259965635 | C372: 3.27 | D372: of:=LN([.B372])/LN([.A372]+1) -> 3.27359477703401 | E372: of:=(1+SQRT(5))/2 -> 1.6180339887499 | F372: of:=3+[.E372]/LN([.A372]+1) -> 3.2733676306058 | G372: of:=[.D372]-[.F372] -> 0.00022714642820354
A373: 372 | B373: 262071111 | C373: 3.27 | D373: of:=LN([.B373])/LN([.A373]+1) -> 3.27347289307623 | E373: of:=(1+SQRT(5))/2 -> 1.6180339887499 | F373: of:=3+[.E373]/LN([.A373]+1) -> 3.27324369856901 | G373: of:=[.D373]-[.F373] -> 0.000229194507226804
A374: 373 | B374: 264189111 | C374: 3.27 | D374: of:=LN([.B374])/LN([.A374]+1) -> 3.2733521977018 | E374: of:=(1+SQRT(5))/2 -> 1.6180339887499 | F374: of:=3+[.E374]/LN([.A374]+1) -> 3.27312021021375 | G374: of:=[.D374]-[.F374] -> 0.000231987488048979
A375: 374 | B375: 266316243 | C375: 3.27 | D375: of:=LN([.B375])/LN([.A375]+1) -> 3.2732305007748 | E375: of:=(1+SQRT(5))/2 -> 1.6180339887499 | F375: of:=3+[.E375]/LN([.A375]+1) -> 3.27299716272146 | G375: of:=[.D375]-[.F375] -> 0.000233338053340582
A376: 375 | B376: 268458151 | C376: 3.27 | D376: of:=LN([.B376])/LN([.A376]+1) -> 3.27311136205847 | E376: of:=(1+SQRT(5))/2 -> 1.6180339887499 | F376: of:=3+[.E376]/LN([.A376]+1) -> 3.27287455329913 | G376: of:=[.D376]-[.F376] -> 0.000236808759340956
A377: 376 | B377: 270610577 | C377: 3.27 | D377: of:=LN([.B377])/LN([.A377]+1) -> 3.27299205387418 | E377: of:=(1+SQRT(5))/2 -> 1.6180339887499 | F377: of:=3+[.E377]/LN([.A377]+1) -> 3.27275237917905 | G377: of:=[.D377]-[.F377] -> 0.000239674695131864
A378: 377 | B378: 272773309 | C378: 3.27 | D378: of:=LN([.B378])/LN([.A378]+1) -> 3.27287243849676 | E378: of:=(1+SQRT(5))/2 -> 1.6180339887499 | F378: of:=3+[.E378]/LN([.A378]+1) -> 3.27263063761846 | G378: of:=[.D378]-[.F378] -> 0.000241800878296505
A379: 378 | B379: 274949217 | C379: 3.27 | D379: of:=LN([.B379])/LN([.A379]+1) -> 3.27275427078491 | E379: of:=(1+SQRT(5))/2 -> 1.6180339887499 | F379: of:=3+[.E379]/LN([.A379]+1) -> 3.27250932589933 | G379: of:=[.D379]-[.F379] -> 0.000244944885576803
A380: 379 | B380: 277135119 | C380: 3.27 | D380: of:=LN([.B380])/LN([.A380]+1) -> 3.27263557099293 | E380: of:=(1+SQRT(5))/2 -> 1.6180339887499 | F380: of:=3+[.E380]/LN([.A380]+1) -> 3.272388441328 | G380: of:=[.D380]-[.F380] -> 0.000247129664932011
A381: 380 | B381: 279332971 | C381: 3.27 | D381: of:=LN([.B381])/LN([.A381]+1) -> 3.27251751994854 | E381: of:=(1+SQRT(5))/2 -> 1.6180339887499 | F381: of:=3+[.E381]/LN([.A381]+1) -> 3.27226798123492 | G381: of:=[.D381]-[.F381] -> 0.000249538713619657
A382: 381 | B382: 281542555 | C382: 3.27 | D382: of:=LN([.B382])/LN([.A382]+1) -> 3.27239996077751 | E382: of:=(1+SQRT(5))/2 -> 1.6180339887499 | F382: of:=3+[.E382]/LN([.A382]+1) -> 3.2721479429744 | G382: of:=[.D382]-[.F382] -> 0.000252017803105353
A383: 382 | B383: 283762193 | C383: 3.27 | D383: of:=LN([.B383])/LN([.A383]+1) -> 3.27228187664762 | E383: of:=(1+SQRT(5))/2 -> 1.6180339887499 | F383: of:=3+[.E383]/LN([.A383]+1) -> 3.2720283239243 | G383: of:=[.D383]-[.F383] -> 0.000253552723325168
A384: 383 | B384: 285997235 | C384: 3.27 | D384: of:=LN([.B384])/LN([.A384]+1) -> 3.27216641376615 | E384: of:=(1+SQRT(5))/2 -> 1.6180339887499 | F384: of:=3+[.E384]/LN([.A384]+1) -> 3.27190912148576 | G384: of:=[.D384]-[.F384] -> 0.000257292280391841
A385: 384 | B385: 288239825 | C385: 3.27 | D385: of:=LN([.B385])/LN([.A385]+1) -> 3.27204891912946 | E385: of:=(1+SQRT(5))/2 -> 1.6180339887499 | F385: of:=3+[.E385]/LN([.A385]+1) -> 3.27179033308294 | G385: of:=[.D385]-[.F385] -> 0.000258586046511411
A386: 385 | B386: 290500053 | C386: 3.27 | D386: of:=LN([.B386])/LN([.A386]+1) -> 3.271935264151 | E386: of:=(1+SQRT(5))/2 -> 1.6180339887499 | F386: of:=3+[.E386]/LN([.A386]+1) -> 3.27167195616278 | G386: of:=[.D386]-[.F386] -> 0.00026330798821661
A387: 386 | B387: 292767851 | C387: 3.27 | D387: of:=LN([.B387])/LN([.A387]+1) -> 3.27181957310481 | E387: of:=(1+SQRT(5))/2 -> 1.6180339887499 | F387: of:=3+[.E387]/LN([.A387]+1) -> 3.27155398819468 | G387: of:=[.D387]-[.F387] -> 0.000265584910131622
A388: 387 | B388: 295045735 | C388: 3.27 | D388: of:=LN([.B388])/LN([.A388]+1) -> 3.27170331597429 | E388: of:=(1+SQRT(5))/2 -> 1.6180339887499 | F388: of:=3+[.E388]/LN([.A388]+1) -> 3.2714364266703 | G388: of:=[.D388]-[.F388] -> 0.000266889303989881
A389: 388 | B389: 297337577 | C389: 3.27 | D389: of:=LN([.B389])/LN([.A389]+1) -> 3.27158868022334 | E389: of:=(1+SQRT(5))/2 -> 1.6180339887499 | F389: of:=3+[.E389]/LN([.A389]+1) -> 3.27131926910327 | G389: of:=[.D389]-[.F389] -> 0.000269411120074281
A390: 389 | B390: 299642689 | C390: 3.27 | D390: of:=LN([.B390])/LN([.A390]+1) -> 3.27147523176287 | E390: of:=(1+SQRT(5))/2 -> 1.6180339887499 | F390: of:=3+[.E390]/LN([.A390]+1) -> 3.27120251302896 | G390: of:=[.D390]-[.F390] -> 0.000272718733902888
A391: 390 | B391: 301958439 | C391: 3.27 | D391: of:=LN([.B391])/LN([.A391]+1) -> 3.27136147154633 | E391: of:=(1+SQRT(5))/2 -> 1.6180339887499 | F391: of:=3+[.E391]/LN([.A391]+1) -> 3.27108615600424 | G391: of:=[.D391]-[.F391] -> 0.000275315542090926
A392: 391 | B392: 304283031 | C392: 3.27 | D392: of:=LN([.B392])/LN([.A392]+1) -> 3.27124640877399 | E392: of:=(1+SQRT(5))/2 -> 1.6180339887499 | F392: of:=3+[.E392]/LN([.A392]+1) -> 3.27097019560721 | G392: of:=[.D392]-[.F392] -> 0.000276213166774841
A393: 392 | B393: 306624151 | C393: 3.27 | D393: of:=LN([.B393])/LN([.A393]+1) -> 3.27113426126917 | E393: of:=(1+SQRT(5))/2 -> 1.6180339887499 | F393: of:=3+[.E393]/LN([.A393]+1) -> 3.27085462943698 | G393: of:=[.D393]-[.F393] -> 0.000279631832194926
A394: 393 | B394: 308974723 | C394: 3.27 | D394: of:=LN([.B394])/LN([.A394]+1) -> 3.27102111733655 | E394: of:=(1+SQRT(5))/2 -> 1.6180339887499 | F394: of:=3+[.E394]/LN([.A394]+1) -> 3.27073945511342 | G394: of:=[.D394]-[.F394] -> 0.00028166222312942
A395: 394 | B395: 311337581 | C395: 3.27 | D395: of:=LN([.B395])/LN([.A395]+1) -> 3.27090851370771 | E395: of:=(1+SQRT(5))/2 -> 1.6180339887499 | F395: of:=3+[.E395]/LN([.A395]+1) -> 3.27062467027695 | G395: of:=[.D395]-[.F395] -> 0.000283843430758601
A396: 395 | B396: 313714427 | C396: 3.27 | D396: of:=LN([.B396])/LN([.A396]+1) -> 3.27079733503349 | E396: of:=(1+SQRT(5))/2 -> 1.6180339887499 | F396: of:=3+[.E396]/LN([.A396]+1) -> 3.27051027258829 | G396: of:=[.D396]-[.F396] -> 0.000287062445201158
A397: 396 | B397: 316096259 | C397: 3.27 | D397: of:=LN([.B397])/LN([.A397]+1) -> 3.27068277872869 | E397: of:=(1+SQRT(5))/2 -> 1.6180339887499 | F397: of:=3+[.E397]/LN([.A397]+1) -> 3.27039625972823 | G397: of:=[.D397]-[.F397] -> 0.000286519000460395
A398: 397 | B398: 318500771 | C398: 3.27 | D398: of:=LN([.B398])/LN([.A398]+1) -> 3.27057419593652 | E398: of:=(1+SQRT(5))/2 -> 1.6180339887499 | F398: of:=3+[.E398]/LN([.A398]+1) -> 3.27028262939745 | G398: of:=[.D398]-[.F398] -> 0.000291566539070143
A399: 398 | B399: 320910381 | C399: 3.27 | D399: of:=LN([.B399])/LN([.A399]+1) -> 3.27046228749459 | E399: of:=(1+SQRT(5))/2 -> 1.6180339887499 | F399: of:=3+[.E399]/LN([.A399]+1) -> 3.27016937931621 | G399: of:=[.D399]-[.F399] -> 0.000292908178377349
A400: 399 | B400: 323335407 | C400: 3.27 | D400: of:=LN([.B400])/LN([.A400]+1) -> 3.27035244890717 | E400: of:=(1+SQRT(5))/2 -> 1.6180339887499 | F400: of:=3+[.E400]/LN([.A400]+1) -> 3.27005650722425 | G400: of:=[.D400]-[.F400] -> 0.000295941682923573
A401: 400 | B401: 325768523 | C401: 3.27 | D401: of:=LN([.B401])/LN([.A401]+1) -> 3.27024087036634 | E401: of:=(1+SQRT(5))/2 -> 1.6180339887499 | F401: of:=3+[.E401]/LN([.A401]+1) -> 3.26994401088046 | G401: of:=[.D401]-[.F401] -> 0.000296859485884315
A402: 401 | B402: 328215197 | C402: 3.27 | D402: of:=LN([.B402])/LN([.A402]+1) -> 3.27013036206 | E402: of:=(1+SQRT(5))/2 -> 1.6180339887499 | F402: of:=3+[.E402]/LN([.A402]+1) -> 3.26983188806275 | G402: of:=[.D402]-[.F402] -> 0.000298473997246251
A403: 402 | B403: 330679261 | C403: 3.27 | D403: of:=LN([.B403])/LN([.A403]+1) -> 3.27002282171019 | E403: of:=(1+SQRT(5))/2 -> 1.6180339887499 | F403: of:=3+[.E403]/LN([.A403]+1) -> 3.26972013656781 | G403: of:=[.D403]-[.F403] -> 0.00030268514238152
A404: 403 | B404: 333151897 | C404: 3.27 | D404: of:=LN([.B404])/LN([.A404]+1) -> 3.26991376036233 | E404: of:=(1+SQRT(5))/2 -> 1.6180339887499 | F404: of:=3+[.E404]/LN([.A404]+1) -> 3.2696087542109 | G404: of:=[.D404]-[.F404] -> 0.000305006151425591
A405: 404 | B405: 335636891 | C405: 3.27 | D405: of:=LN([.B405])/LN([.A405]+1) -> 3.26980508337302 | E405: of:=(1+SQRT(5))/2 -> 1.6180339887499 | F405: of:=3+[.E405]/LN([.A405]+1) -> 3.26949773882567 | G405: of:=[.D405]-[.F405] -> 0.000307344547354038
A406: 405 | B406: 338132541 | C406: 3.27 | D406: of:=LN([.B406])/LN([.A406]+1) -> 3.26969593493259 | E406: of:=(1+SQRT(5))/2 -> 1.6180339887499 | F406: of:=3+[.E406]/LN([.A406]+1) -> 3.26938708826392 | G406: of:=[.D406]-[.F406] -> 0.000308846668668483
A407: 406 | B407: 340643791 | C407: 3.27 | D407: of:=LN([.B407])/LN([.A407]+1) -> 3.26958873271272 | E407: of:=(1+SQRT(5))/2 -> 1.6180339887499 | F407: of:=3+[.E407]/LN([.A407]+1) -> 3.26927680039544 | G407: of:=[.D407]-[.F407] -> 0.000311932317279773
A408: 407 | B408: 343165115 | C408: 3.27 | D408: of:=LN([.B408])/LN([.A408]+1) -> 3.26948074406449 | E408: of:=(1+SQRT(5))/2 -> 1.6180339887499 | F408: of:=3+[.E408]/LN([.A408]+1) -> 3.26916687310779 | G408: of:=[.D408]-[.F408] -> 0.000313870956694107
A409: 408 | B409: 345695069 | C409: 3.27 | D409: of:=LN([.B409])/LN([.A409]+1) -> 3.26937128394274 | E409: of:=(1+SQRT(5))/2 -> 1.6180339887499 | F409: of:=3+[.E409]/LN([.A409]+1) -> 3.26905730430615 | G409: of:=[.D409]-[.F409] -> 0.000313979636593409
A410: 409 | B410: 348245081 | C410: 3.27 | D410: of:=LN([.B410])/LN([.A410]+1) -> 3.26926583257681 | E410: of:=(1+SQRT(5))/2 -> 1.6180339887499 | F410: of:=3+[.E410]/LN([.A410]+1) -> 3.26894809191305 | G410: of:=[.D410]-[.F410] -> 0.00031774066376089
A411: 410 | B411: 350804113 | C411: 3.27 | D411: of:=LN([.B411])/LN([.A411]+1) -> 3.26915906122921 | E411: of:=(1+SQRT(5))/2 -> 1.6180339887499 | F411: of:=3+[.E411]/LN([.A411]+1) -> 3.26883923386826 | G411: of:=[.D411]-[.F411] -> 0.00031982736094438
A412: 411 | B412: 353375247 | C412: 3.27 | D412: of:=LN([.B412])/LN([.A412]+1) -> 3.26905244024313 | E412: of:=(1+SQRT(5))/2 -> 1.6180339887499 | F412: of:=3+[.E412]/LN([.A412]+1) -> 3.26873072812858 | G412: of:=[.D412]-[.F412] -> 0.000321712114552231
A413: 412 | B413: 355959571 | C413: 3.27 | D413: of:=LN([.B413])/LN([.A413]+1) -> 3.26894646527192 | E413: of:=(1+SQRT(5))/2 -> 1.6180339887499 | F413: of:=3+[.E413]/LN([.A413]+1) -> 3.26862257266764 | G413: of:=[.D413]-[.F413] -> 0.000323892604278786
A414: 413 | B414: 358555705 | C414: 3.27 | D414: of:=LN([.B414])/LN([.A414]+1) -> 3.26884047455363 | E414: of:=(1+SQRT(5))/2 -> 1.6180339887499 | F414: of:=3+[.E414]/LN([.A414]+1) -> 3.26851476547573 | G414: of:=[.D414]-[.F414] -> 0.000325709077899639
A415: 414 | B415: 361164097 | C415: 3.27 | D415: of:=LN([.B415])/LN([.A415]+1) -> 3.26873466599346 | E415: of:=(1+SQRT(5))/2 -> 1.6180339887499 | F415: of:=3+[.E415]/LN([.A415]+1) -> 3.26840730455964 | G415: of:=[.D415]-[.F415] -> 0.000327361433825502
A416: 415 | B416: 363787153 | C416: 3.27 | D416: of:=LN([.B416])/LN([.A416]+1) -> 3.26863012400216 | E416: of:=(1+SQRT(5))/2 -> 1.6180339887499 | F416: of:=3+[.E416]/LN([.A416]+1) -> 3.26830018794246 | G416: of:=[.D416]-[.F416] -> 0.000329936059705105
A417: 416 | B417: 366423025 | C417: 3.27 | D417: of:=LN([.B417])/LN([.A417]+1) -> 3.26852597575965 | E417: of:=(1+SQRT(5))/2 -> 1.6180339887499 | F417: of:=3+[.E417]/LN([.A417]+1) -> 3.26819341366341 | G417: of:=[.D417]-[.F417] -> 0.000332562096242217
A418: 417 | B418: 369068507 | C418: 3.27 | D418: of:=LN([.B418])/LN([.A418]+1) -> 3.26842076496083 | E418: of:=(1+SQRT(5))/2 -> 1.6180339887499 | F418: of:=3+[.E418]/LN([.A418]+1) -> 3.26808697977769 | G418: of:=[.D418]-[.F418] -> 0.000333785183138424
A419: 418 | B419: 371725881 | C419: 3.27 | D419: of:=LN([.B419])/LN([.A419]+1) -> 3.2683155243456 | E419: of:=(1+SQRT(5))/2 -> 1.6180339887499 | F419: of:=3+[.E419]/LN([.A419]+1) -> 3.2679808843563 | G419: of:=[.D419]-[.F419] -> 0.000334639989302499
A420: 419 | B420: 374400351 | C420: 3.27 | D420: of:=LN([.B420])/LN([.A420]+1) -> 3.26821254792621 | E420: of:=(1+SQRT(5))/2 -> 1.6180339887499 | F420: of:=3+[.E420]/LN([.A420]+1) -> 3.26787512548584 | G420: of:=[.D420]-[.F420] -> 0.000337422440369828
A421: 420 | B421: 377084551 | C421: 3.27 | D421: of:=LN([.B421])/LN([.A421]+1) -> 3.26810854424228 | E421: of:=(1+SQRT(5))/2 -> 1.6180339887499 | F421: of:=3+[.E421]/LN([.A421]+1) -> 3.26776970126842 | G421: of:=[.D421]-[.F421] -> 0.000338842973861553
A422: 421 | B422: 379787521 | C422: 3.27 | D422: of:=LN([.B422])/LN([.A422]+1) -> 3.26800746612516 | E422: of:=(1+SQRT(5))/2 -> 1.6180339887499 | F422: of:=3+[.E422]/LN([.A422]+1) -> 3.26766460982143 | G422: of:=[.D422]-[.F422] -> 0.000342856303732653
A423: 422 | B423: 382498675 | C423: 3.27 | D423: of:=LN([.B423])/LN([.A423]+1) -> 3.26790466372276 | E423: of:=(1+SQRT(5))/2 -> 1.6180339887499 | F423: of:=3+[.E423]/LN([.A423]+1) -> 3.26755984927739 | G423: of:=[.D423]-[.F423] -> 0.000344814445367714
A424: 423 | B424: 385222791 | C424: 3.27 | D424: of:=LN([.B424])/LN([.A424]+1) -> 3.26780221791551 | E424: of:=(1+SQRT(5))/2 -> 1.6180339887499 | F424: of:=3+[.E424]/LN([.A424]+1) -> 3.26745541778383 | G424: of:=[.D424]-[.F424] -> 0.000346800131673763
A425: 424 | B425: 387958655 | C425: 3.27 | D425: of:=LN([.B425])/LN([.A425]+1) -> 3.26769959606296 | E425: of:=(1+SQRT(5))/2 -> 1.6180339887499 | F425: of:=3+[.E425]/LN([.A425]+1) -> 3.26735131350311 | G425: of:=[.D425]-[.F425] -> 0.000348282559852198
A426: 425 | B426: 390708779 | C426: 3.27 | D426: of:=LN([.B426])/LN([.A426]+1) -> 3.26759785642065 | E426: of:=(1+SQRT(5))/2 -> 1.6180339887499 | F426: of:=3+[.E426]/LN([.A426]+1) -> 3.26724753461225 | G426: of:=[.D426]-[.F426] -> 0.000350321808397336
A427: 426 | B427: 393472293 | C427: 3.27 | D427: of:=LN([.B427])/LN([.A427]+1) -> 3.26749660685081 | E427: of:=(1+SQRT(5))/2 -> 1.6180339887499 | F427: of:=3+[.E427]/LN([.A427]+1) -> 3.2671440793028 | G427: of:=[.D427]-[.F427] -> 0.000352527548005632
A428: 427 | B428: 396247845 | C428: 3.27 | D428: of:=LN([.B428])/LN([.A428]+1) -> 3.26739526588454 | E428: of:=(1+SQRT(5))/2 -> 1.6180339887499 | F428: of:=3+[.E428]/LN([.A428]+1) -> 3.26704094578069 | G428: of:=[.D428]-[.F428] -> 0.00035432010384806
A429: 428 | B429: 399037805 | C429: 3.27 | D429: of:=LN([.B429])/LN([.A429]+1) -> 3.26729480793565 | E429: of:=(1+SQRT(5))/2 -> 1.6180339887499 | F429: of:=3+[.E429]/LN([.A429]+1) -> 3.26693813226607 | G429: of:=[.D429]-[.F429] -> 0.00035667566957942
A430: 429 | B430: 401838419 | C430: 3.27 | D430: of:=LN([.B430])/LN([.A430]+1) -> 3.26719366553625 | E430: of:=(1+SQRT(5))/2 -> 1.6180339887499 | F430: of:=3+[.E430]/LN([.A430]+1) -> 3.26683563699317 | G430: of:=[.D430]-[.F430] -> 0.000358028543085975
A431: 430 | B431: 404653061 | C431: 3.27 | D431: of:=LN([.B431])/LN([.A431]+1) -> 3.26709322090243 | E431: of:=(1+SQRT(5))/2 -> 1.6180339887499 | F431: of:=3+[.E431]/LN([.A431]+1) -> 3.26673345821014 | G431: of:=[.D431]-[.F431] -> 0.000359762692287102
A432: 431 | B432: 407481233 | C432: 3.27 | D432: of:=LN([.B432])/LN([.A432]+1) -> 3.26699325011142 | E432: of:=(1+SQRT(5))/2 -> 1.6180339887499 | F432: of:=3+[.E432]/LN([.A432]+1) -> 3.26663159417896 | G432: of:=[.D432]-[.F432] -> 0.000361655932466398
A433: 432 | B433: 410318591 | C433: 3.27 | D433: of:=LN([.B433])/LN([.A433]+1) -> 3.26689199166899 | E433: of:=(1+SQRT(5))/2 -> 1.6180339887499 | F433: of:=3+[.E433]/LN([.A433]+1) -> 3.26653004317521 | G433: of:=[.D433]-[.F433] -> 0.000361948493779352
A434: 433 | B434: 413177177 | C434: 3.27 | D434: of:=LN([.B434])/LN([.A434]+1) -> 3.26679426563268 | E434: of:=(1+SQRT(5))/2 -> 1.6180339887499 | F434: of:=3+[.E434]/LN([.A434]+1) -> 3.26642880348803 | G434: of:=[.D434]-[.F434] -> 0.000365462144653161
A435: 434 | B435: 416046443 | C435: 3.27 | D435: of:=LN([.B435])/LN([.A435]+1) -> 3.26669581489905 | E435: of:=(1+SQRT(5))/2 -> 1.6180339887499 | F435: of:=3+[.E435]/LN([.A435]+1) -> 3.2663278734199 | G435: of:=[.D435]-[.F435] -> 0.000367941479150424
A436: 435 | B436: 418928961 | C436: 3.27 | D436: of:=LN([.B436])/LN([.A436]+1) -> 3.26659765817665 | E436: of:=(1+SQRT(5))/2 -> 1.6180339887499 | F436: of:=3+[.E436]/LN([.A436]+1) -> 3.26622725128656 | G436: of:=[.D436]-[.F436] -> 0.000370406890089381
A437: 436 | B437: 421819093 | C437: 3.27 | D437: of:=LN([.B437])/LN([.A437]+1) -> 3.26649758364671 | E437: of:=(1+SQRT(5))/2 -> 1.6180339887499 | F437: of:=3+[.E437]/LN([.A437]+1) -> 3.26612693541684 | G437: of:=[.D437]-[.F437] -> 0.00037064822987487
A438: 437 | B438: 424726965 | C438: 3.27 | D438: of:=LN([.B438])/LN([.A438]+1) -> 3.26639954560842 | E438: of:=(1+SQRT(5))/2 -> 1.6180339887499 | F438: of:=3+[.E438]/LN([.A438]+1) -> 3.26602692415255 | G438: of:=[.D438]-[.F438] -> 0.000372621455879241
A439: 438 | B439: 427648673 | C439: 3.27 | D439: of:=LN([.B439])/LN([.A439]+1) -> 3.26630199294193 | E439: of:=(1+SQRT(5))/2 -> 1.6180339887499 | F439: of:=3+[.E439]/LN([.A439]+1) -> 3.26592721584833 | G439: of:=[.D439]-[.F439] -> 0.000374777093600898
A440: 439 | B440: 430581475 | C440: 3.27 | D440: of:=LN([.B440])/LN([.A440]+1) -> 3.26620386207206 | E440: of:=(1+SQRT(5))/2 -> 1.6180339887499 | F440: of:=3+[.E440]/LN([.A440]+1) -> 3.26582780887156 | G440: of:=[.D440]-[.F440] -> 0.000376053200493942
A441: 440 | B441: 433530959 | C441: 3.27 | D441: of:=LN([.B441])/LN([.A441]+1) -> 3.26610727541299 | E441: of:=(1+SQRT(5))/2 -> 1.6180339887499 | F441: of:=3+[.E441]/LN([.A441]+1) -> 3.26572870160218 | G441: of:=[.D441]-[.F441] -> 0.000378573810815741
A442: 441 | B442: 436492829 | C442: 3.27 | D442: of:=LN([.B442])/LN([.A442]+1) -> 3.26601057733668 | E442: of:=(1+SQRT(5))/2 -> 1.6180339887499 | F442: of:=3+[.E442]/LN([.A442]+1) -> 3.26562989243259 | G442: of:=[.D442]-[.F442] -> 0.000380684904084383
A443: 442 | B443: 439465717 | C443: 3.27 | D443: of:=LN([.B443])/LN([.A443]+1) -> 3.26591325257755 | E443: of:=(1+SQRT(5))/2 -> 1.6180339887499 | F443: of:=3+[.E443]/LN([.A443]+1) -> 3.26553137976755 | G443: of:=[.D443]-[.F443] -> 0.000381872810007344
A444: 443 | B444: 442453927 | C444: 3.27 | D444: of:=LN([.B444])/LN([.A444]+1) -> 3.26581690357477 | E444: of:=(1+SQRT(5))/2 -> 1.6180339887499 | F444: of:=3+[.E444]/LN([.A444]+1) -> 3.26543316202399 | G444: of:=[.D444]-[.F444] -> 0.000383741550774808
A445: 444 | B445: 445453733 | C445: 3.27 | D445: of:=LN([.B445])/LN([.A445]+1) -> 3.26572013129218 | E445: of:=(1+SQRT(5))/2 -> 1.6180339887499 | F445: of:=3+[.E445]/LN([.A445]+1) -> 3.26533523763097 | G445: of:=[.D445]-[.F445] -> 0.000384893661210306
A446: 445 | B446: 448468773 | C446: 3.27 | D446: of:=LN([.B446])/LN([.A446]+1) -> 3.26562426789575 | E446: of:=(1+SQRT(5))/2 -> 1.6180339887499 | F446: of:=3+[.E446]/LN([.A446]+1) -> 3.2652376050295 | G446: of:=[.D446]-[.F446] -> 0.000386662866248333
A447: 446 | B447: 451498227 | C447: 3.27 | D447: of:=LN([.B447])/LN([.A447]+1) -> 3.26552899000312 | E447: of:=(1+SQRT(5))/2 -> 1.6180339887499 | F447: of:=3+[.E447]/LN([.A447]+1) -> 3.26514026267246 | G447: of:=[.D447]-[.F447] -> 0.000388727330663752
A448: 447 | B448: 454541779 | C448: 3.27 | D448: of:=LN([.B448])/LN([.A448]+1) -> 3.26543416482977 | E448: of:=(1+SQRT(5))/2 -> 1.6180339887499 | F448: of:=3+[.E448]/LN([.A448]+1) -> 3.26504320902443 | G448: of:=[.D448]-[.F448] -> 0.000390955805337878
A449: 448 | B449: 457597075 | C449: 3.27 | D449: of:=LN([.B449])/LN([.A449]+1) -> 3.26533893396563 | E449: of:=(1+SQRT(5))/2 -> 1.6180339887499 | F449: of:=3+[.E449]/LN([.A449]+1) -> 3.26494644256165 | G449: of:=[.D449]-[.F449] -> 0.000392491403975903
A450: 449 | B450: 460664097 | C450: 3.27 | D450: of:=LN([.B450])/LN([.A450]+1) -> 3.26524329309212 | E450: of:=(1+SQRT(5))/2 -> 1.6180339887499 | F450: of:=3+[.E450]/LN([.A450]+1) -> 3.26484996177185 | G450: of:=[.D450]-[.F450] -> 0.000393331320275081
A451: 450 | B451: 463747479 | C451: 3.27 | D451: of:=LN([.B451])/LN([.A451]+1) -> 3.26514887951219 | E451: of:=(1+SQRT(5))/2 -> 1.6180339887499 | F451: of:=3+[.E451]/LN([.A451]+1) -> 3.26475376515414 | G451: of:=[.D451]-[.F451] -> 0.000395114358053839
A452: 451 | B452: 466845655 | C452: 3.27 | D452: of:=LN([.B452])/LN([.A452]+1) -> 3.26505511255424 | E452: of:=(1+SQRT(5))/2 -> 1.6180339887499 | F452: of:=3+[.E452]/LN([.A452]+1) -> 3.26465785121894 | G452: of:=[.D452]-[.F452] -> 0.00039726133530138
A453: 452 | B453: 469957233 | C453: 3.26 | D453: of:=LN([.B453])/LN([.A453]+1) -> 3.26496148807302 | E453: of:=(1+SQRT(5))/2 -> 1.6180339887499 | F453: of:=3+[.E453]/LN([.A453]+1) -> 3.26456221848781 | G453: of:=[.D453]-[.F453] -> 0.000399269585218853
A454: 453 | B454: 473082197 | C454: 3.26 | D454: of:=LN([.B454])/LN([.A454]+1) -> 3.2648679912712 | E454: of:=(1+SQRT(5))/2 -> 1.6180339887499 | F454: of:=3+[.E454]/LN([.A454]+1) -> 3.26446686549339 | G454: of:=[.D454]-[.F454] -> 0.000401125777813149
A455: 454 | B455: 476218989 | C455: 3.26 | D455: of:=LN([.B455])/LN([.A455]+1) -> 3.26477407869982 | E455: of:=(1+SQRT(5))/2 -> 1.6180339887499 | F455: of:=3+[.E455]/LN([.A455]+1) -> 3.26437179077928 | G455: of:=[.D455]-[.F455] -> 0.000402287920536981
A456: 455 | B456: 479374093 | C456: 3.26 | D456: of:=LN([.B456])/LN([.A456]+1) -> 3.26468196205565 | E456: of:=(1+SQRT(5))/2 -> 1.6180339887499 | F456: of:=3+[.E456]/LN([.A456]+1) -> 3.26427699289993 | G456: of:=[.D456]-[.F456] -> 0.000404969155726853
A457: 456 | B457: 482536231 | C457: 3.26 | D457: of:=LN([.B457])/LN([.A457]+1) -> 3.26458778192621 | E457: of:=(1+SQRT(5))/2 -> 1.6180339887499 | F457: of:=3+[.E457]/LN([.A457]+1) -> 3.26418247042051 | G457: of:=[.D457]-[.F457] -> 0.000405311505703221
A458: 457 | B458: 485718403 | C458: 3.26 | D458: of:=LN([.B458])/LN([.A458]+1) -> 3.26449594323005 | E458: of:=(1+SQRT(5))/2 -> 1.6180339887499 | F458: of:=3+[.E458]/LN([.A458]+1) -> 3.26408822191686 | G458: of:=[.D458]-[.F458] -> 0.000407721313198106
A459: 458 | B459: 488911333 | C459: 3.26 | D459: of:=LN([.B459])/LN([.A459]+1) -> 3.26440329613356 | E459: of:=(1+SQRT(5))/2 -> 1.6180339887499 | F459: of:=3+[.E459]/LN([.A459]+1) -> 3.26399424597533 | G459: of:=[.D459]-[.F459] -> 0.000409050158227675
A460: 459 | B460: 492119797 | C460: 3.26 | D460: of:=LN([.B460])/LN([.A460]+1) -> 3.2643114340965 | E460: of:=(1+SQRT(5))/2 -> 1.6180339887499 | F460: of:=3+[.E460]/LN([.A460]+1) -> 3.26390054119274 | G460: of:=[.D460]-[.F460] -> 0.000410892903751847
A461: 460 | B461: 495341509 | C461: 3.26 | D461: of:=LN([.B461])/LN([.A461]+1) -> 3.26421958259854 | E461: of:=(1+SQRT(5))/2 -> 1.6180339887499 | F461: of:=3+[.E461]/LN([.A461]+1) -> 3.26380710617623 | G461: of:=[.D461]-[.F461] -> 0.000412476422312569
A462: 461 | B462: 498576891 | C462: 3.26 | D462: of:=LN([.B462])/LN([.A462]+1) -> 3.26412787342796 | E462: of:=(1+SQRT(5))/2 -> 1.6180339887499 | F462: of:=3+[.E462]/LN([.A462]+1) -> 3.26371393954317 | G462: of:=[.D462]-[.F462] -> 0.000413933884792606
A463: 462 | B463: 501825563 | C463: 3.26 | D463: of:=LN([.B463])/LN([.A463]+1) -> 3.26403617441217 | E463: of:=(1+SQRT(5))/2 -> 1.6180339887499 | F463: of:=3+[.E463]/LN([.A463]+1) -> 3.26362103992107 | G463: of:=[.D463]-[.F463] -> 0.000415134491096314
A464: 463 | B464: 505088191 | C464: 3.26 | D464: of:=LN([.B464])/LN([.A464]+1) -> 3.26394469426462 | E464: of:=(1+SQRT(5))/2 -> 1.6180339887499 | F464: of:=3+[.E464]/LN([.A464]+1) -> 3.2635284059475 | G464: of:=[.D464]-[.F464] -> 0.000416288317112379
A465: 464 | B465: 508367675 | C465: 3.26 | D465: of:=LN([.B465])/LN([.A465]+1) -> 3.26385435152129 | E465: of:=(1+SQRT(5))/2 -> 1.6180339887499 | F465: of:=3+[.E465]/LN([.A465]+1) -> 3.26343603626998 | G465: of:=[.D465]-[.F465] -> 0.000418315251308865
A466: 465 | B466: 511665057 | C466: 3.26 | D466: of:=LN([.B466])/LN([.A466]+1) -> 3.26376544875306 | E466: of:=(1+SQRT(5))/2 -> 1.6180339887499 | F466: of:=3+[.E466]/LN([.A466]+1) -> 3.26334392954586 | G466: of:=[.D466]-[.F466] -> 0.000421519207193022
A467: 466 | B467: 514965505 | C467: 3.26 | D467: of:=LN([.B467])/LN([.A467]+1) -> 3.26367326494483 | E467: of:=(1+SQRT(5))/2 -> 1.6180339887499 | F467: of:=3+[.E467]/LN([.A467]+1) -> 3.26325208444228 | G467: of:=[.D467]-[.F467] -> 0.000421180502553131
A468: 467 | B468: 518287991 | C468: 3.26 | D468: of:=LN([.B468])/LN([.A468]+1) -> 3.26358381423806 | E468: of:=(1+SQRT(5))/2 -> 1.6180339887499 | F468: of:=3+[.E468]/LN([.A468]+1) -> 3.26316049963602 | G468: of:=[.D468]-[.F468] -> 0.000423314602048475
A469: 468 | B469: 521620143 | C469: 3.26 | D469: of:=LN([.B469])/LN([.A469]+1) -> 3.26349317964755 | E469: of:=(1+SQRT(5))/2 -> 1.6180339887499 | F469: of:=3+[.E469]/LN([.A469]+1) -> 3.26306917381345 | G469: of:=[.D469]-[.F469] -> 0.000424005834101848
A470: 469 | B470: 524972655 | C470: 3.26 | D470: of:=LN([.B470])/LN([.A470]+1) -> 3.26340469020664 | E470: of:=(1+SQRT(5))/2 -> 1.6180339887499 | F470: of:=3+[.E470]/LN([.A470]+1) -> 3.26297810567044 | G470: of:=[.D470]-[.F470] -> 0.000426584536194152
A471: 470 | B471: 528335717 | C471: 3.26 | D471: of:=LN([.B471])/LN([.A471]+1) -> 3.26331528046042 | E471: of:=(1+SQRT(5))/2 -> 1.6180339887499 | F471: of:=3+[.E471]/LN([.A471]+1) -> 3.26288729391225 | G471: of:=[.D471]-[.F471] -> 0.000427986548171777
A472: 471 | B472: 531712815 | C472: 3.26 | D472: of:=LN([.B472])/LN([.A472]+1) -> 3.26322602808275 | E472: of:=(1+SQRT(5))/2 -> 1.6180339887499 | F472: of:=3+[.E472]/LN([.A472]+1) -> 3.26279673725344 | G472: of:=[.D472]-[.F472] -> 0.000429290829306428
A473: 472 | B473: 535105969 | C473: 3.26 | D473: of:=LN([.B473])/LN([.A473]+1) -> 3.26313753732343 | E473: of:=(1+SQRT(5))/2 -> 1.6180339887499 | F473: of:=3+[.E473]/LN([.A473]+1) -> 3.26270643441781 | G473: of:=[.D473]-[.F473] -> 0.000431102905614988
A474: 473 | B474: 538513127 | C474: 3.26 | D474: of:=LN([.B474])/LN([.A474]+1) -> 3.26304916902318 | E474: of:=(1+SQRT(5))/2 -> 1.6180339887499 | F474: of:=3+[.E474]/LN([.A474]+1) -> 3.26261638413829 | G474: of:=[.D474]-[.F474] -> 0.000432784884897952
A475: 474 | B475: 541933153 | C475: 3.26 | D475: of:=LN([.B475])/LN([.A475]+1) -> 3.26296057515745 | E475: of:=(1+SQRT(5))/2 -> 1.6180339887499 | F475: of:=3+[.E475]/LN([.A475]+1) -> 3.26252658515685 | G475: of:=[.D475]-[.F475] -> 0.000433990000600737
A476: 475 | B476: 545370869 | C476: 3.26 | D476: of:=LN([.B476])/LN([.A476]+1) -> 3.26287318887367 | E476: of:=(1+SQRT(5))/2 -> 1.6180339887499 | F476: of:=3+[.E476]/LN([.A476]+1) -> 3.26243703622446 | G476: of:=[.D476]-[.F476] -> 0.000436152649204491
A477: 476 | B477: 548819925 | C477: 3.26 | D477: of:=LN([.B477])/LN([.A477]+1) -> 3.26278510482025 | E477: of:=(1+SQRT(5))/2 -> 1.6180339887499 | F477: of:=3+[.E477]/LN([.A477]+1) -> 3.26234773610096 | G477: of:=[.D477]-[.F477] -> 0.000437368719294451
A478: 477 | B478: 552285837 | C478: 3.26 | D478: of:=LN([.B478])/LN([.A478]+1) -> 3.26269795027114 | E478: of:=(1+SQRT(5))/2 -> 1.6180339887499 | F478: of:=3+[.E478]/LN([.A478]+1) -> 3.26225868355498 | G478: of:=[.D478]-[.F478] -> 0.000439266716157238
A479: 478 | B479: 555761679 | C479: 3.26 | D479: of:=LN([.B479])/LN([.A479]+1) -> 3.26260968231021 | E479: of:=(1+SQRT(5))/2 -> 1.6180339887499 | F479: of:=3+[.E479]/LN([.A479]+1) -> 3.26216987736389 | G479: of:=[.D479]-[.F479] -> 0.000439804946318123
A480: 479 | B480: 559254799 | C480: 3.26 | D480: of:=LN([.B480])/LN([.A480]+1) -> 3.26252244578136 | E480: of:=(1+SQRT(5))/2 -> 1.6180339887499 | F480: of:=3+[.E480]/LN([.A480]+1) -> 3.26208131631371 | G480: of:=[.D480]-[.F480] -> 0.000441129467656509
A481: 480 | B481: 562760981 | C481: 3.26 | D481: of:=LN([.B481])/LN([.A481]+1) -> 3.26243500215655 | E481: of:=(1+SQRT(5))/2 -> 1.6180339887499 | F481: of:=3+[.E481]/LN([.A481]+1) -> 3.26199299919899 | G481: of:=[.D481]-[.F481] -> 0.000442002957553811
A482: 481 | B482: 566286595 | C482: 3.26 | D482: of:=LN([.B482])/LN([.A482]+1) -> 3.26234917110482 | E482: of:=(1+SQRT(5))/2 -> 1.6180339887499 | F482: of:=3+[.E482]/LN([.A482]+1) -> 3.2619049248228 | G482: of:=[.D482]-[.F482] -> 0.000444246282014671
A483: 482 | B483: 569825669 | C483: 3.26 | D483: of:=LN([.B483])/LN([.A483]+1) -> 3.26226321999275 | E483: of:=(1+SQRT(5))/2 -> 1.6180339887499 | F483: of:=3+[.E483]/LN([.A483]+1) -> 3.2618170919966 | G483: of:=[.D483]-[.F483] -> 0.000446127996145407
A484: 483 | B484: 573377037 | C484: 3.26 | D484: of:=LN([.B484])/LN([.A484]+1) -> 3.26217681701739 | E484: of:=(1+SQRT(5))/2 -> 1.6180339887499 | F484: of:=3+[.E484]/LN([.A484]+1) -> 3.26172949954019 | G484: of:=[.D484]-[.F484] -> 0.000447317477198617
A485: 484 | B485: 576944069 | C485: 3.26 | D485: of:=LN([.B485])/LN([.A485]+1) -> 3.26209091039102 | E485: of:=(1+SQRT(5))/2 -> 1.6180339887499 | F485: of:=3+[.E485]/LN([.A485]+1) -> 3.26164214628161 | G485: of:=[.D485]-[.F485] -> 0.000448764109409527
A486: 485 | B486: 580522831 | C486: 3.26 | D486: of:=LN([.B486])/LN([.A486]+1) -> 3.26200438993495 | E486: of:=(1+SQRT(5))/2 -> 1.6180339887499 | F486: of:=3+[.E486]/LN([.A486]+1) -> 3.26155503105708 | G486: of:=[.D486]-[.F486] -> 0.000449358877864903
A487: 486 | B487: 584120693 | C487: 3.26 | D487: of:=LN([.B487])/LN([.A487]+1) -> 3.26191930144713 | E487: of:=(1+SQRT(5))/2 -> 1.6180339887499 | F487: of:=3+[.E487]/LN([.A487]+1) -> 3.26146815271096 | G487: of:=[.D487]-[.F487] -> 0.000451148736172247
A488: 487 | B488: 587732343 | C488: 3.26 | D488: of:=LN([.B488])/LN([.A488]+1) -> 3.26183415212685 | E488: of:=(1+SQRT(5))/2 -> 1.6180339887499 | F488: of:=3+[.E488]/LN([.A488]+1) -> 3.26138151009559 | G488: of:=[.D488]-[.F488] -> 0.00045264203126294
A489: 488 | B489: 591359327 | C489: 3.26 | D489: of:=LN([.B489])/LN([.A489]+1) -> 3.26174936032129 | E489: of:=(1+SQRT(5))/2 -> 1.6180339887499 | F489: of:=3+[.E489]/LN([.A489]+1) -> 3.26129510207131 | G489: of:=[.D489]-[.F489] -> 0.000454258249982686
A490: 489 | B490: 595001101 | C490: 3.26 | D490: of:=LN([.B490])/LN([.A490]+1) -> 3.26166476655563 | E490: of:=(1+SQRT(5))/2 -> 1.6180339887499 | F490: of:=3+[.E490]/LN([.A490]+1) -> 3.26120892750633 | G490: of:=[.D490]-[.F490] -> 0.000455839049298135
A491: 490 | B491: 598659141 | C491: 3.26 | D491: of:=LN([.B491])/LN([.A491]+1) -> 3.26158075995756 | E491: of:=(1+SQRT(5))/2 -> 1.6180339887499 | F491: of:=3+[.E491]/LN([.A491]+1) -> 3.26112298527669 | G491: of:=[.D491]-[.F491] -> 0.000457774680872713
A492: 491 | B492: 602327273 | C492: 3.26 | D492: of:=LN([.B492])/LN([.A492]+1) -> 3.26149567064261 | E492: of:=(1+SQRT(5))/2 -> 1.6180339887499 | F492: of:=3+[.E492]/LN([.A492]+1) -> 3.26103727426615 | G492: of:=[.D492]-[.F492] -> 0.000458396376455728
A493: 492 | B493: 606012089 | C493: 3.26 | D493: of:=LN([.B493])/LN([.A493]+1) -> 3.26141126882563 | E493: of:=(1+SQRT(5))/2 -> 1.6180339887499 | F493: of:=3+[.E493]/LN([.A493]+1) -> 3.26095179336618 | G493: of:=[.D493]-[.F493] -> 0.000459475459444469
A494: 493 | B494: 609714015 | C494: 3.26 | D494: of:=LN([.B494])/LN([.A494]+1) -> 3.26132764919656 | E494: of:=(1+SQRT(5))/2 -> 1.6180339887499 | F494: of:=3+[.E494]/LN([.A494]+1) -> 3.26086654147584 | G494: of:=[.D494]-[.F494] -> 0.000461107720712395
A495: 494 | B495: 613430935 | C495: 3.26 | D495: of:=LN([.B495])/LN([.A495]+1) -> 3.26124423604591 | E495: of:=(1+SQRT(5))/2 -> 1.6180339887499 | F495: of:=3+[.E495]/LN([.A495]+1) -> 3.26078151750175 | G495: of:=[.D495]-[.F495] -> 0.000462718544162577
A496: 495 | B496: 617162459 | C496: 3.26 | D496: of:=LN([.B496])/LN([.A496]+1) -> 3.26116091881788 | E496: of:=(1+SQRT(5))/2 -> 1.6180339887499 | F496: of:=3+[.E496]/LN([.A496]+1) -> 3.26069672035797 | G496: of:=[.D496]-[.F496] -> 0.000464198459917409
A497: 496 | B497: 620909883 | C497: 3.26 | D497: of:=LN([.B497])/LN([.A497]+1) -> 3.26107802710797 | E497: of:=(1+SQRT(5))/2 -> 1.6180339887499 | F497: of:=3+[.E497]/LN([.A497]+1) -> 3.260612148966 | G497: of:=[.D497]-[.F497] -> 0.000465878141969078
A498: 497 | B498: 624670885 | C498: 3.26 | D498: of:=LN([.B498])/LN([.A498]+1) -> 3.26099494957486 | E498: of:=(1+SQRT(5))/2 -> 1.6180339887499 | F498: of:=3+[.E498]/LN([.A498]+1) -> 3.26052780225467 | G498: of:=[.D498]-[.F498] -> 0.000467147320193373
A499: 498 | B499: 628445533 | C499: 3.26 | D499: of:=LN([.B499])/LN([.A499]+1) -> 3.2609117024496 | E499: of:=(1+SQRT(5))/2 -> 1.6180339887499 | F499: of:=3+[.E499]/LN([.A499]+1) -> 3.26044367916008 | G499: of:=[.D499]-[.F499] -> 0.000468023289510899
A500: 499 | B500: 632237967 | C500: 3.26 | D500: of:=LN([.B500])/LN([.A500]+1) -> 3.26082933796738 | E500: of:=(1+SQRT(5))/2 -> 1.6180339887499 | F500: of:=3+[.E500]/LN([.A500]+1) -> 3.26035977862557 | G500: of:=[.D500]-[.F500] -> 0.000469559341809589
A501: 500 | B501: 636041729 | C501: 3.26 | D501: of:=LN([.B501])/LN([.A501]+1) -> 3.26074620157288 | E501: of:=(1+SQRT(5))/2 -> 1.6180339887499 | F501: of:=3+[.E501]/LN([.A501]+1) -> 3.2602760996016 | G501: of:=[.D501]-[.F501] -> 0.000470101971277614
A502: 501 | B502: 639867681 | C502: 3.26 | D502: of:=LN([.B502])/LN([.A502]+1) -> 3.26066503300268 | E502: of:=(1+SQRT(5))/2 -> 1.6180339887499 | F502: of:=3+[.E502]/LN([.A502]+1) -> 3.26019264104573 | G502: of:=[.D502]-[.F502] -> 0.000472391956945817
A503: 502 | B503: 643701201 | C503: 3.26 | D503: of:=LN([.B503])/LN([.A503]+1) -> 3.26058213902104 | E503: of:=(1+SQRT(5))/2 -> 1.6180339887499 | F503: of:=3+[.E503]/LN([.A503]+1) -> 3.26010940192254 | G503: of:=[.D503]-[.F503] -> 0.000472737098500708
A504: 503 | B504: 647553997 | C504: 3.26 | D504: of:=LN([.B504])/LN([.A504]+1) -> 3.26050045303815 | E504: of:=(1+SQRT(5))/2 -> 1.6180339887499 | F504: of:=3+[.E504]/LN([.A504]+1) -> 3.26002638120358 | G504: of:=[.D504]-[.F504] -> 0.000474071834569045
A505: 504 | B505: 651421199 | C505: 3.26 | D505: of:=LN([.B505])/LN([.A505]+1) -> 3.26041874690723 | E505: of:=(1+SQRT(5))/2 -> 1.6180339887499 | F505: of:=3+[.E505]/LN([.A505]+1) -> 3.2599435778673 | G505: of:=[.D505]-[.F505] -> 0.000475169039928058
A506: 505 | B506: 655308501 | C506: 3.26 | D506: of:=LN([.B506])/LN([.A506]+1) -> 3.26033841200086 | E506: of:=(1+SQRT(5))/2 -> 1.6180339887499 | F506: of:=3+[.E506]/LN([.A506]+1) -> 3.25986099089898 | G506: of:=[.D506]-[.F506] -> 0.000477421101881426
A507: 506 | B507: 659206355 | C507: 3.26 | D507: of:=LN([.B507])/LN([.A507]+1) -> 3.26025709279123 | E507: of:=(1+SQRT(5))/2 -> 1.6180339887499 | F507: of:=3+[.E507]/LN([.A507]+1) -> 3.25977861929071 | G507: of:=[.D507]-[.F507] -> 0.000478473500520771
A508: 507 | B508: 663117691 | C508: 3.26 | D508: of:=LN([.B508])/LN([.A508]+1) -> 3.26017551229716 | E508: of:=(1+SQRT(5))/2 -> 1.6180339887499 | F508: of:=3+[.E508]/LN([.A508]+1) -> 3.25969646204127 | G508: of:=[.D508]-[.F508] -> 0.000479050255889124
A509: 508 | B509: 667050999 | C509: 3.26 | D509: of:=LN([.B509])/LN([.A509]+1) -> 3.26009571315646 | E509: of:=(1+SQRT(5))/2 -> 1.6180339887499 | F509: of:=3+[.E509]/LN([.A509]+1) -> 3.25961451815613 | G509: of:=[.D509]-[.F509] -> 0.000481195000327173
A510: 509 | B510: 670996489 | C510: 3.26 | D510: of:=LN([.B510])/LN([.A510]+1) -> 3.26001531766124 | E510: of:=(1+SQRT(5))/2 -> 1.6180339887499 | F510: of:=3+[.E510]/LN([.A510]+1) -> 3.25953278664736 | G510: of:=[.D510]-[.F510] -> 0.000482531013881626
A511: 510 | B511: 674959161 | C511: 3.26 | D511: of:=LN([.B511])/LN([.A511]+1) -> 3.25993552029366 | E511: of:=(1+SQRT(5))/2 -> 1.6180339887499 | F511: of:=3+[.E511]/LN([.A511]+1) -> 3.25945126653359 | G511: of:=[.D511]-[.F511] -> 0.000484253760069553
A512: 511 | B512: 678931261 | C512: 3.26 | D512: of:=LN([.B512])/LN([.A512]+1) -> 3.25985447489098 | E512: of:=(1+SQRT(5))/2 -> 1.6180339887499 | F512: of:=3+[.E512]/LN([.A512]+1) -> 3.25936995683992 | G512: of:=[.D512]-[.F512] -> 0.000484518051064864
A513: 512 | B513: 682924247 | C513: 3.26 | D513: of:=LN([.B513])/LN([.A513]+1) -> 3.25977488879338 | E513: of:=(1+SQRT(5))/2 -> 1.6180339887499 | F513: of:=3+[.E513]/LN([.A513]+1) -> 3.25928885659791 | G513: of:=[.D513]-[.F513] -> 0.000486032195472497
A514: 513 | B514: 686931873 | C514: 3.26 | D514: of:=LN([.B514])/LN([.A514]+1) -> 3.25969527426808 | E514: of:=(1+SQRT(5))/2 -> 1.6180339887499 | F514: of:=3+[.E514]/LN([.A514]+1) -> 3.2592079648455 | G514: of:=[.D514]-[.F514] -> 0.000487309422579241
A515: 514 | B515: 690955501 | C515: 3.26 | D515: of:=LN([.B515])/LN([.A515]+1) -> 3.2596159432447 | E515: of:=(1+SQRT(5))/2 -> 1.6180339887499 | F515: of:=3+[.E515]/LN([.A515]+1) -> 3.25912728062696 | G515: of:=[.D515]-[.F515] -> 0.000488662617734281
A516: 515 | B516: 694994841 | C516: 3.26 | D516: of:=LN([.B516])/LN([.A516]+1) -> 3.25953681947834 | E516: of:=(1+SQRT(5))/2 -> 1.6180339887499 | F516: of:=3+[.E516]/LN([.A516]+1) -> 3.25904680299283 | G516: of:=[.D516]-[.F516] -> 0.00049001648551128
A517: 516 | B517: 699048257 | C517: 3.26 | D517: of:=LN([.B517])/LN([.A517]+1) -> 3.25945752038607 | E517: of:=(1+SQRT(5))/2 -> 1.6180339887499 | F517: of:=3+[.E517]/LN([.A517]+1) -> 3.25896653099987 | G517: of:=[.D517]-[.F517] -> 0.000490989386205065
A518: 517 | B518: 703119695 | C518: 3.26 | D518: of:=LN([.B518])/LN([.A518]+1) -> 3.25937894292765 | E518: of:=(1+SQRT(5))/2 -> 1.6180339887499 | F518: of:=3+[.E518]/LN([.A518]+1) -> 3.25888646371101 | G518: of:=[.D518]-[.F518] -> 0.000492479216645858
A519: 518 | B519: 707203079 | C519: 3.26 | D519: of:=LN([.B519])/LN([.A519]+1) -> 3.25929969555918 | E519: of:=(1+SQRT(5))/2 -> 1.6180339887499 | F519: of:=3+[.E519]/LN([.A519]+1) -> 3.25880660019529 | G519: of:=[.D519]-[.F519] -> 0.000493095363888418
A520: 519 | B520: 711303739 | C520: 3.26 | D520: of:=LN([.B520])/LN([.A520]+1) -> 3.25922098451678 | E520: of:=(1+SQRT(5))/2 -> 1.6180339887499 | F520: of:=3+[.E520]/LN([.A520]+1) -> 3.25872693952783 | G520: of:=[.D520]-[.F520] -> 0.000494044988946563
A521: 520 | B521: 715424801 | C521: 3.26 | D521: of:=LN([.B521])/LN([.A521]+1) -> 3.25914349445343 | E521: of:=(1+SQRT(5))/2 -> 1.6180339887499 | F521: of:=3+[.E521]/LN([.A521]+1) -> 3.25864748078975 | G521: of:=[.D521]-[.F521] -> 0.000496013663680905
A522: 521 | B522: 719556843 | C522: 3.26 | D522: of:=LN([.B522])/LN([.A522]+1) -> 3.25906510664405 | E522: of:=(1+SQRT(5))/2 -> 1.6180339887499 | F522: of:=3+[.E522]/LN([.A522]+1) -> 3.25856822306814 | G522: of:=[.D522]-[.F522] -> 0.000496883575907603
A523: 522 | B523: 723705463 | C523: 3.26 | D523: of:=LN([.B523])/LN([.A523]+1) -> 3.25898706896425 | E523: of:=(1+SQRT(5))/2 -> 1.6180339887499 | F523: of:=3+[.E523]/LN([.A523]+1) -> 3.25848916545598 | G523: of:=[.D523]-[.F523] -> 0.000497903508265285
A524: 523 | B524: 727869987 | C524: 3.26 | D524: of:=LN([.B524])/LN([.A524]+1) -> 3.2589092231844 | E524: of:=(1+SQRT(5))/2 -> 1.6180339887499 | F524: of:=3+[.E524]/LN([.A524]+1) -> 3.25841030705215 | G524: of:=[.D524]-[.F524] -> 0.000498916132250393
A525: 524 | B525: 732052291 | C525: 3.26 | D525: of:=LN([.B525])/LN([.A525]+1) -> 3.25883197098836 | E525: of:=(1+SQRT(5))/2 -> 1.6180339887499 | F525: of:=3+[.E525]/LN([.A525]+1) -> 3.25833164696131 | G525: of:=[.D525]-[.F525] -> 0.000500324027049803
A526: 525 | B526: 736251041 | C526: 3.26 | D526: of:=LN([.B526])/LN([.A526]+1) -> 3.2587550085129 | E526: of:=(1+SQRT(5))/2 -> 1.6180339887499 | F526: of:=3+[.E526]/LN([.A526]+1) -> 3.25825318429389 | G526: of:=[.D526]-[.F526] -> 0.000501824219010683
A527: 526 | B527: 740464075 | C527: 3.26 | D527: of:=LN([.B527])/LN([.A527]+1) -> 3.25867786068076 | E527: of:=(1+SQRT(5))/2 -> 1.6180339887499 | F527: of:=3+[.E527]/LN([.A527]+1) -> 3.25817491816605 | G527: of:=[.D527]-[.F527] -> 0.000502942514707616
A528: 527 | B528: 744693525 | C528: 3.26 | D528: of:=LN([.B528])/LN([.A528]+1) -> 3.25860098351998 | E528: of:=(1+SQRT(5))/2 -> 1.6180339887499 | F528: of:=3+[.E528]/LN([.A528]+1) -> 3.2580968476996 | G528: of:=[.D528]-[.F528] -> 0.000504135820371676
A529: 528 | B529: 748936371 | C529: 3.26 | D529: of:=LN([.B529])/LN([.A529]+1) -> 3.25852372524337 | E529: of:=(1+SQRT(5))/2 -> 1.6180339887499 | F529: of:=3+[.E529]/LN([.A529]+1) -> 3.25801897202199 | G529: of:=[.D529]-[.F529] -> 0.000504753221371779
A530: 529 | B530: 753202199 | C530: 3.26 | D530: of:=LN([.B530])/LN([.A530]+1) -> 3.25844811765892 | E530: of:=(1+SQRT(5))/2 -> 1.6180339887499 | F530: of:=3+[.E530]/LN([.A530]+1) -> 3.25794129026623 | G530: of:=[.D530]-[.F530] -> 0.000506827392690035
A531: 530 | B531: 757478655 | C531: 3.26 | D531: of:=LN([.B531])/LN([.A531]+1) -> 3.2583715282777 | E531: of:=(1+SQRT(5))/2 -> 1.6180339887499 | F531: of:=3+[.E531]/LN([.A531]+1) -> 3.25786380157086 | G531: of:=[.D531]-[.F531] -> 0.000507726706839851
A532: 531 | B532: 761769453 | C532: 3.26 | D532: of:=LN([.B532])/LN([.A532]+1) -> 3.25829474742063 | E532: of:=(1+SQRT(5))/2 -> 1.6180339887499 | F532: of:=3+[.E532]/LN([.A532]+1) -> 3.2577865050799 | G532: of:=[.D532]-[.F532] -> 0.000508242340730103
A533: 532 | B533: 766083281 | C533: 3.26 | D533: of:=LN([.B533])/LN([.A533]+1) -> 3.25821958096528 | E533: of:=(1+SQRT(5))/2 -> 1.6180339887499 | F533: of:=3+[.E533]/LN([.A533]+1) -> 3.25770939994282 | G533: of:=[.D533]-[.F533] -> 0.000510181022465694
A534: 533 | B534: 770409243 | C534: 3.26 | D534: of:=LN([.B534])/LN([.A534]+1) -> 3.25814374455538 | E534: of:=(1+SQRT(5))/2 -> 1.6180339887499 | F534: of:=3+[.E534]/LN([.A534]+1) -> 3.25763248531446 | G534: of:=[.D534]-[.F534] -> 0.000511259240917994
A535: 534 | B535: 774746275 | C535: 3.26 | D535: of:=LN([.B535])/LN([.A535]+1) -> 3.25806702759494 | E535: of:=(1+SQRT(5))/2 -> 1.6180339887499 | F535: of:=3+[.E535]/LN([.A535]+1) -> 3.25755576035503 | G535: of:=[.D535]-[.F535] -> 0.000511267239912794
A536: 535 | B536: 779110293 | C536: 3.26 | D536: of:=LN([.B536])/LN([.A536]+1) -> 3.25799269268352 | E536: of:=(1+SQRT(5))/2 -> 1.6180339887499 | F536: of:=3+[.E536]/LN([.A536]+1) -> 3.25747922423002 | G536: of:=[.D536]-[.F536] -> 0.000513468453501975
A537: 536 | B537: 783481577 | C537: 3.26 | D537: of:=LN([.B537])/LN([.A537]+1) -> 3.25791669005644 | E537: of:=(1+SQRT(5))/2 -> 1.6180339887499 | F537: of:=3+[.E537]/LN([.A537]+1) -> 3.25740287611021 | G537: of:=[.D537]-[.F537] -> 0.000513813946228403
A538: 537 | B538: 787876025 | C538: 3.26 | D538: of:=LN([.B538])/LN([.A538]+1) -> 3.2578422543648 | E538: of:=(1+SQRT(5))/2 -> 1.6180339887499 | F538: of:=3+[.E538]/LN([.A538]+1) -> 3.25732671517157 | G538: of:=[.D538]-[.F538] -> 0.00051553919322922
A539: 538 | B539: 792281303 | C539: 3.26 | D539: of:=LN([.B539])/LN([.A539]+1) -> 3.25776687932349 | E539: of:=(1+SQRT(5))/2 -> 1.6180339887499 | F539: of:=3+[.E539]/LN([.A539]+1) -> 3.25725074059526 | G539: of:=[.D539]-[.F539] -> 0.000516138728228643
A540: 539 | B540: 796708711 | C540: 3.26 | D540: of:=LN([.B540])/LN([.A540]+1) -> 3.25769283202724 | E540: of:=(1+SQRT(5))/2 -> 1.6180339887499 | F540: of:=3+[.E540]/LN([.A540]+1) -> 3.25717495156756 | G540: of:=[.D540]-[.F540] -> 0.000517880459680153
A541: 540 | B541: 801146885 | C541: 3.26 | D541: of:=LN([.B541])/LN([.A541]+1) -> 3.25761783171827 | E541: of:=(1+SQRT(5))/2 -> 1.6180339887499 | F541: of:=3+[.E541]/LN([.A541]+1) -> 3.25709934727986 | G541: of:=[.D541]-[.F541] -> 0.000518484438414291
A542: 541 | B542: 805604945 | C542: 3.26 | D542: of:=LN([.B542])/LN([.A542]+1) -> 3.25754368964585 | E542: of:=(1+SQRT(5))/2 -> 1.6180339887499 | F542: of:=3+[.E542]/LN([.A542]+1) -> 3.25702392692856 | G542: of:=[.D542]-[.F542] -> 0.000519762717291261
A543: 542 | B543: 810076537 | C543: 3.26 | D543: of:=LN([.B543])/LN([.A543]+1) -> 3.25746914165141 | E543: of:=(1+SQRT(5))/2 -> 1.6180339887499 | F543: of:=3+[.E543]/LN([.A543]+1) -> 3.25694868971512 | G543: of:=[.D543]-[.F543] -> 0.000520451936292243
A544: 543 | B544: 814566705 | C544: 3.26 | D544: of:=LN([.B544])/LN([.A544]+1) -> 3.25739517424493 | E544: of:=(1+SQRT(5))/2 -> 1.6180339887499 | F544: of:=3+[.E544]/LN([.A544]+1) -> 3.25687363484593 | G544: of:=[.D544]-[.F544] -> 0.000521539398999238
A545: 544 | B545: 819073513 | C545: 3.26 | D545: of:=LN([.B545])/LN([.A545]+1) -> 3.25732139864769 | E545: of:=(1+SQRT(5))/2 -> 1.6180339887499 | F545: of:=3+[.E545]/LN([.A545]+1) -> 3.25679876153231 | G545: of:=[.D545]-[.F545] -> 0.000522637115377478
A546: 545 | B546: 823596245 | C546: 3.26 | D546: of:=LN([.B546])/LN([.A546]+1) -> 3.25724767003373 | E546: of:=(1+SQRT(5))/2 -> 1.6180339887499 | F546: of:=3+[.E546]/LN([.A546]+1) -> 3.25672406899049 | G546: of:=[.D546]-[.F546] -> 0.000523601043239008
A547: 546 | B547: 828138881 | C547: 3.26 | D547: of:=LN([.B547])/LN([.A547]+1) -> 3.25717474635877 | E547: of:=(1+SQRT(5))/2 -> 1.6180339887499 | F547: of:=3+[.E547]/LN([.A547]+1) -> 3.25664955644152 | G547: of:=[.D547]-[.F547] -> 0.00052518991724293
A548: 547 | B548: 832695701 | C548: 3.26 | D548: of:=LN([.B548])/LN([.A548]+1) -> 3.25710152092166 | E548: of:=(1+SQRT(5))/2 -> 1.6180339887499 | F548: of:=3+[.E548]/LN([.A548]+1) -> 3.25657522311129 | G548: of:=[.D548]-[.F548] -> 0.000526297810369947
A549: 548 | B549: 837267015 | C549: 3.26 | D549: of:=LN([.B549])/LN([.A549]+1) -> 3.25702805408342 | E549: of:=(1+SQRT(5))/2 -> 1.6180339887499 | F549: of:=3+[.E549]/LN([.A549]+1) -> 3.25650106823043 | G549: of:=[.D549]-[.F549] -> 0.00052698585298705
A550: 549 | B550: 841859923 | C550: 3.26 | D550: of:=LN([.B550])/LN([.A550]+1) -> 3.25695568309488 | E550: of:=(1+SQRT(5))/2 -> 1.6180339887499 | F550: of:=3+[.E550]/LN([.A550]+1) -> 3.25642709103432 | G550: of:=[.D550]-[.F550] -> 0.00052859206055933
A551: 550 | B551: 846464879 | C551: 3.26 | D551: of:=LN([.B551])/LN([.A551]+1) -> 3.25688259893357 | E551: of:=(1+SQRT(5))/2 -> 1.6180339887499 | F551: of:=3+[.E551]/LN([.A551]+1) -> 3.25635329076303 | G551: of:=[.D551]-[.F551] -> 0.000529308170543086
A552: 551 | B552: 851089591 | C552: 3.26 | D552: of:=LN([.B552])/LN([.A552]+1) -> 3.25681024482612 | E552: of:=(1+SQRT(5))/2 -> 1.6180339887499 | F552: of:=3+[.E552]/LN([.A552]+1) -> 3.25627966666128 | G552: of:=[.D552]-[.F552] -> 0.000530578164836371
A553: 552 | B553: 855728977 | C553: 3.26 | D553: of:=LN([.B553])/LN([.A553]+1) -> 3.25673766449355 | E553: of:=(1+SQRT(5))/2 -> 1.6180339887499 | F553: of:=3+[.E553]/LN([.A553]+1) -> 3.25620621797844 | G553: of:=[.D553]-[.F553] -> 0.000531446515111611
A554: 553 | B554: 860387211 | C554: 3.26 | D554: of:=LN([.B554])/LN([.A554]+1) -> 3.25666562633555 | E554: of:=(1+SQRT(5))/2 -> 1.6180339887499 | F554: of:=3+[.E554]/LN([.A554]+1) -> 3.25613294396842 | G554: of:=[.D554]-[.F554] -> 0.000532682367131443
A555: 554 | B555: 865060843 | C555: 3.26 | D555: of:=LN([.B555])/LN([.A555]+1) -> 3.25659348658277 | E555: of:=(1+SQRT(5))/2 -> 1.6180339887499 | F555: of:=3+[.E555]/LN([.A555]+1) -> 3.2560598438897 | G555: of:=[.D555]-[.F555] -> 0.000533642693067549
A556: 555 | B556: 869750857 | C556: 3.26 | D556: of:=LN([.B556])/LN([.A556]+1) -> 3.2565214225713 | E556: of:=(1+SQRT(5))/2 -> 1.6180339887499 | F556: of:=3+[.E556]/LN([.A556]+1) -> 3.25598691700527 | G556: of:=[.D556]-[.F556] -> 0.00053450556602197
A557: 556 | B557: 874457245 | C557: 3.26 | D557: of:=LN([.B557])/LN([.A557]+1) -> 3.25644942821812 | E557: of:=(1+SQRT(5))/2 -> 1.6180339887499 | F557: of:=3+[.E557]/LN([.A557]+1) -> 3.25591416258261 | G557: of:=[.D557]-[.F557] -> 0.000535265635517312
A558: 557 | B558: 879185129 | C558: 3.26 | D558: of:=LN([.B558])/LN([.A558]+1) -> 3.2563784201958 | E558: of:=(1+SQRT(5))/2 -> 1.6180339887499 | F558: of:=3+[.E558]/LN([.A558]+1) -> 3.2558415798936 | G558: of:=[.D558]-[.F558] -> 0.000536840302201469
A559: 558 | B559: 883924619 | C559: 3.26 | D559: of:=LN([.B559])/LN([.A559]+1) -> 3.25630660985119 | E559: of:=(1+SQRT(5))/2 -> 1.6180339887499 | F559: of:=3+[.E559]/LN([.A559]+1) -> 3.25576916821457 | G559: of:=[.D559]-[.F559] -> 0.000537441636622837
A560: 559 | B560: 888683863 | C560: 3.26 | D560: of:=LN([.B560])/LN([.A560]+1) -> 3.2562354563247 | E560: of:=(1+SQRT(5))/2 -> 1.6180339887499 | F560: of:=3+[.E560]/LN([.A560]+1) -> 3.25569692682618 | G560: of:=[.D560]-[.F560] -> 0.000538529498517626
A561: 560 | B561: 893458211 | C561: 3.26 | D561: of:=LN([.B561])/LN([.A561]+1) -> 3.25616412304713 | E561: of:=(1+SQRT(5))/2 -> 1.6180339887499 | F561: of:=3+[.E561]/LN([.A561]+1) -> 3.25562485501346 | G561: of:=[.D561]-[.F561] -> 0.000539268033674212
A562: 561 | B562: 898249375 | C562: 3.26 | D562: of:=LN([.B562])/LN([.A562]+1) -> 3.25609291080069 | E562: of:=(1+SQRT(5))/2 -> 1.6180339887499 | F562: of:=3+[.E562]/LN([.A562]+1) -> 3.25555295206572 | G562: of:=[.D562]-[.F562] -> 0.000539958734966373
A563: 562 | B563: 903060553 | C563: 3.26 | D563: of:=LN([.B563])/LN([.A563]+1) -> 3.25602237347856 | E563: of:=(1+SQRT(5))/2 -> 1.6180339887499 | F563: of:=3+[.E563]/LN([.A563]+1) -> 3.25548121727655 | G563: of:=[.D563]-[.F563] -> 0.000541156202014559
A564: 563 | B564: 907891647 | C564: 3.26 | D564: of:=LN([.B564])/LN([.A564]+1) -> 3.25595247950238 | E564: of:=(1+SQRT(5))/2 -> 1.6180339887499 | F564: of:=3+[.E564]/LN([.A564]+1) -> 3.25540964994377 | G564: of:=[.D564]-[.F564] -> 0.00054282955861229
A565: 564 | B565: 912733245 | C565: 3.26 | D565: of:=LN([.B565])/LN([.A565]+1) -> 3.2558815875759 | E565: of:=(1+SQRT(5))/2 -> 1.6180339887499 | F565: of:=3+[.E565]/LN([.A565]+1) -> 3.2553382493694 | G565: of:=[.D565]-[.F565] -> 0.00054333820650454
A566: 565 | B566: 917596533 | C566: 3.26 | D566: of:=LN([.B566])/LN([.A566]+1) -> 3.2558116343818 | E566: of:=(1+SQRT(5))/2 -> 1.6180339887499 | F566: of:=3+[.E566]/LN([.A566]+1) -> 3.25526701485964 | G566: of:=[.D566]-[.F566] -> 0.000544619522165224
A567: 566 | B567: 922476363 | C567: 3.26 | D567: of:=LN([.B567])/LN([.A567]+1) -> 3.25574172092264 | E567: of:=(1+SQRT(5))/2 -> 1.6180339887499 | F567: of:=3+[.E567]/LN([.A567]+1) -> 3.25519594572481 | G567: of:=[.D567]-[.F567] -> 0.000545775197830167
A568: 567 | B568: 927371309 | C568: 3.26 | D568: of:=LN([.B568])/LN([.A568]+1) -> 3.2556716009039 | E568: of:=(1+SQRT(5))/2 -> 1.6180339887499 | F568: of:=3+[.E568]/LN([.A568]+1) -> 3.25512504127935 | G568: of:=[.D568]-[.F568] -> 0.000546559624550635
A569: 568 | B569: 932283125 | C569: 3.26 | D569: of:=LN([.B569])/LN([.A569]+1) -> 3.25560157117787 | E569: of:=(1+SQRT(5))/2 -> 1.6180339887499 | F569: of:=3+[.E569]/LN([.A569]+1) -> 3.25505430084177 | G569: of:=[.D569]-[.F569] -> 0.000547270336098027
A570: 569 | B570: 937214917 | C570: 3.26 | D570: of:=LN([.B570])/LN([.A570]+1) -> 3.25553214939245 | E570: of:=(1+SQRT(5))/2 -> 1.6180339887499 | F570: of:=3+[.E570]/LN([.A570]+1) -> 3.25498372373462 | G570: of:=[.D570]-[.F570] -> 0.000548425657828755
A571: 570 | B571: 942162653 | C571: 3.26 | D571: of:=LN([.B571])/LN([.A571]+1) -> 3.25546264815914 | E571: of:=(1+SQRT(5))/2 -> 1.6180339887499 | F571: of:=3+[.E571]/LN([.A571]+1) -> 3.25491330928446 | G571: of:=[.D571]-[.F571] -> 0.000549338874680672
A572: 571 | B572: 947130439 | C572: 3.26 | D572: of:=LN([.B572])/LN([.A572]+1) -> 3.25539374849152 | E572: of:=(1+SQRT(5))/2 -> 1.6180339887499 | F572: of:=3+[.E572]/LN([.A572]+1) -> 3.25484305682183 | G572: of:=[.D572]-[.F572] -> 0.000550691669687353
A573: 572 | B573: 952109765 | C573: 3.26 | D573: of:=LN([.B573])/LN([.A573]+1) -> 3.2553240300116 | E573: of:=(1+SQRT(5))/2 -> 1.6180339887499 | F573: of:=3+[.E573]/LN([.A573]+1) -> 3.25477296568122 | G573: of:=[.D573]-[.F573] -> 0.000551064330381657
A574: 573 | B574: 957110531 | C574: 3.26 | D574: of:=LN([.B574])/LN([.A574]+1) -> 3.25525513138171 | E574: of:=(1+SQRT(5))/2 -> 1.6180339887499 | F574: of:=3+[.E574]/LN([.A574]+1) -> 3.25470303520103 | G574: of:=[.D574]-[.F574] -> 0.000552096180681527
A575: 574 | B575: 962126383 | C575: 3.26 | D575: of:=LN([.B575])/LN([.A575]+1) -> 3.25518599679558 | E575: of:=(1+SQRT(5))/2 -> 1.6180339887499 | F575: of:=3+[.E575]/LN([.A575]+1) -> 3.25463326472357 | G575: of:=[.D575]-[.F575] -> 0.00055273207200468
A576: 575 | B576: 967165217 | C576: 3.26 | D576: of:=LN([.B576])/LN([.A576]+1) -> 3.25511791154598 | E576: of:=(1+SQRT(5))/2 -> 1.6180339887499 | F576: of:=3+[.E576]/LN([.A576]+1) -> 3.254563653595 | G576: of:=[.D576]-[.F576] -> 0.000554257950982962
A577: 576 | B577: 972215527 | C577: 3.26 | D577: of:=LN([.B577])/LN([.A577]+1) -> 3.25504899397387 | E577: of:=(1+SQRT(5))/2 -> 1.6180339887499 | F577: of:=3+[.E577]/LN([.A577]+1) -> 3.25449420116529 | G577: of:=[.D577]-[.F577] -> 0.000554792808576288
A578: 577 | B578: 977284917 | C578: 3.25 | D578: of:=LN([.B578])/LN([.A578]+1) -> 3.25498047814556 | E578: of:=(1+SQRT(5))/2 -> 1.6180339887499 | F578: of:=3+[.E578]/LN([.A578]+1) -> 3.25442490678824 | G578: of:=[.D578]-[.F578] -> 0.000555571357320428
A579: 578 | B579: 982374981 | C579: 3.25 | D579: of:=LN([.B579])/LN([.A579]+1) -> 3.25491260961221 | E579: of:=(1+SQRT(5))/2 -> 1.6180339887499 | F579: of:=3+[.E579]/LN([.A579]+1) -> 3.25435576982141 | G579: of:=[.D579]-[.F579] -> 0.000556839790803121
A580: 579 | B580: 987478583 | C580: 3.25 | D580: of:=LN([.B580])/LN([.A580]+1) -> 3.25484423915705 | E580: of:=(1+SQRT(5))/2 -> 1.6180339887499 | F580: of:=3+[.E580]/LN([.A580]+1) -> 3.25428678962609 | G580: of:=[.D580]-[.F580] -> 0.000557449530960152
A581: 580 | B581: 992601585 | C581: 3.25 | D581: of:=LN([.B581])/LN([.A581]+1) -> 3.25477629986239 | E581: of:=(1+SQRT(5))/2 -> 1.6180339887499 | F581: of:=3+[.E581]/LN([.A581]+1) -> 3.25421796556731 | G581: of:=[.D581]-[.F581] -> 0.000558334295075458
A582: 581 | B582: 997745931 | C582: 3.25 | D582: of:=LN([.B582])/LN([.A582]+1) -> 3.25470908784198 | E582: of:=(1+SQRT(5))/2 -> 1.6180339887499 | F582: of:=3+[.E582]/LN([.A582]+1) -> 3.25414929701377 | G582: of:=[.D582]-[.F582] -> 0.000559790828207785
A583: 582 | B583: 1002903847 | C583: 3.25 | D583: of:=LN([.B583])/LN([.A583]+1) -> 3.25464137115054 | E583: of:=(1+SQRT(5))/2 -> 1.6180339887499 | F583: of:=3+[.E583]/LN([.A583]+1) -> 3.25408078333783 | G583: of:=[.D583]-[.F583] -> 0.000560587812701296
A584: 583 | B584: 1008081539 | C584: 3.25 | D584: of:=LN([.B584])/LN([.A584]+1) -> 3.25457412149355 | E584: of:=(1+SQRT(5))/2 -> 1.6180339887499 | F584: of:=3+[.E584]/LN([.A584]+1) -> 3.2540124239155 | G584: of:=[.D584]-[.F584] -> 0.000561697578057352
A585: 584 | B585: 1013274873 | C585: 3.25 | D585: of:=LN([.B585])/LN([.A585]+1) -> 3.25450668811892 | E585: of:=(1+SQRT(5))/2 -> 1.6180339887499 | F585: of:=3+[.E585]/LN([.A585]+1) -> 3.25394421812635 | G585: of:=[.D585]-[.F585] -> 0.000562469992566594
A586: 585 | B586: 1018486777 | C586: 3.25 | D586: of:=LN([.B586])/LN([.A586]+1) -> 3.25443952218591 | E586: of:=(1+SQRT(5))/2 -> 1.6180339887499 | F586: of:=3+[.E586]/LN([.A586]+1) -> 3.25387616535358 | G586: of:=[.D586]-[.F586] -> 0.000563356832325557
A587: 586 | B587: 1023714473 | C587: 3.25 | D587: of:=LN([.B587])/LN([.A587]+1) -> 3.25437219086475 | E587: of:=(1+SQRT(5))/2 -> 1.6180339887499 | F587: of:=3+[.E587]/LN([.A587]+1) -> 3.2538082649839 | G587: of:=[.D587]-[.F587] -> 0.000563925880841865
A588: 587 | B588: 1028965719 | C588: 3.25 | D588: of:=LN([.B588])/LN([.A588]+1) -> 3.25430587634195 | E588: of:=(1+SQRT(5))/2 -> 1.6180339887499 | F588: of:=3+[.E588]/LN([.A588]+1) -> 3.25374051640757 | G588: of:=[.D588]-[.F588] -> 0.00056535993437512
A589: 588 | B589: 1034229153 | C589: 3.25 | D589: of:=LN([.B589])/LN([.A589]+1) -> 3.25423883710829 | E589: of:=(1+SQRT(5))/2 -> 1.6180339887499 | F589: of:=3+[.E589]/LN([.A589]+1) -> 3.25367291901834 | G589: of:=[.D589]-[.F589] -> 0.000565918089951989
A590: 589 | B590: 1039509503 | C590: 3.25 | D590: of:=LN([.B590])/LN([.A590]+1) -> 3.25417179482644 | E590: of:=(1+SQRT(5))/2 -> 1.6180339887499 | F590: of:=3+[.E590]/LN([.A590]+1) -> 3.25360547221341 | G590: of:=[.D590]-[.F590] -> 0.000566322613023473
A591: 590 | B591: 1044815707 | C591: 3.25 | D591: of:=LN([.B591])/LN([.A591]+1) -> 3.25410608723777 | E591: of:=(1+SQRT(5))/2 -> 1.6180339887499 | F591: of:=3+[.E591]/LN([.A591]+1) -> 3.25353817539346 | G591: of:=[.D591]-[.F591] -> 0.000567911844308711
A592: 591 | B592: 1050130701 | C592: 3.25 | D592: of:=LN([.B592])/LN([.A592]+1) -> 3.25403914472308 | E592: of:=(1+SQRT(5))/2 -> 1.6180339887499 | F592: of:=3+[.E592]/LN([.A592]+1) -> 3.25347102796256 | G592: of:=[.D592]-[.F592] -> 0.000568116760517157
A593: 592 | B593: 1055469017 | C593: 3.25 | D593: of:=LN([.B593])/LN([.A593]+1) -> 3.25397314046107 | E593: of:=(1+SQRT(5))/2 -> 1.6180339887499 | F593: of:=3+[.E593]/LN([.A593]+1) -> 3.2534040293282 | G593: of:=[.D593]-[.F593] -> 0.000569111132870503
A594: 593 | B594: 1060825627 | C594: 3.25 | D594: of:=LN([.B594])/LN([.A594]+1) -> 3.25390731468533 | E594: of:=(1+SQRT(5))/2 -> 1.6180339887499 | F594: of:=3+[.E594]/LN([.A594]+1) -> 3.25333717890122 | G594: of:=[.D594]-[.F594] -> 0.000570135784106807
A595: 594 | B595: 1066200281 | C595: 3.25 | D595: of:=LN([.B595])/LN([.A595]+1) -> 3.25384162510532 | E595: of:=(1+SQRT(5))/2 -> 1.6180339887499 | F595: of:=3+[.E595]/LN([.A595]+1) -> 3.25327047609582 | G595: of:=[.D595]-[.F595] -> 0.000571149009501948
A596: 595 | B596: 1071593109 | C596: 3.25 | D596: of:=LN([.B596])/LN([.A596]+1) -> 3.25377608580611 | E596: of:=(1+SQRT(5))/2 -> 1.6180339887499 | F596: of:=3+[.E596]/LN([.A596]+1) -> 3.25320392032949 | G596: of:=[.D596]-[.F596] -> 0.0005721654766222
A597: 596 | B597: 1076999925 | C597: 3.25 | D597: of:=LN([.B597])/LN([.A597]+1) -> 3.25371008361594 | E597: of:=(1+SQRT(5))/2 -> 1.6180339887499 | F597: of:=3+[.E597]/LN([.A597]+1) -> 3.25313751102306 | G597: of:=[.D597]-[.F597] -> 0.000572572592878018
A598: 597 | B598: 1082427849 | C598: 3.25 | D598: of:=LN([.B598])/LN([.A598]+1) -> 3.25364465196206 | E598: of:=(1+SQRT(5))/2 -> 1.6180339887499 | F598: of:=3+[.E598]/LN([.A598]+1) -> 3.25307124760059 | G598: of:=[.D598]-[.F598] -> 0.000573404361471575
A599: 598 | B599: 1087876861 | C599: 3.25 | D599: of:=LN([.B599])/LN([.A599]+1) -> 3.25357977629539 | E599: of:=(1+SQRT(5))/2 -> 1.6180339887499 | F599: of:=3+[.E599]/LN([.A599]+1) -> 3.25300512948942 | G599: of:=[.D599]-[.F599] -> 0.000574646805973966
A600: 599 | B600: 1093337995 | C600: 3.25 | D600: of:=LN([.B600])/LN([.A600]+1) -> 3.25351416322266 | E600: of:=(1+SQRT(5))/2 -> 1.6180339887499 | F600: of:=3+[.E600]/LN([.A600]+1) -> 3.25293915612008 | G600: of:=[.D600]-[.F600] -> 0.000575007102578073
A601: 600 | B601: 1098821457 | C601: 3.25 | D601: of:=LN([.B601])/LN([.A601]+1) -> 3.25344927326197 | E601: of:=(1+SQRT(5))/2 -> 1.6180339887499 | F601: of:=3+[.E601]/LN([.A601]+1) -> 3.25287332692633 | G601: of:=[.D601]-[.F601] -> 0.00057594633563518
A602: 601 | B602: 1104322329 | C602: 3.25 | D602: of:=LN([.B602])/LN([.A602]+1) -> 3.25338439661111 | E602: of:=(1+SQRT(5))/2 -> 1.6180339887499 | F602: of:=3+[.E602]/LN([.A602]+1) -> 3.25280764134509 | G602: of:=[.D602]-[.F602] -> 0.000576755266021856
A603: 602 | B603: 1109844567 | C603: 3.25 | D603: of:=LN([.B603])/LN([.A603]+1) -> 3.25332008720503 | E603: of:=(1+SQRT(5))/2 -> 1.6180339887499 | F603: of:=3+[.E603]/LN([.A603]+1) -> 3.25274209881644 | G603: of:=[.D603]-[.F603] -> 0.000577988388585915
A604: 603 | B604: 1115382869 | C604: 3.25 | D604: of:=LN([.B604])/LN([.A604]+1) -> 3.25325559121414 | E604: of:=(1+SQRT(5))/2 -> 1.6180339887499 | F604: of:=3+[.E604]/LN([.A604]+1) -> 3.25267669878358 | G604: of:=[.D604]-[.F604] -> 0.000578892430557865
A605: 604 | B605: 1120936507 | C605: 3.25 | D605: of:=LN([.B605])/LN([.A605]+1) -> 3.25319080753458 | E605: of:=(1+SQRT(5))/2 -> 1.6180339887499 | F605: of:=3+[.E605]/LN([.A605]+1) -> 3.25261144069283 | G605: of:=[.D605]-[.F605] -> 0.000579366841753526
A606: 605 | B606: 1126513427 | C606: 3.25 | D606: of:=LN([.B606])/LN([.A606]+1) -> 3.25312683900786 | E606: of:=(1+SQRT(5))/2 -> 1.6180339887499 | F606: of:=3+[.E606]/LN([.A606]+1) -> 3.25254632399359 | G606: of:=[.D606]-[.F606] -> 0.000580515014267036
A607: 606 | B607: 1132101809 | C607: 3.25 | D607: of:=LN([.B607])/LN([.A607]+1) -> 3.25306204117339 | E607: of:=(1+SQRT(5))/2 -> 1.6180339887499 | F607: of:=3+[.E607]/LN([.A607]+1) -> 3.25248134813831 | G607: of:=[.D607]-[.F607] -> 0.000580693035075797
A608: 607 | B608: 1137719595 | C608: 3.25 | D608: of:=LN([.B608])/LN([.A608]+1) -> 3.25299888453449 | E608: of:=(1+SQRT(5))/2 -> 1.6180339887499 | F608: of:=3+[.E608]/LN([.A608]+1) -> 3.25241651258251 | G608: of:=[.D608]-[.F608] -> 0.00058237195198485
A609: 608 | B609: 1143346553 | C609: 3.25 | D609: of:=LN([.B609])/LN([.A609]+1) -> 3.25293458125873 | E609: of:=(1+SQRT(5))/2 -> 1.6180339887499 | F609: of:=3+[.E609]/LN([.A609]+1) -> 3.2523518167847 | G609: of:=[.D609]-[.F609] -> 0.000582764474034825
A610: 609 | B610: 1148997109 | C610: 3.25 | D610: of:=LN([.B610])/LN([.A610]+1) -> 3.25287110419478 | E610: of:=(1+SQRT(5))/2 -> 1.6180339887499 | F610: of:=3+[.E610]/LN([.A610]+1) -> 3.25228726020639 | G610: of:=[.D610]-[.F610] -> 0.000583843988391841
A611: 610 | B611: 1154662913 | C611: 3.25 | D611: of:=LN([.B611])/LN([.A611]+1) -> 3.2528073107724 | E611: of:=(1+SQRT(5))/2 -> 1.6180339887499 | F611: of:=3+[.E611]/LN([.A611]+1) -> 3.25222284231209 | G611: of:=[.D611]-[.F611] -> 0.000584468460311349
A612: 611 | B612: 1160347357 | C612: 3.25 | D612: of:=LN([.B612])/LN([.A612]+1) -> 3.25274365892003 | E612: of:=(1+SQRT(5))/2 -> 1.6180339887499 | F612: of:=3+[.E612]/LN([.A612]+1) -> 3.25215856256923 | G612: of:=[.D612]-[.F612] -> 0.000585096350799397
A613: 612 | B613: 1166050035 | C613: 3.25 | D613: of:=LN([.B613])/LN([.A613]+1) -> 3.25268008971083 | E613: of:=(1+SQRT(5))/2 -> 1.6180339887499 | F613: of:=3+[.E613]/LN([.A613]+1) -> 3.2520944204482 | G613: of:=[.D613]-[.F613] -> 0.000585669262628485
A614: 613 | B614: 1171777435 | C614: 3.25 | D614: of:=LN([.B614])/LN([.A614]+1) -> 3.25261746183608 | E614: of:=(1+SQRT(5))/2 -> 1.6180339887499 | F614: of:=3+[.E614]/LN([.A614]+1) -> 3.25203041542229 | G614: of:=[.D614]-[.F614] -> 0.000587046413791814
A615: 614 | B615: 1177516407 | C615: 3.25 | D615: of:=LN([.B615])/LN([.A615]+1) -> 3.25255401928992 | E615: of:=(1+SQRT(5))/2 -> 1.6180339887499 | F615: of:=3+[.E615]/LN([.A615]+1) -> 3.25196654696767 | G615: of:=[.D615]-[.F615] -> 0.000587472322251426
A616: 615 | B616: 1183279563 | C616: 3.25 | D616: of:=LN([.B616])/LN([.A616]+1) -> 3.25249143145543 | E616: of:=(1+SQRT(5))/2 -> 1.6180339887499 | F616: of:=3+[.E616]/LN([.A616]+1) -> 3.2519028145634 | G616: of:=[.D616]-[.F616] -> 0.000588616892034821
A617: 616 | B617: 1189056121 | C617: 3.25 | D617: of:=LN([.B617])/LN([.A617]+1) -> 3.2524282714494 | E617: of:=(1+SQRT(5))/2 -> 1.6180339887499 | F617: of:=3+[.E617]/LN([.A617]+1) -> 3.25183921769138 | G617: of:=[.D617]-[.F617] -> 0.000589053758019098
A618: 617 | B618: 1194852925 | C618: 3.25 | D618: of:=LN([.B618])/LN([.A618]+1) -> 3.25236543686413 | E618: of:=(1+SQRT(5))/2 -> 1.6180339887499 | F618: of:=3+[.E618]/LN([.A618]+1) -> 3.25177575583634 | G618: of:=[.D618]-[.F618] -> 0.00058968102779744
A619: 618 | B619: 1200671739 | C619: 3.25 | D619: of:=LN([.B619])/LN([.A619]+1) -> 3.2523031488701 | E619: of:=(1+SQRT(5))/2 -> 1.6180339887499 | F619: of:=3+[.E619]/LN([.A619]+1) -> 3.25171242848581 | G619: of:=[.D619]-[.F619] -> 0.000590720384284538
A620: 619 | B620: 1206512167 | C620: 3.25 | D620: of:=LN([.B620])/LN([.A620]+1) -> 3.25224134566719 | E620: of:=(1+SQRT(5))/2 -> 1.6180339887499 | F620: of:=3+[.E620]/LN([.A620]+1) -> 3.25164923513014 | G620: of:=[.D620]-[.F620] -> 0.000592110537057433
A621: 620 | B621: 1212360845 | C621: 3.25 | D621: of:=LN([.B621])/LN([.A621]+1) -> 3.25217830348292 | E621: of:=(1+SQRT(5))/2 -> 1.6180339887499 | F621: of:=3+[.E621]/LN([.A621]+1) -> 3.25158617526241 | G621: of:=[.D621]-[.F621] -> 0.000592128220506361
A622: 621 | B622: 1218234689 | C622: 3.25 | D622: of:=LN([.B622])/LN([.A622]+1) -> 3.252116197257 | E622: of:=(1+SQRT(5))/2 -> 1.6180339887499 | F622: of:=3+[.E622]/LN([.A622]+1) -> 3.25152324837848 | G622: of:=[.D622]-[.F622] -> 0.000592948878519017
A623: 622 | B623: 1224128527 | C623: 3.25 | D623: of:=LN([.B623])/LN([.A623]+1) -> 3.25205435381421 | E623: of:=(1+SQRT(5))/2 -> 1.6180339887499 | F623: of:=3+[.E623]/LN([.A623]+1) -> 3.25146045397692 | G623: of:=[.D623]-[.F623] -> 0.000593899837288081
A624: 623 | B624: 1230039173 | C624: 3.25 | D624: of:=LN([.B624])/LN([.A624]+1) -> 3.25199236435703 | E624: of:=(1+SQRT(5))/2 -> 1.6180339887499 | F624: of:=3+[.E624]/LN([.A624]+1) -> 3.25139779155903 | G624: of:=[.D624]-[.F624] -> 0.000594572798005011
A625: 624 | B625: 1235969951 | C625: 3.25 | D625: of:=LN([.B625])/LN([.A625]+1) -> 3.25193064647887 | E625: of:=(1+SQRT(5))/2 -> 1.6180339887499 | F625: of:=3+[.E625]/LN([.A625]+1) -> 3.25133526062879 | G625: of:=[.D625]-[.F625] -> 0.000595385850084451
A626: 625 | B626: 1241919515 | C626: 3.25 | D626: of:=LN([.B626])/LN([.A626]+1) -> 3.25186902542205 | E626: of:=(1+SQRT(5))/2 -> 1.6180339887499 | F626: of:=3+[.E626]/LN([.A626]+1) -> 3.25127286069285 | G626: of:=[.D626]-[.F626] -> 0.000596164729198545
A627: 626 | B627: 1247887667 | C627: 3.25 | D627: of:=LN([.B627])/LN([.A627]+1) -> 3.25180747275193 | E627: of:=(1+SQRT(5))/2 -> 1.6180339887499 | F627: of:=3+[.E627]/LN([.A627]+1) -> 3.25121059126054 | G627: of:=[.D627]-[.F627] -> 0.000596881491390811
A628: 627 | B628: 1253876333 | C628: 3.25 | D628: of:=LN([.B628])/LN([.A628]+1) -> 3.25174622353286 | E628: of:=(1+SQRT(5))/2 -> 1.6180339887499 | F628: of:=3+[.E628]/LN([.A628]+1) -> 3.25114845184379 | G628: of:=[.D628]-[.F628] -> 0.000597771689075266
A629: 628 | B629: 1259883539 | C629: 3.25 | D629: of:=LN([.B629])/LN([.A629]+1) -> 3.25168502775066 | E629: of:=(1+SQRT(5))/2 -> 1.6180339887499 | F629: of:=3+[.E629]/LN([.A629]+1) -> 3.25108644195717 | G629: of:=[.D629]-[.F629] -> 0.000598585793489814
A630: 629 | B630: 1265907363 | C630: 3.25 | D630: of:=LN([.B630])/LN([.A630]+1) -> 3.25162364674473 | E630: of:=(1+SQRT(5))/2 -> 1.6180339887499 | F630: of:=3+[.E630]/LN([.A630]+1) -> 3.25102456111785 | G630: of:=[.D630]-[.F630] -> 0.000599085626883156
A631: 630 | B631: 1271955301 | C631: 3.25 | D631: of:=LN([.B631])/LN([.A631]+1) -> 3.25156299506794 | E631: of:=(1+SQRT(5))/2 -> 1.6180339887499 | F631: of:=3+[.E631]/LN([.A631]+1) -> 3.25096280884558 | G631: of:=[.D631]-[.F631] -> 0.000600186222367682
A632: 631 | B632: 1278018875 | C632: 3.25 | D632: of:=LN([.B632])/LN([.A632]+1) -> 3.25150203087601 | E632: of:=(1+SQRT(5))/2 -> 1.6180339887499 | F632: of:=3+[.E632]/LN([.A632]+1) -> 3.25090118466266 | G632: of:=[.D632]-[.F632] -> 0.000600846213352657
A633: 632 | B633: 1284099787 | C633: 3.25 | D633: of:=LN([.B633])/LN([.A633]+1) -> 3.25144096203063 | E633: of:=(1+SQRT(5))/2 -> 1.6180339887499 | F633: of:=3+[.E633]/LN([.A633]+1) -> 3.25083968809395 | G633: of:=[.D633]-[.F633] -> 0.000601273936676083
A634: 633 | B634: 1290203515 | C634: 3.25 | D634: of:=LN([.B634])/LN([.A634]+1) -> 3.25138044589935 | E634: of:=(1+SQRT(5))/2 -> 1.6180339887499 | F634: of:=3+[.E634]/LN([.A634]+1) -> 3.25077831866684 | G634: of:=[.D634]-[.F634] -> 0.000602127232509186
A635: 634 | B635: 1296326991 | C635: 3.25 | D635: of:=LN([.B635])/LN([.A635]+1) -> 3.2513201052932 | E635: of:=(1+SQRT(5))/2 -> 1.6180339887499 | F635: of:=3+[.E635]/LN([.A635]+1) -> 3.25071707591121 | G635: of:=[.D635]-[.F635] -> 0.000603029381980758
A636: 635 | B636: 1302463327 | C636: 3.25 | D636: of:=LN([.B636])/LN([.A636]+1) -> 3.25125911610714 | E636: of:=(1+SQRT(5))/2 -> 1.6180339887499 | F636: of:=3+[.E636]/LN([.A636]+1) -> 3.25065595935947 | G636: of:=[.D636]-[.F636] -> 0.00060315674766942
A637: 636 | B637: 1308625559 | C637: 3.25 | D637: of:=LN([.B637])/LN([.A637]+1) -> 3.25119902855035 | E637: of:=(1+SQRT(5))/2 -> 1.6180339887499 | F637: of:=3+[.E637]/LN([.A637]+1) -> 3.25059496854647 | G637: of:=[.D637]-[.F637] -> 0.000604060003885909
A638: 637 | B638: 1314811229 | C638: 3.25 | D638: of:=LN([.B638])/LN([.A638]+1) -> 3.25113953760036 | E638: of:=(1+SQRT(5))/2 -> 1.6180339887499 | F638: of:=3+[.E638]/LN([.A638]+1) -> 3.25053410300953 | G638: of:=[.D638]-[.F638] -> 0.000605434590832399
A639: 638 | B639: 1321009295 | C639: 3.25 | D639: of:=LN([.B639])/LN([.A639]+1) -> 3.25107933826579 | E639: of:=(1+SQRT(5))/2 -> 1.6180339887499 | F639: of:=3+[.E639]/LN([.A639]+1) -> 3.25047336228842 | G639: of:=[.D639]-[.F639] -> 0.000605975977369333
A640: 639 | B640: 1327228573 | C640: 3.25 | D640: of:=LN([.B640])/LN([.A640]+1) -> 3.25101946679327 | E640: of:=(1+SQRT(5))/2 -> 1.6180339887499 | F640: of:=3+[.E640]/LN([.A640]+1) -> 3.25041274592533 | G640: of:=[.D640]-[.F640] -> 0.000606720867939892
A641: 640 | B641: 1333465449 | C641: 3.25 | D641: of:=LN([.B641])/LN([.A641]+1) -> 3.25095949682553 | E641: of:=(1+SQRT(5))/2 -> 1.6180339887499 | F641: of:=3+[.E641]/LN([.A641]+1) -> 3.25035225346487 | G641: of:=[.D641]-[.F641] -> 0.00060724336066853
A642: 641 | B642: 1339725701 | C642: 3.25 | D642: of:=LN([.B642])/LN([.A642]+1) -> 3.25090009478457 | E642: of:=(1+SQRT(5))/2 -> 1.6180339887499 | F642: of:=3+[.E642]/LN([.A642]+1) -> 3.25029188445401 | G642: of:=[.D642]-[.F642] -> 0.000608210330560688
A643: 642 | B643: 1345998551 | C643: 3.25 | D643: of:=LN([.B643])/LN([.A643]+1) -> 3.25084001180065 | E643: of:=(1+SQRT(5))/2 -> 1.6180339887499 | F643: of:=3+[.E643]/LN([.A643]+1) -> 3.25023163844213 | G643: of:=[.D643]-[.F643] -> 0.000608373358523373
A644: 643 | B644: 1352300241 | C644: 3.25 | D644: of:=LN([.B644])/LN([.A644]+1) -> 3.25078111273163 | E644: of:=(1+SQRT(5))/2 -> 1.6180339887499 | F644: of:=3+[.E644]/LN([.A644]+1) -> 3.25017151498095 | G644: of:=[.D644]-[.F644] -> 0.000609597750679924
A645: 644 | B645: 1358613913 | C645: 3.25 | D645: of:=LN([.B645])/LN([.A645]+1) -> 3.25072146006773 | E645: of:=(1+SQRT(5))/2 -> 1.6180339887499 | F645: of:=3+[.E645]/LN([.A645]+1) -> 3.25011151362455 | G645: of:=[.D645]-[.F645] -> 0.000609946443180132
A646: 645 | B646: 1364952097 | C646: 3.25 | D646: of:=LN([.B646])/LN([.A646]+1) -> 3.25066248133614 | E646: of:=(1+SQRT(5))/2 -> 1.6180339887499 | F646: of:=3+[.E646]/LN([.A646]+1) -> 3.25005163392932 | G646: of:=[.D646]-[.F646] -> 0.00061084740682027
A647: 646 | B647: 1371305507 | C647: 3.25 | D647: of:=LN([.B647])/LN([.A647]+1) -> 3.25060311833666 | E647: of:=(1+SQRT(5))/2 -> 1.6180339887499 | F647: of:=3+[.E647]/LN([.A647]+1) -> 3.24999187545398 | G647: of:=[.D647]-[.F647] -> 0.000611242882678553
A648: 647 | B648: 1377680663 | C648: 3.25 | D648: of:=LN([.B648])/LN([.A648]+1) -> 3.25054410558117 | E648: of:=(1+SQRT(5))/2 -> 1.6180339887499 | F648: of:=3+[.E648]/LN([.A648]+1) -> 3.24993223775953 | G648: of:=[.D648]-[.F648] -> 0.000611867821640022
A649: 648 | B649: 1384076863 | C649: 3.25 | D649: of:=LN([.B649])/LN([.A649]+1) -> 3.25048535755041 | E649: of:=(1+SQRT(5))/2 -> 1.6180339887499 | F649: of:=3+[.E649]/LN([.A649]+1) -> 3.24987272040925 | G649: of:=[.D649]-[.F649] -> 0.000612637141157446
A650: 649 | B650: 1390493891 | C650: 3.25 | D650: of:=LN([.B650])/LN([.A650]+1) -> 3.25042684431839 | E650: of:=(1+SQRT(5))/2 -> 1.6180339887499 | F650: of:=3+[.E650]/LN([.A650]+1) -> 3.2498133229687 | G650: of:=[.D650]-[.F650] -> 0.000613521349696278
A651: 650 | B651: 1396932321 | C651: 3.25 | D651: of:=LN([.B651])/LN([.A651]+1) -> 3.25036862381105 | E651: of:=(1+SQRT(5))/2 -> 1.6180339887499 | F651: of:=3+[.E651]/LN([.A651]+1) -> 3.24975404500568 | G651: of:=[.D651]-[.F651] -> 0.000614578805367305
A652: 651 | B652: 1403388511 | C652: 3.25 | D652: of:=LN([.B652])/LN([.A652]+1) -> 3.25031028921501 | E652: of:=(1+SQRT(5))/2 -> 1.6180339887499 | F652: of:=3+[.E652]/LN([.A652]+1) -> 3.24969488609023 | G652: of:=[.D652]-[.F652] -> 0.000615403124782254
A653: 652 | B653: 1409858029 | C653: 3.25 | D653: of:=LN([.B653])/LN([.A653]+1) -> 3.2502513550998 | E653: of:=(1+SQRT(5))/2 -> 1.6180339887499 | F653: of:=3+[.E653]/LN([.A653]+1) -> 3.24963584579461 | G653: of:=[.D653]-[.F653] -> 0.000615509305189832
A654: 653 | B654: 1416356909 | C654: 3.25 | D654: of:=LN([.B654])/LN([.A654]+1) -> 3.25019357424336 | E654: of:=(1+SQRT(5))/2 -> 1.6180339887499 | F654: of:=3+[.E654]/LN([.A654]+1) -> 3.24957692369327 | G654: of:=[.D654]-[.F654] -> 0.000616650550096409
A655: 654 | B655: 1422868157 | C655: 3.25 | D655: of:=LN([.B655])/LN([.A655]+1) -> 3.25013508616517 | E655: of:=(1+SQRT(5))/2 -> 1.6180339887499 | F655: of:=3+[.E655]/LN([.A655]+1) -> 3.24951811936287 | G655: of:=[.D655]-[.F655] -> 0.000616966802305718
A656: 655 | B656: 1429404023 | C656: 3.25 | D656: of:=LN([.B656])/LN([.A656]+1) -> 3.25007722027896 | E656: of:=(1+SQRT(5))/2 -> 1.6180339887499 | F656: of:=3+[.E656]/LN([.A656]+1) -> 3.24945943238223 | G656: of:=[.D656]-[.F656] -> 0.00061778789672795
A657: 656 | B657: 1435957825 | C657: 3.25 | D657: of:=LN([.B657])/LN([.A657]+1) -> 3.25001924836176 | E657: of:=(1+SQRT(5))/2 -> 1.6180339887499 | F657: of:=3+[.E657]/LN([.A657]+1) -> 3.24940086233235 | G657: of:=[.D657]-[.F657] -> 0.000618386029410445
A658: 657 | B658: 1442533479 | C658: 3.25 | D658: of:=LN([.B658])/LN([.A658]+1) -> 3.24996158824993 | E658: of:=(1+SQRT(5))/2 -> 1.6180339887499 | F658: of:=3+[.E658]/LN([.A658]+1) -> 3.24934240879636 | G658: of:=[.D658]-[.F658] -> 0.000619179453571483
A659: 658 | B659: 1449128007 | C659: 3.25 | D659: of:=LN([.B659])/LN([.A659]+1) -> 3.24990391685428 | E659: of:=(1+SQRT(5))/2 -> 1.6180339887499 | F659: of:=3+[.E659]/LN([.A659]+1) -> 3.24928407135953 | G659: of:=[.D659]-[.F659] -> 0.000619845494754134
A660: 659 | B660: 1455740659 | C660: 3.25 | D660: of:=LN([.B660])/LN([.A660]+1) -> 3.24984615297575 | E660: of:=(1+SQRT(5))/2 -> 1.6180339887499 | F660: of:=3+[.E660]/LN([.A660]+1) -> 3.24922584960923 | G660: of:=[.D660]-[.F660] -> 0.000620303366513753
A661: 660 | B661: 1462374117 | C661: 3.25 | D661: of:=LN([.B661])/LN([.A661]+1) -> 3.24978857837358 | E661: of:=(1+SQRT(5))/2 -> 1.6180339887499 | F661: of:=3+[.E661]/LN([.A661]+1) -> 3.24916774313497 | G661: of:=[.D661]-[.F661] -> 0.000620835238605899
A662: 661 | B662: 1469029123 | C662: 3.25 | D662: of:=LN([.B662])/LN([.A662]+1) -> 3.24973126613723 | E662: of:=(1+SQRT(5))/2 -> 1.6180339887499 | F662: of:=3+[.E662]/LN([.A662]+1) -> 3.24910975152832 | G662: of:=[.D662]-[.F662] -> 0.000621514608911244
A663: 662 | B663: 1475706605 | C663: 3.25 | D663: of:=LN([.B663])/LN([.A663]+1) -> 3.24967430735378 | E663: of:=(1+SQRT(5))/2 -> 1.6180339887499 | F663: of:=3+[.E663]/LN([.A663]+1) -> 3.24905187438292 | G663: of:=[.D663]-[.F663] -> 0.000622432970860398
A664: 663 | B664: 1482400701 | C664: 3.25 | D664: of:=LN([.B664])/LN([.A664]+1) -> 3.24961708649701 | E664: of:=(1+SQRT(5))/2 -> 1.6180339887499 | F664: of:=3+[.E664]/LN([.A664]+1) -> 3.24899411129451 | G664: of:=[.D664]-[.F664] -> 0.00062297520249377
A665: 664 | B665: 1489117627 | C665: 3.25 | D665: of:=LN([.B665])/LN([.A665]+1) -> 3.24956024754783 | E665: of:=(1+SQRT(5))/2 -> 1.6180339887499 | F665: of:=3+[.E665]/LN([.A665]+1) -> 3.24893646186085 | G665: of:=[.D665]-[.F665] -> 0.000623785686973744
A666: 665 | B666: 1495854805 | C666: 3.25 | D666: of:=LN([.B666])/LN([.A666]+1) -> 3.24950351805371 | E666: of:=(1+SQRT(5))/2 -> 1.6180339887499 | F666: of:=3+[.E666]/LN([.A666]+1) -> 3.24887892568174 | G666: of:=[.D666]-[.F666] -> 0.000624592371966326
A667: 666 | B667: 1502606129 | C667: 3.25 | D667: of:=LN([.B667])/LN([.A667]+1) -> 3.24944626961974 | E667: of:=(1+SQRT(5))/2 -> 1.6180339887499 | F667: of:=3+[.E667]/LN([.A667]+1) -> 3.248821502359 | G667: of:=[.D667]-[.F667] -> 0.000624767260732462
A668: 667 | B668: 1509386759 | C668: 3.25 | D668: of:=LN([.B668])/LN([.A668]+1) -> 3.24939005184402 | E668: of:=(1+SQRT(5))/2 -> 1.6180339887499 | F668: of:=3+[.E668]/LN([.A668]+1) -> 3.24876419149647 | G668: of:=[.D668]-[.F668] -> 0.000625860347550411
A669: 668 | B669: 1516181175 | C669: 3.25 | D669: of:=LN([.B669])/LN([.A669]+1) -> 3.24933327485581 | E669: of:=(1+SQRT(5))/2 -> 1.6180339887499 | F669: of:=3+[.E669]/LN([.A669]+1) -> 3.24870699269997 | G669: of:=[.D669]-[.F669] -> 0.00062628215584315
A670: 669 | B670: 1522995691 | C670: 3.25 | D670: of:=LN([.B670])/LN([.A670]+1) -> 3.24927658171539 | E670: of:=(1+SQRT(5))/2 -> 1.6180339887499 | F670: of:=3+[.E670]/LN([.A670]+1) -> 3.24864990557731 | G670: of:=[.D670]-[.F670] -> 0.000626676138077542
A671: 670 | B671: 1529835919 | C671: 3.25 | D671: of:=LN([.B671])/LN([.A671]+1) -> 3.24922053295562 | E671: of:=(1+SQRT(5))/2 -> 1.6180339887499 | F671: of:=3+[.E671]/LN([.A671]+1) -> 3.24859292973828 | G671: of:=[.D671]-[.F671] -> 0.000627603217336681
A672: 671 | B672: 1536689349 | C672: 3.25 | D672: of:=LN([.B672])/LN([.A672]+1) -> 3.24916386716163 | E672: of:=(1+SQRT(5))/2 -> 1.6180339887499 | F672: of:=3+[.E672]/LN([.A672]+1) -> 3.24853606479461 | G672: of:=[.D672]-[.F672] -> 0.000627802367021424
A673: 672 | B673: 1543568395 | C673: 3.25 | D673: of:=LN([.B673])/LN([.A673]+1) -> 3.24910782616686 | E673: of:=(1+SQRT(5))/2 -> 1.6180339887499 | F673: of:=3+[.E673]/LN([.A673]+1) -> 3.24847931035997 | G673: of:=[.D673]-[.F673] -> 0.000628515806885499
A674: 673 | B674: 1550471629 | C674: 3.25 | D674: of:=LN([.B674])/LN([.A674]+1) -> 3.24905225794408 | E674: of:=(1+SQRT(5))/2 -> 1.6180339887499 | F674: of:=3+[.E674]/LN([.A674]+1) -> 3.24842266604999 | G674: of:=[.D674]-[.F674] -> 0.000629591894087067
A675: 674 | B675: 1557391007 | C675: 3.25 | D675: of:=LN([.B675])/LN([.A675]+1) -> 3.24899636117155 | E675: of:=(1+SQRT(5))/2 -> 1.6180339887499 | F675: of:=3+[.E675]/LN([.A675]+1) -> 3.24836613148218 | G675: of:=[.D675]-[.F675] -> 0.000630229689364548
A676: 675 | B676: 1564330663 | C676: 3.25 | D676: of:=LN([.B676])/LN([.A676]+1) -> 3.24894054412133 | E676: of:=(1+SQRT(5))/2 -> 1.6180339887499 | F676: of:=3+[.E676]/LN([.A676]+1) -> 3.24830970627599 | G676: of:=[.D676]-[.F676] -> 0.000630837845337684
A677: 676 | B677: 1571288557 | C677: 3.25 | D677: of:=LN([.B677])/LN([.A677]+1) -> 3.24888460463384 | E677: of:=(1+SQRT(5))/2 -> 1.6180339887499 | F677: of:=3+[.E677]/LN([.A677]+1) -> 3.24825339005275 | G677: of:=[.D677]-[.F677] -> 0.000631214581086503
A678: 677 | B678: 1578270607 | C678: 3.25 | D678: of:=LN([.B678])/LN([.A678]+1) -> 3.24882911775489 | E678: of:=(1+SQRT(5))/2 -> 1.6180339887499 | F678: of:=3+[.E678]/LN([.A678]+1) -> 3.24819718243566 | G678: of:=[.D678]-[.F678] -> 0.000631935319223675
A679: 678 | B679: 1585271999 | C679: 3.25 | D679: of:=LN([.B679])/LN([.A679]+1) -> 3.2487736096524 | E679: of:=(1+SQRT(5))/2 -> 1.6180339887499 | F679: of:=3+[.E679]/LN([.A679]+1) -> 3.24814108304981 | G679: of:=[.D679]-[.F679] -> 0.000632526602585504
A680: 679 | B680: 1592294957 | C680: 3.25 | D680: of:=LN([.B680])/LN([.A680]+1) -> 3.24871829294572 | E680: of:=(1+SQRT(5))/2 -> 1.6180339887499 | F680: of:=3+[.E680]/LN([.A680]+1) -> 3.24808509152213 | G680: of:=[.D680]-[.F680] -> 0.000633201423582364
A681: 680 | B681: 1599338113 | C681: 3.25 | D681: of:=LN([.B681])/LN([.A681]+1) -> 3.24866303204471 | E681: of:=(1+SQRT(5))/2 -> 1.6180339887499 | F681: of:=3+[.E681]/LN([.A681]+1) -> 3.24802920748141 | G681: of:=[.D681]-[.F681] -> 0.000633824563291086
A682: 681 | B682: 1606402579 | C682: 3.25 | D682: of:=LN([.B682])/LN([.A682]+1) -> 3.24860793045335 | E682: of:=(1+SQRT(5))/2 -> 1.6180339887499 | F682: of:=3+[.E682]/LN([.A682]+1) -> 3.24797343055827 | G682: of:=[.D682]-[.F682] -> 0.000634499895081131
A683: 682 | B683: 1613483769 | C683: 3.25 | D683: of:=LN([.B683])/LN([.A683]+1) -> 3.248552548665 | E683: of:=(1+SQRT(5))/2 -> 1.6180339887499 | F683: of:=3+[.E683]/LN([.A683]+1) -> 3.24791776038514 | G683: of:=[.D683]-[.F683] -> 0.000634788279863408
A684: 683 | B684: 1620592129 | C684: 3.25 | D684: of:=LN([.B684])/LN([.A684]+1) -> 3.24849787617183 | E684: of:=(1+SQRT(5))/2 -> 1.6180339887499 | F684: of:=3+[.E684]/LN([.A684]+1) -> 3.24786219659626 | G684: of:=[.D684]-[.F684] -> 0.000635679575570425
A685: 684 | B685: 1627712073 | C685: 3.25 | D685: of:=LN([.B685])/LN([.A685]+1) -> 3.24844243491566 | E685: of:=(1+SQRT(5))/2 -> 1.6180339887499 | F685: of:=3+[.E685]/LN([.A685]+1) -> 3.2478067388277 | G685: of:=[.D685]-[.F685] -> 0.000635696087957882
A686: 685 | B686: 1634864125 | C686: 3.25 | D686: of:=LN([.B686])/LN([.A686]+1) -> 3.24838815595048 | E686: of:=(1+SQRT(5))/2 -> 1.6180339887499 | F686: of:=3+[.E686]/LN([.A686]+1) -> 3.24775138671727 | G686: of:=[.D686]-[.F686] -> 0.000636769233212764
A687: 686 | B687: 1642033157 | C687: 3.25 | D687: of:=LN([.B687])/LN([.A687]+1) -> 3.24833361117088 | E687: of:=(1+SQRT(5))/2 -> 1.6180339887499 | F687: of:=3+[.E687]/LN([.A687]+1) -> 3.2476961399046 | G687: of:=[.D687]-[.F687] -> 0.000637471266287548
A688: 687 | B688: 1649223127 | C688: 3.25 | D688: of:=LN([.B688])/LN([.A688]+1) -> 3.2482791697588 | E688: of:=(1+SQRT(5))/2 -> 1.6180339887499 | F688: of:=3+[.E688]/LN([.A688]+1) -> 3.24764099803104 | G688: of:=[.D688]-[.F688] -> 0.000638171727758596
A689: 688 | B689: 1656429865 | C689: 3.25 | D689: of:=LN([.B689])/LN([.A689]+1) -> 3.24822444332583 | E689: of:=(1+SQRT(5))/2 -> 1.6180339887499 | F689: of:=3+[.E689]/LN([.A689]+1) -> 3.24758596073974 | G689: of:=[.D689]-[.F689] -> 0.00063848258609589
A690: 689 | B690: 1663663329 | C690: 3.25 | D690: of:=LN([.B690])/LN([.A690]+1) -> 3.24817034971888 | E690: of:=(1+SQRT(5))/2 -> 1.6180339887499 | F690: of:=3+[.E690]/LN([.A690]+1) -> 3.24753102767555 | G690: of:=[.D690]-[.F690] -> 0.000639322043327617
A691: 690 | B691: 1670912561 | C691: 3.25 | D691: of:=LN([.B691])/LN([.A691]+1) -> 3.24811587550353 | E691: of:=(1+SQRT(5))/2 -> 1.6180339887499 | F691: of:=3+[.E691]/LN([.A691]+1) -> 3.24747619848507 | G691: of:=[.D691]-[.F691] -> 0.000639677018460461
A692: 691 | B692: 1678189777 | C692: 3.25 | D692: of:=LN([.B692])/LN([.A692]+1) -> 3.24806213725035 | E692: of:=(1+SQRT(5))/2 -> 1.6180339887499 | F692: of:=3+[.E692]/LN([.A692]+1) -> 3.24742147281663 | G692: of:=[.D692]-[.F692] -> 0.000640664433713134
A693: 692 | B693: 1685482581 | C693: 3.25 | D693: of:=LN([.B693])/LN([.A693]+1) -> 3.24800799883159 | E693: of:=(1+SQRT(5))/2 -> 1.6180339887499 | F693: of:=3+[.E693]/LN([.A693]+1) -> 3.24736685032025 | G693: of:=[.D693]-[.F693] -> 0.000641148511334677
A694: 693 | B694: 1692796981 | C694: 3.25 | D694: of:=LN([.B694])/LN([.A694]+1) -> 3.24795400644634 | E694: of:=(1+SQRT(5))/2 -> 1.6180339887499 | F694: of:=3+[.E694]/LN([.A694]+1) -> 3.24731233064766 | G694: of:=[.D694]-[.F694] -> 0.00064167579868446
A695: 694 | B695: 1700137519 | C695: 3.25 | D695: of:=LN([.B695])/LN([.A695]+1) -> 3.24790056465559 | E695: of:=(1+SQRT(5))/2 -> 1.6180339887499 | F695: of:=3+[.E695]/LN([.A695]+1) -> 3.24725791345226 | G695: of:=[.D695]-[.F695] -> 0.000642651203326849
A696: 695 | B696: 1707493179 | C696: 3.25 | D696: of:=LN([.B696])/LN([.A696]+1) -> 3.24784667861212 | E696: of:=(1+SQRT(5))/2 -> 1.6180339887499 | F696: of:=3+[.E696]/LN([.A696]+1) -> 3.24720359838915 | G696: of:=[.D696]-[.F696] -> 0.000643080222964887
A697: 696 | B697: 1714863389 | C697: 3.25 | D697: of:=LN([.B697])/LN([.A697]+1) -> 3.24779230168196 | E697: of:=(1+SQRT(5))/2 -> 1.6180339887499 | F697: of:=3+[.E697]/LN([.A697]+1) -> 3.24714938511509 | G697: of:=[.D697]-[.F697] -> 0.000642916566870877
A698: 697 | B698: 1722267025 | C698: 3.25 | D698: of:=LN([.B698])/LN([.A698]+1) -> 3.24773911256905 | E698: of:=(1+SQRT(5))/2 -> 1.6180339887499 | F698: of:=3+[.E698]/LN([.A698]+1) -> 3.24709527328848 | G698: of:=[.D698]-[.F698] -> 0.000643839280570102
A699: 698 | B699: 1729688431 | C699: 3.25 | D699: of:=LN([.B699])/LN([.A699]+1) -> 3.24768571160391 | E699: of:=(1+SQRT(5))/2 -> 1.6180339887499 | F699: of:=3+[.E699]/LN([.A699]+1) -> 3.24704126256938 | G699: of:=[.D699]-[.F699] -> 0.000644449034535199
A700: 699 | B700: 1737132111 | C700: 3.25 | D700: of:=LN([.B700])/LN([.A700]+1) -> 3.24763249574271 | E700: of:=(1+SQRT(5))/2 -> 1.6180339887499 | F700: of:=3+[.E700]/LN([.A700]+1) -> 3.24698735261948 | G700: of:=[.D700]-[.F700] -> 0.000645143123233272
A701: 700 | B701: 1744594781 | C701: 3.25 | D701: of:=LN([.B701])/LN([.A701]+1) -> 3.24757917354795 | E701: of:=(1+SQRT(5))/2 -> 1.6180339887499 | F701: of:=3+[.E701]/LN([.A701]+1) -> 3.2469335431021 | G701: of:=[.D701]-[.F701] -> 0.000645630445854639
A702: 701 | B702: 1752080127 | C702: 3.25 | D702: of:=LN([.B702])/LN([.A702]+1) -> 3.24752606578668 | E702: of:=(1+SQRT(5))/2 -> 1.6180339887499 | F702: of:=3+[.E702]/LN([.A702]+1) -> 3.24687983368217 | G702: of:=[.D702]-[.F702] -> 0.000646232104514422
A703: 702 | B703: 1759585811 | C703: 3.25 | D703: of:=LN([.B703])/LN([.A703]+1) -> 3.24747296523801 | E703: of:=(1+SQRT(5))/2 -> 1.6180339887499 | F703: of:=3+[.E703]/LN([.A703]+1) -> 3.24682622402622 | G703: of:=[.D703]-[.F703] -> 0.000646741211792978
A704: 703 | B704: 1767109753 | C704: 3.25 | D704: of:=LN([.B704])/LN([.A704]+1) -> 3.24741969064389 | E704: of:=(1+SQRT(5))/2 -> 1.6180339887499 | F704: of:=3+[.E704]/LN([.A704]+1) -> 3.24677271380239 | G704: of:=[.D704]-[.F704] -> 0.0006469768415025
A705: 704 | B705: 1774659351 | C705: 3.25 | D705: of:=LN([.B705])/LN([.A705]+1) -> 3.2473668783509 | E705: of:=(1+SQRT(5))/2 -> 1.6180339887499 | F705: of:=3+[.E705]/LN([.A705]+1) -> 3.24671930268039 | G705: of:=[.D705]-[.F705] -> 0.000647575670508438
A706: 705 | B706: 1782232965 | C706: 3.25 | D706: of:=LN([.B706])/LN([.A706]+1) -> 3.24731438027359 | E706: of:=(1+SQRT(5))/2 -> 1.6180339887499 | F706: of:=3+[.E706]/LN([.A706]+1) -> 3.2466659903315 | G706: of:=[.D706]-[.F706] -> 0.000648389942081273
A707: 706 | B707: 1789827827 | C707: 3.25 | D707: of:=LN([.B707])/LN([.A707]+1) -> 3.2472619548758 | E707: of:=(1+SQRT(5))/2 -> 1.6180339887499 | F707: of:=3+[.E707]/LN([.A707]+1) -> 3.24661277642859 | G707: of:=[.D707]-[.F707] -> 0.000649178447207355
A708: 707 | B708: 1797439405 | C708: 3.25 | D708: of:=LN([.B708])/LN([.A708]+1) -> 3.24720921535313 | E708: of:=(1+SQRT(5))/2 -> 1.6180339887499 | F708: of:=3+[.E708]/LN([.A708]+1) -> 3.24655966064606 | G708: of:=[.D708]-[.F708] -> 0.000649554707061295
A709: 708 | B709: 1805072561 | C709: 3.25 | D709: of:=LN([.B709])/LN([.A709]+1) -> 3.2471565746335 | E709: of:=(1+SQRT(5))/2 -> 1.6180339887499 | F709: of:=3+[.E709]/LN([.A709]+1) -> 3.24650664265987 | G709: of:=[.D709]-[.F709] -> 0.000649931973629947
A710: 709 | B710: 1812732275 | C710: 3.25 | D710: of:=LN([.B710])/LN([.A710]+1) -> 3.24710444825987 | E710: of:=(1+SQRT(5))/2 -> 1.6180339887499 | F710: of:=3+[.E710]/LN([.A710]+1) -> 3.24645372214751 | G710: of:=[.D710]-[.F710] -> 0.000650726112354949
A711: 710 | B711: 1820409815 | C711: 3.25 | D711: of:=LN([.B711])/LN([.A711]+1) -> 3.24705209734411 | E711: of:=(1+SQRT(5))/2 -> 1.6180339887499 | F711: of:=3+[.E711]/LN([.A711]+1) -> 3.246400898788 | G711: of:=[.D711]-[.F711] -> 0.000651198556115062
A712: 711 | B712: 1828113237 | C712: 3.25 | D712: of:=LN([.B712])/LN([.A712]+1) -> 3.24700019420409 | E712: of:=(1+SQRT(5))/2 -> 1.6180339887499 | F712: of:=3+[.E712]/LN([.A712]+1) -> 3.24634817226187 | G712: of:=[.D712]-[.F712] -> 0.000652021942217473
A713: 712 | B713: 1835834223 | C713: 3.25 | D713: of:=LN([.B713])/LN([.A713]+1) -> 3.24694804163694 | E713: of:=(1+SQRT(5))/2 -> 1.6180339887499 | F713: of:=3+[.E713]/LN([.A713]+1) -> 3.24629554225117 | G713: of:=[.D713]-[.F713] -> 0.000652499385771499
A714: 713 | B714: 1843581559 | C714: 3.25 | D714: of:=LN([.B714])/LN([.A714]+1) -> 3.24689636664174 | E714: of:=(1+SQRT(5))/2 -> 1.6180339887499 | F714: of:=3+[.E714]/LN([.A714]+1) -> 3.24624300843943 | G714: of:=[.D714]-[.F714] -> 0.000653358202310717
A715: 714 | B715: 1851346133 | C715: 3.25 | D715: of:=LN([.B715])/LN([.A715]+1) -> 3.24684441246615 | E715: of:=(1+SQRT(5))/2 -> 1.6180339887499 | F715: of:=3+[.E715]/LN([.A715]+1) -> 3.2461905705117 | G715: of:=[.D715]-[.F715] -> 0.000653841954454837
A716: 715 | B716: 1859127709 | C716: 3.25 | D716: of:=LN([.B716])/LN([.A716]+1) -> 3.24679216191335 | E716: of:=(1+SQRT(5))/2 -> 1.6180339887499 | F716: of:=3+[.E716]/LN([.A716]+1) -> 3.24613822815447 | G716: of:=[.D716]-[.F716] -> 0.000653933758877123
A717: 716 | B717: 1866936709 | C717: 3.25 | D717: of:=LN([.B717])/LN([.A717]+1) -> 3.24674046636476 | E717: of:=(1+SQRT(5))/2 -> 1.6180339887499 | F717: of:=3+[.E717]/LN([.A717]+1) -> 3.24608598105575 | G717: of:=[.D717]-[.F717] -> 0.000654485309012021
A718: 717 | B718: 1874766199 | C718: 3.25 | D718: of:=LN([.B718])/LN([.A718]+1) -> 3.24668875458924 | E718: of:=(1+SQRT(5))/2 -> 1.6180339887499 | F718: of:=3+[.E718]/LN([.A718]+1) -> 3.24603382890496 | G718: of:=[.D718]-[.F718] -> 0.000654925684274943
A719: 718 | B719: 1882619517 | C719: 3.25 | D719: of:=LN([.B719])/LN([.A719]+1) -> 3.24663729481039 | E719: of:=(1+SQRT(5))/2 -> 1.6180339887499 | F719: of:=3+[.E719]/LN([.A719]+1) -> 3.24598177139302 | G719: of:=[.D719]-[.F719] -> 0.000655523417369519
A720: 719 | B720: 1890492827 | C720: 3.25 | D720: of:=LN([.B720])/LN([.A720]+1) -> 3.24658577378257 | E720: of:=(1+SQRT(5))/2 -> 1.6180339887499 | F720: of:=3+[.E720]/LN([.A720]+1) -> 3.24592980821226 | G720: of:=[.D720]-[.F720] -> 0.000655965570315331
A721: 720 | B721: 1898387849 | C721: 3.25 | D721: of:=LN([.B721])/LN([.A721]+1) -> 3.24653432846139 | E721: of:=(1+SQRT(5))/2 -> 1.6180339887499 | F721: of:=3+[.E721]/LN([.A721]+1) -> 3.24587793905646 | G721: of:=[.D721]-[.F721] -> 0.000656389404936064
A722: 721 | B722: 1906307011 | C722: 3.25 | D722: of:=LN([.B722])/LN([.A722]+1) -> 3.24648314984665 | E722: of:=(1+SQRT(5))/2 -> 1.6180339887499 | F722: of:=3+[.E722]/LN([.A722]+1) -> 3.24582616362083 | G722: of:=[.D722]-[.F722] -> 0.000656986225818557
A723: 722 | B723: 1914245901 | C723: 3.25 | D723: of:=LN([.B723])/LN([.A723]+1) -> 3.24643188284722 | E723: of:=(1+SQRT(5))/2 -> 1.6180339887499 | F723: of:=3+[.E723]/LN([.A723]+1) -> 3.245774481602 | G723: of:=[.D723]-[.F723] -> 0.000657401245216516
A724: 723 | B724: 1922214565 | C724: 3.25 | D724: of:=LN([.B724])/LN([.A724]+1) -> 3.24638132079611 | E724: of:=(1+SQRT(5))/2 -> 1.6180339887499 | F724: of:=3+[.E724]/LN([.A724]+1) -> 3.245722892698 | G724: of:=[.D724]-[.F724] -> 0.000658428098109454
A725: 724 | B725: 1930193141 | C725: 3.25 | D725: of:=LN([.B725])/LN([.A725]+1) -> 3.24632989062065 | E725: of:=(1+SQRT(5))/2 -> 1.6180339887499 | F725: of:=3+[.E725]/LN([.A725]+1) -> 3.24567139660826 | G725: of:=[.D725]-[.F725] -> 0.000658494012391486
A726: 725 | B726: 1938205849 | C726: 3.25 | D726: of:=LN([.B726])/LN([.A726]+1) -> 3.2462794990373 | E726: of:=(1+SQRT(5))/2 -> 1.6180339887499 | F726: of:=3+[.E726]/LN([.A726]+1) -> 3.24561999303362 | G726: of:=[.D726]-[.F726] -> 0.000659506003679145
A727: 726 | B727: 1946228687 | C727: 3.25 | D727: of:=LN([.B727])/LN([.A727]+1) -> 3.24622825936532 | E727: of:=(1+SQRT(5))/2 -> 1.6180339887499 | F727: of:=3+[.E727]/LN([.A727]+1) -> 3.24556868167629 | G727: of:=[.D727]-[.F727] -> 0.000659577689030577
A728: 727 | B728: 1954280057 | C728: 3.25 | D728: of:=LN([.B728])/LN([.A728]+1) -> 3.24617760991742 | E728: of:=(1+SQRT(5))/2 -> 1.6180339887499 | F728: of:=3+[.E728]/LN([.A728]+1) -> 3.24551746223985 | G728: of:=[.D728]-[.F728] -> 0.000660147677564282
A729: 728 | B729: 1962358111 | C729: 3.25 | D729: of:=LN([.B729])/LN([.A729]+1) -> 3.24612739871749 | E729: of:=(1+SQRT(5))/2 -> 1.6180339887499 | F729: of:=3+[.E729]/LN([.A729]+1) -> 3.24546633442927 | G729: of:=[.D729]-[.F729] -> 0.000661064288215663
A730: 729 | B730: 1970451783 | C730: 3.25 | D730: of:=LN([.B730])/LN([.A730]+1) -> 3.24607676681797 | E730: of:=(1+SQRT(5))/2 -> 1.6180339887499 | F730: of:=3+[.E730]/LN([.A730]+1) -> 3.24541529795087 | G730: of:=[.D730]-[.F730] -> 0.000661468867100723
A731: 730 | B731: 1978568151 | C731: 3.25 | D731: of:=LN([.B731])/LN([.A731]+1) -> 3.24602626065867 | E731: of:=(1+SQRT(5))/2 -> 1.6180339887499 | F731: of:=3+[.E731]/LN([.A731]+1) -> 3.2453643525123 | G731: of:=[.D731]-[.F731] -> 0.000661908146371015
A732: 731 | B732: 1986707541 | C732: 3.25 | D732: of:=LN([.B732])/LN([.A732]+1) -> 3.24597590204142 | E732: of:=(1+SQRT(5))/2 -> 1.6180339887499 | F732: of:=3+[.E732]/LN([.A732]+1) -> 3.24531349782258 | G732: of:=[.D732]-[.F732] -> 0.000662404218832346
A733: 732 | B733: 1994869137 | C733: 3.25 | D733: of:=LN([.B733])/LN([.A733]+1) -> 3.24592562561171 | E733: of:=(1+SQRT(5))/2 -> 1.6180339887499 | F733: of:=3+[.E733]/LN([.A733]+1) -> 3.24526273359207 | G733: of:=[.D733]-[.F733] -> 0.000662892019640537
A734: 733 | B734: 2003056699 | C734: 3.25 | D734: of:=LN([.B734])/LN([.A734]+1) -> 3.2458757133452 | E734: of:=(1+SQRT(5))/2 -> 1.6180339887499 | F734: of:=3+[.E734]/LN([.A734]+1) -> 3.24521205953243 | G734: of:=[.D734]-[.F734] -> 0.000663653812773113
A735: 734 | B735: 2011255973 | C735: 3.25 | D735: of:=LN([.B735])/LN([.A735]+1) -> 3.24582508529771 | E735: of:=(1+SQRT(5))/2 -> 1.6180339887499 | F735: of:=3+[.E735]/LN([.A735]+1) -> 3.24516147535666 | G735: of:=[.D735]-[.F735] -> 0.000663609941055299
A736: 735 | B736: 2019494667 | C736: 3.25 | D736: of:=LN([.B736])/LN([.A736]+1) -> 3.24577582766307 | E736: of:=(1+SQRT(5))/2 -> 1.6180339887499 | F736: of:=3+[.E736]/LN([.A736]+1) -> 3.24511098077906 | G736: of:=[.D736]-[.F736] -> 0.000664846884009585
A737: 736 | B737: 2027743453 | C737: 3.25 | D737: of:=LN([.B737])/LN([.A737]+1) -> 3.2457257309 | E737: of:=(1+SQRT(5))/2 -> 1.6180339887499 | F737: of:=3+[.E737]/LN([.A737]+1) -> 3.24506057551524 | G737: of:=[.D737]-[.F737] -> 0.000665155384761196
A738: 737 | B738: 2036012031 | C738: 3.25 | D738: of:=LN([.B738])/LN([.A738]+1) -> 3.24567552572262 | E738: of:=(1+SQRT(5))/2 -> 1.6180339887499 | F738: of:=3+[.E738]/LN([.A738]+1) -> 3.24501025928212 | G738: of:=[.D738]-[.F738] -> 0.000665266440503576
A739: 738 | B739: 2044311093 | C739: 3.25 | D739: of:=LN([.B739])/LN([.A739]+1) -> 3.24562600391691 | E739: of:=(1+SQRT(5))/2 -> 1.6180339887499 | F739: of:=3+[.E739]/LN([.A739]+1) -> 3.24496003179787 | G739: of:=[.D739]-[.F739] -> 0.000665972119040514
A740: 739 | B740: 2052626581 | C740: 3.25 | D740: of:=LN([.B740])/LN([.A740]+1) -> 3.24557611871202 | E740: of:=(1+SQRT(5))/2 -> 1.6180339887499 | F740: of:=3+[.E740]/LN([.A740]+1) -> 3.24490989278199 | G740: of:=[.D740]-[.F740] -> 0.000666225930029185
A741: 740 | B741: 2060971101 | C741: 3.25 | D741: of:=LN([.B741])/LN([.A741]+1) -> 3.24552679895689 | E741: of:=(1+SQRT(5))/2 -> 1.6180339887499 | F741: of:=3+[.E741]/LN([.A741]+1) -> 3.2448598419552 | G741: of:=[.D741]-[.F741] -> 0.000666957001689283
A742: 741 | B742: 2069335897 | C742: 3.25 | D742: of:=LN([.B742])/LN([.A742]+1) -> 3.24547739585994 | E742: of:=(1+SQRT(5))/2 -> 1.6180339887499 | F742: of:=3+[.E742]/LN([.A742]+1) -> 3.24480987903954 | G742: of:=[.D742]-[.F742] -> 0.000667516820402003
A743: 742 | B743: 2077721605 | C743: 3.25 | D743: of:=LN([.B743])/LN([.A743]+1) -> 3.24542795538477 | E743: of:=(1+SQRT(5))/2 -> 1.6180339887499 | F743: of:=3+[.E743]/LN([.A743]+1) -> 3.24476000375827 | G743: of:=[.D743]-[.F743] -> 0.000667951626500685
A744: 743 | B744: 2086130051 | C744: 3.25 | D744: of:=LN([.B744])/LN([.A744]+1) -> 3.24537860899742 | E744: of:=(1+SQRT(5))/2 -> 1.6180339887499 | F744: of:=3+[.E744]/LN([.A744]+1) -> 3.24471021583591 | G744: of:=[.D744]-[.F744] -> 0.000668393161507019
A745: 744 | B745: 2094557569 | C745: 3.25 | D745: of:=LN([.B745])/LN([.A745]+1) -> 3.24532908947314 | E745: of:=(1+SQRT(5))/2 -> 1.6180339887499 | F745: of:=3+[.E745]/LN([.A745]+1) -> 3.24466051499823 | G745: of:=[.D745]-[.F745] -> 0.000668574474912198
A746: 745 | B746: 2103018585 | C746: 3.25 | D746: of:=LN([.B746])/LN([.A746]+1) -> 3.2452804346626 | E746: of:=(1+SQRT(5))/2 -> 1.6180339887499 | F746: of:=3+[.E746]/LN([.A746]+1) -> 3.24461090097223 | G746: of:=[.D746]-[.F746] -> 0.000669533690375701
A747: 746 | B747: 2111491915 | C747: 3.25 | D747: of:=LN([.B747])/LN([.A747]+1) -> 3.2452311158522 | E747: of:=(1+SQRT(5))/2 -> 1.6180339887499 | F747: of:=3+[.E747]/LN([.A747]+1) -> 3.24456137348614 | G747: of:=[.D747]-[.F747] -> 0.000669742366059989
A748: 747 | B748: 2119992515 | C748: 3.25 | D748: of:=LN([.B748])/LN([.A748]+1) -> 3.24518220613745 | E748: of:=(1+SQRT(5))/2 -> 1.6180339887499 | F748: of:=3+[.E748]/LN([.A748]+1) -> 3.24451193226941 | G748: of:=[.D748]-[.F748] -> 0.000670273868034865
A749: 748 | B749: 2128515687 | C749: 3.25 | D749: of:=LN([.B749])/LN([.A749]+1) -> 3.24513336553579 | E749: of:=(1+SQRT(5))/2 -> 1.6180339887499 | F749: of:=3+[.E749]/LN([.A749]+1) -> 3.24446257705272 | G749: of:=[.D749]-[.F749] -> 0.000670788483076112
A750: 749 | B750: 2137062439 | C750: 3.25 | D750: of:=LN([.B750])/LN([.A750]+1) -> 3.24508466307106 | E750: of:=(1+SQRT(5))/2 -> 1.6180339887499 | F750: of:=3+[.E750]/LN([.A750]+1) -> 3.24441330756793 | G750: of:=[.D750]-[.F750] -> 0.000671355503129245
A751: 750 | B751: 2145633991 | C751: 3.25 | D751: of:=LN([.B751])/LN([.A751]+1) -> 3.24503618152895 | E751: of:=(1+SQRT(5))/2 -> 1.6180339887499 | F751: of:=3+[.E751]/LN([.A751]+1) -> 3.24436412354812 | G751: of:=[.D751]-[.F751] -> 0.000672057980827923
A752: 751 | B752: 2154217017 | C752: 3.24 | D752: of:=LN([.B752])/LN([.A752]+1) -> 3.24498698273477 | E752: of:=(1+SQRT(5))/2 -> 1.6180339887499 | F752: of:=3+[.E752]/LN([.A752]+1) -> 3.24431502472756 | G752: of:=[.D752]-[.F752] -> 0.000671958007216311
A753: 752 | B753: 2162832235 | C753: 3.24 | D753: of:=LN([.B753])/LN([.A753]+1) -> 3.24493852044857 | E753: of:=(1+SQRT(5))/2 -> 1.6180339887499 | F753: of:=3+[.E753]/LN([.A753]+1) -> 3.2442660108417 | G753: of:=[.D753]-[.F753] -> 0.000672509606868044
A754: 753 | B754: 2171473883 | C754: 3.24 | D754: of:=LN([.B754])/LN([.A754]+1) -> 3.24489038362578 | E754: of:=(1+SQRT(5))/2 -> 1.6180339887499 | F754: of:=3+[.E754]/LN([.A754]+1) -> 3.24421708162718 | G754: of:=[.D754]-[.F754] -> 0.000673301998601605
A755: 754 | B755: 2180132271 | C755: 3.24 | D755: of:=LN([.B755])/LN([.A755]+1) -> 3.24484189614296 | E755: of:=(1+SQRT(5))/2 -> 1.6180339887499 | F755: of:=3+[.E755]/LN([.A755]+1) -> 3.2441682368218 | G755: of:=[.D755]-[.F755] -> 0.000673659321154485
A756: 755 | B756: 2188818397 | C756: 3.24 | D756: of:=LN([.B756])/LN([.A756]+1) -> 3.24479381913816 | E756: of:=(1+SQRT(5))/2 -> 1.6180339887499 | F756: of:=3+[.E756]/LN([.A756]+1) -> 3.24411947616455 | G756: of:=[.D756]-[.F756] -> 0.00067434297361002
A757: 756 | B757: 2197519919 | C757: 3.24 | D757: of:=LN([.B757])/LN([.A757]+1) -> 3.24474529898784 | E757: of:=(1+SQRT(5))/2 -> 1.6180339887499 | F757: of:=3+[.E757]/LN([.A757]+1) -> 3.24407079939554 | G757: of:=[.D757]-[.F757] -> 0.000674499592298261
A758: 757 | B758: 2206250711 | C758: 3.24 | D758: of:=LN([.B758])/LN([.A758]+1) -> 3.24469728829132 | E758: of:=(1+SQRT(5))/2 -> 1.6180339887499 | F758: of:=3+[.E758]/LN([.A758]+1) -> 3.24402220625607 | G758: of:=[.D758]-[.F758] -> 0.000675082035254349
A759: 758 | B759: 2214995725 | C759: 3.24 | D759: of:=LN([.B759])/LN([.A759]+1) -> 3.24464875503537 | E759: of:=(1+SQRT(5))/2 -> 1.6180339887499 | F759: of:=3+[.E759]/LN([.A759]+1) -> 3.24397369648856 | G759: of:=[.D759]-[.F759] -> 0.000675058546809382
A760: 759 | B760: 2223780487 | C760: 3.24 | D760: of:=LN([.B760])/LN([.A760]+1) -> 3.24460143487057 | E760: of:=(1+SQRT(5))/2 -> 1.6180339887499 | F760: of:=3+[.E760]/LN([.A760]+1) -> 3.24392526983658 | G760: of:=[.D760]-[.F760] -> 0.000676165033985932
A761: 760 | B761: 2232575897 | C761: 3.24 | D761: of:=LN([.B761])/LN([.A761]+1) -> 3.24455334687726 | E761: of:=(1+SQRT(5))/2 -> 1.6180339887499 | F761: of:=3+[.E761]/LN([.A761]+1) -> 3.24387692604484 | G761: of:=[.D761]-[.F761] -> 0.00067642083241326
A762: 761 | B762: 2241398211 | C762: 3.24 | D762: of:=LN([.B762])/LN([.A762]+1) -> 3.24450559219312 | E762: of:=(1+SQRT(5))/2 -> 1.6180339887499 | F762: of:=3+[.E762]/LN([.A762]+1) -> 3.24382866485917 | G762: of:=[.D762]-[.F762] -> 0.000676927333951749
A763: 762 | B763: 2250243637 | C763: 3.24 | D763: of:=LN([.B763])/LN([.A763]+1) -> 3.24445791152168 | E763: of:=(1+SQRT(5))/2 -> 1.6180339887499 | F763: of:=3+[.E763]/LN([.A763]+1) -> 3.24378048602651 | G763: of:=[.D763]-[.F763] -> 0.000677425495166695
A764: 763 | B764: 2259111951 | C764: 3.24 | D764: of:=LN([.B764])/LN([.A764]+1) -> 3.24441028773126 | E764: of:=(1+SQRT(5))/2 -> 1.6180339887499 | F764: of:=3+[.E764]/LN([.A764]+1) -> 3.24373238929493 | G764: of:=[.D764]-[.F764] -> 0.000677898436337809
A765: 764 | B765: 2268004493 | C765: 3.24 | D765: of:=LN([.B765])/LN([.A765]+1) -> 3.24436280782616 | E765: of:=(1+SQRT(5))/2 -> 1.6180339887499 | F765: of:=3+[.E765]/LN([.A765]+1) -> 3.24368437441358 | G765: of:=[.D765]-[.F765] -> 0.000678433412575341
A766: 765 | B766: 2276917453 | C766: 3.24 | D766: of:=LN([.B766])/LN([.A766]+1) -> 3.24431521680232 | E766: of:=(1+SQRT(5))/2 -> 1.6180339887499 | F766: of:=3+[.E766]/LN([.A766]+1) -> 3.24363644113275 | G766: of:=[.D766]-[.F766] -> 0.000678775669562981
A767: 766 | B767: 2285857313 | C767: 3.24 | D767: of:=LN([.B767])/LN([.A767]+1) -> 3.2442679416653 | E767: of:=(1+SQRT(5))/2 -> 1.6180339887499 | F767: of:=3+[.E767]/LN([.A767]+1) -> 3.2435885892038 | G767: of:=[.D767]-[.F767] -> 0.000679352461504745
A768: 767 | B768: 2294819043 | C768: 3.24 | D768: of:=LN([.B768])/LN([.A768]+1) -> 3.24422064735822 | E768: of:=(1+SQRT(5))/2 -> 1.6180339887499 | F768: of:=3+[.E768]/LN([.A768]+1) -> 3.24354081837917 | G768: of:=[.D768]-[.F768] -> 0.000679828979048391
A769: 768 | B769: 2303799859 | C769: 3.24 | D769: of:=LN([.B769])/LN([.A769]+1) -> 3.24417315100462 | E769: of:=(1+SQRT(5))/2 -> 1.6180339887499 | F769: of:=3+[.E769]/LN([.A769]+1) -> 3.2434931284124 | G769: of:=[.D769]-[.F769] -> 0.000680022592220109
A770: 769 | B770: 2312804419 | C770: 3.24 | D770: of:=LN([.B770])/LN([.A770]+1) -> 3.2441257568552 | E770: of:=(1+SQRT(5))/2 -> 1.6180339887499 | F770: of:=3+[.E770]/LN([.A770]+1) -> 3.24344551905809 | G770: of:=[.D770]-[.F770] -> 0.000680237797109573
A771: 770 | B771: 2321841131 | C771: 3.24 | D771: of:=LN([.B771])/LN([.A771]+1) -> 3.24407900716417 | E771: of:=(1+SQRT(5))/2 -> 1.6180339887499 | F771: of:=3+[.E771]/LN([.A771]+1) -> 3.24339799007194 | G771: of:=[.D771]-[.F771] -> 0.000681017092231784
A772: 771 | B772: 2330893691 | C772: 3.24 | D772: of:=LN([.B772])/LN([.A772]+1) -> 3.2440318408129 | E772: of:=(1+SQRT(5))/2 -> 1.6180339887499 | F772: of:=3+[.E772]/LN([.A772]+1) -> 3.24335054121067 | G772: of:=[.D772]-[.F772] -> 0.000681299602233842
A773: 772 | B773: 2339979069 | C773: 3.24 | D773: of:=LN([.B773])/LN([.A773]+1) -> 3.24398535216152 | E773: of:=(1+SQRT(5))/2 -> 1.6180339887499 | F773: of:=3+[.E773]/LN([.A773]+1) -> 3.24330317223209 | G773: of:=[.D773]-[.F773] -> 0.000682179929430316
A774: 773 | B774: 2349075979 | C774: 3.24 | D774: of:=LN([.B774])/LN([.A774]+1) -> 3.24393816941627 | E774: of:=(1+SQRT(5))/2 -> 1.6180339887499 | F774: of:=3+[.E774]/LN([.A774]+1) -> 3.24325588289504 | G774: of:=[.D774]-[.F774] -> 0.000682286521225262
A775: 774 | B775: 2358205049 | C775: 3.24 | D775: of:=LN([.B775])/LN([.A775]+1) -> 3.24389161462144 | E775: of:=(1+SQRT(5))/2 -> 1.6180339887499 | F775: of:=3+[.E775]/LN([.A775]+1) -> 3.24320867295943 | G775: of:=[.D775]-[.F775] -> 0.000682941662010439
A776: 775 | B776: 2367350745 | C776: 3.24 | D776: of:=LN([.B776])/LN([.A776]+1) -> 3.24384469280969 | E776: of:=(1+SQRT(5))/2 -> 1.6180339887499 | F776: of:=3+[.E776]/LN([.A776]+1) -> 3.24316154218619 | G776: of:=[.D776]-[.F776] -> 0.000683150623500328
A777: 776 | B777: 2376526461 | C777: 3.24 | D777: of:=LN([.B777])/LN([.A777]+1) -> 3.24379825404117 | E777: of:=(1+SQRT(5))/2 -> 1.6180339887499 | F777: of:=3+[.E777]/LN([.A777]+1) -> 3.24311449033729 | G777: of:=[.D777]-[.F777] -> 0.000683763703879681
A778: 777 | B778: 2385727299 | C778: 3.24 | D778: of:=LN([.B778])/LN([.A778]+1) -> 3.24375198283133 | E778: of:=(1+SQRT(5))/2 -> 1.6180339887499 | F778: of:=3+[.E778]/LN([.A778]+1) -> 3.24306751717573 | G778: of:=[.D778]-[.F778] -> 0.000684465655599542
A779: 778 | B779: 2394942493 | C779: 3.24 | D779: of:=LN([.B779])/LN([.A779]+1) -> 3.24370520076587 | E779: of:=(1+SQRT(5))/2 -> 1.6180339887499 | F779: of:=3+[.E779]/LN([.A779]+1) -> 3.24302062246553 | G779: of:=[.D779]-[.F779] -> 0.000684578300334415
A780: 779 | B780: 2404185577 | C780: 3.24 | D780: of:=LN([.B780])/LN([.A780]+1) -> 3.2436587581582 | E780: of:=(1+SQRT(5))/2 -> 1.6180339887499 | F780: of:=3+[.E780]/LN([.A780]+1) -> 3.24297380597172 | G780: of:=[.D780]-[.F780] -> 0.000684952186478682
A781: 780 | B781: 2413451115 | C781: 3.24 | D781: of:=LN([.B781])/LN([.A781]+1) -> 3.24361231155286 | E781: of:=(1+SQRT(5))/2 -> 1.6180339887499 | F781: of:=3+[.E781]/LN([.A781]+1) -> 3.24292706746036 | G781: of:=[.D781]-[.F781] -> 0.000685244092500259
A782: 781 | B782: 2422750289 | C782: 3.24 | D782: of:=LN([.B782])/LN([.A782]+1) -> 3.24356655262287 | E782: of:=(1+SQRT(5))/2 -> 1.6180339887499 | F782: of:=3+[.E782]/LN([.A782]+1) -> 3.24288040669849 | G782: of:=[.D782]-[.F782] -> 0.000686145924379655
A783: 782 | B783: 2432059301 | C783: 3.24 | D783: of:=LN([.B783])/LN([.A783]+1) -> 3.24352000334495 | E783: of:=(1+SQRT(5))/2 -> 1.6180339887499 | F783: of:=3+[.E783]/LN([.A783]+1) -> 3.24283382345416 | G783: of:=[.D783]-[.F783] -> 0.000686179890784899
A784: 783 | B784: 2441401623 | C784: 3.24 | D784: of:=LN([.B784])/LN([.A784]+1) -> 3.24347411465536 | E784: of:=(1+SQRT(5))/2 -> 1.6180339887499 | F784: of:=3+[.E784]/LN([.A784]+1) -> 3.24278731749643 | G784: of:=[.D784]-[.F784] -> 0.000686797158932162
A785: 784 | B785: 2450761455 | C785: 3.24 | D785: of:=LN([.B785])/LN([.A785]+1) -> 3.24342791025302 | E785: of:=(1+SQRT(5))/2 -> 1.6180339887499 | F785: of:=3+[.E785]/LN([.A785]+1) -> 3.24274088859533 | G785: of:=[.D785]-[.F785] -> 0.000687021657689968
A786: 785 | B786: 2460150709 | C786: 3.24 | D786: of:=LN([.B786])/LN([.A786]+1) -> 3.24338211901872 | E786: of:=(1+SQRT(5))/2 -> 1.6180339887499 | F786: of:=3+[.E786]/LN([.A786]+1) -> 3.24269453652186 | G786: of:=[.D786]-[.F786] -> 0.000687582496853967
A787: 786 | B787: 2469559653 | C787: 3.24 | D787: of:=LN([.B787])/LN([.A787]+1) -> 3.24333614385322 | E787: of:=(1+SQRT(5))/2 -> 1.6180339887499 | F787: of:=3+[.E787]/LN([.A787]+1) -> 3.24264826104804 | G787: of:=[.D787]-[.F787] -> 0.000687882805180173
A788: 787 | B788: 2478995711 | C788: 3.24 | D788: of:=LN([.B788])/LN([.A788]+1) -> 3.24329043481678 | E788: of:=(1+SQRT(5))/2 -> 1.6180339887499 | F788: of:=3+[.E788]/LN([.A788]+1) -> 3.24260206194682 | G788: of:=[.D788]-[.F788] -> 0.000688372869961373
A789: 788 | B789: 2488453053 | C789: 3.24 | D789: of:=LN([.B789])/LN([.A789]+1) -> 3.24324463636134 | E789: of:=(1+SQRT(5))/2 -> 1.6180339887499 | F789: of:=3+[.E789]/LN([.A789]+1) -> 3.24255593899214 | G789: of:=[.D789]-[.F789] -> 0.000688697369202629
A790: 789 | B790: 2497937341 | C790: 3.24 | D790: of:=LN([.B790])/LN([.A790]+1) -> 3.24319908812634 | E790: of:=(1+SQRT(5))/2 -> 1.6180339887499 | F790: of:=3+[.E790]/LN([.A790]+1) -> 3.24250989195889 | G790: of:=[.D790]-[.F790] -> 0.000689196167458661
A791: 790 | B791: 2507447925 | C791: 3.24 | D791: of:=LN([.B791])/LN([.A791]+1) -> 3.24315374713107 | E791: of:=(1+SQRT(5))/2 -> 1.6180339887499 | F791: of:=3+[.E791]/LN([.A791]+1) -> 3.24246392062292 | G791: of:=[.D791]-[.F791] -> 0.000689826508149416
A792: 791 | B792: 2516977229 | C792: 3.24 | D792: of:=LN([.B792])/LN([.A792]+1) -> 3.2431081587959 | E792: of:=(1+SQRT(5))/2 -> 1.6180339887499 | F792: of:=3+[.E792]/LN([.A792]+1) -> 3.24241802476103 | G792: of:=[.D792]-[.F792] -> 0.00069013403486462
A793: 792 | B793: 2526524261 | C793: 3.24 | D793: of:=LN([.B793])/LN([.A793]+1) -> 3.24306226610364 | E793: of:=(1+SQRT(5))/2 -> 1.6180339887499 | F793: of:=3+[.E793]/LN([.A793]+1) -> 3.24237220415097 | G793: of:=[.D793]-[.F793] -> 0.000690061952670185
A794: 793 | B794: 2536112897 | C794: 3.24 | D794: of:=LN([.B794])/LN([.A794]+1) -> 3.2430174815024 | E794: of:=(1+SQRT(5))/2 -> 1.6180339887499 | F794: of:=3+[.E794]/LN([.A794]+1) -> 3.24232645857143 | G794: of:=[.D794]-[.F794] -> 0.00069102293096357
A795: 794 | B795: 2545714313 | C795: 3.24 | D795: of:=LN([.B795])/LN([.A795]+1) -> 3.2429720952942 | E795: of:=(1+SQRT(5))/2 -> 1.6180339887499 | F795: of:=3+[.E795]/LN([.A795]+1) -> 3.24228078780203 | G795: of:=[.D795]-[.F795] -> 0.000691307492174609
A796: 795 | B796: 2555343981 | C796: 3.24 | D796: of:=LN([.B796])/LN([.A796]+1) -> 3.24292701992871 | E796: of:=(1+SQRT(5))/2 -> 1.6180339887499 | F796: of:=3+[.E796]/LN([.A796]+1) -> 3.24223519162331 | G796: of:=[.D796]-[.F796] -> 0.000691828305405817
A797: 796 | B797: 2564993037 | C797: 3.24 | D797: of:=LN([.B797])/LN([.A797]+1) -> 3.24288173333966 | E797: of:=(1+SQRT(5))/2 -> 1.6180339887499 | F797: of:=3+[.E797]/LN([.A797]+1) -> 3.24218966981675 | G797: of:=[.D797]-[.F797] -> 0.000692063522907294
A798: 797 | B798: 2574670967 | C798: 3.24 | D798: of:=LN([.B798])/LN([.A798]+1) -> 3.24283678827992 | E798: of:=(1+SQRT(5))/2 -> 1.6180339887499 | F798: of:=3+[.E798]/LN([.A798]+1) -> 3.24214422216475 | G798: of:=[.D798]-[.F798] -> 0.000692566115162663
A799: 798 | B799: 2584375829 | C799: 3.24 | D799: of:=LN([.B799])/LN([.A799]+1) -> 3.24279206716783 | E799: of:=(1+SQRT(5))/2 -> 1.6180339887499 | F799: of:=3+[.E799]/LN([.A799]+1) -> 3.24209884845062 | G799: of:=[.D799]-[.F799] -> 0.000693218717205291
A800: 799 | B800: 2594095445 | C800: 3.24 | D800: of:=LN([.B800])/LN([.A800]+1) -> 3.24274686396063 | E800: of:=(1+SQRT(5))/2 -> 1.6180339887499 | F800: of:=3+[.E800]/LN([.A800]+1) -> 3.24205354845858 | G800: of:=[.D800]-[.F800] -> 0.000693315502040548
A801: 800 | B801: 2603846353 | C801: 3.24 | D801: of:=LN([.B801])/LN([.A801]+1) -> 3.24270213319858 | E801: of:=(1+SQRT(5))/2 -> 1.6180339887499 | F801: of:=3+[.E801]/LN([.A801]+1) -> 3.24200832197376 | G801: of:=[.D801]-[.F801] -> 0.00069381122482115
A802: 801 | B802: 2613617151 | C802: 3.24 | D802: of:=LN([.B802])/LN([.A802]+1) -> 3.24265721584576 | E802: of:=(1+SQRT(5))/2 -> 1.6180339887499 | F802: of:=3+[.E802]/LN([.A802]+1) -> 3.24196316878217 | G802: of:=[.D802]-[.F802] -> 0.000694047063591441
A803: 802 | B803: 2623416597 | C803: 3.24 | D803: of:=LN([.B803])/LN([.A803]+1) -> 3.24261261213078 | E803: of:=(1+SQRT(5))/2 -> 1.6180339887499 | F803: of:=3+[.E803]/LN([.A803]+1) -> 3.24191808867073 | G803: of:=[.D803]-[.F803] -> 0.000694523460048391
A804: 803 | B804: 2633242161 | C804: 3.24 | D804: of:=LN([.B804])/LN([.A804]+1) -> 3.24256817365521 | E804: of:=(1+SQRT(5))/2 -> 1.6180339887499 | F804: of:=3+[.E804]/LN([.A804]+1) -> 3.24187308142726 | G804: of:=[.D804]-[.F804] -> 0.000695092227941174
A805: 804 | B805: 2643082961 | C805: 3.24 | D805: of:=LN([.B805])/LN([.A805]+1) -> 3.24252328204608 | E805: of:=(1+SQRT(5))/2 -> 1.6180339887499 | F805: of:=3+[.E805]/LN([.A805]+1) -> 3.24182814684045 | G805: of:=[.D805]-[.F805] -> 0.000695135205623032
A806: 805 | B806: 2652962585 | C806: 3.24 | D806: of:=LN([.B806])/LN([.A806]+1) -> 3.24247927013724 | E806: of:=(1+SQRT(5))/2 -> 1.6180339887499 | F806: of:=3+[.E806]/LN([.A806]+1) -> 3.24178328469988 | G806: of:=[.D806]-[.F806] -> 0.000695985437365376
A807: 806 | B807: 2662856449 | C807: 3.24 | D807: of:=LN([.B807])/LN([.A807]+1) -> 3.24243474724858 | E807: of:=(1+SQRT(5))/2 -> 1.6180339887499 | F807: of:=3+[.E807]/LN([.A807]+1) -> 3.24173849479598 | G807: of:=[.D807]-[.F807] -> 0.000696252452602852
A808: 807 | B808: 2672777609 | C808: 3.24 | D808: of:=LN([.B808])/LN([.A808]+1) -> 3.24239044792869 | E808: of:=(1+SQRT(5))/2 -> 1.6180339887499 | F808: of:=3+[.E808]/LN([.A808]+1) -> 3.24169377692009 | G808: of:=[.D808]-[.F808] -> 0.000696671008604266
A809: 808 | B809: 2682720155 | C809: 3.24 | D809: of:=LN([.B809])/LN([.A809]+1) -> 3.24234603948775 | E809: of:=(1+SQRT(5))/2 -> 1.6180339887499 | F809: of:=3+[.E809]/LN([.A809]+1) -> 3.24164913086439 | G809: of:=[.D809]-[.F809] -> 0.000696908623360137
A810: 809 | B810: 2692689569 | C810: 3.24 | D810: of:=LN([.B810])/LN([.A810]+1) -> 3.24230182612493 | E810: of:=(1+SQRT(5))/2 -> 1.6180339887499 | F810: of:=3+[.E810]/LN([.A810]+1) -> 3.24160455642192 | G810: of:=[.D810]-[.F810] -> 0.000697269703006764
A811: 810 | B811: 2702688009 | C811: 3.24 | D811: of:=LN([.B811])/LN([.A811]+1) -> 3.24225792371242 | E811: of:=(1+SQRT(5))/2 -> 1.6180339887499 | F811: of:=3+[.E811]/LN([.A811]+1) -> 3.2415600533866 | G811: of:=[.D811]-[.F811] -> 0.000697870325820915
A812: 811 | B812: 2712700759 | C812: 3.24 | D812: of:=LN([.B812])/LN([.A812]+1) -> 3.24221351783446 | E812: of:=(1+SQRT(5))/2 -> 1.6180339887499 | F812: of:=3+[.E812]/LN([.A812]+1) -> 3.24151562155318 | G812: of:=[.D812]-[.F812] -> 0.000697896281279142
A813: 812 | B813: 2722752567 | C813: 3.24 | D813: of:=LN([.B813])/LN([.A813]+1) -> 3.24216996974566 | E813: of:=(1+SQRT(5))/2 -> 1.6180339887499 | F813: of:=3+[.E813]/LN([.A813]+1) -> 3.24147126071726 | G813: of:=[.D813]-[.F813] -> 0.000698709028397637
A814: 813 | B814: 2732818085 | C814: 3.24 | D814: of:=LN([.B814])/LN([.A814]+1) -> 3.24212588446738 | E814: of:=(1+SQRT(5))/2 -> 1.6180339887499 | F814: of:=3+[.E814]/LN([.A814]+1) -> 3.2414269706753 | G814: of:=[.D814]-[.F814] -> 0.0006989137920832
A815: 814 | B815: 2742908635 | C815: 3.24 | D815: of:=LN([.B815])/LN([.A815]+1) -> 3.24208188294727 | E815: of:=(1+SQRT(5))/2 -> 1.6180339887499 | F815: of:=3+[.E815]/LN([.A815]+1) -> 3.24138275122457 | G815: of:=[.D815]-[.F815] -> 0.000699131722703861
A816: 815 | B816: 2753027875 | C816: 3.24 | D816: of:=LN([.B816])/LN([.A816]+1) -> 3.2420381613615 | E816: of:=(1+SQRT(5))/2 -> 1.6180339887499 | F816: of:=3+[.E816]/LN([.A816]+1) -> 3.24133860216319 | G816: of:=[.D816]-[.F816] -> 0.000699559198301447
A817: 816 | B817: 2763169221 | C817: 3.24 | D817: of:=LN([.B817])/LN([.A817]+1) -> 3.24199436009933 | E817: of:=(1+SQRT(5))/2 -> 1.6180339887499 | F817: of:=3+[.E817]/LN([.A817]+1) -> 3.24129452329013 | G817: of:=[.D817]-[.F817] -> 0.000699836809203269
A818: 817 | B818: 2773342411 | C818: 3.24 | D818: of:=LN([.B818])/LN([.A818]+1) -> 3.24195100257819 | E818: of:=(1+SQRT(5))/2 -> 1.6180339887499 | F818: of:=3+[.E818]/LN([.A818]+1) -> 3.24125051440514 | G818: of:=[.D818]-[.F818] -> 0.000700488173046576
A819: 818 | B819: 2783535429 | C819: 3.24 | D819: of:=LN([.B819])/LN([.A819]+1) -> 3.24190743912611 | E819: of:=(1+SQRT(5))/2 -> 1.6180339887499 | F819: of:=3+[.E819]/LN([.A819]+1) -> 3.24120657530883 | G819: of:=[.D819]-[.F819] -> 0.000700863817272968
A820: 819 | B820: 2793754221 | C820: 3.24 | D820: of:=LN([.B820])/LN([.A820]+1) -> 3.24186398829541 | E820: of:=(1+SQRT(5))/2 -> 1.6180339887499 | F820: of:=3+[.E820]/LN([.A820]+1) -> 3.24116270580261 | G820: of:=[.D820]-[.F820] -> 0.000701282492802324
A821: 820 | B821: 2803995425 | C821: 3.24 | D821: of:=LN([.B821])/LN([.A821]+1) -> 3.24182046908931 | E821: of:=(1+SQRT(5))/2 -> 1.6180339887499 | F821: of:=3+[.E821]/LN([.A821]+1) -> 3.2411189056887 | G821: of:=[.D821]-[.F821] -> 0.000701563400608229
A822: 821 | B822: 2814268571 | C822: 3.24 | D822: of:=LN([.B822])/LN([.A822]+1) -> 3.24177738580598 | E822: of:=(1+SQRT(5))/2 -> 1.6180339887499 | F822: of:=3+[.E822]/LN([.A822]+1) -> 3.24107517477013 | G822: of:=[.D822]-[.F822] -> 0.00070221103585677
A823: 822 | B823: 2824562355 | C823: 3.24 | D823: of:=LN([.B823])/LN([.A823]+1) -> 3.24173413626097 | E823: of:=(1+SQRT(5))/2 -> 1.6180339887499 | F823: of:=3+[.E823]/LN([.A823]+1) -> 3.24103151285073 | G823: of:=[.D823]-[.F823] -> 0.000702623410240744
A824: 823 | B824: 2834874145 | C824: 3.24 | D824: of:=LN([.B824])/LN([.A824]+1) -> 3.24169058305645 | E824: of:=(1+SQRT(5))/2 -> 1.6180339887499 | F824: of:=3+[.E824]/LN([.A824]+1) -> 3.24098791973514 | G824: of:=[.D824]-[.F824] -> 0.000702663321303643
A825: 824 | B825: 2845219423 | C825: 3.24 | D825: of:=LN([.B825])/LN([.A825]+1) -> 3.24164753894522 | E825: of:=(1+SQRT(5))/2 -> 1.6180339887499 | F825: of:=3+[.E825]/LN([.A825]+1) -> 3.24094439522879 | G825: of:=[.D825]-[.F825] -> 0.000703143716430432
A826: 825 | B826: 2855591063 | C826: 3.24 | D826: of:=LN([.B826])/LN([.A826]+1) -> 3.24160462557339 | E826: of:=(1+SQRT(5))/2 -> 1.6180339887499 | F826: of:=3+[.E826]/LN([.A826]+1) -> 3.2409009391379 | G826: of:=[.D826]-[.F826] -> 0.000703686435495676
A827: 826 | B827: 2865978159 | C827: 3.24 | D827: of:=LN([.B827])/LN([.A827]+1) -> 3.24156127398711 | E827: of:=(1+SQRT(5))/2 -> 1.6180339887499 | F827: of:=3+[.E827]/LN([.A827]+1) -> 3.24085755126946 | G827: of:=[.D827]-[.F827] -> 0.000703722717651178
A828: 827 | B828: 2876402587 | C828: 3.24 | D828: of:=LN([.B828])/LN([.A828]+1) -> 3.24151862009162 | E828: of:=(1+SQRT(5))/2 -> 1.6180339887499 | F828: of:=3+[.E828]/LN([.A828]+1) -> 3.24081423143127 | G828: of:=[.D828]-[.F828] -> 0.000704388660345057
A829: 828 | B829: 2886837309 | C829: 3.24 | D829: of:=LN([.B829])/LN([.A829]+1) -> 3.2414752612579 | E829: of:=(1+SQRT(5))/2 -> 1.6180339887499 | F829: of:=3+[.E829]/LN([.A829]+1) -> 3.2407709794319 | G829: of:=[.D829]-[.F829] -> 0.000704281826001019
A830: 829 | B830: 2897311425 | C830: 3.24 | D830: of:=LN([.B830])/LN([.A830]+1) -> 3.24143269879934 | E830: of:=(1+SQRT(5))/2 -> 1.6180339887499 | F830: of:=3+[.E830]/LN([.A830]+1) -> 3.24072779508067 | G830: of:=[.D830]-[.F830] -> 0.000704903718665495
A831: 830 | B831: 2907806025 | C831: 3.24 | D831: of:=LN([.B831])/LN([.A831]+1) -> 3.24138995533387 | E831: of:=(1+SQRT(5))/2 -> 1.6180339887499 | F831: of:=3+[.E831]/LN([.A831]+1) -> 3.24068467818771 | G831: of:=[.D831]-[.F831] -> 0.000705277146161976
A832: 831 | B832: 2918329439 | C832: 3.24 | D832: of:=LN([.B832])/LN([.A832]+1) -> 3.24134745643899 | E832: of:=(1+SQRT(5))/2 -> 1.6180339887499 | F832: of:=3+[.E832]/LN([.A832]+1) -> 3.24064162856388 | G832: of:=[.D832]-[.F832] -> 0.000705827875101317
A833: 832 | B833: 2928866447 | C833: 3.24 | D833: of:=LN([.B833])/LN([.A833]+1) -> 3.24130442564423 | E833: of:=(1+SQRT(5))/2 -> 1.6180339887499 | F833: of:=3+[.E833]/LN([.A833]+1) -> 3.24059864602083 | G833: of:=[.D833]-[.F833] -> 0.000705779623397351
A834: 833 | B834: 2939444315 | C834: 3.24 | D834: of:=LN([.B834])/LN([.A834]+1) -> 3.24126224705255 | E834: of:=(1+SQRT(5))/2 -> 1.6180339887499 | F834: of:=3+[.E834]/LN([.A834]+1) -> 3.24055573037095 | G834: of:=[.D834]-[.F834] -> 0.000706516681600711
A835: 834 | B835: 2950038849 | C835: 3.24 | D835: of:=LN([.B835])/LN([.A835]+1) -> 3.241219690988 | E835: of:=(1+SQRT(5))/2 -> 1.6180339887499 | F835: of:=3+[.E835]/LN([.A835]+1) -> 3.24051288142739 | G835: of:=[.D835]-[.F835] -> 0.000706809560615085
A836: 835 | B836: 2960663505 | C836: 3.24 | D836: of:=LN([.B836])/LN([.A836]+1) -> 3.24117743619371 | E836: of:=(1+SQRT(5))/2 -> 1.6180339887499 | F836: of:=3+[.E836]/LN([.A836]+1) -> 3.24047009900404 | G836: of:=[.D836]-[.F836] -> 0.000707337189671975
A837: 836 | B837: 2971308345 | C837: 3.24 | D837: of:=LN([.B837])/LN([.A837]+1) -> 3.2411349813155 | E837: of:=(1+SQRT(5))/2 -> 1.6180339887499 | F837: of:=3+[.E837]/LN([.A837]+1) -> 3.24042738291556 | G837: of:=[.D837]-[.F837] -> 0.00070759839994361
A838: 837 | B838: 2981976505 | C838: 3.24 | D838: of:=LN([.B838])/LN([.A838]+1) -> 3.24109248387776 | E838: of:=(1+SQRT(5))/2 -> 1.6180339887499 | F838: of:=3+[.E838]/LN([.A838]+1) -> 3.24038473297732 | G838: of:=[.D838]-[.F838] -> 0.000707750900435844
A839: 838 | B839: 2992673283 | C839: 3.24 | D839: of:=LN([.B839])/LN([.A839]+1) -> 3.24105020636443 | E839: of:=(1+SQRT(5))/2 -> 1.6180339887499 | F839: of:=3+[.E839]/LN([.A839]+1) -> 3.24034214900546 | G839: of:=[.D839]-[.F839] -> 0.00070805735896684
A840: 839 | B840: 3003401765 | C840: 3.24 | D840: of:=LN([.B840])/LN([.A840]+1) -> 3.24100829795007 | E840: of:=(1+SQRT(5))/2 -> 1.6180339887499 | F840: of:=3+[.E840]/LN([.A840]+1) -> 3.24029963081683 | G840: of:=[.D840]-[.F840] -> 0.000708667133237029
A841: 840 | B841: 3014143039 | C841: 3.24 | D841: of:=LN([.B841])/LN([.A841]+1) -> 3.2409658218695 | E841: of:=(1+SQRT(5))/2 -> 1.6180339887499 | F841: of:=3+[.E841]/LN([.A841]+1) -> 3.24025717822904 | G841: of:=[.D841]-[.F841] -> 0.000708643640463968
A842: 841 | B842: 3024919961 | C842: 3.24 | D842: of:=LN([.B842])/LN([.A842]+1) -> 3.240923905286 | E842: of:=(1+SQRT(5))/2 -> 1.6180339887499 | F842: of:=3+[.E842]/LN([.A842]+1) -> 3.24021479106038 | G842: of:=[.D842]-[.F842] -> 0.000709114225618812
A843: 842 | B843: 3035724561 | C843: 3.24 | D843: of:=LN([.B843])/LN([.A843]+1) -> 3.24088215129551 | E843: of:=(1+SQRT(5))/2 -> 1.6180339887499 | F843: of:=3+[.E843]/LN([.A843]+1) -> 3.24017246912991 | G843: of:=[.D843]-[.F843] -> 0.000709682165600523
A844: 843 | B844: 3046548939 | C844: 3.24 | D844: of:=LN([.B844])/LN([.A844]+1) -> 3.24084017229431 | E844: of:=(1+SQRT(5))/2 -> 1.6180339887499 | F844: of:=3+[.E844]/LN([.A844]+1) -> 3.24013021225738 | G844: of:=[.D844]-[.F844] -> 0.000709960036930912
A845: 844 | B845: 3057402399 | C845: 3.24 | D845: of:=LN([.B845])/LN([.A845]+1) -> 3.24079842139439 | E845: of:=(1+SQRT(5))/2 -> 1.6180339887499 | F845: of:=3+[.E845]/LN([.A845]+1) -> 3.24008802026327 | G845: of:=[.D845]-[.F845] -> 0.000710401131125416
A846: 845 | B846: 3068280359 | C846: 3.24 | D846: of:=LN([.B846])/LN([.A846]+1) -> 3.24075667356801 | E846: of:=(1+SQRT(5))/2 -> 1.6180339887499 | F846: of:=3+[.E846]/LN([.A846]+1) -> 3.24004589296876 | G846: of:=[.D846]-[.F846] -> 0.000710780599250782
A847: 846 | B847: 3079182547 | C847: 3.24 | D847: of:=LN([.B847])/LN([.A847]+1) -> 3.24071491474225 | E847: of:=(1+SQRT(5))/2 -> 1.6180339887499 | F847: of:=3+[.E847]/LN([.A847]+1) -> 3.24000383019576 | G847: of:=[.D847]-[.F847] -> 0.000711084546490159
A848: 847 | B848: 3090112425 | C848: 3.24 | D848: of:=LN([.B848])/LN([.A848]+1) -> 3.24067331026142 | E848: of:=(1+SQRT(5))/2 -> 1.6180339887499 | F848: of:=3+[.E848]/LN([.A848]+1) -> 3.23996183176686 | G848: of:=[.D848]-[.F848] -> 0.000711478494558548
A849: 848 | B849: 3101067741 | C849: 3.24 | D849: of:=LN([.B849])/LN([.A849]+1) -> 3.24063174980355 | E849: of:=(1+SQRT(5))/2 -> 1.6180339887499 | F849: of:=3+[.E849]/LN([.A849]+1) -> 3.23991989750536 | G849: of:=[.D849]-[.F849] -> 0.000711852298194593
A850: 849 | B850: 3112043991 | C850: 3.24 | D850: of:=LN([.B850])/LN([.A850]+1) -> 3.24059001739191 | E850: of:=(1+SQRT(5))/2 -> 1.6180339887499 | F850: of:=3+[.E850]/LN([.A850]+1) -> 3.23987802723526 | G850: of:=[.D850]-[.F850] -> 0.000711990156649911
A851: 850 | B851: 3123049691 | C851: 3.24 | D851: of:=LN([.B851])/LN([.A851]+1) -> 3.24054851820134 | E851: of:=(1+SQRT(5))/2 -> 1.6180339887499 | F851: of:=3+[.E851]/LN([.A851]+1) -> 3.23983622078126 | G851: of:=[.D851]-[.F851] -> 0.00071229742008061
A852: 851 | B852: 3134086453 | C852: 3.24 | D852: of:=LN([.B852])/LN([.A852]+1) -> 3.24050732496321 | E852: of:=(1+SQRT(5))/2 -> 1.6180339887499 | F852: of:=3+[.E852]/LN([.A852]+1) -> 3.23979447796873 | G852: of:=[.D852]-[.F852] -> 0.000712846994480376
A853: 852 | B853: 3145142979 | C853: 3.24 | D853: of:=LN([.B853])/LN([.A853]+1) -> 3.24046590110248 | E853: of:=(1+SQRT(5))/2 -> 1.6180339887499 | F853: of:=3+[.E853]/LN([.A853]+1) -> 3.23975279862375 | G853: of:=[.D853]-[.F853] -> 0.000713102478726579
A854: 853 | B854: 3156231465 | C854: 3.24 | D854: of:=LN([.B854])/LN([.A854]+1) -> 3.24042482071864 | E854: of:=(1+SQRT(5))/2 -> 1.6180339887499 | F854: of:=3+[.E854]/LN([.A854]+1) -> 3.23971118257307 | G854: of:=[.D854]-[.F854] -> 0.00071363814556813
A855: 854 | B855: 3167343069 | C855: 3.24 | D855: of:=LN([.B855])/LN([.A855]+1) -> 3.2403836656091 | E855: of:=(1+SQRT(5))/2 -> 1.6180339887499 | F855: of:=3+[.E855]/LN([.A855]+1) -> 3.23966962964411 | G855: of:=[.D855]-[.F855] -> 0.000714035964983761
A856: 855 | B856: 3178478355 | C856: 3.24 | D856: of:=LN([.B856])/LN([.A856]+1) -> 3.24034246196813 | E856: of:=(1+SQRT(5))/2 -> 1.6180339887499 | F856: of:=3+[.E856]/LN([.A856]+1) -> 3.23962813966499 | G856: of:=[.D856]-[.F856] -> 0.000714322303135173
A857: 856 | B857: 3189641443 | C857: 3.24 | D857: of:=LN([.B857])/LN([.A857]+1) -> 3.24030140069103 | E857: of:=(1+SQRT(5))/2 -> 1.6180339887499 | F857: of:=3+[.E857]/LN([.A857]+1) -> 3.23958671246449 | G857: of:=[.D857]-[.F857] -> 0.000714688226535642
A858: 857 | B858: 3200823131 | C858: 3.24 | D858: of:=LN([.B858])/LN([.A858]+1) -> 3.24026005369747 | E858: of:=(1+SQRT(5))/2 -> 1.6180339887499 | F858: of:=3+[.E858]/LN([.A858]+1) -> 3.23954534787206 | G858: of:=[.D858]-[.F858] -> 0.000714705825410888
A859: 858 | B859: 3212042245 | C859: 3.24 | D859: of:=LN([.B859])/LN([.A859]+1) -> 3.24021929079786 | E859: of:=(1+SQRT(5))/2 -> 1.6180339887499 | F859: of:=3+[.E859]/LN([.A859]+1) -> 3.23950404571781 | G859: of:=[.D859]-[.F859] -> 0.000715245080045168
A860: 859 | B860: 3223280261 | C860: 3.24 | D860: of:=LN([.B860])/LN([.A860]+1) -> 3.24017825417363 | E860: of:=(1+SQRT(5))/2 -> 1.6180339887499 | F860: of:=3+[.E860]/LN([.A860]+1) -> 3.23946280583253 | G860: of:=[.D860]-[.F860] -> 0.000715448341107816
A861: 860 | B861: 3234547863 | C861: 3.24 | D861: of:=LN([.B861])/LN([.A861]+1) -> 3.24013743469298 | E861: of:=(1+SQRT(5))/2 -> 1.6180339887499 | F861: of:=3+[.E861]/LN([.A861]+1) -> 3.23942162804764 | G861: of:=[.D861]-[.F861] -> 0.000715806645335437
A862: 861 | B862: 3245846717 | C862: 3.24 | D862: of:=LN([.B862])/LN([.A862]+1) -> 3.24009690503283 | E862: of:=(1+SQRT(5))/2 -> 1.6180339887499 | F862: of:=3+[.E862]/LN([.A862]+1) -> 3.23938051219525 | G862: of:=[.D862]-[.F862] -> 0.000716392837583957
A863: 862 | B863: 3257155221 | C863: 3.24 | D863: of:=LN([.B863])/LN([.A863]+1) -> 3.24005568011316 | E863: of:=(1+SQRT(5))/2 -> 1.6180339887499 | F863: of:=3+[.E863]/LN([.A863]+1) -> 3.23933945810809 | G863: of:=[.D863]-[.F863] -> 0.000716222005071376
A864: 863 | B864: 3268503859 | C864: 3.24 | D864: of:=LN([.B864])/LN([.A864]+1) -> 3.24001514599615 | E864: of:=(1+SQRT(5))/2 -> 1.6180339887499 | F864: of:=3+[.E864]/LN([.A864]+1) -> 3.23929846561957 | G864: of:=[.D864]-[.F864] -> 0.000716680376579237
A865: 864 | B865: 3279871515 | C865: 3.24 | D865: of:=LN([.B865])/LN([.A865]+1) -> 3.23997434229182 | E865: of:=(1+SQRT(5))/2 -> 1.6180339887499 | F865: of:=3+[.E865]/LN([.A865]+1) -> 3.23925753456373 | G865: of:=[.D865]-[.F865] -> 0.000716807728094349
A866: 865 | B866: 3291279927 | C866: 3.24 | D866: of:=LN([.B866])/LN([.A866]+1) -> 3.23993424753422 | E866: of:=(1+SQRT(5))/2 -> 1.6180339887499 | F866: of:=3+[.E866]/LN([.A866]+1) -> 3.23921666477524 | G866: of:=[.D866]-[.F866] -> 0.000717582758976931
A867: 866 | B867: 3302703563 | C867: 3.24 | D867: of:=LN([.B867])/LN([.A867]+1) -> 3.23989371040596 | E867: of:=(1+SQRT(5))/2 -> 1.6180339887499 | F867: of:=3+[.E867]/LN([.A867]+1) -> 3.23917585608944 | G867: of:=[.D867]-[.F867] -> 0.000717854316525379
A868: 867 | B868: 3314154151 | C868: 3.24 | D868: of:=LN([.B868])/LN([.A868]+1) -> 3.23985325784652 | E868: of:=(1+SQRT(5))/2 -> 1.6180339887499 | F868: of:=3+[.E868]/LN([.A868]+1) -> 3.23913510834227 | G868: of:=[.D868]-[.F868] -> 0.000718149504250754
A869: 868 | B869: 3325633307 | C869: 3.24 | D869: of:=LN([.B869])/LN([.A869]+1) -> 3.23981295987978 | E869: of:=(1+SQRT(5))/2 -> 1.6180339887499 | F869: of:=3+[.E869]/LN([.A869]+1) -> 3.23909442137034 | G869: of:=[.D869]-[.F869] -> 0.000718538509433486
A870: 869 | B870: 3337130103 | C870: 3.24 | D870: of:=LN([.B870])/LN([.A870]+1) -> 3.23977233015908 | E870: of:=(1+SQRT(5))/2 -> 1.6180339887499 | F870: of:=3+[.E870]/LN([.A870]+1) -> 3.23905379501087 | G870: of:=[.D870]-[.F870] -> 0.000718535148216848
A871: 870 | B871: 3348670853 | C871: 3.24 | D871: of:=LN([.B871])/LN([.A871]+1) -> 3.23973253219984 | E871: of:=(1+SQRT(5))/2 -> 1.6180339887499 | F871: of:=3+[.E871]/LN([.A871]+1) -> 3.23901322910169 | G871: of:=[.D871]-[.F871] -> 0.000719303098144941
A872: 871 | B872: 3360225663 | C872: 3.24 | D872: of:=LN([.B872])/LN([.A872]+1) -> 3.2396922422097 | E872: of:=(1+SQRT(5))/2 -> 1.6180339887499 | F872: of:=3+[.E872]/LN([.A872]+1) -> 3.2389727234813 | G872: of:=[.D872]-[.F872] -> 0.000719518728405699
A873: 872 | B873: 3371806215 | C873: 3.24 | D873: of:=LN([.B873])/LN([.A873]+1) -> 3.23965197625886 | E873: of:=(1+SQRT(5))/2 -> 1.6180339887499 | F873: of:=3+[.E873]/LN([.A873]+1) -> 3.23893227798877 | G873: of:=[.D873]-[.F873] -> 0.000719698270091662
A874: 873 | B874: 3383423465 | C874: 3.24 | D874: of:=LN([.B874])/LN([.A874]+1) -> 3.23961221133288 | E874: of:=(1+SQRT(5))/2 -> 1.6180339887499 | F874: of:=3+[.E874]/LN([.A874]+1) -> 3.23889189246382 | G874: of:=[.D874]-[.F874] -> 0.000720318869058989
A875: 874 | B875: 3395059829 | C875: 3.24 | D875: of:=LN([.B875])/LN([.A875]+1) -> 3.23957217662642 | E875: of:=(1+SQRT(5))/2 -> 1.6180339887499 | F875: of:=3+[.E875]/LN([.A875]+1) -> 3.23885156674677 | G875: of:=[.D875]-[.F875] -> 0.000720609879650169
A876: 875 | B876: 3406720241 | C876: 3.24 | D876: of:=LN([.B876])/LN([.A876]+1) -> 3.23953208795802 | E876: of:=(1+SQRT(5))/2 -> 1.6180339887499 | F876: of:=3+[.E876]/LN([.A876]+1) -> 3.23881130067855 | G876: of:=[.D876]-[.F876] -> 0.000720787279465895
A877: 876 | B877: 3418407465 | C877: 3.24 | D877: of:=LN([.B877])/LN([.A877]+1) -> 3.23949206438836 | E877: of:=(1+SQRT(5))/2 -> 1.6180339887499 | F877: of:=3+[.E877]/LN([.A877]+1) -> 3.23877109410072 | G877: of:=[.D877]-[.F877] -> 0.000720970287634071
A878: 877 | B878: 3430129735 | C878: 3.24 | D878: of:=LN([.B878])/LN([.A878]+1) -> 3.23945245856325 | E878: of:=(1+SQRT(5))/2 -> 1.6180339887499 | F878: of:=3+[.E878]/LN([.A878]+1) -> 3.23873094685542 | G878: of:=[.D878]-[.F878] -> 0.000721511707835631
A879: 878 | B879: 3441870701 | C879: 3.24 | D879: of:=LN([.B879])/LN([.A879]+1) -> 3.23941256440375 | E879: of:=(1+SQRT(5))/2 -> 1.6180339887499 | F879: of:=3+[.E879]/LN([.A879]+1) -> 3.23869085878539 | G879: of:=[.D879]-[.F879] -> 0.000721705618358826
A880: 879 | B880: 3453639517 | C880: 3.24 | D880: of:=LN([.B880])/LN([.A880]+1) -> 3.23937277510495 | E880: of:=(1+SQRT(5))/2 -> 1.6180339887499 | F880: of:=3+[.E880]/LN([.A880]+1) -> 3.23865082973399 | G880: of:=[.D880]-[.F880] -> 0.000721945370960597
A881: 880 | B881: 3465435899 | C881: 3.24 | D881: of:=LN([.B881])/LN([.A881]+1) -> 3.23933307663355 | E881: of:=(1+SQRT(5))/2 -> 1.6180339887499 | F881: of:=3+[.E881]/LN([.A881]+1) -> 3.23861085954516 | G881: of:=[.D881]-[.F881] -> 0.000722217088391375
A882: 881 | B882: 3477251087 | C882: 3.24 | D882: of:=LN([.B882])/LN([.A882]+1) -> 3.23929309574727 | E882: of:=(1+SQRT(5))/2 -> 1.6180339887499 | F882: of:=3+[.E882]/LN([.A882]+1) -> 3.23857094806344 | G882: of:=[.D882]-[.F882] -> 0.000722147683831498
A883: 882 | B883: 3489113729 | C883: 3.24 | D883: of:=LN([.B883])/LN([.A883]+1) -> 3.23925404506766 | E883: of:=(1+SQRT(5))/2 -> 1.6180339887499 | F883: of:=3+[.E883]/LN([.A883]+1) -> 3.23853109513397 | G883: of:=[.D883]-[.F883] -> 0.000722949933693151
A884: 883 | B884: 3500992445 | C884: 3.24 | D884: of:=LN([.B884])/LN([.A884]+1) -> 3.23921459271759 | E884: of:=(1+SQRT(5))/2 -> 1.6180339887499 | F884: of:=3+[.E884]/LN([.A884]+1) -> 3.23849130060244 | G884: of:=[.D884]-[.F884] -> 0.000723292115140772
A885: 884 | B885: 3512895781 | C885: 3.24 | D885: of:=LN([.B885])/LN([.A885]+1) -> 3.23917510066996 | E885: of:=(1+SQRT(5))/2 -> 1.6180339887499 | F885: of:=3+[.E885]/LN([.A885]+1) -> 3.23845156431518 | G885: of:=[.D885]-[.F885] -> 0.000723536354776844
A886: 885 | B886: 3524835193 | C886: 3.24 | D886: of:=LN([.B886])/LN([.A886]+1) -> 3.23913604742258 | E886: of:=(1+SQRT(5))/2 -> 1.6180339887499 | F886: of:=3+[.E886]/LN([.A886]+1) -> 3.23841188611905 | G886: of:=[.D886]-[.F886] -> 0.000724161303531368
A887: 886 | B887: 3536782389 | C887: 3.24 | D887: of:=LN([.B887])/LN([.A887]+1) -> 3.23909624901644 | E887: of:=(1+SQRT(5))/2 -> 1.6180339887499 | F887: of:=3+[.E887]/LN([.A887]+1) -> 3.23837226586152 | G887: of:=[.D887]-[.F887] -> 0.000723983154920838
A888: 887 | B888: 3548771507 | C888: 3.24 | D888: of:=LN([.B888])/LN([.A888]+1) -> 3.23905712950944 | E888: of:=(1+SQRT(5))/2 -> 1.6180339887499 | F888: of:=3+[.E888]/LN([.A888]+1) -> 3.23833270339063 | G888: of:=[.D888]-[.F888] -> 0.000724426118812627
A889: 888 | B889: 3560781007 | C889: 3.24 | D889: of:=LN([.B889])/LN([.A889]+1) -> 3.23901779001158 | E889: of:=(1+SQRT(5))/2 -> 1.6180339887499 | F889: of:=3+[.E889]/LN([.A889]+1) -> 3.23829319855497 | G889: of:=[.D889]-[.F889] -> 0.000724591456603196
A890: 889 | B890: 3572827839 | C890: 3.24 | D890: of:=LN([.B890])/LN([.A890]+1) -> 3.23897893062048 | E890: of:=(1+SQRT(5))/2 -> 1.6180339887499 | F890: of:=3+[.E890]/LN([.A890]+1) -> 3.23825375120374 | G890: of:=[.D890]-[.F890] -> 0.000725179416734889
A891: 890 | B891: 3584895835 | C891: 3.24 | D891: of:=LN([.B891])/LN([.A891]+1) -> 3.2389398814659 | E891: of:=(1+SQRT(5))/2 -> 1.6180339887499 | F891: of:=3+[.E891]/LN([.A891]+1) -> 3.23821436118668 | G891: of:=[.D891]-[.F891] -> 0.000725520279214909
A892: 891 | B892: 3596989917 | C892: 3.24 | D892: of:=LN([.B892])/LN([.A892]+1) -> 3.23890084517581 | E892: of:=(1+SQRT(5))/2 -> 1.6180339887499 | F892: of:=3+[.E892]/LN([.A892]+1) -> 3.2381750283541 | G892: of:=[.D892]-[.F892] -> 0.000725816821709024
A893: 892 | B893: 3609110659 | C893: 3.24 | D893: of:=LN([.B893])/LN([.A893]+1) -> 3.23886184422634 | E893: of:=(1+SQRT(5))/2 -> 1.6180339887499 | F893: of:=3+[.E893]/LN([.A893]+1) -> 3.23813575255688 | G893: of:=[.D893]-[.F893] -> 0.000726091669463802
A894: 893 | B894: 3621258877 | C894: 3.24 | D894: of:=LN([.B894])/LN([.A894]+1) -> 3.23882291061171 | E894: of:=(1+SQRT(5))/2 -> 1.6180339887499 | F894: of:=3+[.E894]/LN([.A894]+1) -> 3.23809653364644 | G894: of:=[.D894]-[.F894] -> 0.000726376965274778
A895: 894 | B895: 3633433559 | C895: 3.24 | D895: of:=LN([.B895])/LN([.A895]+1) -> 3.23878400185523 | E895: of:=(1+SQRT(5))/2 -> 1.6180339887499 | F895: of:=3+[.E895]/LN([.A895]+1) -> 3.23805737147477 | G895: of:=[.D895]-[.F895] -> 0.000726630380463167
A896: 895 | B896: 3645639207 | C896: 3.24 | D896: of:=LN([.B896])/LN([.A896]+1) -> 3.23874529856748 | E896: of:=(1+SQRT(5))/2 -> 1.6180339887499 | F896: of:=3+[.E896]/LN([.A896]+1) -> 3.23801826589442 | G896: of:=[.D896]-[.F896] -> 0.000727032673056627
A897: 896 | B897: 3657867793 | C897: 3.24 | D897: of:=LN([.B897])/LN([.A897]+1) -> 3.23870647500656 | E897: of:=(1+SQRT(5))/2 -> 1.6180339887499 | F897: of:=3+[.E897]/LN([.A897]+1) -> 3.23797921675848 | G897: of:=[.D897]-[.F897] -> 0.000727258248083285
A898: 897 | B898: 3670130009 | C898: 3.24 | D898: of:=LN([.B898])/LN([.A898]+1) -> 3.23866796006173 | E898: of:=(1+SQRT(5))/2 -> 1.6180339887499 | F898: of:=3+[.E898]/LN([.A898]+1) -> 3.23794022392059 | G898: of:=[.D898]-[.F898] -> 0.000727736141138635
A899: 898 | B899: 3682405077 | C899: 3.24 | D899: of:=LN([.B899])/LN([.A899]+1) -> 3.23862892009434 | E899: of:=(1+SQRT(5))/2 -> 1.6180339887499 | F899: of:=3+[.E899]/LN([.A899]+1) -> 3.23790128723493 | G899: of:=[.D899]-[.F899] -> 0.000727632859405691
A900: 899 | B900: 3694723125 | C900: 3.24 | D900: of:=LN([.B900])/LN([.A900]+1) -> 3.23859055857439 | E900: of:=(1+SQRT(5))/2 -> 1.6180339887499 | F900: of:=3+[.E900]/LN([.A900]+1) -> 3.23786240655624 | G900: of:=[.D900]-[.F900] -> 0.000728152018151906
A901: 900 | B901: 3707057093 | C901: 3.24 | D901: of:=LN([.B901])/LN([.A901]+1) -> 3.23855179471775 | E901: of:=(1+SQRT(5))/2 -> 1.6180339887499 | F901: of:=3+[.E901]/LN([.A901]+1) -> 3.23782358173979 | G901: of:=[.D901]-[.F901] -> 0.000728212977965992
A902: 901 | B902: 3719428847 | C902: 3.24 | D902: of:=LN([.B902])/LN([.A902]+1) -> 3.23851349591044 | E902: of:=(1+SQRT(5))/2 -> 1.6180339887499 | F902: of:=3+[.E902]/LN([.A902]+1) -> 3.23778481264138 | G902: of:=[.D902]-[.F902] -> 0.000728683269062724
A903: 902 | B903: 3731824551 | C903: 3.24 | D903: of:=LN([.B903])/LN([.A903]+1) -> 3.23847511175763 | E903: of:=(1+SQRT(5))/2 -> 1.6180339887499 | F903: of:=3+[.E903]/LN([.A903]+1) -> 3.23774609911736 | G903: of:=[.D903]-[.F903] -> 0.000729012640279692
A904: 903 | B904: 3744248645 | C904: 3.24 | D904: of:=LN([.B904])/LN([.A904]+1) -> 3.23843681659128 | E904: of:=(1+SQRT(5))/2 -> 1.6180339887499 | F904: of:=3+[.E904]/LN([.A904]+1) -> 3.23770744102459 | G904: of:=[.D904]-[.F904] -> 0.00072937556668462
A905: 904 | B905: 3756696565 | C905: 3.24 | D905: of:=LN([.B905])/LN([.A905]+1) -> 3.23839843026709 | E905: of:=(1+SQRT(5))/2 -> 1.6180339887499 | F905: of:=3+[.E905]/LN([.A905]+1) -> 3.2376688382205 | G905: of:=[.D905]-[.F905] -> 0.000729592046595506
A906: 905 | B906: 3769171033 | C906: 3.24 | D906: of:=LN([.B906])/LN([.A906]+1) -> 3.238360059034 | E906: of:=(1+SQRT(5))/2 -> 1.6180339887499 | F906: of:=3+[.E906]/LN([.A906]+1) -> 3.237630290563 | G906: of:=[.D906]-[.F906] -> 0.000729768470996373
A907: 906 | B907: 3781677225 | C907: 3.24 | D907: of:=LN([.B907])/LN([.A907]+1) -> 3.23832190295993 | E907: of:=(1+SQRT(5))/2 -> 1.6180339887499 | F907: of:=3+[.E907]/LN([.A907]+1) -> 3.23759179791056 | G907: of:=[.D907]-[.F907] -> 0.000730105049368657
A908: 907 | B908: 3794214493 | C908: 3.24 | D908: of:=LN([.B908])/LN([.A908]+1) -> 3.23828393398247 | E908: of:=(1+SQRT(5))/2 -> 1.6180339887499 | F908: of:=3+[.E908]/LN([.A908]+1) -> 3.23755336012216 | G908: of:=[.D908]-[.F908] -> 0.000730573860312056
A909: 908 | B909: 3806771347 | C909: 3.24 | D909: of:=LN([.B909])/LN([.A909]+1) -> 3.23824570634197 | E909: of:=(1+SQRT(5))/2 -> 1.6180339887499 | F909: of:=3+[.E909]/LN([.A909]+1) -> 3.23751497705729 | G909: of:=[.D909]-[.F909] -> 0.000730729284677878
A910: 909 | B910: 3819362587 | C910: 3.24 | D910: of:=LN([.B910])/LN([.A910]+1) -> 3.23820779069427 | E910: of:=(1+SQRT(5))/2 -> 1.6180339887499 | F910: of:=3+[.E910]/LN([.A910]+1) -> 3.23747664857597 | G910: of:=[.D910]-[.F910] -> 0.000731142118300721
A911: 910 | B911: 3831975295 | C911: 3.24 | D911: of:=LN([.B911])/LN([.A911]+1) -> 3.23816968837072 | E911: of:=(1+SQRT(5))/2 -> 1.6180339887499 | F911: of:=3+[.E911]/LN([.A911]+1) -> 3.23743837453874 | G911: of:=[.D911]-[.F911] -> 0.000731313831985325
A912: 911 | B912: 3844614197 | C912: 3.24 | D912: of:=LN([.B912])/LN([.A912]+1) -> 3.23813158091224 | E912: of:=(1+SQRT(5))/2 -> 1.6180339887499 | F912: of:=3+[.E912]/LN([.A912]+1) -> 3.23740015480663 | G912: of:=[.D912]-[.F912] -> 0.000731426105610833
A913: 912 | B913: 3857283727 | C913: 3.24 | D913: of:=LN([.B913])/LN([.A913]+1) -> 3.23809363626346 | E913: of:=(1+SQRT(5))/2 -> 1.6180339887499 | F913: of:=3+[.E913]/LN([.A913]+1) -> 3.2373619892412 | G913: of:=[.D913]-[.F913] -> 0.000731647022255366
A914: 913 | B914: 3869987481 | C914: 3.24 | D914: of:=LN([.B914])/LN([.A914]+1) -> 3.23805598829813 | E914: of:=(1+SQRT(5))/2 -> 1.6180339887499 | F914: of:=3+[.E914]/LN([.A914]+1) -> 3.23732387770452 | G914: of:=[.D914]-[.F914] -> 0.000732110593610891
A915: 914 | B915: 3882719073 | C915: 3.24 | D915: of:=LN([.B915])/LN([.A915]+1) -> 3.23801839202028 | E915: of:=(1+SQRT(5))/2 -> 1.6180339887499 | F915: of:=3+[.E915]/LN([.A915]+1) -> 3.23728582005914 | G915: of:=[.D915]-[.F915] -> 0.000732571961143513
A916: 915 | B916: 3895474059 | C916: 3.24 | D916: of:=LN([.B916])/LN([.A916]+1) -> 3.23798067888448 | E916: of:=(1+SQRT(5))/2 -> 1.6180339887499 | F916: of:=3+[.E916]/LN([.A916]+1) -> 3.23724781616814 | G916: of:=[.D916]-[.F916] -> 0.000732862716347871
A917: 916 | B917: 3908254239 | C917: 3.24 | D917: of:=LN([.B917])/LN([.A917]+1) -> 3.23794291687703 | E917: of:=(1+SQRT(5))/2 -> 1.6180339887499 | F917: of:=3+[.E917]/LN([.A917]+1) -> 3.23720986589508 | G917: of:=[.D917]-[.F917] -> 0.000733050981946537
A918: 917 | B918: 3921069833 | C918: 3.24 | D918: of:=LN([.B918])/LN([.A918]+1) -> 3.23790548782206 | E918: of:=(1+SQRT(5))/2 -> 1.6180339887499 | F918: of:=3+[.E918]/LN([.A918]+1) -> 3.23717196910404 | G918: of:=[.D918]-[.F918] -> 0.000733518718026627
A919: 918 | B919: 3933895941 | C919: 3.24 | D919: of:=LN([.B919])/LN([.A919]+1) -> 3.23786745993019 | E919: of:=(1+SQRT(5))/2 -> 1.6180339887499 | F919: of:=3+[.E919]/LN([.A919]+1) -> 3.23713412565957 | G919: of:=[.D919]-[.F919] -> 0.000733334270620389
A920: 919 | B920: 3946767237 | C920: 3.24 | D920: of:=LN([.B920])/LN([.A920]+1) -> 3.23783012597227 | E920: of:=(1+SQRT(5))/2 -> 1.6180339887499 | F920: of:=3+[.E920]/LN([.A920]+1) -> 3.23709633542673 | G920: of:=[.D920]-[.F920] -> 0.000733790545540014
A921: 920 | B921: 3959666213 | C921: 3.24 | D921: of:=LN([.B921])/LN([.A921]+1) -> 3.23779283031863 | E921: of:=(1+SQRT(5))/2 -> 1.6180339887499 | F921: of:=3+[.E921]/LN([.A921]+1) -> 3.23705859827107 | G921: of:=[.D921]-[.F921] -> 0.000734232047558514
A922: 921 | B922: 3972587301 | C922: 3.24 | D922: of:=LN([.B922])/LN([.A922]+1) -> 3.23775536653599 | E922: of:=(1+SQRT(5))/2 -> 1.6180339887499 | F922: of:=3+[.E922]/LN([.A922]+1) -> 3.23702091405862 | G922: of:=[.D922]-[.F922] -> 0.000734452477368919
A923: 922 | B923: 3985537327 | C923: 3.24 | D923: of:=LN([.B923])/LN([.A923]+1) -> 3.23771798646865 | E923: of:=(1+SQRT(5))/2 -> 1.6180339887499 | F923: of:=3+[.E923]/LN([.A923]+1) -> 3.2369832826559 | G923: of:=[.D923]-[.F923] -> 0.000734703812746762
A924: 923 | B924: 3998516871 | C924: 3.24 | D924: of:=LN([.B924])/LN([.A924]+1) -> 3.23768070978929 | E924: of:=(1+SQRT(5))/2 -> 1.6180339887499 | F924: of:=3+[.E924]/LN([.A924]+1) -> 3.23694570392992 | G924: of:=[.D924]-[.F924] -> 0.000735005859371807
A925: 924 | B925: 4011517091 | C925: 3.24 | D925: of:=LN([.B925])/LN([.A925]+1) -> 3.2376432120048 | E925: of:=(1+SQRT(5))/2 -> 1.6180339887499 | F925: of:=3+[.E925]/LN([.A925]+1) -> 3.23690817774816 | G925: of:=[.D925]-[.F925] -> 0.000735034256631462
A926: 925 | B926: 4024558071 | C926: 3.24 | D926: of:=LN([.B926])/LN([.A926]+1) -> 3.23760622521688 | E926: of:=(1+SQRT(5))/2 -> 1.6180339887499 | F926: of:=3+[.E926]/LN([.A926]+1) -> 3.2368707039786 | G926: of:=[.D926]-[.F926] -> 0.000735521238285131
A927: 926 | B927: 4037627041 | C927: 3.24 | D927: of:=LN([.B927])/LN([.A927]+1) -> 3.23756928058561 | E927: of:=(1+SQRT(5))/2 -> 1.6180339887499 | F927: of:=3+[.E927]/LN([.A927]+1) -> 3.23683328248966 | G927: of:=[.D927]-[.F927] -> 0.000735998095948265
A928: 927 | B928: 4050710979 | C928: 3.24 | D928: of:=LN([.B928])/LN([.A928]+1) -> 3.23753190650084 | E928: of:=(1+SQRT(5))/2 -> 1.6180339887499 | F928: of:=3+[.E928]/LN([.A928]+1) -> 3.23679591315027 | G928: of:=[.D928]-[.F928] -> 0.000735993350570396
A929: 928 | B929: 4063838201 | C929: 3.24 | D929: of:=LN([.B929])/LN([.A929]+1) -> 3.23749512617854 | E929: of:=(1+SQRT(5))/2 -> 1.6180339887499 | F929: of:=3+[.E929]/LN([.A929]+1) -> 3.23675859582982 | G929: of:=[.D929]-[.F929] -> 0.000736530348717679
A930: 929 | B930: 4076981797 | C930: 3.24 | D930: of:=LN([.B930])/LN([.A930]+1) -> 3.23745796723889 | E930: of:=(1+SQRT(5))/2 -> 1.6180339887499 | F930: of:=3+[.E930]/LN([.A930]+1) -> 3.23672133039818 | G930: of:=[.D930]-[.F930] -> 0.000736636840709792
A931: 930 | B931: 4090156337 | C931: 3.24 | D931: of:=LN([.B931])/LN([.A931]+1) -> 3.23742095388916 | E931: of:=(1+SQRT(5))/2 -> 1.6180339887499 | F931: of:=3+[.E931]/LN([.A931]+1) -> 3.23668411672566 | G931: of:=[.D931]-[.F931] -> 0.000736837163508142
A932: 931 | B932: 4103365909 | C932: 3.24 | D932: of:=LN([.B932])/LN([.A932]+1) -> 3.23738422967074 | E932: of:=(1+SQRT(5))/2 -> 1.6180339887499 | F932: of:=3+[.E932]/LN([.A932]+1) -> 3.23664695468306 | G932: of:=[.D932]-[.F932] -> 0.000737274987678394
A933: 932 | B933: 4116594009 | C933: 3.24 | D933: of:=LN([.B933])/LN([.A933]+1) -> 3.2373472046988 | E933: of:=(1+SQRT(5))/2 -> 1.6180339887499 | F933: of:=3+[.E933]/LN([.A933]+1) -> 3.23660984414164 | G933: of:=[.D933]-[.F933] -> 0.000737360557158784
A934: 933 | B934: 4129860141 | C934: 3.24 | D934: of:=LN([.B934])/LN([.A934]+1) -> 3.23731057181843 | E934: of:=(1+SQRT(5))/2 -> 1.6180339887499 | F934: of:=3+[.E934]/LN([.A934]+1) -> 3.23657278497313 | G934: of:=[.D934]-[.F934] -> 0.000737786845301791
A935: 934 | B935: 4143148227 | C935: 3.24 | D935: of:=LN([.B935])/LN([.A935]+1) -> 3.23727375908979 | E935: of:=(1+SQRT(5))/2 -> 1.6180339887499 | F935: of:=3+[.E935]/LN([.A935]+1) -> 3.2365357770497 | G935: of:=[.D935]-[.F935] -> 0.000737982040092788
A936: 935 | B936: 4156470411 | C936: 3.24 | D936: of:=LN([.B936])/LN([.A936]+1) -> 3.23723719468421 | E936: of:=(1+SQRT(5))/2 -> 1.6180339887499 | F936: of:=3+[.E936]/LN([.A936]+1) -> 3.23649882024398 | G936: of:=[.D936]-[.F936] -> 0.000738374440229173
A937: 936 | B937: 4169807743 | C937: 3.24 | D937: of:=LN([.B937])/LN([.A937]+1) -> 3.2372002112674 | E937: of:=(1+SQRT(5))/2 -> 1.6180339887499 | F937: of:=3+[.E937]/LN([.A937]+1) -> 3.23646191442907 | G937: of:=[.D937]-[.F937] -> 0.000738296838325159
A938: 937 | B938: 4183188835 | C938: 3.24 | D938: of:=LN([.B938])/LN([.A938]+1) -> 3.23716381178454 | E938: of:=(1+SQRT(5))/2 -> 1.6180339887499 | F938: of:=3+[.E938]/LN([.A938]+1) -> 3.23642505947852 | G938: of:=[.D938]-[.F938] -> 0.000738752306026047
A939: 938 | B939: 4196591635 | C939: 3.24 | D939: of:=LN([.B939])/LN([.A939]+1) -> 3.23712722199862 | E939: of:=(1+SQRT(5))/2 -> 1.6180339887499 | F939: of:=3+[.E939]/LN([.A939]+1) -> 3.23638825526631 | G939: of:=[.D939]-[.F939] -> 0.000738966732308555
A940: 939 | B940: 4210021463 | C940: 3.24 | D940: of:=LN([.B940])/LN([.A940]+1) -> 3.23709062772194 | E940: of:=(1+SQRT(5))/2 -> 1.6180339887499 | F940: of:=3+[.E940]/LN([.A940]+1) -> 3.2363515016669 | G940: of:=[.D940]-[.F940] -> 0.000739126055031125
A941: 940 | B941: 4223489951 | C941: 3.24 | D941: of:=LN([.B941])/LN([.A941]+1) -> 3.23705443056518 | E941: of:=(1+SQRT(5))/2 -> 1.6180339887499 | F941: of:=3+[.E941]/LN([.A941]+1) -> 3.23631479855518 | G941: of:=[.D941]-[.F941] -> 0.000739632010001934
A942: 941 | B942: 4236981323 | C942: 3.24 | D942: of:=LN([.B942])/LN([.A942]+1) -> 3.23701808215688 | E942: of:=(1+SQRT(5))/2 -> 1.6180339887499 | F942: of:=3+[.E942]/LN([.A942]+1) -> 3.23627814580648 | G942: of:=[.D942]-[.F942] -> 0.000739936350399706
A943: 942 | B943: 4250495511 | C943: 3.24 | D943: of:=LN([.B943])/LN([.A943]+1) -> 3.23698158099671 | E943: of:=(1+SQRT(5))/2 -> 1.6180339887499 | F943: of:=3+[.E943]/LN([.A943]+1) -> 3.23624154329658 | G943: of:=[.D943]-[.F943] -> 0.000740037700126983
A944: 943 | B944: 4264045635 | C944: 3.24 | D944: of:=LN([.B944])/LN([.A944]+1) -> 3.2369453771129 | E944: of:=(1+SQRT(5))/2 -> 1.6180339887499 | F944: of:=3+[.E944]/LN([.A944]+1) -> 3.2362049909017 | G944: of:=[.D944]-[.F944] -> 0.000740386211202093
A945: 944 | B945: 4277620845 | C945: 3.24 | D945: of:=LN([.B945])/LN([.A945]+1) -> 3.23690909665156 | E945: of:=(1+SQRT(5))/2 -> 1.6180339887499 | F945: of:=3+[.E945]/LN([.A945]+1) -> 3.2361684884985 | G945: of:=[.D945]-[.F945] -> 0.000740608153065203
A946: 945 | B946: 4291234381 | C946: 3.24 | D946: of:=LN([.B946])/LN([.A946]+1) -> 3.2368731899791 | E946: of:=(1+SQRT(5))/2 -> 1.6180339887499 | F946: of:=3+[.E946]/LN([.A946]+1) -> 3.23613203596407 | G946: of:=[.D946]-[.F946] -> 0.000741154015029721
A947: 946 | B947: 4304862343 | C947: 3.24 | D947: of:=LN([.B947])/LN([.A947]+1) -> 3.23683684260856 | E947: of:=(1+SQRT(5))/2 -> 1.6180339887499 | F947: of:=3+[.E947]/LN([.A947]+1) -> 3.23609563317594 | G947: of:=[.D947]-[.F947] -> 0.000741209432614465
A948: 947 | B948: 4318524187 | C948: 3.24 | D948: of:=LN([.B948])/LN([.A948]+1) -> 3.23680071553889 | E948: of:=(1+SQRT(5))/2 -> 1.6180339887499 | F948: of:=3+[.E948]/LN([.A948]+1) -> 3.23605928001208 | G948: of:=[.D948]-[.F948] -> 0.000741435526804057
A949: 948 | B949: 4332210737 | C949: 3.24 | D949: of:=LN([.B949])/LN([.A949]+1) -> 3.23676449695966 | E949: of:=(1+SQRT(5))/2 -> 1.6180339887499 | F949: of:=3+[.E949]/LN([.A949]+1) -> 3.23602297635088 | G949: of:=[.D949]-[.F949] -> 0.000741520608787738
A950: 949 | B950: 4345931261 | C950: 3.24 | D950: of:=LN([.B950])/LN([.A950]+1) -> 3.23672849815338 | E950: of:=(1+SQRT(5))/2 -> 1.6180339887499 | F950: of:=3+[.E950]/LN([.A950]+1) -> 3.23598672207115 | G950: of:=[.D950]-[.F950] -> 0.000741776082235912
A951: 950 | B951: 4359687867 | C951: 3.24 | D951: of:=LN([.B951])/LN([.A951]+1) -> 3.23669278679808 | E951: of:=(1+SQRT(5))/2 -> 1.6180339887499 | F951: of:=3+[.E951]/LN([.A951]+1) -> 3.23595051705214 | G951: of:=[.D951]-[.F951] -> 0.000742269745939161
A952: 951 | B952: 4373462577 | C952: 3.24 | D952: of:=LN([.B952])/LN([.A952]+1) -> 3.2366567600391 | E952: of:=(1+SQRT(5))/2 -> 1.6180339887499 | F952: of:=3+[.E952]/LN([.A952]+1) -> 3.23591436117353 | G952: of:=[.D952]-[.F952] -> 0.000742398865569705
A953: 952 | B953: 4387275229 | C953: 3.24 | D953: of:=LN([.B953])/LN([.A953]+1) -> 3.23662107952172 | E953: of:=(1+SQRT(5))/2 -> 1.6180339887499 | F953: of:=3+[.E953]/LN([.A953]+1) -> 3.23587825431541 | G953: of:=[.D953]-[.F953] -> 0.000742825206315523
A954: 953 | B954: 4401108349 | C954: 3.24 | D954: of:=LN([.B954])/LN([.A954]+1) -> 3.23658516246174 | E954: of:=(1+SQRT(5))/2 -> 1.6180339887499 | F954: of:=3+[.E954]/LN([.A954]+1) -> 3.23584219635829 | G954: of:=[.D954]-[.F954] -> 0.000742966103445042
A955: 954 | B955: 4414971411 | C955: 3.24 | D955: of:=LN([.B955])/LN([.A955]+1) -> 3.23654932327724 | E955: of:=(1+SQRT(5))/2 -> 1.6180339887499 | F955: of:=3+[.E955]/LN([.A955]+1) -> 3.23580618718311 | G955: of:=[.D955]-[.F955] -> 0.000743136094127017
A956: 955 | B956: 4428867295 | C956: 3.24 | D956: of:=LN([.B956])/LN([.A956]+1) -> 3.23651365531225 | E956: of:=(1+SQRT(5))/2 -> 1.6180339887499 | F956: of:=3+[.E956]/LN([.A956]+1) -> 3.23577022667123 | G956: of:=[.D956]-[.F956] -> 0.000743428641018618
A957: 956 | B957: 4442790867 | C957: 3.24 | D957: of:=LN([.B957])/LN([.A957]+1) -> 3.23647798787941 | E957: of:=(1+SQRT(5))/2 -> 1.6180339887499 | F957: of:=3+[.E957]/LN([.A957]+1) -> 3.2357343147044 | G957: of:=[.D957]-[.F957] -> 0.000743673175009452
A958: 957 | B958: 4456743953 | C958: 3.24 | D958: of:=LN([.B958])/LN([.A958]+1) -> 3.23644238001505 | E958: of:=(1+SQRT(5))/2 -> 1.6180339887499 | F958: of:=3+[.E958]/LN([.A958]+1) -> 3.23569845116481 | G958: of:=[.D958]-[.F958] -> 0.000743928850239772
A959: 958 | B959: 4470728001 | C959: 3.24 | D959: of:=LN([.B959])/LN([.A959]+1) -> 3.23640687766761 | E959: of:=(1+SQRT(5))/2 -> 1.6180339887499 | F959: of:=3+[.E959]/LN([.A959]+1) -> 3.23566263593504 | G959: of:=[.D959]-[.F959] -> 0.000744241732569151
A960: 959 | B960: 4484738887 | C960: 3.24 | D960: of:=LN([.B960])/LN([.A960]+1) -> 3.23637134525167 | E960: of:=(1+SQRT(5))/2 -> 1.6180339887499 | F960: of:=3+[.E960]/LN([.A960]+1) -> 3.2356268688981 | G960: of:=[.D960]-[.F960] -> 0.000744476353566448
A961: 960 | B961: 4498775257 | C961: 3.24 | D961: of:=LN([.B961])/LN([.A961]+1) -> 3.23633573860395 | E961: of:=(1+SQRT(5))/2 -> 1.6180339887499 | F961: of:=3+[.E961]/LN([.A961]+1) -> 3.23559114993739 | G961: of:=[.D961]-[.F961] -> 0.000744588666561796
A962: 961 | B962: 4512842233 | C962: 3.24 | D962: of:=LN([.B962])/LN([.A962]+1) -> 3.23630022305212 | E962: of:=(1+SQRT(5))/2 -> 1.6180339887499 | F962: of:=3+[.E962]/LN([.A962]+1) -> 3.23555547893673 | G962: of:=[.D962]-[.F962] -> 0.000744744115386276
A963: 962 | B963: 4526945691 | C963: 3.24 | D963: of:=LN([.B963])/LN([.A963]+1) -> 3.23626498601304 | E963: of:=(1+SQRT(5))/2 -> 1.6180339887499 | F963: of:=3+[.E963]/LN([.A963]+1) -> 3.23551985578033 | G963: of:=[.D963]-[.F963] -> 0.000745130232708391
A964: 963 | B964: 4541073345 | C964: 3.24 | D964: of:=LN([.B964])/LN([.A964]+1) -> 3.23622963037938 | E964: of:=(1+SQRT(5))/2 -> 1.6180339887499 | F964: of:=3+[.E964]/LN([.A964]+1) -> 3.23548428035282 | G964: of:=[.D964]-[.F964] -> 0.000745350026562175
A965: 964 | B965: 4555231011 | C965: 3.24 | D965: of:=LN([.B965])/LN([.A965]+1) -> 3.23619434247096 | E965: of:=(1+SQRT(5))/2 -> 1.6180339887499 | F965: of:=3+[.E965]/LN([.A965]+1) -> 3.23544875253921 | G965: of:=[.D965]-[.F965] -> 0.000745589931748558
A966: 965 | B966: 4569422765 | C966: 3.24 | D966: of:=LN([.B966])/LN([.A966]+1) -> 3.23615925078486 | E966: of:=(1+SQRT(5))/2 -> 1.6180339887499 | F966: of:=3+[.E966]/LN([.A966]+1) -> 3.23541327222491 | G966: of:=[.D966]-[.F966] -> 0.000745978559947957
A967: 966 | B967: 4583637781 | C967: 3.24 | D967: of:=LN([.B967])/LN([.A967]+1) -> 3.23612400919816 | E967: of:=(1+SQRT(5))/2 -> 1.6180339887499 | F967: of:=3+[.E967]/LN([.A967]+1) -> 3.23537783929575 | G967: of:=[.D967]-[.F967] -> 0.000746169902412941
A968: 967 | B968: 4597884215 | C968: 3.24 | D968: of:=LN([.B968])/LN([.A968]+1) -> 3.23608887655499 | E968: of:=(1+SQRT(5))/2 -> 1.6180339887499 | F968: of:=3+[.E968]/LN([.A968]+1) -> 3.23534245363793 | G968: of:=[.D968]-[.F968] -> 0.000746422917055956
A969: 968 | B969: 4612154567 | C969: 3.24 | D969: of:=LN([.B969])/LN([.A969]+1) -> 3.23605361469164 | E969: of:=(1+SQRT(5))/2 -> 1.6180339887499 | F969: of:=3+[.E969]/LN([.A969]+1) -> 3.23530711513805 | G969: of:=[.D969]-[.F969] -> 0.000746499553585966
A970: 969 | B970: 4626467101 | C970: 3.24 | D970: of:=LN([.B970])/LN([.A970]+1) -> 3.23601879827043 | E970: of:=(1+SQRT(5))/2 -> 1.6180339887499 | F970: of:=3+[.E970]/LN([.A970]+1) -> 3.23527182368311 | G970: of:=[.D970]-[.F970] -> 0.000746974587316984
A971: 970 | B971: 4640795833 | C971: 3.24 | D971: of:=LN([.B971])/LN([.A971]+1) -> 3.23598360834121 | E971: of:=(1+SQRT(5))/2 -> 1.6180339887499 | F971: of:=3+[.E971]/LN([.A971]+1) -> 3.23523657916049 | G971: of:=[.D971]-[.F971] -> 0.000747029180718339
A972: 971 | B972: 4655163259 | C972: 3.24 | D972: of:=LN([.B972])/LN([.A972]+1) -> 3.23594875037245 | E972: of:=(1+SQRT(5))/2 -> 1.6180339887499 | F972: of:=3+[.E972]/LN([.A972]+1) -> 3.23520138145795 | G972: of:=[.D972]-[.F972] -> 0.000747368914499891
A973: 972 | B973: 4669558115 | C973: 3.24 | D973: of:=LN([.B973])/LN([.A973]+1) -> 3.23591386994501 | E973: of:=(1+SQRT(5))/2 -> 1.6180339887499 | F973: of:=3+[.E973]/LN([.A973]+1) -> 3.23516623046367 | G973: of:=[.D973]-[.F973] -> 0.000747639481348372
A974: 973 | B974: 4683978017 | C974: 3.24 | D974: of:=LN([.B974])/LN([.A974]+1) -> 3.23587889270231 | E974: of:=(1+SQRT(5))/2 -> 1.6180339887499 | F974: of:=3+[.E974]/LN([.A974]+1) -> 3.23513112606616 | G974: of:=[.D974]-[.F974] -> 0.000747766636142622
A975: 974 | B975: 4698434483 | C975: 3.24 | D975: of:=LN([.B975])/LN([.A975]+1) -> 3.2358441751631 | E975: of:=(1+SQRT(5))/2 -> 1.6180339887499 | F975: of:=3+[.E975]/LN([.A975]+1) -> 3.23509606815437 | G975: of:=[.D975]-[.F975] -> 0.000748107008732291
A976: 975 | B976: 4712921475 | C976: 3.24 | D976: of:=LN([.B976])/LN([.A976]+1) -> 3.23580952809298 | E976: of:=(1+SQRT(5))/2 -> 1.6180339887499 | F976: of:=3+[.E976]/LN([.A976]+1) -> 3.23506105661759 | G976: of:=[.D976]-[.F976] -> 0.000748471475389589
A977: 976 | B977: 4727428183 | C977: 3.24 | D977: of:=LN([.B977])/LN([.A977]+1) -> 3.23577461806018 | E977: of:=(1+SQRT(5))/2 -> 1.6180339887499 | F977: of:=3+[.E977]/LN([.A977]+1) -> 3.2350260913455 | G977: of:=[.D977]-[.F977] -> 0.000748526714680509
A978: 977 | B978: 4741975455 | C978: 3.24 | D978: of:=LN([.B978])/LN([.A978]+1) -> 3.23574008550881 | E978: of:=(1+SQRT(5))/2 -> 1.6180339887499 | F978: of:=3+[.E978]/LN([.A978]+1) -> 3.23499117222817 | G978: of:=[.D978]-[.F978] -> 0.000748913280636643
A979: 978 | B979: 4756540217 | C979: 3.24 | D979: of:=LN([.B979])/LN([.A979]+1) -> 3.23570522178762 | E979: of:=(1+SQRT(5))/2 -> 1.6180339887499 | F979: of:=3+[.E979]/LN([.A979]+1) -> 3.23495629915603 | G979: of:=[.D979]-[.F979] -> 0.000748922631586879
A980: 979 | B980: 4771146393 | C980: 3.24 | D980: of:=LN([.B980])/LN([.A980]+1) -> 3.23567075750787 | E980: of:=(1+SQRT(5))/2 -> 1.6180339887499 | F980: of:=3+[.E980]/LN([.A980]+1) -> 3.2349214720199 | G980: of:=[.D980]-[.F980] -> 0.000749285487972706
A981: 980 | B981: 4785777997 | C981: 3.24 | D981: of:=LN([.B981])/LN([.A981]+1) -> 3.23563620333113 | E981: of:=(1+SQRT(5))/2 -> 1.6180339887499 | F981: of:=3+[.E981]/LN([.A981]+1) -> 3.23488669071095 | G981: of:=[.D981]-[.F981] -> 0.000749512620182635
A982: 981 | B982: 4800442289 | C982: 3.24 | D982: of:=LN([.B982])/LN([.A982]+1) -> 3.23560177903807 | E982: of:=(1+SQRT(5))/2 -> 1.6180339887499 | F982: of:=3+[.E982]/LN([.A982]+1) -> 3.23485195512074 | G982: of:=[.D982]-[.F982] -> 0.000749823917336023
A983: 982 | B983: 4815127965 | C983: 3.24 | D983: of:=LN([.B983])/LN([.A983]+1) -> 3.23556714209486 | E983: of:=(1+SQRT(5))/2 -> 1.6180339887499 | F983: of:=3+[.E983]/LN([.A983]+1) -> 3.23481726514119 | G983: of:=[.D983]-[.F983] -> 0.000749876953670459
A984: 983 | B984: 4829853523 | C984: 3.24 | D984: of:=LN([.B984])/LN([.A984]+1) -> 3.23553284968465 | E984: of:=(1+SQRT(5))/2 -> 1.6180339887499 | F984: of:=3+[.E984]/LN([.A984]+1) -> 3.23478262066459 | G984: of:=[.D984]-[.F984] -> 0.000750229020056725
A985: 984 | B985: 4844603435 | C985: 3.24 | D985: of:=LN([.B985])/LN([.A985]+1) -> 3.23549843290355 | E985: of:=(1+SQRT(5))/2 -> 1.6180339887499 | F985: of:=3+[.E985]/LN([.A985]+1) -> 3.2347480215836 | G985: of:=[.D985]-[.F985] -> 0.000750411319944355
A986: 985 | B986: 4859379849 | C986: 3.24 | D986: of:=LN([.B986])/LN([.A986]+1) -> 3.23546395647337 | E986: of:=(1+SQRT(5))/2 -> 1.6180339887499 | F986: of:=3+[.E986]/LN([.A986]+1) -> 3.23471346779124 | G986: of:=[.D986]-[.F986] -> 0.00075048868213079
A987: 986 | B987: 4874195823 | C987: 3.24 | D987: of:=LN([.B987])/LN([.A987]+1) -> 3.23542980894228 | E987: of:=(1+SQRT(5))/2 -> 1.6180339887499 | F987: of:=3+[.E987]/LN([.A987]+1) -> 3.23467895918089 | G987: of:=[.D987]-[.F987] -> 0.000750849761389727
A988: 987 | B988: 4889037863 | C988: 3.24 | D988: of:=LN([.B988])/LN([.A988]+1) -> 3.2353955863323 | E988: of:=(1+SQRT(5))/2 -> 1.6180339887499 | F988: of:=3+[.E988]/LN([.A988]+1) -> 3.23464449564629 | G988: of:=[.D988]-[.F988] -> 0.000751090686011313
A989: 988 | B989: 4903911447 | C989: 3.24 | D989: of:=LN([.B989])/LN([.A989]+1) -> 3.23536145074695 | E989: of:=(1+SQRT(5))/2 -> 1.6180339887499 | F989: of:=3+[.E989]/LN([.A989]+1) -> 3.23461007708155 | G989: of:=[.D989]-[.F989] -> 0.000751373665399679
A990: 989 | B990: 4918811313 | C990: 3.24 | D990: of:=LN([.B990])/LN([.A990]+1) -> 3.23532724568659 | E990: of:=(1+SQRT(5))/2 -> 1.6180339887499 | F990: of:=3+[.E990]/LN([.A990]+1) -> 3.23457570338113 | G990: of:=[.D990]-[.F990] -> 0.000751542305458042
A991: 990 | B991: 4933744699 | C991: 3.24 | D991: of:=LN([.B991])/LN([.A991]+1) -> 3.23529318388765 | E991: of:=(1+SQRT(5))/2 -> 1.6180339887499 | F991: of:=3+[.E991]/LN([.A991]+1) -> 3.23454137443985 | G991: of:=[.D991]-[.F991] -> 0.000751809447804508
A992: 991 | B992: 4948705509 | C992: 3.24 | D992: of:=LN([.B992])/LN([.A992]+1) -> 3.23525908487902 | E992: of:=(1+SQRT(5))/2 -> 1.6180339887499 | F992: of:=3+[.E992]/LN([.A992]+1) -> 3.23450709015287 | G992: of:=[.D992]-[.F992] -> 0.000751994726152283
A993: 992 | B993: 4963696415 | C993: 3.24 | D993: of:=LN([.B993])/LN([.A993]+1) -> 3.23522502644651 | E993: of:=(1+SQRT(5))/2 -> 1.6180339887499 | F993: of:=3+[.E993]/LN([.A993]+1) -> 3.23447285041573 | G993: of:=[.D993]-[.F993] -> 0.000752176030781815
A994: 993 | B994: 4978722333 | C994: 3.24 | D994: of:=LN([.B994])/LN([.A994]+1) -> 3.23519115069929 | E994: of:=(1+SQRT(5))/2 -> 1.6180339887499 | F994: of:=3+[.E994]/LN([.A994]+1) -> 3.2344386551243 | G994: of:=[.D994]-[.F994] -> 0.00075249557498891
A995: 994 | B995: 4993775639 | C995: 3.24 | D995: of:=LN([.B995])/LN([.A995]+1) -> 3.23515723416281 | E995: of:=(1+SQRT(5))/2 -> 1.6180339887499 | F995: of:=3+[.E995]/LN([.A995]+1) -> 3.2344045041748 | G995: of:=[.D995]-[.F995] -> 0.000752729988010348
A996: 995 | B996: 5008860353 | C996: 3.24 | D996: of:=LN([.B996])/LN([.A996]+1) -> 3.23512339290503 | E996: of:=(1+SQRT(5))/2 -> 1.6180339887499 | F996: of:=3+[.E996]/LN([.A996]+1) -> 3.23437039746383 | G996: of:=[.D996]-[.F996] -> 0.000752995441200444
A997: 996 | B997: 5023973567 | C997: 3.24 | D997: of:=LN([.B997])/LN([.A997]+1) -> 3.23508954181649 | E997: of:=(1+SQRT(5))/2 -> 1.6180339887499 | F997: of:=3+[.E997]/LN([.A997]+1) -> 3.23433633488828 | G997: of:=[.D997]-[.F997] -> 0.000753206928212347
A998: 997 | B998: 5039116499 | C998: 3.24 | D998: of:=LN([.B998])/LN([.A998]+1) -> 3.23505571542492 | E998: of:=(1+SQRT(5))/2 -> 1.6180339887499 | F998: of:=3+[.E998]/LN([.A998]+1) -> 3.23430231634544 | G998: of:=[.D998]-[.F998] -> 0.0007533990794788
A999: 998 | B999: 5054291241 | C999: 3.24 | D999: of:=LN([.B999])/LN([.A999]+1) -> 3.23502197286132 | E999: of:=(1+SQRT(5))/2 -> 1.6180339887499 | F999: of:=3+[.E999]/LN([.A999]+1) -> 3.23426834173292 | G999: of:=[.D999]-[.F999] -> 0.000753631128407761
A1000: 999 | B1000: 5069494611 | C1000: 3.23 | D1000: of:=LN([.B1000])/LN([.A1000]+1) -> 3.23498822190834 | E1000: of:=(1+SQRT(5))/2 -> 1.6180339887499 | F1000: of:=3+[.E1000]/LN([.A1000]+1) -> 3.23423441094866 | G1000: of:=[.D1000]-[.F1000] -> 0.000753810959678525
A1001: 1000 | B1001: 5084733329 | C1001: 3.23 | D1001: of:=LN([.B1001])/LN([.A1001]+1) -> 3.23495465337857 | E1001: of:=(1+SQRT(5))/2 -> 1.6180339887499 | F1001: of:=3+[.E1001]/LN([.A1001]+1) -> 3.23420052389097 | G1001: of:=[.D1001]-[.F1001] -> 0.000754129487599897
A1002: 1001 | B1002: 5100001793 | C1002: 3.23 | D1002: of:=LN([.B1002])/LN([.A1002]+1) -> 3.2349211060289 | E1002: of:=(1+SQRT(5))/2 -> 1.6180339887499 | F1002: of:=3+[.E1002]/LN([.A1002]+1) -> 3.23416668045849 | G1002: of:=[.D1002]-[.F1002] -> 0.000754425570414607
A1003: 1002 | B1003: 5115292961 | C1003: 3.23 | D1003: of:=LN([.B1003])/LN([.A1003]+1) -> 3.23488737989647 | E1003: of:=(1+SQRT(5))/2 -> 1.6180339887499 | F1003: of:=3+[.E1003]/LN([.A1003]+1) -> 3.23413288055017 | G1003: of:=[.D1003]-[.F1003] -> 0.000754499346300896
A1004: 1003 | B1004: 5130624119 | C1004: 3.23 | D1004: of:=LN([.B1004])/LN([.A1004]+1) -> 3.23485396356124 | E1004: of:=(1+SQRT(5))/2 -> 1.6180339887499 | F1004: of:=3+[.E1004]/LN([.A1004]+1) -> 3.23409912406534 | G1004: of:=[.D1004]-[.F1004] -> 0.000754839495898718
A1005: 1004 | B1005: 5145972101 | C1005: 3.23 | D1005: of:=LN([.B1005])/LN([.A1005]+1) -> 3.23482020233808 | E1005: of:=(1+SQRT(5))/2 -> 1.6180339887499 | F1005: of:=3+[.E1005]/LN([.A1005]+1) -> 3.23406541090364 | G1005: of:=[.D1005]-[.F1005] -> 0.000754791434443902
A1006: 1005 | B1006: 5161366757 | C1006: 3.23 | D1006: of:=LN([.B1006])/LN([.A1006]+1) -> 3.2347869354077 | E1006: of:=(1+SQRT(5))/2 -> 1.6180339887499 | F1006: of:=3+[.E1006]/LN([.A1006]+1) -> 3.23403174096504 | G1006: of:=[.D1006]-[.F1006] -> 0.000755194442661367
A1007: 1006 | B1007: 5176782507 | C1007: 3.23 | D1007: of:=LN([.B1007])/LN([.A1007]+1) -> 3.23475344299238 | E1007: of:=(1+SQRT(5))/2 -> 1.6180339887499 | F1007: of:=3+[.E1007]/LN([.A1007]+1) -> 3.23399811414986 | G1007: of:=[.D1007]-[.F1007] -> 0.000755328842519276
A1008: 1007 | B1008: 5192233825 | C1008: 3.23 | D1008: of:=LN([.B1008])/LN([.A1008]+1) -> 3.23472012973468 | E1008: of:=(1+SQRT(5))/2 -> 1.6180339887499 | F1008: of:=3+[.E1008]/LN([.A1008]+1) -> 3.23396453035873 | G1008: of:=[.D1008]-[.F1008] -> 0.000755599375950045
A1009: 1008 | B1009: 5207710269 | C1009: 3.23 | D1009: of:=LN([.B1009])/LN([.A1009]+1) -> 3.23468670352258 | E1009: of:=(1+SQRT(5))/2 -> 1.6180339887499 | F1009: of:=3+[.E1009]/LN([.A1009]+1) -> 3.23393098949264 | G1009: of:=[.D1009]-[.F1009] -> 0.000755714029943455
A1010: 1009 | B1010: 5223220783 | C1010: 3.23 | D1010: of:=LN([.B1010])/LN([.A1010]+1) -> 3.23465341239636 | E1010: of:=(1+SQRT(5))/2 -> 1.6180339887499 | F1010: of:=3+[.E1010]/LN([.A1010]+1) -> 3.23389749145287 | G1010: of:=[.D1010]-[.F1010] -> 0.00075592094349064
A1011: 1010 | B1011: 5238759499 | C1011: 3.23 | D1011: of:=LN([.B1011])/LN([.A1011]+1) -> 3.23462009265804 | E1011: of:=(1+SQRT(5))/2 -> 1.6180339887499 | F1011: of:=3+[.E1011]/LN([.A1011]+1) -> 3.23386403614105 | G1011: of:=[.D1011]-[.F1011] -> 0.00075605651698929
A1012: 1011 | B1012: 5254332181 | C1012: 3.23 | D1012: of:=LN([.B1012])/LN([.A1012]+1) -> 3.23458690256567 | E1012: of:=(1+SQRT(5))/2 -> 1.6180339887499 | F1012: of:=3+[.E1012]/LN([.A1012]+1) -> 3.23383062345913 | G1012: of:=[.D1012]-[.F1012] -> 0.000756279106540969
A1013: 1012 | B1013: 5269940783 | C1013: 3.23 | D1013: of:=LN([.B1013])/LN([.A1013]+1) -> 3.23455389394968 | E1013: of:=(1+SQRT(5))/2 -> 1.6180339887499 | F1013: of:=3+[.E1013]/LN([.A1013]+1) -> 3.23379725330939 | G1013: of:=[.D1013]-[.F1013] -> 0.000756640640291018
A1014: 1013 | B1014: 5285574385 | C1014: 3.23 | D1014: of:=LN([.B1014])/LN([.A1014]+1) -> 3.23452076609993 | E1014: of:=(1+SQRT(5))/2 -> 1.6180339887499 | F1014: of:=3+[.E1014]/LN([.A1014]+1) -> 3.23376392559442 | G1014: of:=[.D1014]-[.F1014] -> 0.000756840505510503
A1015: 1014 | B1015: 5301239041 | C1015: 3.23 | D1015: of:=LN([.B1015])/LN([.A1015]+1) -> 3.2344876845498 | E1015: of:=(1+SQRT(5))/2 -> 1.6180339887499 | F1015: of:=3+[.E1015]/LN([.A1015]+1) -> 3.23373064021713 | G1015: of:=[.D1015]-[.F1015] -> 0.000757044332663437
A1016: 1015 | B1016: 5316945287 | C1016: 3.23 | D1016: of:=LN([.B1016])/LN([.A1016]+1) -> 3.2344549345414 | E1016: of:=(1+SQRT(5))/2 -> 1.6180339887499 | F1016: of:=3+[.E1016]/LN([.A1016]+1) -> 3.23369739708078 | G1016: of:=[.D1016]-[.F1016] -> 0.000757537460622348
A1017: 1016 | B1017: 5332663371 | C1017: 3.23 | D1017: of:=LN([.B1017])/LN([.A1017]+1) -> 3.23442170676161 | E1017: of:=(1+SQRT(5))/2 -> 1.6180339887499 | F1017: of:=3+[.E1017]/LN([.A1017]+1) -> 3.2336641960889 | G1017: of:=[.D1017]-[.F1017] -> 0.000757510672713568
A1018: 1017 | B1018: 5348421945 | C1018: 3.23 | D1018: of:=LN([.B1018])/LN([.A1018]+1) -> 3.23438877861913 | E1018: of:=(1+SQRT(5))/2 -> 1.6180339887499 | F1018: of:=3+[.E1018]/LN([.A1018]+1) -> 3.23363103714537 | G1018: of:=[.D1018]-[.F1018] -> 0.000757741473759843
A1019: 1018 | B1019: 5364209973 | C1019: 3.23 | D1019: of:=LN([.B1019])/LN([.A1019]+1) -> 3.23435584979423 | E1019: of:=(1+SQRT(5))/2 -> 1.6180339887499 | F1019: of:=3+[.E1019]/LN([.A1019]+1) -> 3.23359792015438 | G1019: of:=[.D1019]-[.F1019] -> 0.000757929639854993
A1020: 1019 | B1020: 5380032395 | C1020: 3.23 | D1020: of:=LN([.B1020])/LN([.A1020]+1) -> 3.23432305230842 | E1020: of:=(1+SQRT(5))/2 -> 1.6180339887499 | F1020: of:=3+[.E1020]/LN([.A1020]+1) -> 3.23356484502042 | G1020: of:=[.D1020]-[.F1020] -> 0.000758207288002133
A1021: 1020 | B1021: 5395881425 | C1021: 3.23 | D1021: of:=LN([.B1021])/LN([.A1021]+1) -> 3.23429017615951 | E1021: of:=(1+SQRT(5))/2 -> 1.6180339887499 | F1021: of:=3+[.E1021]/LN([.A1021]+1) -> 3.23353181164832 | G1021: of:=[.D1021]-[.F1021] -> 0.000758364511193932
A1022: 1021 | B1022: 5411764605 | C1022: 3.23 | D1022: of:=LN([.B1022])/LN([.A1022]+1) -> 3.23425742266125 | E1022: of:=(1+SQRT(5))/2 -> 1.6180339887499 | F1022: of:=3+[.E1022]/LN([.A1022]+1) -> 3.2334988199432 | G1022: of:=[.D1022]-[.F1022] -> 0.000758602718051726
A1023: 1022 | B1023: 5427677177 | C1023: 3.23 | D1023: of:=LN([.B1023])/LN([.A1023]+1) -> 3.2342246636727 | E1023: of:=(1+SQRT(5))/2 -> 1.6180339887499 | F1023: of:=3+[.E1023]/LN([.A1023]+1) -> 3.23346586981048 | G1023: of:=[.D1023]-[.F1023] -> 0.000758793862214002
A1024: 1023 | B1024: 5443618437 | C1024: 3.23 | D1024: of:=LN([.B1024])/LN([.A1024]+1) -> 3.23419188006335 | E1024: of:=(1+SQRT(5))/2 -> 1.6180339887499 | F1024: of:=3+[.E1024]/LN([.A1024]+1) -> 3.23343296115593 | G1024: of:=[.D1024]-[.F1024] -> 0.000758918907420192
A1025: 1024 | B1025: 5459601663 | C1025: 3.23 | D1025: of:=LN([.B1025])/LN([.A1025]+1) -> 3.23415942235977 | E1025: of:=(1+SQRT(5))/2 -> 1.6180339887499 | F1025: of:=3+[.E1025]/LN([.A1025]+1) -> 3.23340009388558 | G1025: of:=[.D1025]-[.F1025] -> 0.000759328474190912
A1026: 1025 | B1026: 5475600877 | C1026: 3.23 | D1026: of:=LN([.B1026])/LN([.A1026]+1) -> 3.2341266027811 | E1026: of:=(1+SQRT(5))/2 -> 1.6180339887499 | F1026: of:=3+[.E1026]/LN([.A1026]+1) -> 3.23336726790579 | G1026: of:=[.D1026]-[.F1026] -> 0.000759334875304329
A1027: 1026 | B1027: 5491637353 | C1027: 3.23 | D1027: of:=LN([.B1027])/LN([.A1027]+1) -> 3.23409398277582 | E1027: of:=(1+SQRT(5))/2 -> 1.6180339887499 | F1027: of:=3+[.E1027]/LN([.A1027]+1) -> 3.23333448312324 | G1027: of:=[.D1027]-[.F1027] -> 0.000759499652586815
A1028: 1027 | B1028: 5507714751 | C1028: 3.23 | D1028: of:=LN([.B1028])/LN([.A1028]+1) -> 3.23406165581722 | E1028: of:=(1+SQRT(5))/2 -> 1.6180339887499 | F1028: of:=3+[.E1028]/LN([.A1028]+1) -> 3.23330173944487 | G1028: of:=[.D1028]-[.F1028] -> 0.000759916372341518
A1029: 1028 | B1029: 5523810811 | C1029: 3.23 | D1029: of:=LN([.B1029])/LN([.A1029]+1) -> 3.23402903773293 | E1029: of:=(1+SQRT(5))/2 -> 1.6180339887499 | F1029: of:=3+[.E1029]/LN([.A1029]+1) -> 3.23326903677797 | G1029: of:=[.D1029]-[.F1029] -> 0.000760000954956652
A1030: 1029 | B1030: 5539942985 | C1030: 3.23 | D1030: of:=LN([.B1030])/LN([.A1030]+1) -> 3.23399658476743 | E1030: of:=(1+SQRT(5))/2 -> 1.6180339887499 | F1030: of:=3+[.E1030]/LN([.A1030]+1) -> 3.2332363750301 | G1030: of:=[.D1030]-[.F1030] -> 0.000760209737329376
A1031: 1030 | B1031: 5556114471 | C1031: 3.23 | D1031: of:=LN([.B1031])/LN([.A1031]+1) -> 3.23396437785833 | E1031: of:=(1+SQRT(5))/2 -> 1.6180339887499 | F1031: of:=3+[.E1031]/LN([.A1031]+1) -> 3.23320375410913 | G1031: of:=[.D1031]-[.F1031] -> 0.000760623749198608
A1032: 1031 | B1032: 5572298613 | C1032: 3.23 | D1032: of:=LN([.B1032])/LN([.A1032]+1) -> 3.23393172488492 | E1032: of:=(1+SQRT(5))/2 -> 1.6180339887499 | F1032: of:=3+[.E1032]/LN([.A1032]+1) -> 3.23317117392323 | G1032: of:=[.D1032]-[.F1032] -> 0.000760550961695028
A1033: 1032 | B1033: 5588523235 | C1033: 3.23 | D1033: of:=LN([.B1033])/LN([.A1033]+1) -> 3.23389934678469 | E1033: of:=(1+SQRT(5))/2 -> 1.6180339887499 | F1033: of:=3+[.E1033]/LN([.A1033]+1) -> 3.23313863438086 | G1033: of:=[.D1033]-[.F1033] -> 0.000760712403837349
A1034: 1033 | B1034: 5604785703 | C1034: 3.23 | D1034: of:=LN([.B1034])/LN([.A1034]+1) -> 3.23386717284373 | E1034: of:=(1+SQRT(5))/2 -> 1.6180339887499 | F1034: of:=3+[.E1034]/LN([.A1034]+1) -> 3.23310613539078 | G1034: of:=[.D1034]-[.F1034] -> 0.000761037452949864
A1035: 1034 | B1035: 5621077867 | C1035: 3.23 | D1035: of:=LN([.B1035])/LN([.A1035]+1) -> 3.23383499184229 | E1035: of:=(1+SQRT(5))/2 -> 1.6180339887499 | F1035: of:=3+[.E1035]/LN([.A1035]+1) -> 3.23307367686205 | G1035: of:=[.D1035]-[.F1035] -> 0.000761314980244343
A1036: 1035 | B1036: 5637405045 | C1036: 3.23 | D1036: of:=LN([.B1036])/LN([.A1036]+1) -> 3.23380293920511 | E1036: of:=(1+SQRT(5))/2 -> 1.6180339887499 | F1036: of:=3+[.E1036]/LN([.A1036]+1) -> 3.23304125870401 | G1036: of:=[.D1036]-[.F1036] -> 0.000761680501097484
A1037: 1036 | B1037: 5653748353 | C1037: 3.23 | D1037: of:=LN([.B1037])/LN([.A1037]+1) -> 3.23377053226417 | E1037: of:=(1+SQRT(5))/2 -> 1.6180339887499 | F1037: of:=3+[.E1037]/LN([.A1037]+1) -> 3.23300888082632 | G1037: of:=[.D1037]-[.F1037] -> 0.000761651437854116
A1038: 1037 | B1038: 5670137505 | C1038: 3.23 | D1038: of:=LN([.B1038])/LN([.A1038]+1) -> 3.23373852829044 | E1038: of:=(1+SQRT(5))/2 -> 1.6180339887499 | F1038: of:=3+[.E1038]/LN([.A1038]+1) -> 3.23297654313889 | G1038: of:=[.D1038]-[.F1038] -> 0.000761985151557454
A1039: 1038 | B1039: 5686545233 | C1039: 3.23 | D1039: of:=LN([.B1039])/LN([.A1039]+1) -> 3.23370623278231 | E1039: of:=(1+SQRT(5))/2 -> 1.6180339887499 | F1039: of:=3+[.E1039]/LN([.A1039]+1) -> 3.23294424555195 | G1039: of:=[.D1039]-[.F1039] -> 0.000761987230355921
A1040: 1039 | B1040: 5702997159 | C1040: 3.23 | D1040: of:=LN([.B1040])/LN([.A1040]+1) -> 3.23367429459859 | E1040: of:=(1+SQRT(5))/2 -> 1.6180339887499 | F1040: of:=3+[.E1040]/LN([.A1040]+1) -> 3.23291198797601 | G1040: of:=[.D1040]-[.F1040] -> 0.00076230662257526
A1041: 1040 | B1041: 5719469757 | C1041: 3.23 | D1041: of:=LN([.B1041])/LN([.A1041]+1) -> 3.23364211798981 | E1041: of:=(1+SQRT(5))/2 -> 1.6180339887499 | F1041: of:=3+[.E1041]/LN([.A1041]+1) -> 3.23287977032187 | G1041: of:=[.D1041]-[.F1041] -> 0.000762347667939256
A1042: 1041 | B1042: 5735980765 | C1042: 3.23 | D1042: of:=LN([.B1042])/LN([.A1042]+1) -> 3.2336101496369 | E1042: of:=(1+SQRT(5))/2 -> 1.6180339887499 | F1042: of:=3+[.E1042]/LN([.A1042]+1) -> 3.23284759250062 | G1042: of:=[.D1042]-[.F1042] -> 0.000762557136276598
A1043: 1042 | B1043: 5752523187 | C1043: 3.23 | D1043: of:=LN([.B1043])/LN([.A1043]+1) -> 3.23357821217509 | E1043: of:=(1+SQRT(5))/2 -> 1.6180339887499 | F1043: of:=3+[.E1043]/LN([.A1043]+1) -> 3.23281545442361 | G1043: of:=[.D1043]-[.F1043] -> 0.000762757751475274
A1044: 1043 | B1044: 5769101631 | C1044: 3.23 | D1044: of:=LN([.B1044])/LN([.A1044]+1) -> 3.23354641974536 | E1044: of:=(1+SQRT(5))/2 -> 1.6180339887499 | F1044: of:=3+[.E1044]/LN([.A1044]+1) -> 3.23278335600251 | G1044: of:=[.D1044]-[.F1044] -> 0.000763063742842629
A1045: 1044 | B1045: 5785709749 | C1045: 3.23 | D1045: of:=LN([.B1045])/LN([.A1045]+1) -> 3.2335146127194 | E1045: of:=(1+SQRT(5))/2 -> 1.6180339887499 | F1045: of:=3+[.E1045]/LN([.A1045]+1) -> 3.23275129714925 | G1045: of:=[.D1045]-[.F1045] -> 0.000763315570146528
A1046: 1045 | B1046: 5802342959 | C1046: 3.23 | D1046: of:=LN([.B1046])/LN([.A1046]+1) -> 3.23348267715844 | E1046: of:=(1+SQRT(5))/2 -> 1.6180339887499 | F1046: of:=3+[.E1046]/LN([.A1046]+1) -> 3.23271927777604 | G1046: of:=[.D1046]-[.F1046] -> 0.000763399382401442
A1047: 1046 | B1047: 5819013965 | C1047: 3.23 | D1047: of:=LN([.B1047])/LN([.A1047]+1) -> 3.23345092769177 | E1047: of:=(1+SQRT(5))/2 -> 1.6180339887499 | F1047: of:=3+[.E1047]/LN([.A1047]+1) -> 3.23268729779538 | G1047: of:=[.D1047]-[.F1047] -> 0.000763629896386231
A1048: 1047 | B1048: 5835710667 | C1048: 3.23 | D1048: of:=LN([.B1048])/LN([.A1048]+1) -> 3.23341906402265 | E1048: of:=(1+SQRT(5))/2 -> 1.6180339887499 | F1048: of:=3+[.E1048]/LN([.A1048]+1) -> 3.23265535712005 | G1048: of:=[.D1048]-[.F1048] -> 0.000763706902591643
A1049: 1048 | B1049: 5852447301 | C1049: 3.23 | D1049: of:=LN([.B1049])/LN([.A1049]+1) -> 3.23338743640798 | E1049: of:=(1+SQRT(5))/2 -> 1.6180339887499 | F1049: of:=3+[.E1049]/LN([.A1049]+1) -> 3.2326234556631 | G1049: of:=[.D1049]-[.F1049] -> 0.000763980744878268
A1050: 1049 | B1050: 5869215777 | C1050: 3.23 | D1050: of:=LN([.B1050])/LN([.A1050]+1) -> 3.23335584410477 | E1050: of:=(1+SQRT(5))/2 -> 1.6180339887499 | F1050: of:=3+[.E1050]/LN([.A1050]+1) -> 3.23259159333787 | G1050: of:=[.D1050]-[.F1050] -> 0.000764250766908781
A1051: 1050 | B1051: 5886013411 | C1051: 3.23 | D1051: of:=LN([.B1051])/LN([.A1051]+1) -> 3.23332422077178 | E1051: of:=(1+SQRT(5))/2 -> 1.6180339887499 | F1051: of:=3+[.E1051]/LN([.A1051]+1) -> 3.23255977005794 | G1051: of:=[.D1051]-[.F1051] -> 0.000764450713839349
A1052: 1051 | B1052: 5902842529 | C1052: 3.23 | D1052: of:=LN([.B1052])/LN([.A1052]+1) -> 3.233292622833 | E1052: of:=(1+SQRT(5))/2 -> 1.6180339887499 | F1052: of:=3+[.E1052]/LN([.A1052]+1) -> 3.23252798573722 | G1052: of:=[.D1052]-[.F1052] -> 0.000764637095777676
A1053: 1052 | B1053: 5919706445 | C1053: 3.23 | D1053: of:=LN([.B1053])/LN([.A1053]+1) -> 3.23326113002256 | E1053: of:=(1+SQRT(5))/2 -> 1.6180339887499 | F1053: of:=3+[.E1053]/LN([.A1053]+1) -> 3.23249624028985 | G1053: of:=[.D1053]-[.F1053] -> 0.00076488973271216
A1054: 1053 | B1054: 5936597353 | C1054: 3.23 | D1054: of:=LN([.B1054])/LN([.A1054]+1) -> 3.23322955200947 | E1054: of:=(1+SQRT(5))/2 -> 1.6180339887499 | F1054: of:=3+[.E1054]/LN([.A1054]+1) -> 3.23246453363025 | G1054: of:=[.D1054]-[.F1054] -> 0.000765018379219384
A1055: 1054 | B1055: 5953526683 | C1055: 3.23 | D1055: of:=LN([.B1055])/LN([.A1055]+1) -> 3.23319816486904 | E1055: of:=(1+SQRT(5))/2 -> 1.6180339887499 | F1055: of:=3+[.E1055]/LN([.A1055]+1) -> 3.23243286567312 | G1055: of:=[.D1055]-[.F1055] -> 0.000765299195915947
A1056: 1055 | B1056: 5970478789 | C1056: 3.23 | D1056: of:=LN([.B1056])/LN([.A1056]+1) -> 3.23316659002675 | E1056: of:=(1+SQRT(5))/2 -> 1.6180339887499 | F1056: of:=3+[.E1056]/LN([.A1056]+1) -> 3.23240123633344 | G1056: of:=[.D1056]-[.F1056] -> 0.000765353693310544
A1057: 1056 | B1057: 5987467713 | C1057: 3.23 | D1057: of:=LN([.B1057])/LN([.A1057]+1) -> 3.23313516548471 | E1057: of:=(1+SQRT(5))/2 -> 1.6180339887499 | F1057: of:=3+[.E1057]/LN([.A1057]+1) -> 3.23236964552644 | G1057: of:=[.D1057]-[.F1057] -> 0.000765519958277672
A1058: 1057 | B1058: 6004492085 | C1058: 3.23 | D1058: of:=LN([.B1058])/LN([.A1058]+1) -> 3.23310385667054 | E1058: of:=(1+SQRT(5))/2 -> 1.6180339887499 | F1058: of:=3+[.E1058]/LN([.A1058]+1) -> 3.23233809316761 | G1058: of:=[.D1058]-[.F1058] -> 0.000765763502935446
A1059: 1058 | B1059: 6021546833 | C1059: 3.23 | D1059: of:=LN([.B1059])/LN([.A1059]+1) -> 3.23307254114961 | E1059: of:=(1+SQRT(5))/2 -> 1.6180339887499 | F1059: of:=3+[.E1059]/LN([.A1059]+1) -> 3.23230657917273 | G1059: of:=[.D1059]-[.F1059] -> 0.000765961976874952
A1060: 1059 | B1060: 6038629509 | C1060: 3.23 | D1060: of:=LN([.B1060])/LN([.A1060]+1) -> 3.23304116031493 | E1060: of:=(1+SQRT(5))/2 -> 1.6180339887499 | F1060: of:=3+[.E1060]/LN([.A1060]+1) -> 3.23227510345784 | G1060: of:=[.D1060]-[.F1060] -> 0.00076605685709108
A1061: 1060 | B1061: 6055749345 | C1061: 3.23 | D1061: of:=LN([.B1061])/LN([.A1061]+1) -> 3.23300993309622 | E1061: of:=(1+SQRT(5))/2 -> 1.6180339887499 | F1061: of:=3+[.E1061]/LN([.A1061]+1) -> 3.23224366593924 | G1061: of:=[.D1061]-[.F1061] -> 0.000766267156982803
A1062: 1061 | B1062: 6072903145 | C1062: 3.23 | D1062: of:=LN([.B1062])/LN([.A1062]+1) -> 3.2329787821358 | E1062: of:=(1+SQRT(5))/2 -> 1.6180339887499 | F1062: of:=3+[.E1062]/LN([.A1062]+1) -> 3.23221226653348 | G1062: of:=[.D1062]-[.F1062] -> 0.000766515602319107
A1063: 1062 | B1063: 6090084233 | C1063: 3.23 | D1063: of:=LN([.B1063])/LN([.A1063]+1) -> 3.23294754898954 | E1063: of:=(1+SQRT(5))/2 -> 1.6180339887499 | F1063: of:=3+[.E1063]/LN([.A1063]+1) -> 3.2321809051574 | G1063: of:=[.D1063]-[.F1063] -> 0.00076664383214764
A1064: 1063 | B1064: 6107302635 | C1064: 3.23 | D1064: of:=LN([.B1064])/LN([.A1064]+1) -> 3.23291646945631 | E1064: of:=(1+SQRT(5))/2 -> 1.6180339887499 | F1064: of:=3+[.E1064]/LN([.A1064]+1) -> 3.23214958172808 | G1064: of:=[.D1064]-[.F1064] -> 0.000766887728234522
A1065: 1064 | B1065: 6124551985 | C1065: 3.23 | D1065: of:=LN([.B1065])/LN([.A1065]+1) -> 3.23288539260117 | E1065: of:=(1+SQRT(5))/2 -> 1.6180339887499 | F1065: of:=3+[.E1065]/LN([.A1065]+1) -> 3.23211829616286 | G1065: of:=[.D1065]-[.F1065] -> 0.000767096438309522
A1066: 1065 | B1066: 6141831053 | C1066: 3.23 | D1066: of:=LN([.B1066])/LN([.A1066]+1) -> 3.23285428921145 | E1066: of:=(1+SQRT(5))/2 -> 1.6180339887499 | F1066: of:=3+[.E1066]/LN([.A1066]+1) -> 3.23208704837936 | G1066: of:=[.D1066]-[.F1066] -> 0.000767240832082905
A1067: 1066 | B1067: 6159141475 | C1067: 3.23 | D1067: of:=LN([.B1067])/LN([.A1067]+1) -> 3.23282319715514 | E1067: of:=(1+SQRT(5))/2 -> 1.6180339887499 | F1067: of:=3+[.E1067]/LN([.A1067]+1) -> 3.23205583829545 | G1067: of:=[.D1067]-[.F1067] -> 0.000767358859693701
A1068: 1067 | B1068: 6176493171 | C1068: 3.23 | D1068: of:=LN([.B1068])/LN([.A1068]+1) -> 3.23279234618523 | E1068: of:=(1+SQRT(5))/2 -> 1.6180339887499 | F1068: of:=3+[.E1068]/LN([.A1068]+1) -> 3.23202466582923 | G1068: of:=[.D1068]-[.F1068] -> 0.000767680356007716
A1069: 1068 | B1069: 6193863155 | C1069: 3.23 | D1069: of:=LN([.B1069])/LN([.A1069]+1) -> 3.23276120162287 | E1069: of:=(1+SQRT(5))/2 -> 1.6180339887499 | F1069: of:=3+[.E1069]/LN([.A1069]+1) -> 3.23199353089908 | G1069: of:=[.D1069]-[.F1069] -> 0.000767670723787806
A1070: 1069 | B1070: 6211285245 | C1070: 3.23 | D1070: of:=LN([.B1070])/LN([.A1070]+1) -> 3.23273054613837 | E1070: of:=(1+SQRT(5))/2 -> 1.6180339887499 | F1070: of:=3+[.E1070]/LN([.A1070]+1) -> 3.23196243342365 | G1070: of:=[.D1070]-[.F1070] -> 0.000768112714720548
A1071: 1070 | B1071: 6228725287 | C1071: 3.23 | D1071: of:=LN([.B1071])/LN([.A1071]+1) -> 3.23269958898923 | E1071: of:=(1+SQRT(5))/2 -> 1.6180339887499 | F1071: of:=3+[.E1071]/LN([.A1071]+1) -> 3.23193137332181 | G1071: of:=[.D1071]-[.F1071] -> 0.000768215667426464
A1072: 1071 | B1072: 6246200443 | C1072: 3.23 | D1072: of:=LN([.B1072])/LN([.A1072]+1) -> 3.23266872616021 | E1072: of:=(1+SQRT(5))/2 -> 1.6180339887499 | F1072: of:=3+[.E1072]/LN([.A1072]+1) -> 3.2319003505127 | G1072: of:=[.D1072]-[.F1072] -> 0.000768375647512531
A1073: 1072 | B1073: 6263707481 | C1073: 3.23 | D1073: of:=LN([.B1073])/LN([.A1073]+1) -> 3.23263788242819 | E1073: of:=(1+SQRT(5))/2 -> 1.6180339887499 | F1073: of:=3+[.E1073]/LN([.A1073]+1) -> 3.23186936491571 | G1073: of:=[.D1073]-[.F1073] -> 0.000768517512475864
A1074: 1073 | B1074: 6281251249 | C1074: 3.23 | D1074: of:=LN([.B1074])/LN([.A1074]+1) -> 3.23260716776369 | E1074: of:=(1+SQRT(5))/2 -> 1.6180339887499 | F1074: of:=3+[.E1074]/LN([.A1074]+1) -> 3.23183841645049 | G1074: of:=[.D1074]-[.F1074] -> 0.000768751313194649
A1075: 1074 | B1075: 6298826693 | C1075: 3.23 | D1075: of:=LN([.B1075])/LN([.A1075]+1) -> 3.23257646563326 | E1075: of:=(1+SQRT(5))/2 -> 1.6180339887499 | F1075: of:=3+[.E1075]/LN([.A1075]+1) -> 3.23180750503693 | G1075: of:=[.D1075]-[.F1075] -> 0.000768960596331247
A1076: 1075 | B1076: 6316433305 | C1076: 3.23 | D1076: of:=LN([.B1076])/LN([.A1076]+1) -> 3.23254576395633 | E1076: of:=(1+SQRT(5))/2 -> 1.6180339887499 | F1076: of:=3+[.E1076]/LN([.A1076]+1) -> 3.23177663059515 | G1076: of:=[.D1076]-[.F1076] -> 0.000769133361174568
A1077: 1076 | B1077: 6334072657 | C1077: 3.23 | D1077: of:=LN([.B1077])/LN([.A1077]+1) -> 3.23251509782665 | E1077: of:=(1+SQRT(5))/2 -> 1.6180339887499 | F1077: of:=3+[.E1077]/LN([.A1077]+1) -> 3.23174579304556 | G1077: of:=[.D1077]-[.F1077] -> 0.000769304781095936
A1078: 1077 | B1078: 6351744569 | C1078: 3.23 | D1078: of:=LN([.B1078])/LN([.A1078]+1) -> 3.23248446242846 | E1078: of:=(1+SQRT(5))/2 -> 1.6180339887499 | F1078: of:=3+[.E1078]/LN([.A1078]+1) -> 3.23171499230878 | G1078: of:=[.D1078]-[.F1078] -> 0.000769470119676541
A1079: 1078 | B1079: 6369450309 | C1079: 3.23 | D1079: of:=LN([.B1079])/LN([.A1079]+1) -> 3.23245388555324 | E1079: of:=(1+SQRT(5))/2 -> 1.6180339887499 | F1079: of:=3+[.E1079]/LN([.A1079]+1) -> 3.2316842283057 | G1079: of:=[.D1079]-[.F1079] -> 0.000769657247546629
A1080: 1079 | B1080: 6387188983 | C1080: 3.23 | D1080: of:=LN([.B1080])/LN([.A1080]+1) -> 3.23242334620708 | E1080: of:=(1+SQRT(5))/2 -> 1.6180339887499 | F1080: of:=3+[.E1080]/LN([.A1080]+1) -> 3.23165350095743 | G1080: of:=[.D1080]-[.F1080] -> 0.000769845249653844
A1081: 1080 | B1081: 6404951755 | C1081: 3.23 | D1081: of:=LN([.B1081])/LN([.A1081]+1) -> 3.23239264613501 | E1081: of:=(1+SQRT(5))/2 -> 1.6180339887499 | F1081: of:=3+[.E1081]/LN([.A1081]+1) -> 3.23162281018535 | G1081: of:=[.D1081]-[.F1081] -> 0.000769835949658848
A1082: 1081 | B1082: 6422763579 | C1082: 3.23 | D1082: of:=LN([.B1082])/LN([.A1082]+1) -> 3.23236234239766 | E1082: of:=(1+SQRT(5))/2 -> 1.6180339887499 | F1082: of:=3+[.E1082]/LN([.A1082]+1) -> 3.23159215591107 | G1082: of:=[.D1082]-[.F1082] -> 0.000770186486596103
A1083: 1082 | B1083: 6440601927 | C1083: 3.23 | D1083: of:=LN([.B1083])/LN([.A1083]+1) -> 3.23233193052601 | E1083: of:=(1+SQRT(5))/2 -> 1.6180339887499 | F1083: of:=3+[.E1083]/LN([.A1083]+1) -> 3.23156153805644 | G1083: of:=[.D1083]-[.F1083] -> 0.000770392469574333
A1084: 1083 | B1084: 6458471167 | C1084: 3.23 | D1084: of:=LN([.B1084])/LN([.A1084]+1) -> 3.23230150779576 | E1084: of:=(1+SQRT(5))/2 -> 1.6180339887499 | F1084: of:=3+[.E1084]/LN([.A1084]+1) -> 3.23153095654355 | G1084: of:=[.D1084]-[.F1084] -> 0.000770551252217366
A1085: 1084 | B1085: 6476362097 | C1085: 3.23 | D1085: of:=LN([.B1085])/LN([.A1085]+1) -> 3.23227087057326 | E1085: of:=(1+SQRT(5))/2 -> 1.6180339887499 | F1085: of:=3+[.E1085]/LN([.A1085]+1) -> 3.23150041129473 | G1085: of:=[.D1085]-[.F1085] -> 0.000770459278525593
A1086: 1085 | B1086: 6494313559 | C1086: 3.23 | D1086: of:=LN([.B1086])/LN([.A1086]+1) -> 3.23224087589367 | E1086: of:=(1+SQRT(5))/2 -> 1.6180339887499 | F1086: of:=3+[.E1086]/LN([.A1086]+1) -> 3.23146990223257 | G1086: of:=[.D1086]-[.F1086] -> 0.000770973661106567
A1087: 1086 | B1087: 6512278797 | C1087: 3.23 | D1087: of:=LN([.B1087])/LN([.A1087]+1) -> 3.23221049079223 | E1087: of:=(1+SQRT(5))/2 -> 1.6180339887499 | F1087: of:=3+[.E1087]/LN([.A1087]+1) -> 3.23143942927986 | G1087: of:=[.D1087]-[.F1087] -> 0.000771061512367055
A1088: 1087 | B1088: 6530283111 | C1088: 3.23 | D1088: of:=LN([.B1088])/LN([.A1088]+1) -> 3.23218027230264 | E1088: of:=(1+SQRT(5))/2 -> 1.6180339887499 | F1088: of:=3+[.E1088]/LN([.A1088]+1) -> 3.23140899235966 | G1088: of:=[.D1088]-[.F1088] -> 0.000771279942975767
A1089: 1088 | B1089: 6548316769 | C1089: 3.23 | D1089: of:=LN([.B1089])/LN([.A1089]+1) -> 3.23215000602719 | E1089: of:=(1+SQRT(5))/2 -> 1.6180339887499 | F1089: of:=3+[.E1089]/LN([.A1089]+1) -> 3.23137859139525 | G1089: of:=[.D1089]-[.F1089] -> 0.000771414631945078
A1090: 1089 | B1090: 6566381875 | C1090: 3.23 | D1090: of:=LN([.B1090])/LN([.A1090]+1) -> 3.23211973776043 | E1090: of:=(1+SQRT(5))/2 -> 1.6180339887499 | F1090: of:=3+[.E1090]/LN([.A1090]+1) -> 3.23134822631014 | G1090: of:=[.D1090]-[.F1090] -> 0.000771511450293083
A1091: 1090 | B1091: 6584484407 | C1091: 3.23 | D1091: of:=LN([.B1091])/LN([.A1091]+1) -> 3.23208959688388 | E1091: of:=(1+SQRT(5))/2 -> 1.6180339887499 | F1091: of:=3+[.E1091]/LN([.A1091]+1) -> 3.23131789702809 | G1091: of:=[.D1091]-[.F1091] -> 0.000771699855790953
A1092: 1091 | B1092: 6602619051 | C1092: 3.23 | D1092: of:=LN([.B1092])/LN([.A1092]+1) -> 3.23205946682418 | E1092: of:=(1+SQRT(5))/2 -> 1.6180339887499 | F1092: of:=3+[.E1092]/LN([.A1092]+1) -> 3.23128760347309 | G1092: of:=[.D1092]-[.F1092] -> 0.000771863351091806
A1093: 1092 | B1093: 6620787247 | C1093: 3.23 | D1093: of:=LN([.B1093])/LN([.A1093]+1) -> 3.23202937814522 | E1093: of:=(1+SQRT(5))/2 -> 1.6180339887499 | F1093: of:=3+[.E1093]/LN([.A1093]+1) -> 3.23125734556935 | G1093: of:=[.D1093]-[.F1093] -> 0.000772032575869996
A1094: 1093 | B1094: 6638996241 | C1094: 3.23 | D1094: of:=LN([.B1094])/LN([.A1094]+1) -> 3.23199948603577 | E1094: of:=(1+SQRT(5))/2 -> 1.6180339887499 | F1094: of:=3+[.E1094]/LN([.A1094]+1) -> 3.23122712324132 | G1094: of:=[.D1094]-[.F1094] -> 0.000772362794453141
A1095: 1094 | B1095: 6657226381 | C1095: 3.23 | D1095: of:=LN([.B1095])/LN([.A1095]+1) -> 3.23196936657678 | E1095: of:=(1+SQRT(5))/2 -> 1.6180339887499 | F1095: of:=3+[.E1095]/LN([.A1095]+1) -> 3.23119693641367 | G1095: of:=[.D1095]-[.F1095] -> 0.000772430163102467
A1096: 1095 | B1096: 6675496861 | C1096: 3.23 | D1096: of:=LN([.B1096])/LN([.A1096]+1) -> 3.23193943208596 | E1096: of:=(1+SQRT(5))/2 -> 1.6180339887499 | F1096: of:=3+[.E1096]/LN([.A1096]+1) -> 3.23116678501133 | G1096: of:=[.D1096]-[.F1096] -> 0.000772647074624988
A1097: 1096 | B1097: 6693793681 | C1097: 3.23 | D1097: of:=LN([.B1097])/LN([.A1097]+1) -> 3.23190938178247 | E1097: of:=(1+SQRT(5))/2 -> 1.6180339887499 | F1097: of:=3+[.E1097]/LN([.A1097]+1) -> 3.23113666895943 | G1097: of:=[.D1097]-[.F1097] -> 0.000772712823043253
A1098: 1097 | B1098: 6712131099 | C1098: 3.23 | D1098: of:=LN([.B1098])/LN([.A1098]+1) -> 3.23187951964246 | E1098: of:=(1+SQRT(5))/2 -> 1.6180339887499 | F1098: of:=3+[.E1098]/LN([.A1098]+1) -> 3.23110658818332 | G1098: of:=[.D1098]-[.F1098] -> 0.000772931459135151
A1099: 1098 | B1099: 6730502741 | C1099: 3.23 | D1099: of:=LN([.B1099])/LN([.A1099]+1) -> 3.23184970838404 | E1099: of:=(1+SQRT(5))/2 -> 1.6180339887499 | F1099: of:=3+[.E1099]/LN([.A1099]+1) -> 3.23107654260861 | G1099: of:=[.D1099]-[.F1099] -> 0.000773165775428186
A1100: 1099 | B1100: 6748902279 | C1100: 3.23 | D1100: of:=LN([.B1100])/LN([.A1100]+1) -> 3.23181981326139 | E1100: of:=(1+SQRT(5))/2 -> 1.6180339887499 | F1100: of:=3+[.E1100]/LN([.A1100]+1) -> 3.23104653216111 | G1100: of:=[.D1100]-[.F1100] -> 0.000773281100280077
A1101: 1100 | B1101: 6767341739 | C1101: 3.23 | D1101: of:=LN([.B1101])/LN([.A1101]+1) -> 3.23179008829489 | E1101: of:=(1+SQRT(5))/2 -> 1.6180339887499 | F1101: of:=3+[.E1101]/LN([.A1101]+1) -> 3.23101655676687 | G1101: of:=[.D1101]-[.F1101] -> 0.00077353152802262
A1102: 1101 | B1102: 6785802785 | C1102: 3.23 | D1102: of:=LN([.B1102])/LN([.A1102]+1) -> 3.23176014586573 | E1102: of:=(1+SQRT(5))/2 -> 1.6180339887499 | F1102: of:=3+[.E1102]/LN([.A1102]+1) -> 3.23098661635215 | G1102: of:=[.D1102]-[.F1102] -> 0.000773529513578009
A1103: 1102 | B1103: 6804309811 | C1103: 3.23 | D1103: of:=LN([.B1103])/LN([.A1103]+1) -> 3.23173049914548 | E1103: of:=(1+SQRT(5))/2 -> 1.6180339887499 | F1103: of:=3+[.E1103]/LN([.A1103]+1) -> 3.23095671084344 | G1103: of:=[.D1103]-[.F1103] -> 0.000773788302041556
A1104: 1103 | B1104: 6822844683 | C1104: 3.23 | D1104: of:=LN([.B1104])/LN([.A1104]+1) -> 3.23170076586905 | E1104: of:=(1+SQRT(5))/2 -> 1.6180339887499 | F1104: of:=3+[.E1104]/LN([.A1104]+1) -> 3.23092684016746 | G1104: of:=[.D1104]-[.F1104] -> 0.000773925701595513
A1105: 1104 | B1105: 6841406803 | C1105: 3.23 | D1105: of:=LN([.B1105])/LN([.A1105]+1) -> 3.23167093388549 | E1105: of:=(1+SQRT(5))/2 -> 1.6180339887499 | F1105: of:=3+[.E1105]/LN([.A1105]+1) -> 3.23089700425113 | G1105: of:=[.D1105]-[.F1105] -> 0.000773929634353632
A1106: 1105 | B1106: 6860019129 | C1106: 3.23 | D1106: of:=LN([.B1106])/LN([.A1106]+1) -> 3.23164148113465 | E1106: of:=(1+SQRT(5))/2 -> 1.6180339887499 | F1106: of:=3+[.E1106]/LN([.A1106]+1) -> 3.23086720302162 | G1106: of:=[.D1106]-[.F1106] -> 0.000774278113029769
A1107: 1106 | B1107: 6878658185 | C1107: 3.23 | D1107: of:=LN([.B1107])/LN([.A1107]+1) -> 3.23161191707891 | E1107: of:=(1+SQRT(5))/2 -> 1.6180339887499 | F1107: of:=3+[.E1107]/LN([.A1107]+1) -> 3.2308374364063 | G1107: of:=[.D1107]-[.F1107] -> 0.000774480672608213
A1108: 1107 | B1108: 6897332215 | C1108: 3.23 | D1108: of:=LN([.B1108])/LN([.A1108]+1) -> 3.23158241274956 | E1108: of:=(1+SQRT(5))/2 -> 1.6180339887499 | F1108: of:=3+[.E1108]/LN([.A1108]+1) -> 3.23080770433276 | G1108: of:=[.D1108]-[.F1108] -> 0.000774708416802827
A1109: 1108 | B1109: 6916033173 | C1109: 3.23 | D1109: of:=LN([.B1109])/LN([.A1109]+1) -> 3.23155280129698 | E1109: of:=(1+SQRT(5))/2 -> 1.6180339887499 | F1109: of:=3+[.E1109]/LN([.A1109]+1) -> 3.23077800672881 | G1109: of:=[.D1109]-[.F1109] -> 0.000774794568167536
A1110: 1109 | B1110: 6934777503 | C1110: 3.23 | D1110: of:=LN([.B1110])/LN([.A1110]+1) -> 3.23152342138419 | E1110: of:=(1+SQRT(5))/2 -> 1.6180339887499 | F1110: of:=3+[.E1110]/LN([.A1110]+1) -> 3.23074834352249 | G1110: of:=[.D1110]-[.F1110] -> 0.000775077861705054
A1111: 1110 | B1111: 6953547773 | C1111: 3.23 | D1111: of:=LN([.B1111])/LN([.A1111]+1) -> 3.23149391317383 | E1111: of:=(1+SQRT(5))/2 -> 1.6180339887499 | F1111: of:=3+[.E1111]/LN([.A1111]+1) -> 3.23071871464203 | G1111: of:=[.D1111]-[.F1111] -> 0.000775198531798971
A1112: 1111 | B1112: 6972351147 | C1112: 3.23 | D1112: of:=LN([.B1112])/LN([.A1112]+1) -> 3.23146442383761 | E1112: of:=(1+SQRT(5))/2 -> 1.6180339887499 | F1112: of:=3+[.E1112]/LN([.A1112]+1) -> 3.23068912001589 | G1112: of:=[.D1112]-[.F1112] -> 0.000775303821718865
A1113: 1112 | B1113: 6991189181 | C1113: 3.23 | D1113: of:=LN([.B1113])/LN([.A1113]+1) -> 3.23143498453921 | E1113: of:=(1+SQRT(5))/2 -> 1.6180339887499 | F1113: of:=3+[.E1113]/LN([.A1113]+1) -> 3.23065955957276 | G1113: of:=[.D1113]-[.F1113] -> 0.000775424966451332
A1114: 1113 | B1114: 7010067639 | C1114: 3.23 | D1114: of:=LN([.B1114])/LN([.A1114]+1) -> 3.23140571165288 | E1114: of:=(1+SQRT(5))/2 -> 1.6180339887499 | F1114: of:=3+[.E1114]/LN([.A1114]+1) -> 3.23063003324152 | G1114: of:=[.D1114]-[.F1114] -> 0.00077567841135906
A1115: 1114 | B1115: 7028974593 | C1115: 3.23 | D1115: of:=LN([.B1115])/LN([.A1115]+1) -> 3.23137636151841 | E1115: of:=(1+SQRT(5))/2 -> 1.6180339887499 | F1115: of:=3+[.E1115]/LN([.A1115]+1) -> 3.23060054095127 | G1115: of:=[.D1115]-[.F1115] -> 0.00077582056714931
A1116: 1115 | B1116: 7047917319 | C1116: 3.23 | D1116: of:=LN([.B1116])/LN([.A1116]+1) -> 3.23134708149723 | E1116: of:=(1+SQRT(5))/2 -> 1.6180339887499 | F1116: of:=3+[.E1116]/LN([.A1116]+1) -> 3.23057108263132 | G1116: of:=[.D1116]-[.F1116] -> 0.000775998865906846
A1117: 1116 | B1117: 7066888793 | C1117: 3.23 | D1117: of:=LN([.B1117])/LN([.A1117]+1) -> 3.2313177289795 | E1117: of:=(1+SQRT(5))/2 -> 1.6180339887499 | F1117: of:=3+[.E1117]/LN([.A1117]+1) -> 3.2305416582112 | G1117: of:=[.D1117]-[.F1117] -> 0.000776070768303327
A1118: 1117 | B1118: 7085902451 | C1118: 3.23 | D1118: of:=LN([.B1118])/LN([.A1118]+1) -> 3.23128857431174 | E1118: of:=(1+SQRT(5))/2 -> 1.6180339887499 | F1118: of:=3+[.E1118]/LN([.A1118]+1) -> 3.23051226762065 | G1118: of:=[.D1118]-[.F1118] -> 0.0007763066910913
A1119: 1118 | B1119: 7104941119 | C1119: 3.23 | D1119: of:=LN([.B1119])/LN([.A1119]+1) -> 3.23125927111078 | E1119: of:=(1+SQRT(5))/2 -> 1.6180339887499 | F1119: of:=3+[.E1119]/LN([.A1119]+1) -> 3.23048291078961 | G1119: of:=[.D1119]-[.F1119] -> 0.000776360321169456
A1120: 1119 | B1120: 7124021755 | C1120: 3.23 | D1120: of:=LN([.B1120])/LN([.A1120]+1) -> 3.23123015926331 | E1120: of:=(1+SQRT(5))/2 -> 1.6180339887499 | F1120: of:=3+[.E1120]/LN([.A1120]+1) -> 3.23045358764823 | G1120: of:=[.D1120]-[.F1120] -> 0.000776571615082933
A1121: 1120 | B1121: 7143132421 | C1121: 3.23 | D1121: of:=LN([.B1121])/LN([.A1121]+1) -> 3.23120099876238 | E1121: of:=(1+SQRT(5))/2 -> 1.6180339887499 | F1121: of:=3+[.E1121]/LN([.A1121]+1) -> 3.23042429812688 | G1121: of:=[.D1121]-[.F1121] -> 0.00077670063549995
A1122: 1121 | B1122: 7162274403 | C1122: 3.23 | D1122: of:=LN([.B1122])/LN([.A1122]+1) -> 3.2311718151872 | E1122: of:=(1+SQRT(5))/2 -> 1.6180339887499 | F1122: of:=3+[.E1122]/LN([.A1122]+1) -> 3.23039504215612 | G1122: of:=[.D1122]-[.F1122] -> 0.00077677303107393
A1123: 1122 | B1123: 7181458443 | C1123: 3.23 | D1123: of:=LN([.B1123])/LN([.A1123]+1) -> 3.23114282130009 | E1123: of:=(1+SQRT(5))/2 -> 1.6180339887499 | F1123: of:=3+[.E1123]/LN([.A1123]+1) -> 3.23036581966674 | G1123: of:=[.D1123]-[.F1123] -> 0.000777001633350594
A1124: 1123 | B1124: 7200677919 | C1124: 3.23 | D1124: of:=LN([.B1124])/LN([.A1124]+1) -> 3.23111388420312 | E1124: of:=(1+SQRT(5))/2 -> 1.6180339887499 | F1124: of:=3+[.E1124]/LN([.A1124]+1) -> 3.2303366305897 | G1124: of:=[.D1124]-[.F1124] -> 0.000777253613421625
A1125: 1124 | B1125: 7219928373 | C1125: 3.23 | D1125: of:=LN([.B1125])/LN([.A1125]+1) -> 3.23108491513974 | E1125: of:=(1+SQRT(5))/2 -> 1.6180339887499 | F1125: of:=3+[.E1125]/LN([.A1125]+1) -> 3.2303074748562 | G1125: of:=[.D1125]-[.F1125] -> 0.000777440283540543
A1126: 1125 | B1126: 7239213291 | C1126: 3.23 | D1126: of:=LN([.B1126])/LN([.A1126]+1) -> 3.23105598251829 | E1126: of:=(1+SQRT(5))/2 -> 1.6180339887499 | F1126: of:=3+[.E1126]/LN([.A1126]+1) -> 3.23027835239763 | G1126: of:=[.D1126]-[.F1126] -> 0.000777630120660344
A1127: 1126 | B1127: 7258536913 | C1127: 3.23 | D1127: of:=LN([.B1127])/LN([.A1127]+1) -> 3.2310271687678 | E1127: of:=(1+SQRT(5))/2 -> 1.6180339887499 | F1127: of:=3+[.E1127]/LN([.A1127]+1) -> 3.23024926314558 | G1127: of:=[.D1127]-[.F1127] -> 0.000777905622220132
A1128: 1127 | B1128: 7277881241 | C1128: 3.23 | D1128: of:=LN([.B1128])/LN([.A1128]+1) -> 3.23099812064173 | E1128: of:=(1+SQRT(5))/2 -> 1.6180339887499 | F1128: of:=3+[.E1128]/LN([.A1128]+1) -> 3.23022020703184 | G1128: of:=[.D1128]-[.F1128] -> 0.000777913609890657
A1129: 1128 | B1129: 7297266259 | C1129: 3.23 | D1129: of:=LN([.B1129])/LN([.A1129]+1) -> 3.2309692293103 | E1129: of:=(1+SQRT(5))/2 -> 1.6180339887499 | F1129: of:=3+[.E1129]/LN([.A1129]+1) -> 3.23019118398842 | G1129: of:=[.D1129]-[.F1129] -> 0.000778045321875975
A1130: 1129 | B1130: 7316684365 | C1130: 3.23 | D1130: of:=LN([.B1130])/LN([.A1130]+1) -> 3.23094034528647 | E1130: of:=(1+SQRT(5))/2 -> 1.6180339887499 | F1130: of:=3+[.E1130]/LN([.A1130]+1) -> 3.23016219394751 | G1130: of:=[.D1130]-[.F1130] -> 0.000778151338961752
A1131: 1130 | B1131: 7336140021 | C1131: 3.23 | D1131: of:=LN([.B1131])/LN([.A1131]+1) -> 3.23091155463145 | E1131: of:=(1+SQRT(5))/2 -> 1.6180339887499 | F1131: of:=3+[.E1131]/LN([.A1131]+1) -> 3.2301332368415 | G1131: of:=[.D1131]-[.F1131] -> 0.000778317789944527
A1132: 1131 | B1132: 7355633489 | C1132: 3.23 | D1132: of:=LN([.B1132])/LN([.A1132]+1) -> 3.23088286124943 | E1132: of:=(1+SQRT(5))/2 -> 1.6180339887499 | F1132: of:=3+[.E1132]/LN([.A1132]+1) -> 3.23010431260301 | G1132: of:=[.D1132]-[.F1132] -> 0.000778548646424238
A1133: 1132 | B1133: 7375158489 | C1133: 3.23 | D1133: of:=LN([.B1133])/LN([.A1133]+1) -> 3.23085414286785 | E1133: of:=(1+SQRT(5))/2 -> 1.6180339887499 | F1133: of:=3+[.E1133]/LN([.A1133]+1) -> 3.23007542116481 | G1133: of:=[.D1133]-[.F1133] -> 0.000778721703037277
A1134: 1133 | B1134: 7394719807 | C1134: 3.23 | D1134: of:=LN([.B1134])/LN([.A1134]+1) -> 3.23082549132998 | E1134: of:=(1+SQRT(5))/2 -> 1.6180339887499 | F1134: of:=3+[.E1134]/LN([.A1134]+1) -> 3.23004656245991 | G1134: of:=[.D1134]-[.F1134] -> 0.000778928870067031
A1135: 1134 | B1135: 7414309913 | C1135: 3.23 | D1135: of:=LN([.B1135])/LN([.A1135]+1) -> 3.23079676132197 | E1135: of:=(1+SQRT(5))/2 -> 1.6180339887499 | F1135: of:=3+[.E1135]/LN([.A1135]+1) -> 3.2300177364215 | G1135: of:=[.D1135]-[.F1135] -> 0.000779024900470215
A1136: 1135 | B1136: 7433931485 | C1136: 3.23 | D1136: of:=LN([.B1136])/LN([.A1136]+1) -> 3.23076800431808 | E1136: of:=(1+SQRT(5))/2 -> 1.6180339887499 | F1136: of:=3+[.E1136]/LN([.A1136]+1) -> 3.22998894298296 | G1136: of:=[.D1136]-[.F1136] -> 0.000779061335111742
A1137: 1136 | B1137: 7453596703 | C1137: 3.23 | D1137: of:=LN([.B1137])/LN([.A1137]+1) -> 3.2307394524084 | E1137: of:=(1+SQRT(5))/2 -> 1.6180339887499 | F1137: of:=3+[.E1137]/LN([.A1137]+1) -> 3.22996018207788 | G1137: of:=[.D1137]-[.F1137] -> 0.000779270330518056
A1138: 1137 | B1138: 7473299713 | C1138: 3.23 | D1138: of:=LN([.B1138])/LN([.A1138]+1) -> 3.23071099220338 | E1138: of:=(1+SQRT(5))/2 -> 1.6180339887499 | F1138: of:=3+[.E1138]/LN([.A1138]+1) -> 3.22993145364004 | G1138: of:=[.D1138]-[.F1138] -> 0.000779538563342896
A1139: 1138 | B1139: 7493024073 | C1139: 3.23 | D1139: of:=LN([.B1139])/LN([.A1139]+1) -> 3.23068231078191 | E1139: of:=(1+SQRT(5))/2 -> 1.6180339887499 | F1139: of:=3+[.E1139]/LN([.A1139]+1) -> 3.2299027576034 | G1139: of:=[.D1139]-[.F1139] -> 0.000779553178510639
A1140: 1139 | B1140: 7512786869 | C1140: 3.23 | D1140: of:=LN([.B1140])/LN([.A1140]+1) -> 3.23065373269743 | E1140: of:=(1+SQRT(5))/2 -> 1.6180339887499 | F1140: of:=3+[.E1140]/LN([.A1140]+1) -> 3.22987409390213 | G1140: of:=[.D1140]-[.F1140] -> 0.000779638795298077
A1141: 1140 | B1141: 7532589075 | C1141: 3.23 | D1141: of:=LN([.B1141])/LN([.A1141]+1) -> 3.23062527509123 | E1141: of:=(1+SQRT(5))/2 -> 1.6180339887499 | F1141: of:=3+[.E1141]/LN([.A1141]+1) -> 3.22984546247059 | G1141: of:=[.D1141]-[.F1141] -> 0.000779812620641529
A1142: 1141 | B1142: 7552430987 | C1142: 3.23 | D1142: of:=LN([.B1142])/LN([.A1142]+1) -> 3.23059694216235 | E1142: of:=(1+SQRT(5))/2 -> 1.6180339887499 | F1142: of:=3+[.E1142]/LN([.A1142]+1) -> 3.22981686324332 | G1142: of:=[.D1142]-[.F1142] -> 0.000780078919025318
A1143: 1142 | B1143: 7572298505 | C1143: 3.23 | D1143: of:=LN([.B1143])/LN([.A1143]+1) -> 3.23056846806631 | E1143: of:=(1+SQRT(5))/2 -> 1.6180339887499 | F1143: of:=3+[.E1143]/LN([.A1143]+1) -> 3.22978829615508 | G1143: of:=[.D1143]-[.F1143] -> 0.000780171911236138
A1144: 1143 | B1144: 7592211339 | C1144: 3.23 | D1144: of:=LN([.B1144])/LN([.A1144]+1) -> 3.23054022223376 | E1144: of:=(1+SQRT(5))/2 -> 1.6180339887499 | F1144: of:=3+[.E1144]/LN([.A1144]+1) -> 3.22975976114078 | G1144: of:=[.D1144]-[.F1144] -> 0.000780461092975582
A1145: 1144 | B1145: 7612143311 | C1145: 3.23 | D1145: of:=LN([.B1145])/LN([.A1145]+1) -> 3.23051171414357 | E1145: of:=(1+SQRT(5))/2 -> 1.6180339887499 | F1145: of:=3+[.E1145]/LN([.A1145]+1) -> 3.22973125813555 | G1145: of:=[.D1145]-[.F1145] -> 0.000780456008020458
A1146: 1145 | B1146: 7632122683 | C1146: 3.23 | D1146: of:=LN([.B1146])/LN([.A1146]+1) -> 3.23048347127735 | E1146: of:=(1+SQRT(5))/2 -> 1.6180339887499 | F1146: of:=3+[.E1146]/LN([.A1146]+1) -> 3.2297027870747 | G1146: of:=[.D1146]-[.F1146] -> 0.0007806842026441
A1147: 1146 | B1147: 7652125889 | C1147: 3.23 | D1147: of:=LN([.B1147])/LN([.A1147]+1) -> 3.23045505394114 | E1147: of:=(1+SQRT(5))/2 -> 1.6180339887499 | F1147: of:=3+[.E1147]/LN([.A1147]+1) -> 3.22967434789373 | G1147: of:=[.D1147]-[.F1147] -> 0.00078070604741276
A1148: 1147 | B1148: 7672174489 | C1148: 3.23 | D1148: of:=LN([.B1148])/LN([.A1148]+1) -> 3.23042686203975 | E1148: of:=(1+SQRT(5))/2 -> 1.6180339887499 | F1148: of:=3+[.E1148]/LN([.A1148]+1) -> 3.22964594052832 | G1148: of:=[.D1148]-[.F1148] -> 0.000780921511431387
A1149: 1148 | B1149: 7692254527 | C1149: 3.23 | D1149: of:=LN([.B1149])/LN([.A1149]+1) -> 3.23039863588978 | E1149: of:=(1+SQRT(5))/2 -> 1.6180339887499 | F1149: of:=3+[.E1149]/LN([.A1149]+1) -> 3.22961756491434 | G1149: of:=[.D1149]-[.F1149] -> 0.000781070975444553
A1150: 1149 | B1150: 7712370357 | C1150: 3.23 | D1150: of:=LN([.B1150])/LN([.A1150]+1) -> 3.23037045551013 | E1150: of:=(1+SQRT(5))/2 -> 1.6180339887499 | F1150: of:=3+[.E1150]/LN([.A1150]+1) -> 3.22958922098785 | G1150: of:=[.D1150]-[.F1150] -> 0.000781234522281959
A1151: 1150 | B1151: 7732521457 | C1151: 3.23 | D1151: of:=LN([.B1151])/LN([.A1151]+1) -> 3.23034231058276 | E1151: of:=(1+SQRT(5))/2 -> 1.6180339887499 | F1151: of:=3+[.E1151]/LN([.A1151]+1) -> 3.2295609086851 | G1151: of:=[.D1151]-[.F1151] -> 0.000781401897656853
A1152: 1151 | B1152: 7752706535 | C1152: 3.23 | D1152: of:=LN([.B1152])/LN([.A1152]+1) -> 3.23031417681174 | E1152: of:=(1+SQRT(5))/2 -> 1.6180339887499 | F1152: of:=3+[.E1152]/LN([.A1152]+1) -> 3.22953262794251 | G1152: of:=[.D1152]-[.F1152] -> 0.000781548869234427
A1153: 1152 | B1153: 7772920869 | C1153: 3.23 | D1153: of:=LN([.B1153])/LN([.A1153]+1) -> 3.23028596757411 | E1153: of:=(1+SQRT(5))/2 -> 1.6180339887499 | F1153: of:=3+[.E1153]/LN([.A1153]+1) -> 3.22950437869669 | G1153: of:=[.D1153]-[.F1153] -> 0.000781588877423189
A1154: 1153 | B1154: 7793180143 | C1154: 3.23 | D1154: of:=LN([.B1154])/LN([.A1154]+1) -> 3.2302579685484 | E1154: of:=(1+SQRT(5))/2 -> 1.6180339887499 | F1154: of:=3+[.E1154]/LN([.A1154]+1) -> 3.22947616088444 | G1154: of:=[.D1154]-[.F1154] -> 0.00078180766395386
A1155: 1154 | B1155: 7813470925 | C1155: 3.23 | D1155: of:=LN([.B1155])/LN([.A1155]+1) -> 3.23022993388211 | E1155: of:=(1+SQRT(5))/2 -> 1.6180339887499 | F1155: of:=3+[.E1155]/LN([.A1155]+1) -> 3.22944797444274 | G1155: of:=[.D1155]-[.F1155] -> 0.000781959439368762
A1156: 1155 | B1156: 7833804315 | C1156: 3.23 | D1156: of:=LN([.B1156])/LN([.A1156]+1) -> 3.23020206441028 | E1156: of:=(1+SQRT(5))/2 -> 1.6180339887499 | F1156: of:=3+[.E1156]/LN([.A1156]+1) -> 3.22941981930875 | G1156: of:=[.D1156]-[.F1156] -> 0.000782245101533796
A1157: 1156 | B1157: 7854163423 | C1157: 3.23 | D1157: of:=LN([.B1157])/LN([.A1157]+1) -> 3.23017405355398 | E1157: of:=(1+SQRT(5))/2 -> 1.6180339887499 | F1157: of:=3+[.E1157]/LN([.A1157]+1) -> 3.2293916954198 | G1157: of:=[.D1157]-[.F1157] -> 0.000782358134176597
A1158: 1157 | B1158: 7874559759 | C1158: 3.23 | D1158: of:=LN([.B1158])/LN([.A1158]+1) -> 3.23014610930079 | E1158: of:=(1+SQRT(5))/2 -> 1.6180339887499 | F1158: of:=3+[.E1158]/LN([.A1158]+1) -> 3.22936360271343 | G1158: of:=[.D1158]-[.F1158] -> 0.000782506587358789
A1159: 1158 | B1159: 7894985781 | C1159: 3.23 | D1159: of:=LN([.B1159])/LN([.A1159]+1) -> 3.23011809535172 | E1159: of:=(1+SQRT(5))/2 -> 1.6180339887499 | F1159: of:=3+[.E1159]/LN([.A1159]+1) -> 3.22933554112733 | G1159: of:=[.D1159]-[.F1159] -> 0.000782554224389553
A1160: 1159 | B1160: 7915453783 | C1160: 3.23 | D1160: of:=LN([.B1160])/LN([.A1160]+1) -> 3.23009023202993 | E1160: of:=(1+SQRT(5))/2 -> 1.6180339887499 | F1160: of:=3+[.E1160]/LN([.A1160]+1) -> 3.22930751059937 | G1160: of:=[.D1160]-[.F1160] -> 0.00078272143055802
A1161: 1160 | B1161: 7935958053 | C1161: 3.23 | D1161: of:=LN([.B1161])/LN([.A1161]+1) -> 3.23006241576623 | E1161: of:=(1+SQRT(5))/2 -> 1.6180339887499 | F1161: of:=3+[.E1161]/LN([.A1161]+1) -> 3.22927951106763 | G1161: of:=[.D1161]-[.F1161] -> 0.000782904698599651
A1162: 1161 | B1162: 7956489719 | C1162: 3.23 | D1162: of:=LN([.B1162])/LN([.A1162]+1) -> 3.2300344878354 | E1162: of:=(1+SQRT(5))/2 -> 1.6180339887499 | F1162: of:=3+[.E1162]/LN([.A1162]+1) -> 3.22925154247034 | G1162: of:=[.D1162]-[.F1162] -> 0.000782945365056964
A1163: 1162 | B1163: 7977071193 | C1163: 3.23 | D1163: of:=LN([.B1163])/LN([.A1163]+1) -> 3.23000684681115 | E1163: of:=(1+SQRT(5))/2 -> 1.6180339887499 | F1163: of:=3+[.E1163]/LN([.A1163]+1) -> 3.22922360474591 | G1163: of:=[.D1163]-[.F1163] -> 0.000783242065244494
A1164: 1163 | B1164: 7997681131 | C1164: 3.23 | D1164: of:=LN([.B1164])/LN([.A1164]+1) -> 3.22997911198526 | E1164: of:=(1+SQRT(5))/2 -> 1.6180339887499 | F1164: of:=3+[.E1164]/LN([.A1164]+1) -> 3.22919569783293 | G1164: of:=[.D1164]-[.F1164] -> 0.000783414152334405
A1165: 1164 | B1165: 8018315715 | C1165: 3.23 | D1165: of:=LN([.B1165])/LN([.A1165]+1) -> 3.22995121632161 | E1165: of:=(1+SQRT(5))/2 -> 1.6180339887499 | F1165: of:=3+[.E1165]/LN([.A1165]+1) -> 3.22916782167017 | G1165: of:=[.D1165]-[.F1165] -> 0.000783394651437064
A1166: 1165 | B1166: 8038998641 | C1166: 3.23 | D1166: of:=LN([.B1166])/LN([.A1166]+1) -> 3.22992357820047 | E1166: of:=(1+SQRT(5))/2 -> 1.6180339887499 | F1166: of:=3+[.E1166]/LN([.A1166]+1) -> 3.22913997619657 | G1166: of:=[.D1166]-[.F1166] -> 0.000783602003902484
A1167: 1166 | B1167: 8059706401 | C1167: 3.23 | D1167: of:=LN([.B1167])/LN([.A1167]+1) -> 3.22989578218811 | E1167: of:=(1+SQRT(5))/2 -> 1.6180339887499 | F1167: of:=3+[.E1167]/LN([.A1167]+1) -> 3.22911216135125 | G1167: of:=[.D1167]-[.F1167] -> 0.000783620836863008
A1168: 1167 | B1168: 8080465379 | C1168: 3.23 | D1168: of:=LN([.B1168])/LN([.A1168]+1) -> 3.22986829149532 | E1168: of:=(1+SQRT(5))/2 -> 1.6180339887499 | F1168: of:=3+[.E1168]/LN([.A1168]+1) -> 3.2290843770735 | G1168: of:=[.D1168]-[.F1168] -> 0.000783914421819798
A1169: 1168 | B1169: 8101250753 | C1169: 3.23 | D1169: of:=LN([.B1169])/LN([.A1169]+1) -> 3.22984066956373 | E1169: of:=(1+SQRT(5))/2 -> 1.6180339887499 | F1169: of:=3+[.E1169]/LN([.A1169]+1) -> 3.22905662330278 | G1169: of:=[.D1169]-[.F1169] -> 0.000784046260951854
A1170: 1169 | B1170: 8122068711 | C1170: 3.23 | D1170: of:=LN([.B1170])/LN([.A1170]+1) -> 3.22981302494176 | E1170: of:=(1+SQRT(5))/2 -> 1.6180339887499 | F1170: of:=3+[.E1170]/LN([.A1170]+1) -> 3.22902889997872 | G1170: of:=[.D1170]-[.F1170] -> 0.000784124963037147
A1171: 1170 | B1171: 8142928229 | C1171: 3.23 | D1171: of:=LN([.B1171])/LN([.A1171]+1) -> 3.22978551347521 | E1171: of:=(1+SQRT(5))/2 -> 1.6180339887499 | F1171: of:=3+[.E1171]/LN([.A1171]+1) -> 3.22900120704114 | G1171: of:=[.D1171]-[.F1171] -> 0.000784306434065574
A1172: 1171 | B1172: 8163815139 | C1172: 3.23 | D1172: of:=LN([.B1172])/LN([.A1172]+1) -> 3.22975788815733 | E1172: of:=(1+SQRT(5))/2 -> 1.6180339887499 | F1172: of:=3+[.E1172]/LN([.A1172]+1) -> 3.22897354443002 | G1172: of:=[.D1172]-[.F1172] -> 0.000784343727311843
A1173: 1172 | B1173: 8184752613 | C1173: 3.23 | D1173: of:=LN([.B1173])/LN([.A1173]+1) -> 3.22973055015003 | E1173: of:=(1+SQRT(5))/2 -> 1.6180339887499 | F1173: of:=3+[.E1173]/LN([.A1173]+1) -> 3.2289459120855 | G1173: of:=[.D1173]-[.F1173] -> 0.000784638064531773
A1174: 1173 | B1174: 8205716061 | C1174: 3.23 | D1174: of:=LN([.B1174])/LN([.A1174]+1) -> 3.22970307283485 | E1174: of:=(1+SQRT(5))/2 -> 1.6180339887499 | F1174: of:=3+[.E1174]/LN([.A1174]+1) -> 3.2289183099479 | G1174: of:=[.D1174]-[.F1174] -> 0.000784762886954837
A1175: 1174 | B1175: 8226717963 | C1175: 3.23 | D1175: of:=LN([.B1175])/LN([.A1175]+1) -> 3.22967567158282 | E1175: of:=(1+SQRT(5))/2 -> 1.6180339887499 | F1175: of:=3+[.E1175]/LN([.A1175]+1) -> 3.22889073795772 | G1175: of:=[.D1175]-[.F1175] -> 0.000784933625100681
A1176: 1175 | B1176: 8247755477 | C1176: 3.23 | D1176: of:=LN([.B1176])/LN([.A1176]+1) -> 3.22964829670332 | E1176: of:=(1+SQRT(5))/2 -> 1.6180339887499 | F1176: of:=3+[.E1176]/LN([.A1176]+1) -> 3.22886319605561 | G1176: of:=[.D1176]-[.F1176] -> 0.00078510064771109
A1177: 1176 | B1177: 8268818127 | C1177: 3.23 | D1177: of:=LN([.B1177])/LN([.A1177]+1) -> 3.22962076846396 | E1177: of:=(1+SQRT(5))/2 -> 1.6180339887499 | F1177: of:=3+[.E1177]/LN([.A1177]+1) -> 3.2288356841824 | G1177: of:=[.D1177]-[.F1177] -> 0.000785084281558213
A1178: 1177 | B1178: 8289933085 | C1178: 3.23 | D1178: of:=LN([.B1178])/LN([.A1178]+1) -> 3.22959355125551 | E1178: of:=(1+SQRT(5))/2 -> 1.6180339887499 | F1178: of:=3+[.E1178]/LN([.A1178]+1) -> 3.22880820227908 | G1178: of:=[.D1178]-[.F1178] -> 0.000785348976429123
A1179: 1178 | B1179: 8311070219 | C1179: 3.23 | D1179: of:=LN([.B1179])/LN([.A1179]+1) -> 3.22956612962658 | E1179: of:=(1+SQRT(5))/2 -> 1.6180339887499 | F1179: of:=3+[.E1179]/LN([.A1179]+1) -> 3.22878075028682 | G1179: of:=[.D1179]-[.F1179] -> 0.000785379339755199
A1180: 1179 | B1180: 8332249739 | C1180: 3.23 | D1180: of:=LN([.B1180])/LN([.A1180]+1) -> 3.22953884778137 | E1180: of:=(1+SQRT(5))/2 -> 1.6180339887499 | F1180: of:=3+[.E1180]/LN([.A1180]+1) -> 3.22875332814694 | G1180: of:=[.D1180]-[.F1180] -> 0.000785519634428411
A1181: 1180 | B1181: 8353464657 | C1181: 3.23 | D1181: of:=LN([.B1181])/LN([.A1181]+1) -> 3.22951158601487 | E1181: of:=(1+SQRT(5))/2 -> 1.6180339887499 | F1181: of:=3+[.E1181]/LN([.A1181]+1) -> 3.22872593580094 | G1181: of:=[.D1181]-[.F1181] -> 0.000785650213928513
A1182: 1181 | B1182: 8374720915 | C1182: 3.23 | D1182: of:=LN([.B1182])/LN([.A1182]+1) -> 3.22948444411539 | E1182: of:=(1+SQRT(5))/2 -> 1.6180339887499 | F1182: of:=3+[.E1182]/LN([.A1182]+1) -> 3.22869857319047 | G1182: of:=[.D1182]-[.F1182] -> 0.000785870924923326
A1183: 1182 | B1183: 8396006381 | C1183: 3.23 | D1183: of:=LN([.B1183])/LN([.A1183]+1) -> 3.22945721657909 | E1183: of:=(1+SQRT(5))/2 -> 1.6180339887499 | F1183: of:=3+[.E1183]/LN([.A1183]+1) -> 3.22867124025735 | G1183: of:=[.D1183]-[.F1183] -> 0.000785976321736381
A1184: 1183 | B1184: 8417323711 | C1184: 3.23 | D1184: of:=LN([.B1184])/LN([.A1184]+1) -> 3.22942994833955 | E1184: of:=(1+SQRT(5))/2 -> 1.6180339887499 | F1184: of:=3+[.E1184]/LN([.A1184]+1) -> 3.22864393694358 | G1184: of:=[.D1184]-[.F1184] -> 0.000786011395974118
A1185: 1184 | B1185: 8438687883 | C1185: 3.23 | D1185: of:=LN([.B1185])/LN([.A1185]+1) -> 3.22940289016999 | E1185: of:=(1+SQRT(5))/2 -> 1.6180339887499 | F1185: of:=3+[.E1185]/LN([.A1185]+1) -> 3.2286166631913 | G1185: of:=[.D1185]-[.F1185] -> 0.00078622697869335
A1186: 1185 | B1186: 8460090393 | C1186: 3.23 | D1186: of:=LN([.B1186])/LN([.A1186]+1) -> 3.22937589805996 | E1186: of:=(1+SQRT(5))/2 -> 1.6180339887499 | F1186: of:=3+[.E1186]/LN([.A1186]+1) -> 3.22858941894282 | G1186: of:=[.D1186]-[.F1186] -> 0.000786479117143024
A1187: 1186 | B1187: 8481521873 | C1187: 3.23 | D1187: of:=LN([.B1187])/LN([.A1187]+1) -> 3.22934881512777 | E1187: of:=(1+SQRT(5))/2 -> 1.6180339887499 | F1187: of:=3+[.E1187]/LN([.A1187]+1) -> 3.22856220414062 | G1187: of:=[.D1187]-[.F1187] -> 0.000786610987149938
A1188: 1187 | B1188: 8502984387 | C1188: 3.23 | D1188: of:=LN([.B1188])/LN([.A1188]+1) -> 3.22932167604498 | E1188: of:=(1+SQRT(5))/2 -> 1.6180339887499 | F1188: of:=3+[.E1188]/LN([.A1188]+1) -> 3.22853501872734 | G1188: of:=[.D1188]-[.F1188] -> 0.000786657317639605
A1189: 1188 | B1189: 8524479663 | C1189: 3.23 | D1189: of:=LN([.B1189])/LN([.A1189]+1) -> 3.22929450955318 | E1189: of:=(1+SQRT(5))/2 -> 1.6180339887499 | F1189: of:=3+[.E1189]/LN([.A1189]+1) -> 3.22850786264577 | G1189: of:=[.D1189]-[.F1189] -> 0.00078664690740915
A1190: 1189 | B1190: 8546030111 | C1190: 3.23 | D1190: of:=LN([.B1190])/LN([.A1190]+1) -> 3.22926768582848 | E1190: of:=(1+SQRT(5))/2 -> 1.6180339887499 | F1190: of:=3+[.E1190]/LN([.A1190]+1) -> 3.22848073583888 | G1190: of:=[.D1190]-[.F1190] -> 0.000786949989598718
A1191: 1190 | B1191: 8567599665 | C1191: 3.23 | D1191: of:=LN([.B1191])/LN([.A1191]+1) -> 3.22924060747279 | E1191: of:=(1+SQRT(5))/2 -> 1.6180339887499 | F1191: of:=3+[.E1191]/LN([.A1191]+1) -> 3.22845363824977 | G1191: of:=[.D1191]-[.F1191] -> 0.000786969223025569
A1192: 1191 | B1192: 8589219875 | C1192: 3.23 | D1192: of:=LN([.B1192])/LN([.A1192]+1) -> 3.22921379473459 | E1192: of:=(1+SQRT(5))/2 -> 1.6180339887499 | F1192: of:=3+[.E1192]/LN([.A1192]+1) -> 3.22842656982172 | G1192: of:=[.D1192]-[.F1192] -> 0.000787224912873974
A1193: 1192 | B1193: 8610866097 | C1193: 3.23 | D1193: of:=LN([.B1193])/LN([.A1193]+1) -> 3.22918684119903 | E1193: of:=(1+SQRT(5))/2 -> 1.6180339887499 | F1193: of:=3+[.E1193]/LN([.A1193]+1) -> 3.22839953049817 | G1193: of:=[.D1193]-[.F1193] -> 0.000787310700860466
A1194: 1193 | B1194: 8632554925 | C1194: 3.23 | D1194: of:=LN([.B1194])/LN([.A1194]+1) -> 3.22916001895983 | E1194: of:=(1+SQRT(5))/2 -> 1.6180339887499 | F1194: of:=3+[.E1194]/LN([.A1194]+1) -> 3.22837252022271 | G1194: of:=[.D1194]-[.F1194] -> 0.000787498737120362
A1195: 1194 | B1195: 8654269451 | C1195: 3.23 | D1195: of:=LN([.B1195])/LN([.A1195]+1) -> 3.2291330509377 | E1195: of:=(1+SQRT(5))/2 -> 1.6180339887499 | F1195: of:=3+[.E1195]/LN([.A1195]+1) -> 3.2283455389391 | G1195: of:=[.D1195]-[.F1195] -> 0.000787511998606938
A1196: 1195 | B1196: 8676036635 | C1196: 3.23 | D1196: of:=LN([.B1196])/LN([.A1196]+1) -> 3.22910637643757 | E1196: of:=(1+SQRT(5))/2 -> 1.6180339887499 | F1196: of:=3+[.E1196]/LN([.A1196]+1) -> 3.22831858659123 | G1196: of:=[.D1196]-[.F1196] -> 0.000787789846342868
A1197: 1196 | B1197: 8697833871 | C1197: 3.23 | D1197: of:=LN([.B1197])/LN([.A1197]+1) -> 3.22907962612286 | E1197: of:=(1+SQRT(5))/2 -> 1.6180339887499 | F1197: of:=3+[.E1197]/LN([.A1197]+1) -> 3.22829166312317 | G1197: of:=[.D1197]-[.F1197] -> 0.000787962999690084
A1198: 1197 | B1198: 8719659313 | C1198: 3.23 | D1198: of:=LN([.B1198])/LN([.A1198]+1) -> 3.22905277039781 | E1198: of:=(1+SQRT(5))/2 -> 1.6180339887499 | F1198: of:=3+[.E1198]/LN([.A1198]+1) -> 3.22826476847915 | G1198: of:=[.D1198]-[.F1198] -> 0.000788001918667014
A1199: 1198 | B1199: 8741527007 | C1199: 3.23 | D1199: of:=LN([.B1199])/LN([.A1199]+1) -> 3.22902603642234 | E1199: of:=(1+SQRT(5))/2 -> 1.6180339887499 | F1199: of:=3+[.E1199]/LN([.A1199]+1) -> 3.22823790260353 | G1199: of:=[.D1199]-[.F1199] -> 0.000788133818817371
A1200: 1199 | B1200: 8763433577 | C1200: 3.23 | D1200: of:=LN([.B1200])/LN([.A1200]+1) -> 3.22899936858539 | E1200: of:=(1+SQRT(5))/2 -> 1.6180339887499 | F1200: of:=3+[.E1200]/LN([.A1200]+1) -> 3.22821106544084 | G1200: of:=[.D1200]-[.F1200] -> 0.000788303144544589
A1201: 1200 | B1201: 8785362913 | C1201: 3.23 | D1201: of:=LN([.B1201])/LN([.A1201]+1) -> 3.22897250744409 | E1201: of:=(1+SQRT(5))/2 -> 1.6180339887499 | F1201: of:=3+[.E1201]/LN([.A1201]+1) -> 3.22818425693577 | G1201: of:=[.D1201]-[.F1201] -> 0.000788250508316768
A1202: 1201 | B1202: 8807345657 | C1202: 3.23 | D1202: of:=LN([.B1202])/LN([.A1202]+1) -> 3.22894594478311 | E1202: of:=(1+SQRT(5))/2 -> 1.6180339887499 | F1202: of:=3+[.E1202]/LN([.A1202]+1) -> 3.22815747703316 | G1202: of:=[.D1202]-[.F1202] -> 0.000788467749955668
A1203: 1202 | B1203: 8829351583 | C1203: 3.23 | D1203: of:=LN([.B1203])/LN([.A1203]+1) -> 3.22891919528113 | E1203: of:=(1+SQRT(5))/2 -> 1.6180339887499 | F1203: of:=3+[.E1203]/LN([.A1203]+1) -> 3.22813072567798 | G1203: of:=[.D1203]-[.F1203] -> 0.000788469603150599
A1204: 1203 | B1204: 8851412007 | C1204: 3.23 | D1204: of:=LN([.B1204])/LN([.A1204]+1) -> 3.22889275884894 | E1204: of:=(1+SQRT(5))/2 -> 1.6180339887499 | F1204: of:=3+[.E1204]/LN([.A1204]+1) -> 3.22810400281539 | G1204: of:=[.D1204]-[.F1204] -> 0.000788756033548665
A1205: 1204 | B1205: 8873500473 | C1205: 3.23 | D1205: of:=LN([.B1205])/LN([.A1205]+1) -> 3.2288662124573 | E1205: of:=(1+SQRT(5))/2 -> 1.6180339887499 | F1205: of:=3+[.E1205]/LN([.A1205]+1) -> 3.22807730839068 | G1205: of:=[.D1205]-[.F1205] -> 0.000788904066621576
A1206: 1205 | B1206: 8895625615 | C1206: 3.23 | D1206: of:=LN([.B1206])/LN([.A1206]+1) -> 3.22883969344387 | E1206: of:=(1+SQRT(5))/2 -> 1.6180339887499 | F1206: of:=3+[.E1206]/LN([.A1206]+1) -> 3.22805064234929 | G1206: of:=[.D1206]-[.F1206] -> 0.000789051094575388
A1207: 1206 | B1207: 8917788359 | C1207: 3.23 | D1207: of:=LN([.B1207])/LN([.A1207]+1) -> 3.22881321591192 | E1207: of:=(1+SQRT(5))/2 -> 1.6180339887499 | F1207: of:=3+[.E1207]/LN([.A1207]+1) -> 3.22802400463682 | G1207: of:=[.D1207]-[.F1207] -> 0.000789211275106894
A1208: 1207 | B1208: 8939984329 | C1208: 3.23 | D1208: of:=LN([.B1208])/LN([.A1208]+1) -> 3.22878671024874 | E1208: of:=(1+SQRT(5))/2 -> 1.6180339887499 | F1208: of:=3+[.E1208]/LN([.A1208]+1) -> 3.227997395199 | G1208: of:=[.D1208]-[.F1208] -> 0.000789315049738004
A1209: 1208 | B1209: 8962220031 | C1209: 3.23 | D1209: of:=LN([.B1209])/LN([.A1209]+1) -> 3.2287602786383 | E1209: of:=(1+SQRT(5))/2 -> 1.6180339887499 | F1209: of:=3+[.E1209]/LN([.A1209]+1) -> 3.22797081398175 | G1209: of:=[.D1209]-[.F1209] -> 0.000789464656550276
A1210: 1209 | B1210: 8984497813 | C1210: 3.23 | D1210: of:=LN([.B1210])/LN([.A1210]+1) -> 3.22873395700731 | E1210: of:=(1+SQRT(5))/2 -> 1.6180339887499 | F1210: of:=3+[.E1210]/LN([.A1210]+1) -> 3.2279442609311 | G1210: of:=[.D1210]-[.F1210] -> 0.00078969607621282
A1211: 1210 | B1211: 9006798637 | C1211: 3.23 | D1211: of:=LN([.B1211])/LN([.A1211]+1) -> 3.22870744644422 | E1211: of:=(1+SQRT(5))/2 -> 1.6180339887499 | F1211: of:=3+[.E1211]/LN([.A1211]+1) -> 3.22791773599324 | G1211: of:=[.D1211]-[.F1211] -> 0.000789710450979086
A1212: 1211 | B1212: 9029144351 | C1212: 3.23 | D1212: of:=LN([.B1212])/LN([.A1212]+1) -> 3.22868108890797 | E1212: of:=(1+SQRT(5))/2 -> 1.6180339887499 | F1212: of:=3+[.E1212]/LN([.A1212]+1) -> 3.22789123911452 | G1212: of:=[.D1212]-[.F1212] -> 0.000789849793450426
A1213: 1212 | B1213: 9051520525 | C1213: 3.23 | D1213: of:=LN([.B1213])/LN([.A1213]+1) -> 3.22865465839112 | E1213: of:=(1+SQRT(5))/2 -> 1.6180339887499 | F1213: of:=3+[.E1213]/LN([.A1213]+1) -> 3.22786477024142 | G1213: of:=[.D1213]-[.F1213] -> 0.000789888149694828
A1214: 1213 | B1214: 9073944725 | C1214: 3.23 | D1214: of:=LN([.B1214])/LN([.A1214]+1) -> 3.22862842774291 | E1214: of:=(1+SQRT(5))/2 -> 1.6180339887499 | F1214: of:=3+[.E1214]/LN([.A1214]+1) -> 3.22783832932058 | G1214: of:=[.D1214]-[.F1214] -> 0.000790098422328356
A1215: 1214 | B1215: 9096395389 | C1215: 3.23 | D1215: of:=LN([.B1215])/LN([.A1215]+1) -> 3.228602061365 | E1215: of:=(1+SQRT(5))/2 -> 1.6180339887499 | F1215: of:=3+[.E1215]/LN([.A1215]+1) -> 3.22781191629878 | G1215: of:=[.D1215]-[.F1215] -> 0.000790145066213555
A1216: 1215 | B1216: 9118891965 | C1216: 3.23 | D1216: of:=LN([.B1216])/LN([.A1216]+1) -> 3.22857586024052 | E1216: of:=(1+SQRT(5))/2 -> 1.6180339887499 | F1216: of:=3+[.E1216]/LN([.A1216]+1) -> 3.22778553112295 | G1216: of:=[.D1216]-[.F1216] -> 0.000790329117572153
A1217: 1216 | B1217: 9141421935 | C1217: 3.23 | D1217: of:=LN([.B1217])/LN([.A1217]+1) -> 3.22854963002644 | E1217: of:=(1+SQRT(5))/2 -> 1.6180339887499 | F1217: of:=3+[.E1217]/LN([.A1217]+1) -> 3.22775917374016 | G1217: of:=[.D1217]-[.F1217] -> 0.000790456286276608
A1218: 1217 | B1218: 9163990183 | C1218: 3.23 | D1218: of:=LN([.B1218])/LN([.A1218]+1) -> 3.22852344565108 | E1218: of:=(1+SQRT(5))/2 -> 1.6180339887499 | F1218: of:=3+[.E1218]/LN([.A1218]+1) -> 3.22773284409763 | G1218: of:=[.D1218]-[.F1218] -> 0.000790601553444681
A1219: 1218 | B1219: 9186596599 | C1219: 3.23 | D1219: of:=LN([.B1219])/LN([.A1219]+1) -> 3.22849730476829 | E1219: of:=(1+SQRT(5))/2 -> 1.6180339887499 | F1219: of:=3+[.E1219]/LN([.A1219]+1) -> 3.22770654214272 | G1219: of:=[.D1219]-[.F1219] -> 0.000790762625566543
A1220: 1219 | B1220: 9209235917 | C1220: 3.23 | D1220: of:=LN([.B1220])/LN([.A1220]+1) -> 3.2284711262732 | E1220: of:=(1+SQRT(5))/2 -> 1.6180339887499 | F1220: of:=3+[.E1220]/LN([.A1220]+1) -> 3.22768026782294 | G1220: of:=[.D1220]-[.F1220] -> 0.000790858450260945
A1221: 1220 | B1221: 9231911231 | C1221: 3.23 | D1221: of:=LN([.B1221])/LN([.A1221]+1) -> 3.22844495730395 | E1221: of:=(1+SQRT(5))/2 -> 1.6180339887499 | F1221: of:=3+[.E1221]/LN([.A1221]+1) -> 3.22765402108593 | G1221: of:=[.D1221]-[.F1221] -> 0.000790936218012739
A1222: 1221 | B1222: 9254630875 | C1222: 3.23 | D1222: of:=LN([.B1222])/LN([.A1222]+1) -> 3.22841892417002 | E1222: of:=(1+SQRT(5))/2 -> 1.6180339887499 | F1222: of:=3+[.E1222]/LN([.A1222]+1) -> 3.2276278018795 | G1222: of:=[.D1222]-[.F1222] -> 0.000791122290520363
A1223: 1222 | B1223: 9277376155 | C1223: 3.23 | D1223: of:=LN([.B1223])/LN([.A1223]+1) -> 3.22839274207988 | E1223: of:=(1+SQRT(5))/2 -> 1.6180339887499 | F1223: of:=3+[.E1223]/LN([.A1223]+1) -> 3.22760161015156 | G1223: of:=[.D1223]-[.F1223] -> 0.000791131928322919
A1224: 1223 | B1224: 9300173141 | C1224: 3.23 | D1224: of:=LN([.B1224])/LN([.A1224]+1) -> 3.22836680614072 | E1224: of:=(1+SQRT(5))/2 -> 1.6180339887499 | F1224: of:=3+[.E1224]/LN([.A1224]+1) -> 3.22757544585021 | G1224: of:=[.D1224]-[.F1224] -> 0.000791360290517407
A1225: 1224 | B1225: 9322989995 | C1225: 3.23 | D1225: of:=LN([.B1225])/LN([.A1225]+1) -> 3.22834063389722 | E1225: of:=(1+SQRT(5))/2 -> 1.6180339887499 | F1225: of:=3+[.E1225]/LN([.A1225]+1) -> 3.22754930892365 | G1225: of:=[.D1225]-[.F1225] -> 0.000791324973572483
A1226: 1225 | B1226: 9345867187 | C1226: 3.23 | D1226: of:=LN([.B1226])/LN([.A1226]+1) -> 3.22831483577037 | E1226: of:=(1+SQRT(5))/2 -> 1.6180339887499 | F1226: of:=3+[.E1226]/LN([.A1226]+1) -> 3.22752319932025 | G1226: of:=[.D1226]-[.F1226] -> 0.000791636450127697
A1227: 1226 | B1227: 9368766171 | C1227: 3.23 | D1227: of:=LN([.B1227])/LN([.A1227]+1) -> 3.22828883011366 | E1227: of:=(1+SQRT(5))/2 -> 1.6180339887499 | F1227: of:=3+[.E1227]/LN([.A1227]+1) -> 3.2274971169885 | G1227: of:=[.D1227]-[.F1227] -> 0.000791713125163351
A1228: 1227 | B1228: 9391701969 | C1228: 3.23 | D1228: of:=LN([.B1228])/LN([.A1228]+1) -> 3.22826284308141 | E1228: of:=(1+SQRT(5))/2 -> 1.6180339887499 | F1228: of:=3+[.E1228]/LN([.A1228]+1) -> 3.22747106187704 | G1228: of:=[.D1228]-[.F1228] -> 0.000791781204365183
A1229: 1228 | B1229: 9414675211 | C1229: 3.23 | D1229: of:=LN([.B1229])/LN([.A1229]+1) -> 3.22823688363865 | E1229: of:=(1+SQRT(5))/2 -> 1.6180339887499 | F1229: of:=3+[.E1229]/LN([.A1229]+1) -> 3.22744503393466 | G1229: of:=[.D1229]-[.F1229] -> 0.000791849703992487
A1230: 1229 | B1230: 9437695223 | C1230: 3.23 | D1230: of:=LN([.B1230])/LN([.A1230]+1) -> 3.22821109016566 | E1230: of:=(1+SQRT(5))/2 -> 1.6180339887499 | F1230: of:=3+[.E1230]/LN([.A1230]+1) -> 3.22741903311026 | G1230: of:=[.D1230]-[.F1230] -> 0.000792057055398754
A1231: 1230 | B1231: 9460749757 | C1231: 3.23 | D1231: of:=LN([.B1231])/LN([.A1231]+1) -> 3.22818527915491 | E1231: of:=(1+SQRT(5))/2 -> 1.6180339887499 | F1231: of:=3+[.E1231]/LN([.A1231]+1) -> 3.2273930593529 | G1231: of:=[.D1231]-[.F1231] -> 0.000792219802014049
A1232: 1231 | B1232: 9483832389 | C1232: 3.23 | D1232: of:=LN([.B1232])/LN([.A1232]+1) -> 3.22815935525892 | E1232: of:=(1+SQRT(5))/2 -> 1.6180339887499 | F1232: of:=3+[.E1232]/LN([.A1232]+1) -> 3.22736711261178 | G1232: of:=[.D1232]-[.F1232] -> 0.000792242647146058
A1233: 1232 | B1233: 9506963771 | C1233: 3.23 | D1233: of:=LN([.B1233])/LN([.A1233]+1) -> 3.22813362426167 | E1233: of:=(1+SQRT(5))/2 -> 1.6180339887499 | F1233: of:=3+[.E1233]/LN([.A1233]+1) -> 3.22734119283622 | G1233: of:=[.D1233]-[.F1233] -> 0.000792431425451934
A1234: 1233 | B1234: 9530121713 | C1234: 3.23 | D1234: of:=LN([.B1234])/LN([.A1234]+1) -> 3.22810775728213 | E1234: of:=(1+SQRT(5))/2 -> 1.6180339887499 | F1234: of:=3+[.E1234]/LN([.A1234]+1) -> 3.22731529997569 | G1234: of:=[.D1234]-[.F1234] -> 0.000792457306435512
A1235: 1234 | B1235: 9553330213 | C1235: 3.23 | D1235: of:=LN([.B1235])/LN([.A1235]+1) -> 3.22808210792945 | E1235: of:=(1+SQRT(5))/2 -> 1.6180339887499 | F1235: of:=3+[.E1235]/LN([.A1235]+1) -> 3.2272894339798 | G1235: of:=[.D1235]-[.F1235] -> 0.000792673949644218
A1236: 1235 | B1236: 9576578447 | C1236: 3.23 | D1236: of:=LN([.B1236])/LN([.A1236]+1) -> 3.22805651549993 | E1236: of:=(1+SQRT(5))/2 -> 1.6180339887499 | F1236: of:=3+[.E1236]/LN([.A1236]+1) -> 3.22726359479829 | G1236: of:=[.D1236]-[.F1236] -> 0.000792920701641275
A1237: 1236 | B1237: 9599841579 | C1237: 3.23 | D1237: of:=LN([.B1237])/LN([.A1237]+1) -> 3.22803061592819 | E1237: of:=(1+SQRT(5))/2 -> 1.6180339887499 | F1237: of:=3+[.E1237]/LN([.A1237]+1) -> 3.22723778238102 | G1237: of:=[.D1237]-[.F1237] -> 0.000792833547168748
A1238: 1237 | B1238: 9623155245 | C1238: 3.23 | D1238: of:=LN([.B1238])/LN([.A1238]+1) -> 3.22800493127021 | E1238: of:=(1+SQRT(5))/2 -> 1.6180339887499 | F1238: of:=3+[.E1238]/LN([.A1238]+1) -> 3.22721199667801 | G1238: of:=[.D1238]-[.F1238] -> 0.000792934592193983
A1239: 1238 | B1239: 9646518771 | C1239: 3.23 | D1239: of:=LN([.B1239])/LN([.A1239]+1) -> 3.22797944979279 | E1239: of:=(1+SQRT(5))/2 -> 1.6180339887499 | F1239: of:=3+[.E1239]/LN([.A1239]+1) -> 3.22718623763941 | G1239: of:=[.D1239]-[.F1239] -> 0.000793212153378242
A1240: 1239 | B1240: 9669909727 | C1240: 3.23 | D1240: of:=LN([.B1240])/LN([.A1240]+1) -> 3.22795384401075 | E1240: of:=(1+SQRT(5))/2 -> 1.6180339887499 | F1240: of:=3+[.E1240]/LN([.A1240]+1) -> 3.22716050521548 | G1240: of:=[.D1240]-[.F1240] -> 0.000793338795267218
A1241: 1240 | B1241: 9693333193 | C1241: 3.23 | D1241: of:=LN([.B1241])/LN([.A1241]+1) -> 3.22792818814261 | E1241: of:=(1+SQRT(5))/2 -> 1.6180339887499 | F1241: of:=3+[.E1241]/LN([.A1241]+1) -> 3.22713479935665 | G1241: of:=[.D1241]-[.F1241] -> 0.000793388785955695
A1242: 1241 | B1242: 9716795609 | C1242: 3.23 | D1242: of:=LN([.B1242])/LN([.A1242]+1) -> 3.22790257530538 | E1242: of:=(1+SQRT(5))/2 -> 1.6180339887499 | F1242: of:=3+[.E1242]/LN([.A1242]+1) -> 3.22710912001346 | G1242: of:=[.D1242]-[.F1242] -> 0.000793455291923983
A1243: 1242 | B1243: 9740304903 | C1243: 3.23 | D1243: of:=LN([.B1243])/LN([.A1243]+1) -> 3.22787711911723 | E1243: of:=(1+SQRT(5))/2 -> 1.6180339887499 | F1243: of:=3+[.E1243]/LN([.A1243]+1) -> 3.22708346713658 | G1243: of:=[.D1243]-[.F1243] -> 0.000793651980655064
A1244: 1243 | B1244: 9763848377 | C1244: 3.23 | D1244: of:=LN([.B1244])/LN([.A1244]+1) -> 3.22785163560427 | E1244: of:=(1+SQRT(5))/2 -> 1.6180339887499 | F1244: of:=3+[.E1244]/LN([.A1244]+1) -> 3.22705784067682 | G1244: of:=[.D1244]-[.F1244] -> 0.000793794927447689
A1245: 1244 | B1245: 9787424147 | C1245: 3.23 | D1245: of:=LN([.B1245])/LN([.A1245]+1) -> 3.22782609767534 | E1245: of:=(1+SQRT(5))/2 -> 1.6180339887499 | F1245: of:=3+[.E1245]/LN([.A1245]+1) -> 3.22703224058513 | G1245: of:=[.D1245]-[.F1245] -> 0.000793857090203964
A1246: 1245 | B1246: 9811043325 | C1246: 3.23 | D1246: of:=LN([.B1246])/LN([.A1246]+1) -> 3.227800664356 | E1246: of:=(1+SQRT(5))/2 -> 1.6180339887499 | F1246: of:=3+[.E1246]/LN([.A1246]+1) -> 3.22700666681258 | G1246: of:=[.D1246]-[.F1246] -> 0.000793997543415692
A1247: 1246 | B1247: 9834696033 | C1247: 3.23 | D1247: of:=LN([.B1247])/LN([.A1247]+1) -> 3.22777519367094 | E1247: of:=(1+SQRT(5))/2 -> 1.6180339887499 | F1247: of:=3+[.E1247]/LN([.A1247]+1) -> 3.22698111931037 | G1247: of:=[.D1247]-[.F1247] -> 0.000794074360574104
A1248: 1247 | B1248: 9858391837 | C1248: 3.23 | D1248: of:=LN([.B1248])/LN([.A1248]+1) -> 3.22774982172244 | E1248: of:=(1+SQRT(5))/2 -> 1.6180339887499 | F1248: of:=3+[.E1248]/LN([.A1248]+1) -> 3.22695559802983 | G1248: of:=[.D1248]-[.F1248] -> 0.000794223692605733
A1249: 1248 | B1249: 9882116981 | C1249: 3.23 | D1249: of:=LN([.B1249])/LN([.A1249]+1) -> 3.22772435225168 | E1249: of:=(1+SQRT(5))/2 -> 1.6180339887499 | F1249: of:=3+[.E1249]/LN([.A1249]+1) -> 3.22693010292243 | G1249: of:=[.D1249]-[.F1249] -> 0.000794249329249652
A1250: 1249 | B1250: 9905887843 | C1250: 3.23 | D1250: of:=LN([.B1250])/LN([.A1250]+1) -> 3.22769901756744 | E1250: of:=(1+SQRT(5))/2 -> 1.6180339887499 | F1250: of:=3+[.E1250]/LN([.A1250]+1) -> 3.22690463393977 | G1250: of:=[.D1250]-[.F1250] -> 0.000794383627678918
A1251: 1250 | B1251: 9929701397 | C1251: 3.23 | D1251: of:=LN([.B1251])/LN([.A1251]+1) -> 3.227673773642 | E1251: of:=(1+SQRT(5))/2 -> 1.6180339887499 | F1251: of:=3+[.E1251]/LN([.A1251]+1) -> 3.22687919103355 | G1251: of:=[.D1251]-[.F1251] -> 0.000794582608454331
A1252: 1251 | B1252: 9953540357 | C1252: 3.23 | D1252: of:=LN([.B1252])/LN([.A1252]+1) -> 3.22764837602302 | E1252: of:=(1+SQRT(5))/2 -> 1.6180339887499 | F1252: of:=3+[.E1252]/LN([.A1252]+1) -> 3.22685377415563 | G1252: of:=[.D1252]-[.F1252] -> 0.000794601867388334
A1253: 1252 | B1253: 9977431699 | C1253: 3.23 | D1253: of:=LN([.B1253])/LN([.A1253]+1) -> 3.22762320460834 | E1253: of:=(1+SQRT(5))/2 -> 1.6180339887499 | F1253: of:=3+[.E1253]/LN([.A1253]+1) -> 3.226828383258 | G1253: of:=[.D1253]-[.F1253] -> 0.000794821350341035
A1254: 1253 | B1254: 10001351905 | C1254: 3.23 | D1254: of:=LN([.B1254])/LN([.A1254]+1) -> 3.227597927807 | E1254: of:=(1+SQRT(5))/2 -> 1.6180339887499 | F1254: of:=3+[.E1254]/LN([.A1254]+1) -> 3.22680301829275 | G1254: of:=[.D1254]-[.F1254] -> 0.000794909514253206
A1255: 1254 | B1255: 10025310385 | C1255: 3.23 | D1255: of:=LN([.B1255])/LN([.A1255]+1) -> 3.22757267768196 | E1255: of:=(1+SQRT(5))/2 -> 1.6180339887499 | F1255: of:=3+[.E1255]/LN([.A1255]+1) -> 3.22677767921212 | G1255: of:=[.D1255]-[.F1255] -> 0.000794998469839658
A1256: 1255 | B1256: 10049308899 | C1256: 3.23 | D1256: of:=LN([.B1256])/LN([.A1256]+1) -> 3.22754747829726 | E1256: of:=(1+SQRT(5))/2 -> 1.6180339887499 | F1256: of:=3+[.E1256]/LN([.A1256]+1) -> 3.22675236596847 | G1256: of:=[.D1256]-[.F1256] -> 0.000795112328789038
A1257: 1256 | B1257: 10073345137 | C1257: 3.23 | D1257: of:=LN([.B1257])/LN([.A1257]+1) -> 3.22752229686054 | E1257: of:=(1+SQRT(5))/2 -> 1.6180339887499 | F1257: of:=3+[.E1257]/LN([.A1257]+1) -> 3.22672707851428 | G1257: of:=[.D1257]-[.F1257] -> 0.000795218346258064
A1258: 1257 | B1258: 10097422029 | C1258: 3.23 | D1258: of:=LN([.B1258])/LN([.A1258]+1) -> 3.22749717361479 | E1258: of:=(1+SQRT(5))/2 -> 1.6180339887499 | F1258: of:=3+[.E1258]/LN([.A1258]+1) -> 3.22670181680217 | G1258: of:=[.D1258]-[.F1258] -> 0.000795356812620884
A1259: 1258 | B1259: 10121536087 | C1259: 3.23 | D1259: of:=LN([.B1259])/LN([.A1259]+1) -> 3.22747205956888 | E1259: of:=(1+SQRT(5))/2 -> 1.6180339887499 | F1259: of:=3+[.E1259]/LN([.A1259]+1) -> 3.22667658078488 | G1259: of:=[.D1259]-[.F1259] -> 0.00079547878400188
A1260: 1259 | B1260: 10145691299 | C1260: 3.23 | D1260: of:=LN([.B1260])/LN([.A1260]+1) -> 3.22744700943745 | E1260: of:=(1+SQRT(5))/2 -> 1.6180339887499 | F1260: of:=3+[.E1260]/LN([.A1260]+1) -> 3.22665137041526 | G1260: of:=[.D1260]-[.F1260] -> 0.000795639022199257
A1261: 1260 | B1261: 10169869817 | C1261: 3.23 | D1261: of:=LN([.B1261])/LN([.A1261]+1) -> 3.22742177665829 | E1261: of:=(1+SQRT(5))/2 -> 1.6180339887499 | F1261: of:=3+[.E1261]/LN([.A1261]+1) -> 3.2266261856463 | G1261: of:=[.D1261]-[.F1261] -> 0.000795591011995445
A1262: 1261 | B1262: 10194111371 | C1262: 3.23 | D1262: of:=LN([.B1262])/LN([.A1262]+1) -> 3.22739690813063 | E1262: of:=(1+SQRT(5))/2 -> 1.6180339887499 | F1262: of:=3+[.E1262]/LN([.A1262]+1) -> 3.22660102643111 | G1262: of:=[.D1262]-[.F1262] -> 0.00079588169951661
A1263: 1262 | B1263: 10218366545 | C1263: 3.23 | D1263: of:=LN([.B1263])/LN([.A1263]+1) -> 3.22737172367298 | E1263: of:=(1+SQRT(5))/2 -> 1.6180339887499 | F1263: of:=3+[.E1263]/LN([.A1263]+1) -> 3.22657589272294 | G1263: of:=[.D1263]-[.F1263] -> 0.000795830950039544
A1264: 1263 | B1264: 10242678589 | C1264: 3.23 | D1264: of:=LN([.B1264])/LN([.A1264]+1) -> 3.22734681658428 | E1264: of:=(1+SQRT(5))/2 -> 1.6180339887499 | F1264: of:=3+[.E1264]/LN([.A1264]+1) -> 3.22655078447513 | G1264: of:=[.D1264]-[.F1264] -> 0.000796032109146694
A1265: 1264 | B1265: 10267022647 | C1265: 3.23 | D1265: of:=LN([.B1265])/LN([.A1265]+1) -> 3.22732184559253 | E1265: of:=(1+SQRT(5))/2 -> 1.6180339887499 | F1265: of:=3+[.E1265]/LN([.A1265]+1) -> 3.22652570164117 | G1265: of:=[.D1265]-[.F1265] -> 0.000796143951361294
A1266: 1265 | B1266: 10291400009 | C1266: 3.23 | D1266: of:=LN([.B1266])/LN([.A1266]+1) -> 3.22729682844545 | E1266: of:=(1+SQRT(5))/2 -> 1.6180339887499 | F1266: of:=3+[.E1266]/LN([.A1266]+1) -> 3.22650064417466 | G1266: of:=[.D1266]-[.F1266] -> 0.000796184270793088
A1267: 1266 | B1267: 10315833295 | C1267: 3.23 | D1267: of:=LN([.B1267])/LN([.A1267]+1) -> 3.2272720721315 | E1267: of:=(1+SQRT(5))/2 -> 1.6180339887499 | F1267: of:=3+[.E1267]/LN([.A1267]+1) -> 3.22647561202932 | G1267: of:=[.D1267]-[.F1267] -> 0.000796460102179264
A1268: 1267 | B1268: 10340293521 | C1268: 3.23 | D1268: of:=LN([.B1268])/LN([.A1268]+1) -> 3.22724718214846 | E1268: of:=(1+SQRT(5))/2 -> 1.6180339887499 | F1268: of:=3+[.E1268]/LN([.A1268]+1) -> 3.22645060515901 | G1268: of:=[.D1268]-[.F1268] -> 0.000796576989456455
A1269: 1268 | B1269: 10364784905 | C1269: 3.23 | D1269: of:=LN([.B1269])/LN([.A1269]+1) -> 3.22722221616371 | E1269: of:=(1+SQRT(5))/2 -> 1.6180339887499 | F1269: of:=3+[.E1269]/LN([.A1269]+1) -> 3.22642562351768 | G1269: of:=[.D1269]-[.F1269] -> 0.000796592646026717
A1270: 1269 | B1270: 10389323175 | C1270: 3.23 | D1270: of:=LN([.B1270])/LN([.A1270]+1) -> 3.22719738629457 | E1270: of:=(1+SQRT(5))/2 -> 1.6180339887499 | F1270: of:=3+[.E1270]/LN([.A1270]+1) -> 3.22640066705944 | G1270: of:=[.D1270]-[.F1270] -> 0.00079671923513347
A1271: 1270 | B1271: 10413901749 | C1271: 3.23 | D1271: of:=LN([.B1271])/LN([.A1271]+1) -> 3.22717260283633 | E1271: of:=(1+SQRT(5))/2 -> 1.6180339887499 | F1271: of:=3+[.E1271]/LN([.A1271]+1) -> 3.22637573573848 | G1271: of:=[.D1271]-[.F1271] -> 0.000796867097847098
A1272: 1271 | B1272: 10438515885 | C1272: 3.23 | D1272: of:=LN([.B1272])/LN([.A1272]+1) -> 3.22714780162556 | E1272: of:=(1+SQRT(5))/2 -> 1.6180339887499 | F1272: of:=3+[.E1272]/LN([.A1272]+1) -> 3.22635082950914 | G1272: of:=[.D1272]-[.F1272] -> 0.000796972116417827
A1273: 1272 | B1273: 10463166393 | C1273: 3.23 | D1273: of:=LN([.B1273])/LN([.A1273]+1) -> 3.2271229933529 | E1273: of:=(1+SQRT(5))/2 -> 1.6180339887499 | F1273: of:=3+[.E1273]/LN([.A1273]+1) -> 3.22632594832586 | G1273: of:=[.D1273]-[.F1273] -> 0.00079704502703537
A1274: 1273 | B1274: 10487859745 | C1274: 3.23 | D1274: of:=LN([.B1274])/LN([.A1274]+1) -> 3.22709826411045 | E1274: of:=(1+SQRT(5))/2 -> 1.6180339887499 | F1274: of:=3+[.E1274]/LN([.A1274]+1) -> 3.22630109214322 | G1274: of:=[.D1274]-[.F1274] -> 0.000797171967231947
A1275: 1274 | B1275: 10512596649 | C1275: 3.23 | D1275: of:=LN([.B1275])/LN([.A1275]+1) -> 3.22707362246585 | E1275: of:=(1+SQRT(5))/2 -> 1.6180339887499 | F1275: of:=3+[.E1275]/LN([.A1275]+1) -> 3.2262762609159 | G1275: of:=[.D1275]-[.F1275] -> 0.000797361549956577
A1276: 1275 | B1276: 10537360999 | C1276: 3.23 | D1276: of:=LN([.B1276])/LN([.A1276]+1) -> 3.22704885377857 | E1276: of:=(1+SQRT(5))/2 -> 1.6180339887499 | F1276: of:=3+[.E1276]/LN([.A1276]+1) -> 3.2262514545987 | G1276: of:=[.D1276]-[.F1276] -> 0.000797399179874425
A1277: 1276 | B1277: 10562168403 | C1277: 3.23 | D1277: of:=LN([.B1277])/LN([.A1277]+1) -> 3.22702416532775 | E1277: of:=(1+SQRT(5))/2 -> 1.6180339887499 | F1277: of:=3+[.E1277]/LN([.A1277]+1) -> 3.22622667314655 | G1277: of:=[.D1277]-[.F1277] -> 0.000797492181207282
A1278: 1277 | B1278: 10587010729 | C1278: 3.23 | D1278: of:=LN([.B1278])/LN([.A1278]+1) -> 3.2269994488753 | E1278: of:=(1+SQRT(5))/2 -> 1.6180339887499 | F1278: of:=3+[.E1278]/LN([.A1278]+1) -> 3.22620191651448 | G1278: of:=[.D1278]-[.F1278] -> 0.000797532360820252
A1279: 1278 | B1279: 10611908023 | C1279: 3.23 | D1279: of:=LN([.B1279])/LN([.A1279]+1) -> 3.22697496841847 | E1279: of:=(1+SQRT(5))/2 -> 1.6180339887499 | F1279: of:=3+[.E1279]/LN([.A1279]+1) -> 3.22617718465766 | G1279: of:=[.D1279]-[.F1279] -> 0.000797783760811299
A1280: 1279 | B1280: 10636823551 | C1280: 3.23 | D1280: of:=LN([.B1280])/LN([.A1280]+1) -> 3.22695023926598 | E1280: of:=(1+SQRT(5))/2 -> 1.6180339887499 | F1280: of:=3+[.E1280]/LN([.A1280]+1) -> 3.22615247753135 | G1280: of:=[.D1280]-[.F1280] -> 0.000797761734625091
A1281: 1280 | B1281: 10661788227 | C1281: 3.23 | D1281: of:=LN([.B1281])/LN([.A1281]+1) -> 3.22692566820101 | E1281: of:=(1+SQRT(5))/2 -> 1.6180339887499 | F1281: of:=3+[.E1281]/LN([.A1281]+1) -> 3.22612779509096 | G1281: of:=[.D1281]-[.F1281] -> 0.000797873110055303
A1282: 1281 | B1282: 10686797847 | C1282: 3.23 | D1282: of:=LN([.B1282])/LN([.A1282]+1) -> 3.2269011988299 | E1282: of:=(1+SQRT(5))/2 -> 1.6180339887499 | F1282: of:=3+[.E1282]/LN([.A1282]+1) -> 3.22610313729197 | G1282: of:=[.D1282]-[.F1282] -> 0.000798061537927719
A1283: 1282 | B1283: 10711826317 | C1283: 3.23 | D1283: of:=LN([.B1283])/LN([.A1283]+1) -> 3.22687648977609 | E1283: of:=(1+SQRT(5))/2 -> 1.6180339887499 | F1283: of:=3+[.E1283]/LN([.A1283]+1) -> 3.22607850409003 | G1283: of:=[.D1283]-[.F1283] -> 0.00079798568606293
A1284: 1283 | B1284: 10736918725 | C1284: 3.23 | D1284: of:=LN([.B1284])/LN([.A1284]+1) -> 3.22685212922074 | E1284: of:=(1+SQRT(5))/2 -> 1.6180339887499 | F1284: of:=3+[.E1284]/LN([.A1284]+1) -> 3.22605389544085 | G1284: of:=[.D1284]-[.F1284] -> 0.000798233779893298
A1285: 1284 | B1285: 10762036765 | C1285: 3.23 | D1285: of:=LN([.B1285])/LN([.A1285]+1) -> 3.22682761713006 | E1285: of:=(1+SQRT(5))/2 -> 1.6180339887499 | F1285: of:=3+[.E1285]/LN([.A1285]+1) -> 3.2260293113003 | G1285: of:=[.D1285]-[.F1285] -> 0.000798305829765589
A1286: 1285 | B1286: 10787208457 | C1286: 3.23 | D1286: of:=LN([.B1286])/LN([.A1286]+1) -> 3.22680331716991 | E1286: of:=(1+SQRT(5))/2 -> 1.6180339887499 | F1286: of:=3+[.E1286]/LN([.A1286]+1) -> 3.22600475162434 | G1286: of:=[.D1286]-[.F1286] -> 0.000798565545569119
A1287: 1286 | B1287: 10812396313 | C1287: 3.23 | D1287: of:=LN([.B1287])/LN([.A1287]+1) -> 3.22677874329738 | E1287: of:=(1+SQRT(5))/2 -> 1.6180339887499 | F1287: of:=3+[.E1287]/LN([.A1287]+1) -> 3.22598021636904 | G1287: of:=[.D1287]-[.F1287] -> 0.000798526928336596
A1288: 1287 | B1288: 10837638681 | C1288: 3.23 | D1288: of:=LN([.B1288])/LN([.A1288]+1) -> 3.22675439138671 | E1288: of:=(1+SQRT(5))/2 -> 1.6180339887499 | F1288: of:=3+[.E1288]/LN([.A1288]+1) -> 3.22595570549061 | G1288: of:=[.D1288]-[.F1288] -> 0.000798685896098217
A1289: 1288 | B1289: 10862915051 | C1289: 3.23 | D1289: of:=LN([.B1289])/LN([.A1289]+1) -> 3.22672999592162 | E1289: of:=(1+SQRT(5))/2 -> 1.6180339887499 | F1289: of:=3+[.E1289]/LN([.A1289]+1) -> 3.22593121894535 | G1289: of:=[.D1289]-[.F1289] -> 0.000798776976269622
A1290: 1289 | B1290: 10888226435 | C1290: 3.23 | D1290: of:=LN([.B1290])/LN([.A1290]+1) -> 3.22670556993805 | E1290: of:=(1+SQRT(5))/2 -> 1.6180339887499 | F1290: of:=3+[.E1290]/LN([.A1290]+1) -> 3.22590675668968 | G1290: of:=[.D1290]-[.F1290] -> 0.000798813248371832
A1291: 1290 | B1291: 10913590577 | C1291: 3.23 | D1291: of:=LN([.B1291])/LN([.A1291]+1) -> 3.22668134037667 | E1291: of:=(1+SQRT(5))/2 -> 1.6180339887499 | F1291: of:=3+[.E1291]/LN([.A1291]+1) -> 3.22588231868013 | G1291: of:=[.D1291]-[.F1291] -> 0.000799021696549662
A1292: 1291 | B1292: 10938989201 | C1292: 3.23 | D1292: of:=LN([.B1292])/LN([.A1292]+1) -> 3.22665707233738 | E1292: of:=(1+SQRT(5))/2 -> 1.6180339887499 | F1292: of:=3+[.E1292]/LN([.A1292]+1) -> 3.22585790487334 | G1292: of:=[.D1292]-[.F1292] -> 0.000799167464045958
A1293: 1292 | B1293: 10964411795 | C1293: 3.23 | D1293: of:=LN([.B1293])/LN([.A1293]+1) -> 3.22663263202929 | E1293: of:=(1+SQRT(5))/2 -> 1.6180339887499 | F1293: of:=3+[.E1293]/LN([.A1293]+1) -> 3.22583351522607 | G1293: of:=[.D1293]-[.F1293] -> 0.000799116803221978
A1294: 1293 | B1294: 10989892361 | C1294: 3.23 | D1294: of:=LN([.B1294])/LN([.A1294]+1) -> 3.22660845223226 | E1294: of:=(1+SQRT(5))/2 -> 1.6180339887499 | F1294: of:=3+[.E1294]/LN([.A1294]+1) -> 3.22580914969519 | G1294: of:=[.D1294]-[.F1294] -> 0.000799302537077828
A1295: 1294 | B1295: 11015400263 | C1295: 3.23 | D1295: of:=LN([.B1295])/LN([.A1295]+1) -> 3.22658414270335 | E1295: of:=(1+SQRT(5))/2 -> 1.6180339887499 | F1295: of:=3+[.E1295]/LN([.A1295]+1) -> 3.22578480823767 | G1295: of:=[.D1295]-[.F1295] -> 0.000799334465678481
A1296: 1295 | B1296: 11040959581 | C1296: 3.23 | D1296: of:=LN([.B1296])/LN([.A1296]+1) -> 3.22656000843544 | E1296: of:=(1+SQRT(5))/2 -> 1.6180339887499 | F1296: of:=3+[.E1296]/LN([.A1296]+1) -> 3.2257604908106 | G1296: of:=[.D1296]-[.F1296] -> 0.000799517624834323
A1297: 1296 | B1297: 11066546343 | C1297: 3.23 | D1297: of:=LN([.B1297])/LN([.A1297]+1) -> 3.22653574569545 | E1297: of:=(1+SQRT(5))/2 -> 1.6180339887499 | F1297: of:=3+[.E1297]/LN([.A1297]+1) -> 3.22573619737119 | G1297: of:=[.D1297]-[.F1297] -> 0.000799548324259103
A1298: 1297 | B1298: 11092183905 | C1298: 3.23 | D1298: of:=LN([.B1298])/LN([.A1298]+1) -> 3.22651164889125 | E1298: of:=(1+SQRT(5))/2 -> 1.6180339887499 | F1298: of:=3+[.E1298]/LN([.A1298]+1) -> 3.22571192787674 | G1298: of:=[.D1298]-[.F1298] -> 0.000799721014510979
A1299: 1298 | B1299: 11117848159 | C1299: 3.23 | D1299: of:=LN([.B1299])/LN([.A1299]+1) -> 3.22648741411347 | E1299: of:=(1+SQRT(5))/2 -> 1.6180339887499 | F1299: of:=3+[.E1299]/LN([.A1299]+1) -> 3.22568768228466 | G1299: of:=[.D1299]-[.F1299] -> 0.000799731828809769
A1300: 1299 | B1300: 11143559947 | C1300: 3.23 | D1300: of:=LN([.B1300])/LN([.A1300]+1) -> 3.22646330295747 | E1300: of:=(1+SQRT(5))/2 -> 1.6180339887499 | F1300: of:=3+[.E1300]/LN([.A1300]+1) -> 3.22566346055249 | G1300: of:=[.D1300]-[.F1300] -> 0.000799842404977991
A1301: 1300 | B1301: 11169316529 | C1301: 3.23 | D1301: of:=LN([.B1301])/LN([.A1301]+1) -> 3.22643928006835 | E1301: of:=(1+SQRT(5))/2 -> 1.6180339887499 | F1301: of:=3+[.E1301]/LN([.A1301]+1) -> 3.22563926263786 | G1301: of:=[.D1301]-[.F1301] -> 0.000800017430493849
A1302: 1301 | B1302: 11195099943 | C1302: 3.23 | D1302: of:=LN([.B1302])/LN([.A1302]+1) -> 3.22641512083571 | E1302: of:=(1+SQRT(5))/2 -> 1.6180339887499 | F1302: of:=3+[.E1302]/LN([.A1302]+1) -> 3.22561508849851 | G1302: of:=[.D1302]-[.F1302] -> 0.000800032337192391
A1303: 1302 | B1303: 11220941051 | C1303: 3.23 | D1303: of:=LN([.B1303])/LN([.A1303]+1) -> 3.22639120946161 | E1303: of:=(1+SQRT(5))/2 -> 1.6180339887499 | F1303: of:=3+[.E1303]/LN([.A1303]+1) -> 3.2255909380923 | G1303: of:=[.D1303]-[.F1303] -> 0.000800271369303829
A1304: 1303 | B1304: 11246806825 | C1304: 3.23 | D1304: of:=LN([.B1304])/LN([.A1304]+1) -> 3.22636713451449 | E1304: of:=(1+SQRT(5))/2 -> 1.6180339887499 | F1304: of:=3+[.E1304]/LN([.A1304]+1) -> 3.22556681137719 | G1304: of:=[.D1304]-[.F1304] -> 0.000800323137300829
A1305: 1304 | B1305: 11272716797 | C1305: 3.23 | D1305: of:=LN([.B1305])/LN([.A1305]+1) -> 3.2263431384473 | E1305: of:=(1+SQRT(5))/2 -> 1.6180339887499 | F1305: of:=3+[.E1305]/LN([.A1305]+1) -> 3.22554270831124 | G1305: of:=[.D1305]-[.F1305] -> 0.000800430136061348
A1306: 1305 | B1306: 11298671331 | C1306: 3.23 | D1306: of:=LN([.B1306])/LN([.A1306]+1) -> 3.22631922493367 | E1306: of:=(1+SQRT(5))/2 -> 1.6180339887499 | F1306: of:=3+[.E1306]/LN([.A1306]+1) -> 3.22551862885262 | G1306: of:=[.D1306]-[.F1306] -> 0.000800596081043548
A1307: 1306 | B1307: 11324652065 | C1307: 3.23 | D1307: of:=LN([.B1307])/LN([.A1307]+1) -> 3.22629516716476 | E1307: of:=(1+SQRT(5))/2 -> 1.6180339887499 | F1307: of:=3+[.E1307]/LN([.A1307]+1) -> 3.22549457295963 | G1307: of:=[.D1307]-[.F1307] -> 0.000800594205129013
A1308: 1307 | B1308: 11350686061 | C1308: 3.23 | D1308: of:=LN([.B1308])/LN([.A1308]+1) -> 3.22627129816175 | E1308: of:=(1+SQRT(5))/2 -> 1.6180339887499 | F1308: of:=3+[.E1308]/LN([.A1308]+1) -> 3.22547054059063 | G1308: of:=[.D1308]-[.F1308] -> 0.000800757571120858
A1309: 1308 | B1309: 11376752369 | C1309: 3.23 | D1309: of:=LN([.B1309])/LN([.A1309]+1) -> 3.22624735974203 | E1309: of:=(1+SQRT(5))/2 -> 1.6180339887499 | F1309: of:=3+[.E1309]/LN([.A1309]+1) -> 3.22544653170414 | G1309: of:=[.D1309]-[.F1309] -> 0.000800828037896384
A1310: 1309 | B1310: 11402865485 | C1310: 3.23 | D1310: of:=LN([.B1310])/LN([.A1310]+1) -> 3.22622352926799 | E1310: of:=(1+SQRT(5))/2 -> 1.6180339887499 | F1310: of:=3+[.E1310]/LN([.A1310]+1) -> 3.22542254625873 | G1310: of:=[.D1310]-[.F1310] -> 0.000800983009253908
A1311: 1310 | B1311: 11429020151 | C1311: 3.23 | D1311: of:=LN([.B1311])/LN([.A1311]+1) -> 3.22619974163126 | E1311: of:=(1+SQRT(5))/2 -> 1.6180339887499 | F1311: of:=3+[.E1311]/LN([.A1311]+1) -> 3.22539858421313 | G1311: of:=[.D1311]-[.F1311] -> 0.000801157418131027
A1312: 1311 | B1312: 11455196485 | C1312: 3.23 | D1312: of:=LN([.B1312])/LN([.A1312]+1) -> 3.22617575452423 | E1312: of:=(1+SQRT(5))/2 -> 1.6180339887499 | F1312: of:=3+[.E1312]/LN([.A1312]+1) -> 3.22537464552613 | G1312: of:=[.D1312]-[.F1312] -> 0.000801108998097266
A1313: 1312 | B1313: 11481426333 | C1313: 3.23 | D1313: of:=LN([.B1313])/LN([.A1313]+1) -> 3.22615195543681 | E1313: of:=(1+SQRT(5))/2 -> 1.6180339887499 | F1313: of:=3+[.E1313]/LN([.A1313]+1) -> 3.22535073015665 | G1313: of:=[.D1313]-[.F1313] -> 0.000801225280161244
A1314: 1313 | B1314: 11507695395 | C1314: 3.23 | D1314: of:=LN([.B1314])/LN([.A1314]+1) -> 3.22612816972911 | E1314: of:=(1+SQRT(5))/2 -> 1.6180339887499 | F1314: of:=3+[.E1314]/LN([.A1314]+1) -> 3.2253268380637 | G1314: of:=[.D1314]-[.F1314] -> 0.00080133166540719
A1315: 1314 | B1315: 11534000489 | C1315: 3.23 | D1315: of:=LN([.B1315])/LN([.A1315]+1) -> 3.22610435864693 | E1315: of:=(1+SQRT(5))/2 -> 1.6180339887499 | F1315: of:=3+[.E1315]/LN([.A1315]+1) -> 3.22530296920641 | G1315: of:=[.D1315]-[.F1315] -> 0.00080138944051944
A1316: 1315 | B1316: 11560362749 | C1316: 3.23 | D1316: of:=LN([.B1316])/LN([.A1316]+1) -> 3.22608077666184 | E1316: of:=(1+SQRT(5))/2 -> 1.6180339887499 | F1316: of:=3+[.E1316]/LN([.A1316]+1) -> 3.225279123544 | G1316: of:=[.D1316]-[.F1316] -> 0.00080165311783853
A1317: 1316 | B1317: 11586743833 | C1317: 3.23 | D1317: of:=LN([.B1317])/LN([.A1317]+1) -> 3.22605696121287 | E1317: of:=(1+SQRT(5))/2 -> 1.6180339887499 | F1317: of:=3+[.E1317]/LN([.A1317]+1) -> 3.22525530103579 | G1317: of:=[.D1317]-[.F1317] -> 0.000801660177076613
A1318: 1317 | B1318: 11613170257 | C1318: 3.23 | D1318: of:=LN([.B1318])/LN([.A1318]+1) -> 3.22603323155689 | E1318: of:=(1+SQRT(5))/2 -> 1.6180339887499 | F1318: of:=3+[.E1318]/LN([.A1318]+1) -> 3.22523150164122 | G1318: of:=[.D1318]-[.F1318] -> 0.000801729915671068
A1319: 1318 | B1319: 11639632733 | C1319: 3.23 | D1319: of:=LN([.B1319])/LN([.A1319]+1) -> 3.22600947577622 | E1319: of:=(1+SQRT(5))/2 -> 1.6180339887499 | F1319: of:=3+[.E1319]/LN([.A1319]+1) -> 3.22520772531981 | G1319: of:=[.D1319]-[.F1319] -> 0.000801750456408623
A1320: 1319 | B1320: 11666149825 | C1320: 3.23 | D1320: of:=LN([.B1320])/LN([.A1320]+1) -> 3.22598591527637 | E1320: of:=(1+SQRT(5))/2 -> 1.6180339887499 | F1320: of:=3+[.E1320]/LN([.A1320]+1) -> 3.22518397203121 | G1320: of:=[.D1320]-[.F1320] -> 0.000801943245156256
A1321: 1320 | B1321: 11692691833 | C1321: 3.23 | D1321: of:=LN([.B1321])/LN([.A1321]+1) -> 3.22596219496188 | E1321: of:=(1+SQRT(5))/2 -> 1.6180339887499 | F1321: of:=3+[.E1321]/LN([.A1321]+1) -> 3.22516024173515 | G1321: of:=[.D1321]-[.F1321] -> 0.000801953226729157
A1322: 1321 | B1322: 11719286043 | C1322: 3.23 | D1322: of:=LN([.B1322])/LN([.A1322]+1) -> 3.22593863969467 | E1322: of:=(1+SQRT(5))/2 -> 1.6180339887499 | F1322: of:=3+[.E1322]/LN([.A1322]+1) -> 3.22513653439146 | G1322: of:=[.D1322]-[.F1322] -> 0.000802105303215672
A1323: 1322 | B1323: 11745923047 | C1323: 3.23 | D1323: of:=LN([.B1323])/LN([.A1323]+1) -> 3.22591513662694 | E1323: of:=(1+SQRT(5))/2 -> 1.6180339887499 | F1323: of:=3+[.E1323]/LN([.A1323]+1) -> 3.22511284996008 | G1323: of:=[.D1323]-[.F1323] -> 0.000802286666863772
A1324: 1323 | B1324: 11772586449 | C1324: 3.23 | D1324: of:=LN([.B1324])/LN([.A1324]+1) -> 3.22589149140253 | E1324: of:=(1+SQRT(5))/2 -> 1.6180339887499 | F1324: of:=3+[.E1324]/LN([.A1324]+1) -> 3.22508918840105 | G1324: of:=[.D1324]-[.F1324] -> 0.000802303001474325
A1325: 1324 | B1325: 11799302171 | C1325: 3.23 | D1325: of:=LN([.B1325])/LN([.A1325]+1) -> 3.22586801037894 | E1325: of:=(1+SQRT(5))/2 -> 1.6180339887499 | F1325: of:=3+[.E1325]/LN([.A1325]+1) -> 3.22506554967452 | G1325: of:=[.D1325]-[.F1325] -> 0.000802460704424135
A1326: 1325 | B1326: 11826052923 | C1326: 3.23 | D1326: of:=LN([.B1326])/LN([.A1326]+1) -> 3.22584448881019 | E1326: of:=(1+SQRT(5))/2 -> 1.6180339887499 | F1326: of:=3+[.E1326]/LN([.A1326]+1) -> 3.22504193374072 | G1326: of:=[.D1326]-[.F1326] -> 0.000802555069471911
A1327: 1326 | B1327: 11852834333 | C1327: 3.23 | D1327: of:=LN([.B1327])/LN([.A1327]+1) -> 3.22582087545002 | E1327: of:=(1+SQRT(5))/2 -> 1.6180339887499 | F1327: of:=3+[.E1327]/LN([.A1327]+1) -> 3.22501834055999 | G1327: of:=[.D1327]-[.F1327] -> 0.000802534890030682
A1328: 1327 | B1328: 11879678291 | C1328: 3.23 | D1328: of:=LN([.B1328])/LN([.A1328]+1) -> 3.22579754399321 | E1328: of:=(1+SQRT(5))/2 -> 1.6180339887499 | F1328: of:=3+[.E1328]/LN([.A1328]+1) -> 3.22499477009276 | G1328: of:=[.D1328]-[.F1328] -> 0.000802773900446585
A1329: 1328 | B1329: 11906543703 | C1329: 3.23 | D1329: of:=LN([.B1329])/LN([.A1329]+1) -> 3.22577401232922 | E1329: of:=(1+SQRT(5))/2 -> 1.6180339887499 | F1329: of:=3+[.E1329]/LN([.A1329]+1) -> 3.22497122229959 | G1329: of:=[.D1329]-[.F1329] -> 0.000802790029628575
A1330: 1329 | B1330: 11933455975 | C1330: 3.23 | D1330: of:=LN([.B1330])/LN([.A1330]+1) -> 3.22575057761962 | E1330: of:=(1+SQRT(5))/2 -> 1.6180339887499 | F1330: of:=3+[.E1330]/LN([.A1330]+1) -> 3.2249476971411 | G1330: of:=[.D1330]-[.F1330] -> 0.000802880478519619
A1331: 1330 | B1331: 11960405355 | C1331: 3.23 | D1331: of:=LN([.B1331])/LN([.A1331]+1) -> 3.22572712560166 | E1331: of:=(1+SQRT(5))/2 -> 1.6180339887499 | F1331: of:=3+[.E1331]/LN([.A1331]+1) -> 3.22492419457803 | G1331: of:=[.D1331]-[.F1331] -> 0.000802931023632603
A1332: 1331 | B1332: 11987402315 | C1332: 3.23 | D1332: of:=LN([.B1332])/LN([.A1332]+1) -> 3.22570377758869 | E1332: of:=(1+SQRT(5))/2 -> 1.6180339887499 | F1332: of:=3+[.E1332]/LN([.A1332]+1) -> 3.22490071457121 | G1332: of:=[.D1332]-[.F1332] -> 0.000803063017485783
A1333: 1332 | B1333: 12014434947 | C1333: 3.23 | D1333: of:=LN([.B1333])/LN([.A1333]+1) -> 3.2256803948627 | E1333: of:=(1+SQRT(5))/2 -> 1.6180339887499 | F1333: of:=3+[.E1333]/LN([.A1333]+1) -> 3.22487725708157 | G1333: of:=[.D1333]-[.F1333] -> 0.000803137781128172
A1334: 1333 | B1334: 12041515387 | C1334: 3.23 | D1334: of:=LN([.B1334])/LN([.A1334]+1) -> 3.22565711749313 | E1334: of:=(1+SQRT(5))/2 -> 1.6180339887499 | F1334: of:=3+[.E1334]/LN([.A1334]+1) -> 3.22485382207015 | G1334: of:=[.D1334]-[.F1334] -> 0.000803295422980188
A1335: 1334 | B1335: 12068640117 | C1335: 3.23 | D1335: of:=LN([.B1335])/LN([.A1335]+1) -> 3.22563390400012 | E1335: of:=(1+SQRT(5))/2 -> 1.6180339887499 | F1335: of:=3+[.E1335]/LN([.A1335]+1) -> 3.22483040949806 | G1335: of:=[.D1335]-[.F1335] -> 0.000803494502056967
A1336: 1335 | B1336: 12095787803 | C1336: 3.23 | D1336: of:=LN([.B1336])/LN([.A1336]+1) -> 3.22561050864796 | E1336: of:=(1+SQRT(5))/2 -> 1.6180339887499 | F1336: of:=3+[.E1336]/LN([.A1336]+1) -> 3.22480701932654 | G1336: of:=[.D1336]-[.F1336] -> 0.000803489321422379
A1337: 1336 | B1337: 12122980419 | C1337: 3.23 | D1337: of:=LN([.B1337])/LN([.A1337]+1) -> 3.22558718429674 | E1337: of:=(1+SQRT(5))/2 -> 1.6180339887499 | F1337: of:=3+[.E1337]/LN([.A1337]+1) -> 3.22478365151689 | G1337: of:=[.D1337]-[.F1337] -> 0.00080353277984857
A1338: 1337 | B1338: 12150224563 | C1338: 3.23 | D1338: of:=LN([.B1338])/LN([.A1338]+1) -> 3.22556400565008 | E1338: of:=(1+SQRT(5))/2 -> 1.6180339887499 | F1338: of:=3+[.E1338]/LN([.A1338]+1) -> 3.22476030603054 | G1338: of:=[.D1338]-[.F1338] -> 0.000803699619534637
A1339: 1338 | B1339: 12177502315 | C1339: 3.23 | D1339: of:=LN([.B1339])/LN([.A1339]+1) -> 3.22554076706051 | E1339: of:=(1+SQRT(5))/2 -> 1.6180339887499 | F1339: of:=3+[.E1339]/LN([.A1339]+1) -> 3.224736982829 | G1339: of:=[.D1339]-[.F1339] -> 0.000803784231514726
A1340: 1339 | B1340: 12204825231 | C1340: 3.23 | D1340: of:=LN([.B1340])/LN([.A1340]+1) -> 3.22551760021631 | E1340: of:=(1+SQRT(5))/2 -> 1.6180339887499 | F1340: of:=3+[.E1340]/LN([.A1340]+1) -> 3.22471368187387 | G1340: of:=[.D1340]-[.F1340] -> 0.00080391834244109
A1341: 1340 | B1341: 12232178775 | C1341: 3.23 | D1341: of:=LN([.B1341])/LN([.A1341]+1) -> 3.22549433936423 | E1341: of:=(1+SQRT(5))/2 -> 1.6180339887499 | F1341: of:=3+[.E1341]/LN([.A1341]+1) -> 3.22469040312685 | G1341: of:=[.D1341]-[.F1341] -> 0.000803936237376846
A1342: 1341 | B1342: 12259582179 | C1342: 3.23 | D1342: of:=LN([.B1342])/LN([.A1342]+1) -> 3.22547120275609 | E1342: of:=(1+SQRT(5))/2 -> 1.6180339887499 | F1342: of:=3+[.E1342]/LN([.A1342]+1) -> 3.22466714654975 | G1342: of:=[.D1342]-[.F1342] -> 0.000804056206340054
A1343: 1342 | B1343: 12287018777 | C1343: 3.23 | D1343: of:=LN([.B1343])/LN([.A1343]+1) -> 3.22544800097571 | E1343: of:=(1+SQRT(5))/2 -> 1.6180339887499 | F1343: of:=3+[.E1343]/LN([.A1343]+1) -> 3.22464391210445 | G1343: of:=[.D1343]-[.F1343] -> 0.000804088871263708
A1344: 1343 | B1344: 12314499189 | C1344: 3.23 | D1344: of:=LN([.B1344])/LN([.A1344]+1) -> 3.2254248539725 | E1344: of:=(1+SQRT(5))/2 -> 1.6180339887499 | F1344: of:=3+[.E1344]/LN([.A1344]+1) -> 3.22462069975294 | G1344: of:=[.D1344]-[.F1344] -> 0.000804154219555819
A1345: 1344 | B1345: 12342022893 | C1345: 3.23 | D1345: of:=LN([.B1345])/LN([.A1345]+1) -> 3.22540175526576 | E1345: of:=(1+SQRT(5))/2 -> 1.6180339887499 | F1345: of:=3+[.E1345]/LN([.A1345]+1) -> 3.22459750945731 | G1345: of:=[.D1345]-[.F1345] -> 0.000804245808455395
A1346: 1345 | B1346: 12369595821 | C1346: 3.23 | D1346: of:=LN([.B1346])/LN([.A1346]+1) -> 3.22537877085218 | E1346: of:=(1+SQRT(5))/2 -> 1.6180339887499 | F1346: of:=3+[.E1346]/LN([.A1346]+1) -> 3.22457434117972 | G1346: of:=[.D1346]-[.F1346] -> 0.000804429672463858
A1347: 1346 | B1347: 12397203263 | C1347: 3.23 | D1347: of:=LN([.B1347])/LN([.A1347]+1) -> 3.22535573503599 | E1347: of:=(1+SQRT(5))/2 -> 1.6180339887499 | F1347: of:=3+[.E1347]/LN([.A1347]+1) -> 3.22455119488244 | G1347: of:=[.D1347]-[.F1347] -> 0.000804540153549471
A1348: 1347 | B1348: 12424840387 | C1348: 3.23 | D1348: of:=LN([.B1348])/LN([.A1348]+1) -> 3.22533259398376 | E1348: of:=(1+SQRT(5))/2 -> 1.6180339887499 | F1348: of:=3+[.E1348]/LN([.A1348]+1) -> 3.22452807052784 | G1348: of:=[.D1348]-[.F1348] -> 0.000804523455925299
A1349: 1348 | B1349: 12452532267 | C1349: 3.23 | D1349: of:=LN([.B1349])/LN([.A1349]+1) -> 3.22530962759037 | E1349: of:=(1+SQRT(5))/2 -> 1.6180339887499 | F1349: of:=3+[.E1349]/LN([.A1349]+1) -> 3.22450496807836 | G1349: of:=[.D1349]-[.F1349] -> 0.000804659512001926
A1350: 1349 | B1350: 12480263593 | C1350: 3.23 | D1350: of:=LN([.B1350])/LN([.A1350]+1) -> 3.22528666422013 | E1350: of:=(1+SQRT(5))/2 -> 1.6180339887499 | F1350: of:=3+[.E1350]/LN([.A1350]+1) -> 3.22448188749656 | G1350: of:=[.D1350]-[.F1350] -> 0.00080477672357171
A1351: 1350 | B1351: 12508029769 | C1351: 3.23 | D1351: of:=LN([.B1351])/LN([.A1351]+1) -> 3.2252636526545 | E1351: of:=(1+SQRT(5))/2 -> 1.6180339887499 | F1351: of:=3+[.E1351]/LN([.A1351]+1) -> 3.22445882874507 | G1351: of:=[.D1351]-[.F1351] -> 0.0008048239094256
A1352: 1351 | B1352: 12535842367 | C1352: 3.23 | D1352: of:=LN([.B1352])/LN([.A1352]+1) -> 3.22524072104926 | E1352: of:=(1+SQRT(5))/2 -> 1.6180339887499 | F1352: of:=3+[.E1352]/LN([.A1352]+1) -> 3.22443579178663 | G1352: of:=[.D1352]-[.F1352] -> 0.000804929262629983
A1353: 1352 | B1353: 12563698825 | C1353: 3.23 | D1353: of:=LN([.B1353])/LN([.A1353]+1) -> 3.22521784034277 | E1353: of:=(1+SQRT(5))/2 -> 1.6180339887499 | F1353: of:=3+[.E1353]/LN([.A1353]+1) -> 3.22441277658405 | G1353: of:=[.D1353]-[.F1353] -> 0.000805063758719804
A1354: 1353 | B1354: 12591591003 | C1354: 3.23 | D1354: of:=LN([.B1354])/LN([.A1354]+1) -> 3.22519492030663 | E1354: of:=(1+SQRT(5))/2 -> 1.6180339887499 | F1354: of:=3+[.E1354]/LN([.A1354]+1) -> 3.22438978310025 | G1354: of:=[.D1354]-[.F1354] -> 0.000805137206382423
A1355: 1354 | B1355: 12619522825 | C1355: 3.23 | D1355: of:=LN([.B1355])/LN([.A1355]+1) -> 3.22517200410941 | E1355: of:=(1+SQRT(5))/2 -> 1.6180339887499 | F1355: of:=3+[.E1355]/LN([.A1355]+1) -> 3.22436681129823 | G1355: of:=[.D1355]-[.F1355] -> 0.000805192811176969
A1356: 1355 | B1356: 12647503505 | C1356: 3.23 | D1356: of:=LN([.B1356])/LN([.A1356]+1) -> 3.22514919251443 | E1356: of:=(1+SQRT(5))/2 -> 1.6180339887499 | F1356: of:=3+[.E1356]/LN([.A1356]+1) -> 3.22434386114109 | G1356: of:=[.D1356]-[.F1356] -> 0.000805331373343599
A1357: 2000 | B1357: 40663365455 | C1357: 3.21 | D1357: of:=LN([.B1357])/LN([.A1357]+1) -> 3.21369562314033 | E1357: of:=(1+SQRT(5))/2 -> 1.6180339887499 | F1357: of:=3+[.E1357]/LN([.A1357]+1) -> 3.21285993261906 | G1357: of:=[.D1357]-[.F1357] -> 0.000835690521265864
A1358: 3000 | B1358: 137222496277 | C1358: 3.2 | D1358: of:=LN([.B1358])/LN([.A1358]+1) -> 3.2029258993028 | E1358: of:=(1+SQRT(5))/2 -> 1.6180339887499 | F1358: of:=3+[.E1358]/LN([.A1358]+1) -> 3.20208498106574 | G1358: of:=[.D1358]-[.F1358] -> 0.000840918237058563
A1359: 4000 | B1359: 325248806303 | C1359: 3.2 | D1359: of:=LN([.B1359])/LN([.A1359]+1) -> 3.19591255854016 | E1359: of:=(1+SQRT(5))/2 -> 1.6180339887499 | F1359: of:=3+[.E1359]/LN([.A1359]+1) -> 3.19507783237322 | G1359: of:=[.D1359]-[.F1359] -> 0.000834726166944577
A1360: 10000 | B1360: 5081468916021 | C1360: 3.18 | D1360: of:=LN([.B1360])/LN([.A1360]+1) -> 3.17646283203962 | E1360: of:=(1+SQRT(5))/2 -> 1.6180339887499 | F1360: of:=3+[.E1360]/LN([.A1360]+1) -> 3.17567390095171 | G1360: of:=[.D1360]-[.F1360] -> 0.000788931087904565